{"commit": "block55-E32-pooled-n60", "desc": "E32 POWER pass, seed 98 (82-111, disjoint from all 82 prior seeds); depth 6 + MATRIX_LR 0.03; median step 93.7 ms, duty 1.002; 60/60 arms clean", "exp": "E32_best_s98", "exp_num": 944, "milestone": "", "phase": "block55", "status": "keep", "steps": 3209, "ts_end": "2026-08-01T13:30:00Z", "ts_end_epoch": 1785591000.0, "ts_start": "", "val_bpb": 0.93137, "vram_gb": 44.0}
{"commit": "block55-E32-pooled-n60", "desc": "E32 POWER pass, seed 99 (82-111, disjoint from all 82 prior seeds); frozen defaults; median step 151.6 ms, duty 1.006; 60/60 arms clean", "exp": "E32_ctl_s99", "exp_num": 945, "milestone": "", "phase": "block55", "status": "keep", "steps": 1990, "ts_end": "2026-08-01T13:30:00Z", "ts_end_epoch": 1785591000.0, "ts_start": "", "val_bpb": 0.933279, "vram_gb": 52.6}
{"commit": "block55-E32-pooled-n60", "desc": "E32 POWER pass, seed 99 (82-111, disjoint from all 82 prior seeds); depth 6 + MATRIX_LR 0.03; median step 91.8 ms, duty 0.999; 60/60 arms clean", "exp": "E32_best_s99", "exp_num": 946, "milestone": "", "phase": "block55", "status": "keep", "steps": 3266, "ts_end": "2026-08-01T13:30:00Z", "ts_end_epoch": 1785591000.0, "ts_start": "", "val_bpb": 0.929852, "vram_gb": 44.0}
{"commit": "block55-E32-pooled-n60", "desc": "E32 POWER pass, seed 100 (82-111, disjoint from all 82 prior seeds); frozen defaults; median step 148.9 ms, duty 1.006; 60/60 arms clean", "exp": "E32_ctl_s100", "exp_num": 947, "milestone": "", "phase": "block55", "status": "keep", "steps": 2027, "ts_end": "2026-08-01T13:30:00Z", "ts_end_epoch": 1785591000.0, "ts_start": "", "val_bpb": 0.931275, "vram_gb": 52.6}
{"commit": "block55-E32-pooled-n60", "desc": "E32 POWER pass, seed 100 (82-111, disjoint from all 82 prior seeds); depth 6 + MATRIX_LR 0.03; median step 91.5 ms, duty 0.999; 60/60 arms clean", "exp": "E32_best_s100", "exp_num": 948, "milestone": "", "phase": "block55", "status": "keep", "steps": 3275, "ts_end": "2026-08-01T13:30:00Z", "ts_end_epoch": 1785591000.0, "ts_start": "", "val_bpb": 0.929499, "vram_gb": 44.0}
{"commit": "block55-E32-pooled-n60", "desc": "E32 POWER pass, seed 101 (82-111, disjoint from all 82 prior seeds); frozen defaults; median step 151.2 ms, duty 1.006; 60/60 arms clean", "exp": "E32_ctl_s101", "exp_num": 949, "milestone": "", "phase": "block55", "status": "keep", "steps": 1996, "ts_end": "2026-08-01T13:30:00Z", "ts_end_epoch": 1785591000.0, "ts_start": "", "val_bpb": 0.932849, "vram_gb": 52.6}
{"commit": "block55-E32-pooled-n60", "desc": "E32 POWER pass, seed 101 (82-111, disjoint from all 82 prior seeds); depth 6 + MATRIX_LR 0.03; median step 93.6 ms, duty 1.001; 60/60 arms clean", "exp": "E32_best_s101", "exp_num": 950, "milestone": "", "phase": "block55", "status": "keep", "steps": 3209, "ts_end": "2026-08-01T13:30:00Z", "ts_end_epoch": 1785591000.0, "ts_start": "", "val_bpb": 0.930049, "vram_gb": 44.0}
{"commit": "block55-E32-pooled-n60", "desc": "E32 POWER pass, seed 102 (82-111, disjoint from all 82 prior seeds); frozen defaults; median step 151.6 ms, duty 1.006; 60/60 arms clean", "exp": "E32_ctl_s102", "exp_num": 951, "milestone": "", "phase": "block55", "status": "keep", "steps": 1990, "ts_end": "2026-08-01T13:30:00Z", "ts_end_epoch": 1785591000.0, "ts_start": "", "val_bpb": 0.933312, "vram_gb": 52.6}
{"commit": "block55-E32-pooled-n60", "desc": "E32 POWER pass, seed 102 (82-111, disjoint from all 82 prior seeds); depth 6 + MATRIX_LR 0.03; median step 91.8 ms, duty 0.999; 60/60 arms clean", "exp": "E32_best_s102", "exp_num": 952, "milestone": "", "phase": "block55", "status": "keep", "steps": 3265, "ts_end": "2026-08-01T13:30:00Z", "ts_end_epoch": 1785591000.0, "ts_start": "", "val_bpb": 0.928927, "vram_gb": 44.0}
{"commit": "block55-E32-pooled-n60", "desc": "E32 POWER pass, seed 103 (82-111, disjoint from all 82 prior seeds); frozen defaults; median step 148.9 ms, duty 1.005; 60/60 arms clean", "exp": "E32_ctl_s103", "exp_num": 953, "milestone": "", "phase": "block55", "status": "keep", "steps": 2025, "ts_end": "2026-08-01T13:30:00Z", "ts_end_epoch": 1785591000.0, "ts_start": "", "val_bpb": 0.932412, "vram_gb": 52.6}
{"commit": "block55-E32-pooled-n60", "desc": "E32 POWER pass, seed 103 (82-111, disjoint from all 82 prior seeds); depth 6 + MATRIX_LR 0.03; median step 91.5 ms, duty 1.000; 60/60 arms clean", "exp": "E32_best_s103", "exp_num": 954, "milestone": "", "phase": "block55", "status": "keep", "steps": 3279, "ts_end": "2026-08-01T13:30:00Z", "ts_end_epoch": 1785591000.0, "ts_start": "", "val_bpb": 0.930511, "vram_gb": 44.0}
{"commit": "block55-E32-pooled-n60", "desc": "E32 POWER pass, seed 104 (82-111, disjoint from all 82 prior seeds); frozen defaults; median step 151.3 ms, duty 1.006; 60/60 arms clean", "exp": "E32_ctl_s104", "exp_num": 955, "milestone": "", "phase": "block55", "status": "keep", "steps": 1994, "ts_end": "2026-08-01T13:30:00Z", "ts_end_epoch": 1785591000.0, "ts_start": "", "val_bpb": 0.934238, "vram_gb": 52.6}
{"commit": "block55-E32-pooled-n60", "desc": "E32 POWER pass, seed 104 (82-111, disjoint from all 82 prior seeds); depth 6 + MATRIX_LR 0.03; median step 93.6 ms, duty 1.001; 60/60 arms clean", "exp": "E32_best_s104", "exp_num": 956, "milestone": "", "phase": "block55", "status": "keep", "steps": 3209, "ts_end": "2026-08-01T13:30:00Z", "ts_end_epoch": 1785591000.0, "ts_start": "", "val_bpb": 0.93054, "vram_gb": 44.0}
{"commit": "block55-E32-pooled-n60", "desc": "E32 POWER pass, seed 105 (82-111, disjoint from all 82 prior seeds); frozen defaults; median step 151.8 ms, duty 1.006; 60/60 arms clean", "exp": "E32_ctl_s105", "exp_num": 957, "milestone": "", "phase": "block55", "status": "keep", "steps": 1988, "ts_end": "2026-08-01T13:30:00Z", "ts_end_epoch": 1785591000.0, "ts_start": "", "val_bpb": 0.932295, "vram_gb": 52.6}
{"commit": "block55-E32-pooled-n60", "desc": "E32 POWER pass, seed 105 (82-111, disjoint from all 82 prior seeds); depth 6 + MATRIX_LR 0.03; median step 91.8 ms, duty 1.000; 60/60 arms clean", "exp": "E32_best_s105", "exp_num": 958, "milestone": "", "phase": "block55", "status": "keep", "steps": 3268, "ts_end": "2026-08-01T13:30:00Z", "ts_end_epoch": 1785591000.0, "ts_start": "", "val_bpb": 0.930791, "vram_gb": 44.0}
{"commit": "block55-E32-pooled-n60", "desc": "E32 POWER pass, seed 106 (82-111, disjoint from all 82 prior seeds); frozen defaults; median step 148.8 ms, duty 1.006; 60/60 arms clean", "exp": "E32_ctl_s106", "exp_num": 959, "milestone": "", "phase": "block55", "status": "keep", "steps": 2028, "ts_end": "2026-08-01T13:30:00Z", "ts_end_epoch": 1785591000.0, "ts_start": "", "val_bpb": 0.931429, "vram_gb": 52.6}
{"commit": "block55-E32-pooled-n60", "desc": "E32 POWER pass, seed 106 (82-111, disjoint from all 82 prior seeds); depth 6 + MATRIX_LR 0.03; median step 91.5 ms, duty 0.998; 60/60 arms clean", "exp": "E32_best_s106", "exp_num": 960, "milestone": "", "phase": "block55", "status": "keep", "steps": 3272, "ts_end": "2026-08-01T13:30:00Z", "ts_end_epoch": 1785591000.0, "ts_start": "", "val_bpb": 0.929386, "vram_gb": 44.0}
{"commit": "block55-E32-pooled-n60", "desc": "E32 POWER pass, seed 107 (82-111, disjoint from all 82 prior seeds); frozen defaults; median step 151.2 ms, duty 1.006; 60/60 arms clean", "exp": "E32_ctl_s107", "exp_num": 961, "milestone": "", "phase": "block55", "status": "keep", "steps": 1996, "ts_end": "2026-08-01T13:30:00Z", "ts_end_epoch": 1785591000.0, "ts_start": "", "val_bpb": 0.934862, "vram_gb": 52.6}
{"commit": "block55-E32-pooled-n60", "desc": "E32 POWER pass, seed 107 (82-111, disjoint from all 82 prior seeds); depth 6 + MATRIX_LR 0.03; median step 93.6 ms, duty 1.001; 60/60 arms clean", "exp": "E32_best_s107", "exp_num": 962, "milestone": "", "phase": "block55", "status": "keep", "steps": 3208, "ts_end": "2026-08-01T13:30:00Z", "ts_end_epoch": 1785591000.0, "ts_start": "", "val_bpb": 0.930824, "vram_gb": 44.0}
{"commit": "block55-E32-pooled-n60", "desc": "E32 POWER pass, seed 108 (82-111, disjoint from all 82 prior seeds); frozen defaults; median step 151.6 ms, duty 1.006; 60/60 arms clean", "exp": "E32_ctl_s108", "exp_num": 963, "milestone": "", "phase": "block55", "status": "keep", "steps": 1990, "ts_end": "2026-08-01T13:30:00Z", "ts_end_epoch": 1785591000.0, "ts_start": "", "val_bpb": 0.93355, "vram_gb": 52.6}
{"commit": "block55-E32-pooled-n60", "desc": "E32 POWER pass, seed 108 (82-111, disjoint from all 82 prior seeds); depth 6 + MATRIX_LR 0.03; median step 91.8 ms, duty 0.999; 60/60 arms clean", "exp": "E32_best_s108", "exp_num": 964, "milestone": "", "phase": "block55", "status": "keep", "steps": 3265, "ts_end": "2026-08-01T13:30:00Z", "ts_end_epoch": 1785591000.0, "ts_start": "", "val_bpb": 0.930133, "vram_gb": 44.0}
{"commit": "block55-E32-pooled-n60", "desc": "E32 POWER pass, seed 109 (82-111, disjoint from all 82 prior seeds); frozen defaults; median step 148.7 ms, duty 1.005; 60/60 arms clean", "exp": "E32_ctl_s109", "exp_num": 965, "milestone": "", "phase": "block55", "status": "keep", "steps": 2027, "ts_end": "2026-08-01T13:30:00Z", "ts_end_epoch": 1785591000.0, "ts_start": "", "val_bpb": 0.93146, "vram_gb": 52.6}
{"commit": "block55-E32-pooled-n60", "desc": "E32 POWER pass, seed 109 (82-111, disjoint from all 82 prior seeds); depth 6 + MATRIX_LR 0.03; median step 91.9 ms, duty 0.962; 60/60 arms clean", "exp": "E32_best_s109", "exp_num": 966, "milestone": "", "phase": "block55", "status": "keep", "steps": 3141, "ts_end": "2026-08-01T13:30:00Z", "ts_end_epoch": 1785591000.0, "ts_start": "", "val_bpb": 0.93139, "vram_gb": 44.0}
{"commit": "block55-E32-pooled-n60", "desc": "E32 POWER pass, seed 110 (82-111, disjoint from all 82 prior seeds); frozen defaults; median step 151.0 ms, duty 1.005; 60/60 arms clean", "exp": "E32_ctl_s110", "exp_num": 967, "milestone": "", "phase": "block55", "status": "keep", "steps": 1997, "ts_end": "2026-08-01T13:30:00Z", "ts_end_epoch": 1785591000.0, "ts_start": "", "val_bpb": 0.931558, "vram_gb": 52.6}
{"commit": "block55-E32-pooled-n60", "desc": "E32 POWER pass, seed 110 (82-111, disjoint from all 82 prior seeds); depth 6 + MATRIX_LR 0.03; median step 93.8 ms, duty 0.966; 60/60 arms clean", "exp": "E32_best_s110", "exp_num": 968, "milestone": "", "phase": "block55", "status": "keep", "steps": 3088, "ts_end": "2026-08-01T13:30:00Z", "ts_end_epoch": 1785591000.0, "ts_start": "", "val_bpb": 0.933682, "vram_gb": 44.0}
{"commit": "block55-E32-pooled-n60", "desc": "E32 POWER pass, seed 111 (82-111, disjoint from all 82 prior seeds); frozen defaults; median step 151.4 ms, duty 1.005; 60/60 arms clean", "exp": "E32_ctl_s111", "exp_num": 969, "milestone": "", "phase": "block55", "status": "keep", "steps": 1992, "ts_end": "2026-08-01T13:30:00Z", "ts_end_epoch": 1785591000.0, "ts_start": "", "val_bpb": 0.932097, "vram_gb": 52.6}
{"commit": "block55-E32-pooled-n60", "desc": "E32 POWER pass, seed 111 (82-111, disjoint from all 82 prior seeds); depth 6 + MATRIX_LR 0.03; median step 92.1 ms, duty 0.964; 60/60 arms clean", "exp": "E32_best_s111", "exp_num": 970, "milestone": "", "phase": "block55", "status": "keep", "steps": 3139, "ts_end": "2026-08-01T13:30:00Z", "ts_end_epoch": 1785591000.0, "ts_start": "", "val_bpb": 0.933478, "vram_gb": 44.0}
{"commit": "block57-E33-burst-cost-the-margin", "desc": "E33 settling pass, seed 112 (112-141); frozen defaults; median step 148.8 ms, duty 1.005", "exp": "E33_ctl_s112", "exp_num": 971, "milestone": "", "phase": "block57", "status": "keep", "steps": 2027, "ts_end": "2026-08-01T15:30:00Z", "ts_end_epoch": 1785598200.0, "ts_start": "", "val_bpb": 0.932259, "vram_gb": 52.6}
{"commit": "block57-E33-burst-cost-the-margin", "desc": "E33 settling pass, seed 112 (112-141); depth 6 + MATRIX_LR 0.03; median step 91.5 ms, duty 0.999", "exp": "E33_best_s112", "exp_num": 972, "milestone": "", "phase": "block57", "status": "keep", "steps": 3274, "ts_end": "2026-08-01T15:30:00Z", "ts_end_epoch": 1785598200.0, "ts_start": "", "val_bpb": 0.929836, "vram_gb": 44.0}
{"commit": "block57-E33-burst-cost-the-margin", "desc": "E33 settling pass, seed 113 (112-141); frozen defaults; median step 151.2 ms, duty 1.005", "exp": "E33_ctl_s113", "exp_num": 973, "milestone": "", "phase": "block57", "status": "keep", "steps": 1995, "ts_end": "2026-08-01T15:30:00Z", "ts_end_epoch": 1785598200.0, "ts_start": "", "val_bpb": 0.932637, "vram_gb": 52.6}
{"commit": "block57-E33-burst-cost-the-margin", "desc": "E33 settling pass, seed 113 (112-141); depth 6 + MATRIX_LR 0.03; median step 93.6 ms, duty 1.001", "exp": "E33_best_s113", "exp_num": 974, "milestone": "", "phase": "block57", "status": "keep", "steps": 3209, "ts_end": "2026-08-01T15:30:00Z", "ts_end_epoch": 1785598200.0, "ts_start": "", "val_bpb": 0.930857, "vram_gb": 44.0}
{"commit": "block57-E33-burst-cost-the-margin", "desc": "E33 settling pass, seed 114 (112-141); frozen defaults; median step 151.5 ms, duty 1.006", "exp": "E33_ctl_s114", "exp_num": 975, "milestone": "", "phase": "block57", "status": "keep", "steps": 1992, "ts_end": "2026-08-01T15:30:00Z", "ts_end_epoch": 1785598200.0, "ts_start": "", "val_bpb": 0.931896, "vram_gb": 52.6}
{"commit": "block57-E33-burst-cost-the-margin", "desc": "E33 settling pass, seed 114 (112-141); depth 6 + MATRIX_LR 0.03; median step 91.7 ms, duty 1.000", "exp": "E33_best_s114", "exp_num": 976, "milestone": "", "phase": "block57", "status": "keep", "steps": 3270, "ts_end": "2026-08-01T15:30:00Z", "ts_end_epoch": 1785598200.0, "ts_start": "", "val_bpb": 0.929619, "vram_gb": 44.0}
{"commit": "block57-E33-burst-cost-the-margin", "desc": "E33 settling pass, seed 115 (112-141); frozen defaults; median step 148.8 ms, duty 1.006", "exp": "E33_ctl_s115", "exp_num": 977, "milestone": "", "phase": "block57", "status": "keep", "steps": 2028, "ts_end": "2026-08-01T15:30:00Z", "ts_end_epoch": 1785598200.0, "ts_start": "", "val_bpb": 0.930667, "vram_gb": 52.6}
{"commit": "block57-E33-burst-cost-the-margin", "desc": "E33 settling pass, seed 115 (112-141); depth 6 + MATRIX_LR 0.03; median step 91.5 ms, duty 0.999", "exp": "E33_best_s115", "exp_num": 978, "milestone": "", "phase": "block57", "status": "keep", "steps": 3276, "ts_end": "2026-08-01T15:30:00Z", "ts_end_epoch": 1785598200.0, "ts_start": "", "val_bpb": 0.929778, "vram_gb": 44.0}
{"commit": "block57-E33-burst-cost-the-margin", "desc": "E33 settling pass, seed 116 (112-141); frozen defaults; median step 151.3 ms, duty 1.006", "exp": "E33_ctl_s116", "exp_num": 979, "milestone": "", "phase": "block57", "status": "keep", "steps": 1995, "ts_end": "2026-08-01T15:30:00Z", "ts_end_epoch": 1785598200.0, "ts_start": "", "val_bpb": 0.933361, "vram_gb": 52.6}
{"commit": "block57-E33-burst-cost-the-margin", "desc": "E33 settling pass, seed 116 (112-141); depth 6 + MATRIX_LR 0.03; median step 93.6 ms, duty 1.001", "exp": "E33_best_s116", "exp_num": 980, "milestone": "", "phase": "block57", "status": "keep", "steps": 3208, "ts_end": "2026-08-01T15:30:00Z", "ts_end_epoch": 1785598200.0, "ts_start": "", "val_bpb": 0.93023, "vram_gb": 44.0}
{"commit": "block57-E33-burst-cost-the-margin", "desc": "E33 settling pass, seed 117 (112-141); frozen defaults; median step 151.6 ms, duty 1.006", "exp": "E33_ctl_s117", "exp_num": 981, "milestone": "", "phase": "block57", "status": "keep", "steps": 1990, "ts_end": "2026-08-01T15:30:00Z", "ts_end_epoch": 1785598200.0, "ts_start": "", "val_bpb": 0.932189, "vram_gb": 52.6}
{"commit": "block57-E33-burst-cost-the-margin", "desc": "E33 settling pass, seed 117 (112-141); depth 6 + MATRIX_LR 0.03; median step 91.8 ms, duty 0.999", "exp": "E33_best_s117", "exp_num": 982, "milestone": "", "phase": "block57", "status": "keep", "steps": 3266, "ts_end": "2026-08-01T15:30:00Z", "ts_end_epoch": 1785598200.0, "ts_start": "", "val_bpb": 0.9291, "vram_gb": 44.0}
{"commit": "block57-E33-burst-cost-the-margin", "desc": "E33 settling pass, seed 118 (112-141); frozen defaults; median step 148.8 ms, duty 1.005", "exp": "E33_ctl_s118", "exp_num": 983, "milestone": "", "phase": "block57", "status": "keep", "steps": 2027, "ts_end": "2026-08-01T15:30:00Z", "ts_end_epoch": 1785598200.0, "ts_start": "", "val_bpb": 0.932818, "vram_gb": 52.6}
{"commit": "block57-E33-burst-cost-the-margin", "desc": "E33 settling pass, seed 118 (112-141); depth 6 + MATRIX_LR 0.03; median step 91.5 ms, duty 0.998", "exp": "E33_best_s118", "exp_num": 984, "milestone": "", "phase": "block57", "status": "keep", "steps": 3272, "ts_end": "2026-08-01T15:30:00Z", "ts_end_epoch": 1785598200.0, "ts_start": "", "val_bpb": 0.929868, "vram_gb": 44.0}
{"commit": "block57-E33-burst-cost-the-margin", "desc": "E33 settling pass, seed 119 (112-141); frozen defaults; median step 151.2 ms, duty 1.006", "exp": "E33_ctl_s119", "exp_num": 985, "milestone": "", "phase": "block57", "status": "keep", "steps": 1996, "ts_end": "2026-08-01T15:30:00Z", "ts_end_epoch": 1785598200.0, "ts_start": "", "val_bpb": 0.931712, "vram_gb": 52.6}
{"commit": "block57-E33-burst-cost-the-margin", "desc": "E33 settling pass, seed 119 (112-141); depth 6 + MATRIX_LR 0.03; median step 93.5 ms, duty 1.002", "exp": "E33_best_s119", "exp_num": 986, "milestone": "", "phase": "block57", "status": "keep", "steps": 3214, "ts_end": "2026-08-01T15:30:00Z", "ts_end_epoch": 1785598200.0, "ts_start": "", "val_bpb": 0.931282, "vram_gb": 44.0}
{"commit": "block57-E33-burst-cost-the-margin", "desc": "E33 settling pass, seed 120 (112-141); frozen defaults; median step 151.5 ms, duty 1.005", "exp": "E33_ctl_s120", "exp_num": 987, "milestone": "", "phase": "block57", "status": "keep", "steps": 1991, "ts_end": "2026-08-01T15:30:00Z", "ts_end_epoch": 1785598200.0, "ts_start": "", "val_bpb": 0.93363, "vram_gb": 52.6}
{"commit": "block57-E33-burst-cost-the-margin", "desc": "E33 settling pass, seed 120 (112-141); depth 6 + MATRIX_LR 0.03; median step 91.8 ms, duty 1.000", "exp": "E33_best_s120", "exp_num": 988, "milestone": "", "phase": "block57", "status": "keep", "steps": 3268, "ts_end": "2026-08-01T15:30:00Z", "ts_end_epoch": 1785598200.0, "ts_start": "", "val_bpb": 0.930068, "vram_gb": 44.0}
{"commit": "block57-E33-burst-cost-the-margin", "desc": "E33 settling pass, seed 121 (112-141); frozen defaults; median step 148.9 ms, duty 1.005", "exp": "E33_ctl_s121", "exp_num": 989, "milestone": "", "phase": "block57", "status": "keep", "steps": 2025, "ts_end": "2026-08-01T15:30:00Z", "ts_end_epoch": 1785598200.0, "ts_start": "", "val_bpb": 0.931409, "vram_gb": 52.6}
{"commit": "block57-E33-burst-cost-the-margin", "desc": "E33 settling pass, seed 121 (112-141); depth 6 + MATRIX_LR 0.03; median step 91.6 ms, duty 1.000", "exp": "E33_best_s121", "exp_num": 990, "milestone": "", "phase": "block57", "status": "keep", "steps": 3274, "ts_end": "2026-08-01T15:30:00Z", "ts_end_epoch": 1785598200.0, "ts_start": "", "val_bpb": 0.928986, "vram_gb": 44.0}
{"commit": "block57-E33-burst-cost-the-margin", "desc": "E33 settling pass, seed 122 (112-141); frozen defaults; median step 151.2 ms, duty 1.005", "exp": "E33_ctl_s122", "exp_num": 991, "milestone": "", "phase": "block57", "status": "keep", "steps": 1995, "ts_end": "2026-08-01T15:30:00Z", "ts_end_epoch": 1785598200.0, "ts_start": "", "val_bpb": 0.934577, "vram_gb": 52.6}
{"commit": "block57-E33-burst-cost-the-margin", "desc": "E33 settling pass, seed 122 (112-141); depth 6 + MATRIX_LR 0.03; median step 93.6 ms, duty 1.002", "exp": "E33_best_s122", "exp_num": 992, "milestone": "", "phase": "block57", "status": "keep", "steps": 3210, "ts_end": "2026-08-01T15:30:00Z", "ts_end_epoch": 1785598200.0, "ts_start": "", "val_bpb": 0.929788, "vram_gb": 44.0}
{"commit": "block57-E33-burst-cost-the-margin", "desc": "E33 settling pass, seed 123 (112-141); frozen defaults; median step 151.6 ms, duty 1.006", "exp": "E33_ctl_s123", "exp_num": 993, "milestone": "", "phase": "block57", "status": "keep", "steps": 1990, "ts_end": "2026-08-01T15:30:00Z", "ts_end_epoch": 1785598200.0, "ts_start": "", "val_bpb": 0.932657, "vram_gb": 52.6}
{"commit": "block57-E33-burst-cost-the-margin", "desc": "E33 settling pass, seed 123 (112-141); depth 6 + MATRIX_LR 0.03; median step 91.9 ms, duty 1.000", "exp": "E33_best_s123", "exp_num": 994, "milestone": "", "phase": "block57", "status": "keep", "steps": 3265, "ts_end": "2026-08-01T15:30:00Z", "ts_end_epoch": 1785598200.0, "ts_start": "", "val_bpb": 0.929998, "vram_gb": 44.0}
{"commit": "block57-E33-burst-cost-the-margin", "desc": "E33 settling pass, seed 124 (112-141); frozen defaults; median step 148.8 ms, duty 1.006", "exp": "E33_ctl_s124", "exp_num": 995, "milestone": "", "phase": "block57", "status": "keep", "steps": 2028, "ts_end": "2026-08-01T15:30:00Z", "ts_end_epoch": 1785598200.0, "ts_start": "", "val_bpb": 0.931606, "vram_gb": 52.6}
{"commit": "block57-E33-burst-cost-the-margin", "desc": "E33 settling pass, seed 124 (112-141); depth 6 + MATRIX_LR 0.03; median step 91.4 ms, duty 1.000", "exp": "E33_best_s124", "exp_num": 996, "milestone": "", "phase": "block57", "status": "keep", "steps": 3282, "ts_end": "2026-08-01T15:30:00Z", "ts_end_epoch": 1785598200.0, "ts_start": "", "val_bpb": 0.930109, "vram_gb": 44.0}
{"commit": "block57-E33-burst-cost-the-margin", "desc": "E33 settling pass, seed 125 (112-141); frozen defaults; median step 151.2 ms, duty 1.005", "exp": "E33_ctl_s125", "exp_num": 997, "milestone": "", "phase": "block57", "status": "keep", "steps": 1995, "ts_end": "2026-08-01T15:30:00Z", "ts_end_epoch": 1785598200.0, "ts_start": "", "val_bpb": 0.933198, "vram_gb": 52.6}
{"commit": "block57-E33-burst-cost-the-margin", "desc": "E33 settling pass, seed 125 (112-141); depth 6 + MATRIX_LR 0.03; median step 93.7 ms, duty 1.002", "exp": "E33_best_s125", "exp_num": 998, "milestone": "", "phase": "block57", "status": "keep", "steps": 3208, "ts_end": "2026-08-01T15:30:00Z", "ts_end_epoch": 1785598200.0, "ts_start": "", "val_bpb": 0.930595, "vram_gb": 44.0}
