{"exp_num": 77, "exp": "exp080_relu", "val_bpb": 0.994076, "vram_gb": 45.9, "steps": 1733, "status": "discard", "desc": "relu not squared (relu^2 important)", "phase": "2", "milestone": "", "ts_start": "", "ts_end": "2026-07-27T13:09:00Z", "ts_end_epoch": 1785157740.0, "commit": "b12e080"}
{"exp_num": 78, "exp": "exp081_x0lam015", "val_bpb": 0.978117, "vram_gb": 51.9, "steps": 1700, "status": "pilot", "desc": "x0_lambda 0.15", "phase": "2", "milestone": "", "ts_start": "", "ts_end": "2026-07-27T13:09:00Z", "ts_end_epoch": 1785157740.0, "commit": "b12e081"}
{"exp_num": 79, "exp": "exp082_mlr05_ffn6", "val_bpb": 0.978898, "vram_gb": 51.9, "steps": 1662, "status": "pilot", "desc": "matrix_lr 0.05 @FFN6 (noise)", "phase": "2", "milestone": "", "ts_start": "", "ts_end": "2026-07-27T13:09:00Z", "ts_end_epoch": 1785157740.0, "commit": "b12e082"}
{"exp_num": 80, "exp": "exp083_emb07_ffn6", "val_bpb": 0.975632, "vram_gb": 51.9, "steps": 1690, "status": "pilot", "desc": "embedding_lr 0.7 @FFN6", "phase": "2", "milestone": "", "ts_start": "", "ts_end": "2026-07-27T13:09:00Z", "ts_end_epoch": 1785157740.0, "commit": "b12e083"}
{"exp_num": 81, "exp": "exp084_warmdown06", "val_bpb": 0.974364, "vram_gb": 51.9, "steps": 1718, "status": "pilot", "desc": "warmdown 0.6 @FFN6", "phase": "2", "milestone": "", "ts_start": "", "ts_end": "2026-07-27T13:09:00Z", "ts_end_epoch": 1785157740.0, "commit": "b12e084"}
{"exp_num": 82, "exp": "exp085_ng23_t16_s43", "val_bpb": 0.971339, "vram_gb": 52.3, "steps": 1695, "status": "keep", "desc": "n-gram(2,3) t16 confirm s43", "phase": "2", "milestone": "", "ts_start": "", "ts_end": "2026-07-27T13:14:00Z", "ts_end_epoch": 1785158040.0, "commit": "b13e085"}
{"exp_num": 83, "exp": "exp086_ng23_t16_s44", "val_bpb": 0.969069, "vram_gb": 52.3, "steps": 1721, "status": "keep", "desc": "n-gram(2,3) t16 confirm s44", "phase": "2", "milestone": "", "ts_start": "", "ts_end": "2026-07-27T13:14:00Z", "ts_end_epoch": 1785158040.0, "commit": "b13e086"}
{"exp_num": 84, "exp": "exp087_ng2_t16_s42", "val_bpb": 0.967981, "vram_gb": 52.4, "steps": 1718, "status": "pilot", "desc": "n-gram bigram-only t16 (beats 2,3 slightly)", "phase": "2", "milestone": "", "ts_start": "", "ts_end": "2026-07-27T13:14:00Z", "ts_end_epoch": 1785158040.0, "commit": "b13e087"}
{"exp_num": 85, "exp": "exp088_ng234_t16_s42", "val_bpb": 0.973176, "vram_gb": 52.5, "steps": 1681, "status": "discard", "desc": "n-gram(2,3,4) +4gram worse", "phase": "2", "milestone": "", "ts_start": "", "ts_end": "2026-07-27T13:14:00Z", "ts_end_epoch": 1785158040.0, "commit": "b13e088"}
{"exp_num": 86, "exp": "exp089_ng23_t17_s42", "val_bpb": 0.967048, "vram_gb": 52.7, "steps": 1641, "status": "pilot", "desc": "n-gram(2,3) t17 bigger table", "phase": "2", "milestone": "", "ts_start": "", "ts_end": "2026-07-27T13:14:00Z", "ts_end_epoch": 1785158040.0, "commit": "b13e089"}
{"exp_num": 87, "exp": "exp090_ng23_t15_s42", "val_bpb": 0.973448, "vram_gb": 52.1, "steps": 1675, "status": "discard", "desc": "n-gram(2,3) t15 smaller table worse", "phase": "2", "milestone": "", "ts_start": "", "ts_end": "2026-07-27T13:14:00Z", "ts_end_epoch": 1785158040.0, "commit": "b13e090"}
{"exp_num": 88, "exp": "exp091_ng23_t18_s42", "val_bpb": 0.961288, "vram_gb": 53.4, "steps": 1689, "status": "pilot", "desc": "n-gram(2,3) t18 (best, bigger table wins)", "phase": "2", "milestone": "", "ts_start": "", "ts_end": "2026-07-27T13:14:00Z", "ts_end_epoch": 1785158040.0, "commit": "b13e091"}
{"exp_num": 89, "exp": "exp092_ng23_t19_s42", "val_bpb": 0.958016, "vram_gb": 54.9, "steps": 1681, "status": "pilot", "desc": "n-gram(2,3) t19", "phase": "2", "milestone": "", "ts_start": "", "ts_end": "2026-07-27T13:21:00Z", "ts_end_epoch": 1785158460.0, "commit": "b14e092"}
{"exp_num": 90, "exp": "exp093_ng23_t20_s42", "val_bpb": 0.954428, "vram_gb": 57.9, "steps": 1677, "status": "keep", "desc": "n-gram(2,3) t20 (best, adopted as reference)", "phase": "2", "milestone": "n-gram table 2\u00b2\u2070", "ts_start": "", "ts_end": "2026-07-27T13:21:00Z", "ts_end_epoch": 1785158460.0, "commit": "b14e093"}
{"exp_num": 91, "exp": "exp094_ng23_t18_s43", "val_bpb": 0.961945, "vram_gb": 53.4, "steps": 1702, "status": "keep", "desc": "n-gram t18 confirm s43", "phase": "2", "milestone": "", "ts_start": "", "ts_end": "2026-07-27T13:21:00Z", "ts_end_epoch": 1785158460.0, "commit": "b14e094"}
{"exp_num": 92, "exp": "exp095_ng23_t18_s44", "val_bpb": 0.963115, "vram_gb": 53.4, "steps": 1678, "status": "keep", "desc": "n-gram t18 confirm s44 (3-seed 0.9621)", "phase": "2", "milestone": "", "ts_start": "", "ts_end": "2026-07-27T13:21:00Z", "ts_end_epoch": 1785158460.0, "commit": "b14e095"}
{"exp_num": 93, "exp": "exp096_ng2_t18_s42", "val_bpb": 0.964408, "vram_gb": 52.9, "steps": 1641, "status": "pilot", "desc": "n-gram bigram-only t18 (worse than 2,3 at big table)", "phase": "2", "milestone": "", "ts_start": "", "ts_end": "2026-07-27T13:21:00Z", "ts_end_epoch": 1785158460.0, "commit": "b14e096"}
{"exp_num": 94, "exp": "exp097_ng2_t19_s42", "val_bpb": 0.960181, "vram_gb": 53.7, "steps": 1674, "status": "pilot", "desc": "n-gram bigram-only t19", "phase": "2", "milestone": "", "ts_start": "", "ts_end": "2026-07-27T13:21:00Z", "ts_end_epoch": 1785158460.0, "commit": "b14e097"}
{"exp_num": 95, "exp": "exp098_ng2_t20_s42", "val_bpb": 0.957518, "vram_gb": 55.2, "steps": 1682, "status": "pilot", "desc": "n-gram bigram-only t20 (2,3 wins)", "phase": "2", "milestone": "", "ts_start": "", "ts_end": "2026-07-27T13:21:00Z", "ts_end_epoch": 1785158460.0, "commit": "b14e098"}
{"exp_num": 96, "exp": "exp099_ng_t21_s42", "val_bpb": 0.954064, "vram_gb": 63.9, "steps": 1606, "status": "pilot", "desc": "n-gram t21", "phase": "2", "milestone": "", "ts_start": "", "ts_end": "2026-07-27T13:28:00Z", "ts_end_epoch": 1785158880.0, "commit": "b15e099"}
{"exp_num": 97, "exp": "exp100_ng_t22_s42", "val_bpb": 0.954024, "vram_gb": 75.9, "steps": 1535, "status": "pilot", "desc": "n-gram t22 (table saturating)", "phase": "2", "milestone": "", "ts_start": "", "ts_end": "2026-07-27T13:28:00Z", "ts_end_epoch": 1785158880.0, "commit": "b15e100"}
{"exp_num": 98, "exp": "exp101_ng_t20_s43", "val_bpb": 0.955647, "vram_gb": 57.9, "steps": 1670, "status": "keep", "desc": "n-gram t20 confirm s43", "phase": "2", "milestone": "", "ts_start": "", "ts_end": "2026-07-27T13:28:00Z", "ts_end_epoch": 1785158880.0, "commit": "b15e101"}
{"exp_num": 99, "exp": "exp102_ng_t20_s44", "val_bpb": 0.956471, "vram_gb": 57.9, "steps": 1640, "status": "keep", "desc": "n-gram t20 confirm s44 (3-seed 0.9555)", "phase": "2", "milestone": "", "ts_start": "", "ts_end": "2026-07-27T13:28:00Z", "ts_end_epoch": 1785158880.0, "commit": "b15e102"}
{"exp_num": 100, "exp": "exp103_ng_t20_wd06", "val_bpb": 0.956844, "vram_gb": 57.9, "steps": 1595, "status": "discard", "desc": "n-gram + warmdown 0.6 (no help)", "phase": "2", "milestone": "", "ts_start": "", "ts_end": "2026-07-27T13:28:00Z", "ts_end_epoch": 1785158880.0, "commit": "b15e103"}
{"exp_num": 101, "exp": "exp104_ng_t20_emb08", "val_bpb": 0.956077, "vram_gb": 57.9, "steps": 1631, "status": "discard", "desc": "n-gram + embedding_lr 0.8 (no help)", "phase": "2", "milestone": "", "ts_start": "", "ts_end": "2026-07-27T13:28:00Z", "ts_end_epoch": 1785158880.0, "commit": "b15e104"}
{"exp_num": 102, "exp": "exp105_ng_t21_s43", "val_bpb": 0.954895, "vram_gb": 63.9, "steps": 1608, "status": "pilot", "desc": "n-gram t21 s43", "phase": "2", "milestone": "", "ts_start": "", "ts_end": "2026-07-27T13:28:00Z", "ts_end_epoch": 1785158880.0, "commit": "b15e105"}
{"exp_num": 103, "exp": "exp106_ng_t21_s44", "val_bpb": 0.954101, "vram_gb": 63.9, "steps": 1608, "status": "pilot", "desc": "n-gram t21 s44 (3-seed 0.9544, marginal over t20)", "phase": "2", "milestone": "", "ts_start": "", "ts_end": "2026-07-27T13:35:00Z", "ts_end_epoch": 1785159300.0, "commit": "b16e106"}
{"exp_num": 104, "exp": "exp107_ng_t22_s43", "val_bpb": 0.954634, "vram_gb": 75.9, "steps": 1534, "status": "pilot", "desc": "n-gram t22 s43 (saturated)", "phase": "2", "milestone": "", "ts_start": "", "ts_end": "2026-07-27T13:35:00Z", "ts_end_epoch": 1785159300.0, "commit": "b16e107"}
{"exp_num": 105, "exp": "exp108_ng_mlr05", "val_bpb": 0.958612, "vram_gb": 57.9, "steps": 1673, "status": "discard", "desc": "n-gram+matrix_lr 0.05 (worse)", "phase": "2", "milestone": "", "ts_start": "", "ts_end": "2026-07-27T13:35:00Z", "ts_end_epoch": 1785159300.0, "commit": "b16e108"}
{"exp_num": 106, "exp": "exp109_ng_wd04", "val_bpb": 0.956598, "vram_gb": 57.9, "steps": 1641, "status": "pilot", "desc": "n-gram+warmdown 0.4", "phase": "2", "milestone": "", "ts_start": "", "ts_end": "2026-07-27T13:35:00Z", "ts_end_epoch": 1785159300.0, "commit": "b16e109"}
{"exp_num": 107, "exp": "exp110_ng_ffn8x", "val_bpb": 0.959416, "vram_gb": 69.3, "steps": 1428, "status": "discard", "desc": "n-gram+FFN 8x (worse, 6x still best)", "phase": "2", "milestone": "", "ts_start": "", "ts_end": "2026-07-27T13:35:00Z", "ts_end_epoch": 1785159300.0, "commit": "b16e110"}
{"exp_num": 108, "exp": "exp111_ng_emb045", "val_bpb": 0.956173, "vram_gb": 57.9, "steps": 1629, "status": "pilot", "desc": "n-gram+embedding_lr 0.45", "phase": "2", "milestone": "", "ts_start": "", "ts_end": "2026-07-27T13:35:00Z", "ts_end_epoch": 1785159300.0, "commit": "b16e111"}
{"exp_num": 109, "exp": "exp112_ng_scalar07", "val_bpb": 0.955136, "vram_gb": 57.9, "steps": 1658, "status": "pilot", "desc": "n-gram+scalar_lr 0.7", "phase": "2", "milestone": "", "ts_start": "", "ts_end": "2026-07-27T13:35:00Z", "ts_end_epoch": 1785159300.0, "commit": "b16e112"}
{"exp_num": 110, "exp": "exp113_nglr03", "val_bpb": 0.954809, "vram_gb": 57.9, "steps": 1657, "status": "pilot", "desc": "NGRAM_LR 0.3", "phase": "2", "milestone": "", "ts_start": "", "ts_end": "2026-07-27T13:52:00Z", "ts_end_epoch": 1785160320.0, "commit": "b17e113"}
{"exp_num": 111, "exp": "exp114_nglr10", "val_bpb": 0.954662, "vram_gb": 57.9, "steps": 1677, "status": "pilot", "desc": "NGRAM_LR 1.0 (flat, no gain)", "phase": "2", "milestone": "", "ts_start": "", "ts_end": "2026-07-27T13:52:00Z", "ts_end_epoch": 1785160320.0, "commit": "b17e114"}
{"exp_num": 112, "exp": "exp115_nglr15", "val_bpb": 0.956052, "vram_gb": 57.9, "steps": 1671, "status": "pilot", "desc": "NGRAM_LR 1.5", "phase": "2", "milestone": "", "ts_start": "", "ts_end": "2026-07-27T13:52:00Z", "ts_end_epoch": 1785160320.0, "commit": "b17e115"}
{"exp_num": 113, "exp": "exp116_nglr20", "val_bpb": 0.957714, "vram_gb": 57.9, "steps": 1641, "status": "discard", "desc": "NGRAM_LR 2.0 (worse)", "phase": "2", "milestone": "", "ts_start": "", "ts_end": "2026-07-27T13:52:00Z", "ts_end_epoch": 1785160320.0, "commit": "b17e116"}
{"exp_num": 114, "exp": "exp117_nglr30", "val_bpb": 0.961548, "vram_gb": 57.9, "steps": 1597, "status": "discard", "desc": "NGRAM_LR 3.0 (worse)", "phase": "2", "milestone": "", "ts_start": "", "ts_end": "2026-07-27T13:52:00Z", "ts_end_epoch": 1785160320.0, "commit": "b17e117"}
{"exp_num": 115, "exp": "exp118_nglr40", "val_bpb": 0.961247, "vram_gb": 57.9, "steps": 1630, "status": "discard", "desc": "NGRAM_LR 4.0 (worse)", "phase": "2", "milestone": "", "ts_start": "", "ts_end": "2026-07-27T13:52:00Z", "ts_end_epoch": 1785160320.0, "commit": "b17e118"}
{"exp_num": 116, "exp": "exp119_nglr06", "val_bpb": 0.955185, "vram_gb": 57.9, "steps": 1660, "status": "pilot", "desc": "NGRAM_LR 0.6 control", "phase": "2", "milestone": "", "ts_start": "", "ts_end": "2026-07-27T13:52:00Z", "ts_end_epoch": 1785160320.0, "commit": "b17e119"}
{"exp_num": 117, "exp": "exp120_maxauto", "val_bpb": 0.953573, "vram_gb": 57.9, "steps": 1700, "status": "keep", "desc": "max-autotune-no-cudagraphs compile (ADOPTED, +U free throughput)", "phase": "2", "milestone": "", "ts_start": "", "ts_end": "2026-07-27T13:57:00Z", "ts_end_epoch": 1785160620.0, "commit": "b18e120"}
{"exp_num": 118, "exp": "exp121_muon_ns3", "val_bpb": 0.962415, "vram_gb": 57.9, "steps": 1680, "status": "discard", "desc": "Muon ns_steps 3 (coarser orthogonalization, worse)", "phase": "2", "milestone": "", "ts_start": "", "ts_end": "2026-07-27T13:57:00Z", "ts_end_epoch": 1785160620.0, "commit": "b18e121"}
{"exp_num": 119, "exp": "exp122_muon_ns4", "val_bpb": 0.956108, "vram_gb": 57.9, "steps": 1671, "status": "discard", "desc": "Muon ns_steps 4 (worse)", "phase": "2", "milestone": "", "ts_start": "", "ts_end": "2026-07-27T13:57:00Z", "ts_end_epoch": 1785160620.0, "commit": "b18e122"}
{"exp_num": 120, "exp": "exp123_winSSSS", "val_bpb": 0.956241, "vram_gb": 57.9, "steps": 1645, "status": "discard", "desc": "window SSSS (hurts quality, lit-confirmed)", "phase": "2", "milestone": "", "ts_start": "", "ts_end": "2026-07-27T13:57:00Z", "ts_end_epoch": 1785160620.0, "commit": "b18e123"}
{"exp_num": 121, "exp": "exp124_maxauto_ssss", "val_bpb": 0.956359, "vram_gb": 57.9, "steps": 1635, "status": "discard", "desc": "max-autotune+SSSS", "phase": "2", "milestone": "", "ts_start": "", "ts_end": "2026-07-27T13:57:00Z", "ts_end_epoch": 1785160620.0, "commit": "b18e124"}
{"exp_num": 122, "exp": "exp125_maxauto_ns3", "val_bpb": 0.962513, "vram_gb": 57.9, "steps": 1675, "status": "discard", "desc": "max-autotune+ns3", "phase": "2", "milestone": "", "ts_start": "", "ts_end": "2026-07-27T13:57:00Z", "ts_end_epoch": 1785160620.0, "commit": "b18e125"}
{"exp_num": 123, "exp": "exp126_veall_ng", "val_bpb": 0.955519, "vram_gb": 57.9, "steps": 1629, "status": "discard", "desc": "VE all layers + n-gram (null)", "phase": "2", "milestone": "", "ts_start": "", "ts_end": "2026-07-27T13:57:00Z", "ts_end_epoch": 1785160620.0, "commit": "b18e126"}
{"exp_num": 124, "exp": "exp127_docmask_s42", "val_bpb": 0.955824, "vram_gb": 57.6, "steps": 1599, "status": "pilot", "desc": "doc-mask=1 s42 (FlexAttn)", "phase": "2", "milestone": "", "ts_start": "", "ts_end": "2026-07-27T14:00:00Z", "ts_end_epoch": 1785160800.0, "commit": "b19e127"}
{"exp_num": 125, "exp": "exp128_docmask_s43", "val_bpb": 0.958167, "vram_gb": 57.6, "steps": 1581, "status": "pilot", "desc": "doc-mask=1 s43", "phase": "2", "milestone": "", "ts_start": "", "ts_end": "2026-07-27T14:00:00Z", "ts_end_epoch": 1785160800.0, "commit": "b19e128"}
{"exp_num": 126, "exp": "exp129_docmask_s44", "val_bpb": 0.955879, "vram_gb": 57.6, "steps": 1594, "status": "pilot", "desc": "doc-mask=1 s44 (3-seed mean 0.9566, NULL vs control)", "phase": "2", "milestone": "", "ts_start": "", "ts_end": "2026-07-27T14:00:00Z", "ts_end_epoch": 1785160800.0, "commit": "b19e129"}
{"exp_num": 127, "exp": "exp130_ctrl_s42", "val_bpb": 0.95582, "vram_gb": 57.6, "steps": 1643, "status": "pilot", "desc": "doc-mask=0 control s42", "phase": "2", "milestone": "", "ts_start": "", "ts_end": "2026-07-27T14:00:00Z", "ts_end_epoch": 1785160800.0, "commit": "b19e130"}
{"exp_num": 128, "exp": "exp131_ctrl_s43", "val_bpb": 0.958468, "vram_gb": 57.6, "steps": 1598, "status": "pilot", "desc": "control s43", "phase": "2", "milestone": "", "ts_start": "", "ts_end": "2026-07-27T14:00:00Z", "ts_end_epoch": 1785160800.0, "commit": "b19e131"}
{"exp_num": 129, "exp": "exp132_ctrl_s44", "val_bpb": 0.956543, "vram_gb": 57.6, "steps": 1635, "status": "pilot", "desc": "control s44", "phase": "2", "milestone": "", "ts_start": "", "ts_end": "2026-07-27T14:00:00Z", "ts_end_epoch": 1785160800.0, "commit": "b19e132"}
{"exp_num": 130, "exp": "exp133_docmask_winL", "val_bpb": 0.956304, "vram_gb": 57.6, "steps": 1587, "status": "discard", "desc": "doc-mask + full in-doc attention (null)", "phase": "2", "milestone": "", "ts_start": "", "ts_end": "2026-07-27T14:00:00Z", "ts_end_epoch": 1785160800.0, "commit": "b19e133"}
{"exp_num": 131, "exp": "exp134_ng_depth10", "val_bpb": 0.962523, "vram_gb": 86.4, "steps": 1018, "status": "discard", "desc": "depth 10 (worse even with n-gram; interaction falsified)", "phase": "2", "milestone": "", "ts_start": "", "ts_end": "2026-07-27T14:14:00Z", "ts_end_epoch": 1785161640.0, "commit": "b20e134"}
{"exp_num": 132, "exp": "exp135_ng_depth12", "val_bpb": 0.976624, "vram_gb": 121.0, "steps": 673, "status": "discard", "desc": "depth 12 (much worse, 124GB, 673 steps)", "phase": "2", "milestone": "", "ts_start": "", "ts_end": "2026-07-27T14:14:00Z", "ts_end_epoch": 1785161640.0, "commit": "b20e135"}
{"exp_num": 133, "exp": "exp136_ng_depth9", "val_bpb": 0.957132, "vram_gb": 79.1, "steps": 1118, "status": "discard", "desc": "depth 9", "phase": "2", "milestone": "", "ts_start": "", "ts_end": "2026-07-27T14:14:00Z", "ts_end_epoch": 1785161640.0, "commit": "b20e136"}
{"exp_num": 134, "exp": "exp137_ng_aspect80", "val_bpb": 0.958088, "vram_gb": 71.8, "steps": 1229, "status": "discard", "desc": "aspect_ratio 80 (wider)", "phase": "2", "milestone": "", "ts_start": "", "ts_end": "2026-07-27T14:14:00Z", "ts_end_epoch": 1785161640.0, "commit": "b20e137"}
{"exp_num": 135, "exp": "exp138_ng_rope50k", "val_bpb": 0.954795, "vram_gb": 57.9, "steps": 1621, "status": "pilot", "desc": "rotary base 50k (neutral)", "phase": "2", "milestone": "", "ts_start": "", "ts_end": "2026-07-27T14:14:00Z", "ts_end_epoch": 1785161640.0, "commit": "b20e138"}
{"exp_num": 136, "exp": "exp139_ng_mom098", "val_bpb": 0.957344, "vram_gb": 57.9, "steps": 1659, "status": "discard", "desc": "Muon momentum final 0.98 (worse)", "phase": "2", "milestone": "", "ts_start": "", "ts_end": "2026-07-27T14:14:00Z", "ts_end_epoch": 1785161640.0, "commit": "b20e139"}
{"exp_num": 137, "exp": "exp140_ng_hdim256", "val_bpb": 0.960453, "vram_gb": 57.9, "steps": 1662, "status": "discard", "desc": "head_dim 256 / 2 heads (worse)", "phase": "2", "milestone": "", "ts_start": "", "ts_end": "2026-07-27T14:14:00Z", "ts_end_epoch": 1785161640.0, "commit": "b20e140"}
{"exp_num": 138, "exp": "exp141_ng234_4g22_s42", "val_bpb": 0.958026, "vram_gb": 69.9, "steps": 1557, "status": "discard", "desc": "n-gram +4gram@2^22 (data-starved, worse)", "phase": "2", "milestone": "", "ts_start": "", "ts_end": "2026-07-27T14:24:00Z", "ts_end_epoch": 1785162240.0, "commit": "b21e141"}
{"exp_num": 139, "exp": "exp142_ng234_4g22_s43", "val_bpb": 0.958702, "vram_gb": 69.9, "steps": 1575, "status": "discard", "desc": "+4gram s43 (3-seed worse)", "phase": "2", "milestone": "", "ts_start": "", "ts_end": "2026-07-27T14:24:00Z", "ts_end_epoch": 1785162240.0, "commit": "b21e142"}
{"exp_num": 140, "exp": "exp143_ng234_3g4g22_s42", "val_bpb": 0.957582, "vram_gb": 78.9, "steps": 1508, "status": "discard", "desc": "+big-trigram+4gram", "phase": "2", "milestone": "", "ts_start": "", "ts_end": "2026-07-27T14:24:00Z", "ts_end_epoch": 1785162240.0, "commit": "b21e143"}
{"exp_num": 141, "exp": "exp144_ng23_3g22_s42", "val_bpb": 0.954681, "vram_gb": 66.9, "steps": 1568, "status": "pilot", "desc": "trigram@2^22 (~ref, marginal)", "phase": "2", "milestone": "", "ts_start": "", "ts_end": "2026-07-27T14:24:00Z", "ts_end_epoch": 1785162240.0, "commit": "b21e144"}
{"exp_num": 142, "exp": "exp145_ng23_both22_s42", "val_bpb": 0.9565, "vram_gb": 75.9, "steps": 1468, "status": "discard", "desc": "bi+tri@2^22 (worse)", "phase": "2", "milestone": "", "ts_start": "", "ts_end": "2026-07-27T14:24:00Z", "ts_end_epoch": 1785162240.0, "commit": "b21e145"}
{"exp_num": 143, "exp": "exp146_ng234_scaled_s42", "val_bpb": 0.961466, "vram_gb": 67.7, "steps": 1553, "status": "discard", "desc": "order-scaled 4gram (worse)", "phase": "2", "milestone": "", "ts_start": "", "ts_end": "2026-07-27T14:24:00Z", "ts_end_epoch": 1785162240.0, "commit": "b21e146"}
{"exp_num": 144, "exp": "exp147_ng2345_s42", "val_bpb": 0.965202, "vram_gb": 79.7, "steps": 1489, "status": "discard", "desc": "+4gram+5gram (data-starved)", "phase": "2", "milestone": "", "ts_start": "", "ts_end": "2026-07-27T14:24:00Z", "ts_end_epoch": 1785162240.0, "commit": "b21e147"}
{"exp_num": 145, "exp": "exp148_ref_s46", "val_bpb": 0.956671, "vram_gb": 57.9, "steps": 1595, "status": "keep", "desc": "reference s46", "phase": "2", "milestone": "", "ts_start": "", "ts_end": "2026-07-27T14:30:00Z", "ts_end_epoch": 1785162600.0, "commit": "b22e148"}
{"exp_num": 146, "exp": "exp149_ref_s47", "val_bpb": 0.952667, "vram_gb": 57.9, "steps": 1715, "status": "keep", "desc": "reference s47 (best single)", "phase": "2", "milestone": "", "ts_start": "", "ts_end": "2026-07-27T14:30:00Z", "ts_end_epoch": 1785162600.0, "commit": "b22e149"}
{"exp_num": 147, "exp": "exp150_ref_s48", "val_bpb": 0.954197, "vram_gb": 57.9, "steps": 1705, "status": "keep", "desc": "reference s48 (3-seed mean 0.9545)", "phase": "2", "milestone": "", "ts_start": "", "ts_end": "2026-07-27T14:30:00Z", "ts_end_epoch": 1785162600.0, "commit": "b22e150"}
{"exp_num": 148, "exp": "exp151_vegate64", "val_bpb": 0.955188, "vram_gb": 57.9, "steps": 1675, "status": "pilot", "desc": "ve_gate_channels 64 (null)", "phase": "2", "milestone": "", "ts_start": "", "ts_end": "2026-07-27T14:30:00Z", "ts_end_epoch": 1785162600.0, "commit": "b22e151"}
{"exp_num": 149, "exp": "exp152_vegate16", "val_bpb": 0.956269, "vram_gb": 57.9, "steps": 1626, "status": "pilot", "desc": "ve_gate_channels 16 (null)", "phase": "2", "milestone": "", "ts_start": "", "ts_end": "2026-07-27T14:30:00Z", "ts_end_epoch": 1785162600.0, "commit": "b22e152"}
{"exp_num": 150, "exp": "exp153_softcap20", "val_bpb": 0.95634, "vram_gb": 57.9, "steps": 1670, "status": "pilot", "desc": "softcap 20 (null)", "phase": "2", "milestone": "", "ts_start": "", "ts_end": "2026-07-27T14:30:00Z", "ts_end_epoch": 1785162600.0, "commit": "b22e153"}
{"exp_num": 151, "exp": "exp154_wdconst", "val_bpb": 0.962643, "vram_gb": 57.9, "steps": 1677, "status": "discard", "desc": "constant weight-decay (rampdown matters, worse)", "phase": "2", "milestone": "", "ts_start": "", "ts_end": "2026-07-27T14:30:00Z", "ts_end_epoch": 1785162600.0, "commit": "b22e154"}
