{"commit": "block48-E28-first-adoption", "desc": "E28 frozen defaults (depth 8, MATRIX_LR 0.04); median step 148.8 ms, duty 1.005; screened against its OWN cell median since the two arms are different shapes; 20/20 arms clean", "exp": "E28_ctl_s47", "exp_num": 841, "milestone": "", "phase": "block48", "status": "keep", "steps": 2027, "ts_end": "2026-08-01T06:00:00Z", "ts_end_epoch": 1785564000.0, "ts_start": "", "val_bpb": 0.930922, "vram_gb": 52.6}
{"commit": "block48-E28-first-adoption", "desc": "E28 ADOPTED config: depth 6, MATRIX_LR 0.03; median step 91.5 ms, duty 1.000; screened against its OWN cell median since the two arms are different shapes; 20/20 arms clean", "exp": "E28_best_s47", "exp_num": 842, "milestone": "SOTA", "phase": "block48", "status": "keep", "steps": 3280, "ts_end": "2026-08-01T06:00:00Z", "ts_end_epoch": 1785564000.0, "ts_start": "", "val_bpb": 0.928277, "vram_gb": 44.0}
{"commit": "block48-E28-first-adoption", "desc": "E28 frozen defaults (depth 8, MATRIX_LR 0.04); median step 151.1 ms, duty 1.006; screened against its OWN cell median since the two arms are different shapes; 20/20 arms clean", "exp": "E28_ctl_s48", "exp_num": 843, "milestone": "", "phase": "block48", "status": "keep", "steps": 1997, "ts_end": "2026-08-01T06:00:00Z", "ts_end_epoch": 1785564000.0, "ts_start": "", "val_bpb": 0.931794, "vram_gb": 52.6}
{"commit": "block48-E28-first-adoption", "desc": "E28 ADOPTED config: depth 6, MATRIX_LR 0.03; median step 92.7 ms, duty 1.001; screened against its OWN cell median since the two arms are different shapes; 20/20 arms clean", "exp": "E28_best_s48", "exp_num": 844, "milestone": "SOTA", "phase": "block48", "status": "keep", "steps": 3241, "ts_end": "2026-08-01T06:00:00Z", "ts_end_epoch": 1785564000.0, "ts_start": "", "val_bpb": 0.931013, "vram_gb": 44.0}
{"commit": "block48-E28-first-adoption", "desc": "E28 frozen defaults (depth 8, MATRIX_LR 0.04); median step 149.5 ms, duty 1.005; screened against its OWN cell median since the two arms are different shapes; 20/20 arms clean", "exp": "E28_ctl_s49", "exp_num": 845, "milestone": "", "phase": "block48", "status": "keep", "steps": 2017, "ts_end": "2026-08-01T06:00:00Z", "ts_end_epoch": 1785564000.0, "ts_start": "", "val_bpb": 0.932498, "vram_gb": 52.6}
{"commit": "block48-E28-first-adoption", "desc": "E28 ADOPTED config: depth 6, MATRIX_LR 0.03; median step 91.5 ms, duty 1.000; screened against its OWN cell median since the two arms are different shapes; 20/20 arms clean", "exp": "E28_best_s49", "exp_num": 846, "milestone": "SOTA", "phase": "block48", "status": "keep", "steps": 3279, "ts_end": "2026-08-01T06:00:00Z", "ts_end_epoch": 1785564000.0, "ts_start": "", "val_bpb": 0.928476, "vram_gb": 44.0}
{"commit": "block48-E28-first-adoption", "desc": "E28 frozen defaults (depth 8, MATRIX_LR 0.04); median step 149.1 ms, duty 1.005; screened against its OWN cell median since the two arms are different shapes; 20/20 arms clean", "exp": "E28_ctl_s50", "exp_num": 847, "milestone": "", "phase": "block48", "status": "keep", "steps": 2023, "ts_end": "2026-08-01T06:00:00Z", "ts_end_epoch": 1785564000.0, "ts_start": "", "val_bpb": 0.931021, "vram_gb": 52.6}
{"commit": "block48-E28-first-adoption", "desc": "E28 ADOPTED config: depth 6, MATRIX_LR 0.03; median step 92.4 ms, duty 1.001; screened against its OWN cell median since the two arms are different shapes; 20/20 arms clean", "exp": "E28_best_s50", "exp_num": 848, "milestone": "SOTA", "phase": "block48", "status": "keep", "steps": 3249, "ts_end": "2026-08-01T06:00:00Z", "ts_end_epoch": 1785564000.0, "ts_start": "", "val_bpb": 0.929172, "vram_gb": 44.0}
{"commit": "block48-E28-first-adoption", "desc": "E28 frozen defaults (depth 8, MATRIX_LR 0.04); median step 151.6 ms, duty 1.006; screened against its OWN cell median since the two arms are different shapes; 20/20 arms clean", "exp": "E28_ctl_s51", "exp_num": 849, "milestone": "", "phase": "block48", "status": "keep", "steps": 1990, "ts_end": "2026-08-01T06:00:00Z", "ts_end_epoch": 1785564000.0, "ts_start": "", "val_bpb": 0.932318, "vram_gb": 52.6}
{"commit": "block48-E28-first-adoption", "desc": "E28 ADOPTED config: depth 6, MATRIX_LR 0.03; median step 91.9 ms, duty 1.001; screened against its OWN cell median since the two arms are different shapes; 20/20 arms clean", "exp": "E28_best_s51", "exp_num": 850, "milestone": "SOTA", "phase": "block48", "status": "keep", "steps": 3267, "ts_end": "2026-08-01T06:00:00Z", "ts_end_epoch": 1785564000.0, "ts_start": "", "val_bpb": 0.930182, "vram_gb": 44.0}
{"commit": "block50-E29-adoption-retracted", "desc": "E29 VERIFICATION on FRESH seed 52 (52-61 disjoint from every prior arm); frozen defaults; median step 148.9 ms, duty 1.006; 20/20 arms clean", "exp": "E29_ctl_s52", "exp_num": 851, "milestone": "", "phase": "block50", "status": "keep", "steps": 2027, "ts_end": "2026-08-01T08:00:00Z", "ts_end_epoch": 1785571200.0, "ts_start": "", "val_bpb": 0.930842, "vram_gb": 52.6}
{"commit": "block50-E29-adoption-retracted", "desc": "E29 VERIFICATION on FRESH seed 52 (52-61 disjoint from every prior arm); candidate: depth 6 + MATRIX_LR 0.03; median step 91.4 ms, duty 0.999; 20/20 arms clean", "exp": "E29_best_s52", "exp_num": 852, "milestone": "", "phase": "block50", "status": "keep", "steps": 3280, "ts_end": "2026-08-01T08:00:00Z", "ts_end_epoch": 1785571200.0, "ts_start": "", "val_bpb": 0.929636, "vram_gb": 44.0}
{"commit": "block50-E29-adoption-retracted", "desc": "E29 VERIFICATION on FRESH seed 53 (52-61 disjoint from every prior arm); frozen defaults; median step 151.2 ms, duty 1.005; 20/20 arms clean", "exp": "E29_ctl_s53", "exp_num": 853, "milestone": "", "phase": "block50", "status": "keep", "steps": 1995, "ts_end": "2026-08-01T08:00:00Z", "ts_end_epoch": 1785571200.0, "ts_start": "", "val_bpb": 0.933258, "vram_gb": 52.6}
{"commit": "block50-E29-adoption-retracted", "desc": "E29 VERIFICATION on FRESH seed 53 (52-61 disjoint from every prior arm); candidate: depth 6 + MATRIX_LR 0.03; median step 93.7 ms, duty 1.002; 20/20 arms clean", "exp": "E29_best_s53", "exp_num": 854, "milestone": "", "phase": "block50", "status": "keep", "steps": 3208, "ts_end": "2026-08-01T08:00:00Z", "ts_end_epoch": 1785571200.0, "ts_start": "", "val_bpb": 0.931186, "vram_gb": 44.0}
{"commit": "block50-E29-adoption-retracted", "desc": "E29 VERIFICATION on FRESH seed 54 (52-61 disjoint from every prior arm); frozen defaults; median step 151.6 ms, duty 1.006; 20/20 arms clean", "exp": "E29_ctl_s54", "exp_num": 855, "milestone": "", "phase": "block50", "status": "keep", "steps": 1990, "ts_end": "2026-08-01T08:00:00Z", "ts_end_epoch": 1785571200.0, "ts_start": "", "val_bpb": 0.931472, "vram_gb": 52.6}
{"commit": "block50-E29-adoption-retracted", "desc": "E29 VERIFICATION on FRESH seed 54 (52-61 disjoint from every prior arm); candidate: depth 6 + MATRIX_LR 0.03; median step 91.9 ms, duty 0.999; 20/20 arms clean", "exp": "E29_best_s54", "exp_num": 856, "milestone": "", "phase": "block50", "status": "keep", "steps": 3260, "ts_end": "2026-08-01T08:00:00Z", "ts_end_epoch": 1785571200.0, "ts_start": "", "val_bpb": 0.92976, "vram_gb": 44.0}
{"commit": "block50-E29-adoption-retracted", "desc": "E29 VERIFICATION on FRESH seed 55 (52-61 disjoint from every prior arm); frozen defaults; median step 148.7 ms, duty 1.005; 20/20 arms clean", "exp": "E29_ctl_s55", "exp_num": 857, "milestone": "", "phase": "block50", "status": "keep", "steps": 2028, "ts_end": "2026-08-01T08:00:00Z", "ts_end_epoch": 1785571200.0, "ts_start": "", "val_bpb": 0.930367, "vram_gb": 52.6}
{"commit": "block50-E29-adoption-retracted", "desc": "E29 VERIFICATION on FRESH seed 55 (52-61 disjoint from every prior arm); candidate: depth 6 + MATRIX_LR 0.03; median step 91.5 ms, duty 0.999; 20/20 arms clean", "exp": "E29_best_s55", "exp_num": 858, "milestone": "", "phase": "block50", "status": "keep", "steps": 3276, "ts_end": "2026-08-01T08:00:00Z", "ts_end_epoch": 1785571200.0, "ts_start": "", "val_bpb": 0.929584, "vram_gb": 44.0}
{"commit": "block50-E29-adoption-retracted", "desc": "E29 VERIFICATION on FRESH seed 56 (52-61 disjoint from every prior arm); frozen defaults; median step 151.3 ms, duty 1.006; 20/20 arms clean", "exp": "E29_ctl_s56", "exp_num": 859, "milestone": "", "phase": "block50", "status": "keep", "steps": 1995, "ts_end": "2026-08-01T08:00:00Z", "ts_end_epoch": 1785571200.0, "ts_start": "", "val_bpb": 0.931795, "vram_gb": 52.6}
{"commit": "block50-E29-adoption-retracted", "desc": "E29 VERIFICATION on FRESH seed 56 (52-61 disjoint from every prior arm); candidate: depth 6 + MATRIX_LR 0.03; median step 93.7 ms, duty 1.001; 20/20 arms clean", "exp": "E29_best_s56", "exp_num": 860, "milestone": "", "phase": "block50", "status": "keep", "steps": 3206, "ts_end": "2026-08-01T08:00:00Z", "ts_end_epoch": 1785571200.0, "ts_start": "", "val_bpb": 0.931475, "vram_gb": 44.0}
{"commit": "block50-E29-adoption-retracted", "desc": "E29 VERIFICATION on FRESH seed 57 (52-61 disjoint from every prior arm); frozen defaults; median step 151.6 ms, duty 1.006; 20/20 arms clean", "exp": "E29_ctl_s57", "exp_num": 861, "milestone": "", "phase": "block50", "status": "keep", "steps": 1990, "ts_end": "2026-08-01T08:00:00Z", "ts_end_epoch": 1785571200.0, "ts_start": "", "val_bpb": 0.932356, "vram_gb": 52.6}
{"commit": "block50-E29-adoption-retracted", "desc": "E29 VERIFICATION on FRESH seed 57 (52-61 disjoint from every prior arm); candidate: depth 6 + MATRIX_LR 0.03; median step 91.8 ms, duty 1.000; 20/20 arms clean", "exp": "E29_best_s57", "exp_num": 862, "milestone": "", "phase": "block50", "status": "keep", "steps": 3267, "ts_end": "2026-08-01T08:00:00Z", "ts_end_epoch": 1785571200.0, "ts_start": "", "val_bpb": 0.929536, "vram_gb": 44.0}
{"commit": "block50-E29-adoption-retracted", "desc": "E29 VERIFICATION on FRESH seed 58 (52-61 disjoint from every prior arm); frozen defaults; median step 148.8 ms, duty 1.006; 20/20 arms clean", "exp": "E29_ctl_s58", "exp_num": 863, "milestone": "", "phase": "block50", "status": "keep", "steps": 2028, "ts_end": "2026-08-01T08:00:00Z", "ts_end_epoch": 1785571200.0, "ts_start": "", "val_bpb": 0.930584, "vram_gb": 52.6}
{"commit": "block50-E29-adoption-retracted", "desc": "E29 VERIFICATION on FRESH seed 58 (52-61 disjoint from every prior arm); candidate: depth 6 + MATRIX_LR 0.03; median step 91.4 ms, duty 0.999; 20/20 arms clean", "exp": "E29_best_s58", "exp_num": 864, "milestone": "", "phase": "block50", "status": "keep", "steps": 3280, "ts_end": "2026-08-01T08:00:00Z", "ts_end_epoch": 1785571200.0, "ts_start": "", "val_bpb": 0.929345, "vram_gb": 44.0}
{"commit": "block50-E29-adoption-retracted", "desc": "E29 VERIFICATION on FRESH seed 59 (52-61 disjoint from every prior arm); frozen defaults; median step 151.1 ms, duty 1.006; 20/20 arms clean", "exp": "E29_ctl_s59", "exp_num": 865, "milestone": "", "phase": "block50", "status": "keep", "steps": 1997, "ts_end": "2026-08-01T08:00:00Z", "ts_end_epoch": 1785571200.0, "ts_start": "", "val_bpb": 0.931976, "vram_gb": 52.6}
{"commit": "block50-E29-adoption-retracted", "desc": "E29 VERIFICATION on FRESH seed 59 (52-61 disjoint from every prior arm); candidate: depth 6 + MATRIX_LR 0.03; median step 93.6 ms, duty 1.002; 20/20 arms clean", "exp": "E29_best_s59", "exp_num": 866, "milestone": "", "phase": "block50", "status": "keep", "steps": 3211, "ts_end": "2026-08-01T08:00:00Z", "ts_end_epoch": 1785571200.0, "ts_start": "", "val_bpb": 0.929501, "vram_gb": 44.0}
{"commit": "block50-E29-adoption-retracted", "desc": "E29 VERIFICATION on FRESH seed 60 (52-61 disjoint from every prior arm); frozen defaults; median step 151.5 ms, duty 1.005; 20/20 arms clean", "exp": "E29_ctl_s60", "exp_num": 867, "milestone": "", "phase": "block50", "status": "keep", "steps": 1991, "ts_end": "2026-08-01T08:00:00Z", "ts_end_epoch": 1785571200.0, "ts_start": "", "val_bpb": 0.932898, "vram_gb": 52.6}
{"commit": "block50-E29-adoption-retracted", "desc": "E29 VERIFICATION on FRESH seed 60 (52-61 disjoint from every prior arm); candidate: depth 6 + MATRIX_LR 0.03; median step 91.8 ms, duty 0.999; 20/20 arms clean", "exp": "E29_best_s60", "exp_num": 868, "milestone": "", "phase": "block50", "status": "keep", "steps": 3265, "ts_end": "2026-08-01T08:00:00Z", "ts_end_epoch": 1785571200.0, "ts_start": "", "val_bpb": 0.930225, "vram_gb": 44.0}
{"commit": "block50-E29-adoption-retracted", "desc": "E29 VERIFICATION on FRESH seed 61 (52-61 disjoint from every prior arm); frozen defaults; median step 149.7 ms, duty 1.006; 20/20 arms clean", "exp": "E29_ctl_s61", "exp_num": 869, "milestone": "", "phase": "block50", "status": "keep", "steps": 2016, "ts_end": "2026-08-01T08:00:00Z", "ts_end_epoch": 1785571200.0, "ts_start": "", "val_bpb": 0.930839, "vram_gb": 52.6}
{"commit": "block50-E29-adoption-retracted", "desc": "E29 VERIFICATION on FRESH seed 61 (52-61 disjoint from every prior arm); candidate: depth 6 + MATRIX_LR 0.03; median step 91.6 ms, duty 1.001; 20/20 arms clean", "exp": "E29_best_s61", "exp_num": 870, "milestone": "", "phase": "block50", "status": "keep", "steps": 3278, "ts_end": "2026-08-01T08:00:00Z", "ts_end_epoch": 1785571200.0, "ts_start": "", "val_bpb": 0.930517, "vram_gb": 44.0}
{"commit": "block52-E30-control-not-mistuned", "desc": "E30 CONTROL CHECK: depth 8 MATRIX_LR=0.04, seed 62 (62-71 disjoint from every prior arm); median step 148.9 ms, duty 1.006; 20/20 clean", "exp": "E30_d8_lr0.04_s62", "exp_num": 871, "milestone": "", "phase": "block52", "status": "keep", "steps": 2026, "ts_end": "2026-08-01T10:00:00Z", "ts_end_epoch": 1785578400.0, "ts_start": "", "val_bpb": 0.931717, "vram_gb": 52.6}
{"commit": "block52-E30-control-not-mistuned", "desc": "E30 CONTROL CHECK: depth 8 MATRIX_LR=0.03, seed 62 (62-71 disjoint from every prior arm); median step 149.3 ms, duty 1.005; 20/20 clean", "exp": "E30_d8_lr0.03_s62", "exp_num": 872, "milestone": "", "phase": "block52", "status": "keep", "steps": 2020, "ts_end": "2026-08-01T10:00:00Z", "ts_end_epoch": 1785578400.0, "ts_start": "", "val_bpb": 0.93141, "vram_gb": 52.6}
{"commit": "block52-E30-control-not-mistuned", "desc": "E30 CONTROL CHECK: depth 8 MATRIX_LR=0.04, seed 63 (62-71 disjoint from every prior arm); median step 151.3 ms, duty 1.006; 20/20 clean", "exp": "E30_d8_lr0.04_s63", "exp_num": 873, "milestone": "", "phase": "block52", "status": "keep", "steps": 1994, "ts_end": "2026-08-01T10:00:00Z", "ts_end_epoch": 1785578400.0, "ts_start": "", "val_bpb": 0.933486, "vram_gb": 52.6}
{"commit": "block52-E30-control-not-mistuned", "desc": "E30 CONTROL CHECK: depth 8 MATRIX_LR=0.03, seed 63 (62-71 disjoint from every prior arm); median step 153.7 ms, duty 1.006; 20/20 clean", "exp": "E30_d8_lr0.03_s63", "exp_num": 874, "milestone": "", "phase": "block52", "status": "keep", "steps": 1964, "ts_end": "2026-08-01T10:00:00Z", "ts_end_epoch": 1785578400.0, "ts_start": "", "val_bpb": 0.934963, "vram_gb": 52.6}
{"commit": "block52-E30-control-not-mistuned", "desc": "E30 CONTROL CHECK: depth 8 MATRIX_LR=0.04, seed 64 (62-71 disjoint from every prior arm); median step 151.7 ms, duty 1.006; 20/20 clean", "exp": "E30_d8_lr0.04_s64", "exp_num": 875, "milestone": "", "phase": "block52", "status": "keep", "steps": 1989, "ts_end": "2026-08-01T10:00:00Z", "ts_end_epoch": 1785578400.0, "ts_start": "", "val_bpb": 0.933842, "vram_gb": 52.6}
{"commit": "block52-E30-control-not-mistuned", "desc": "E30 CONTROL CHECK: depth 8 MATRIX_LR=0.03, seed 64 (62-71 disjoint from every prior arm); median step 149.3 ms, duty 1.005; 20/20 clean", "exp": "E30_d8_lr0.03_s64", "exp_num": 876, "milestone": "", "phase": "block52", "status": "keep", "steps": 2020, "ts_end": "2026-08-01T10:00:00Z", "ts_end_epoch": 1785578400.0, "ts_start": "", "val_bpb": 0.933566, "vram_gb": 52.6}
{"commit": "block52-E30-control-not-mistuned", "desc": "E30 CONTROL CHECK: depth 8 MATRIX_LR=0.04, seed 65 (62-71 disjoint from every prior arm); median step 148.8 ms, duty 1.006; 20/20 clean", "exp": "E30_d8_lr0.04_s65", "exp_num": 877, "milestone": "", "phase": "block52", "status": "keep", "steps": 2028, "ts_end": "2026-08-01T10:00:00Z", "ts_end_epoch": 1785578400.0, "ts_start": "", "val_bpb": 0.932822, "vram_gb": 52.6}
{"commit": "block52-E30-control-not-mistuned", "desc": "E30 CONTROL CHECK: depth 8 MATRIX_LR=0.03, seed 65 (62-71 disjoint from every prior arm); median step 149.2 ms, duty 1.006; 20/20 clean", "exp": "E30_d8_lr0.03_s65", "exp_num": 878, "milestone": "", "phase": "block52", "status": "keep", "steps": 2022, "ts_end": "2026-08-01T10:00:00Z", "ts_end_epoch": 1785578400.0, "ts_start": "", "val_bpb": 0.933321, "vram_gb": 52.6}
{"commit": "block52-E30-control-not-mistuned", "desc": "E30 CONTROL CHECK: depth 8 MATRIX_LR=0.04, seed 66 (62-71 disjoint from every prior arm); median step 151.2 ms, duty 1.006; 20/20 clean", "exp": "E30_d8_lr0.04_s66", "exp_num": 879, "milestone": "", "phase": "block52", "status": "keep", "steps": 1996, "ts_end": "2026-08-01T10:00:00Z", "ts_end_epoch": 1785578400.0, "ts_start": "", "val_bpb": 0.934439, "vram_gb": 52.6}
{"commit": "block52-E30-control-not-mistuned", "desc": "E30 CONTROL CHECK: depth 8 MATRIX_LR=0.03, seed 66 (62-71 disjoint from every prior arm); median step 153.7 ms, duty 1.006; 20/20 clean", "exp": "E30_d8_lr0.03_s66", "exp_num": 880, "milestone": "", "phase": "block52", "status": "keep", "steps": 1964, "ts_end": "2026-08-01T10:00:00Z", "ts_end_epoch": 1785578400.0, "ts_start": "", "val_bpb": 0.936081, "vram_gb": 52.6}
{"commit": "block52-E30-control-not-mistuned", "desc": "E30 CONTROL CHECK: depth 8 MATRIX_LR=0.04, seed 67 (62-71 disjoint from every prior arm); median step 151.6 ms, duty 1.006; 20/20 clean", "exp": "E30_d8_lr0.04_s67", "exp_num": 881, "milestone": "", "phase": "block52", "status": "keep", "steps": 1991, "ts_end": "2026-08-01T10:00:00Z", "ts_end_epoch": 1785578400.0, "ts_start": "", "val_bpb": 0.932359, "vram_gb": 52.6}
{"commit": "block52-E30-control-not-mistuned", "desc": "E30 CONTROL CHECK: depth 8 MATRIX_LR=0.03, seed 67 (62-71 disjoint from every prior arm); median step 149.3 ms, duty 1.006; 20/20 clean", "exp": "E30_d8_lr0.03_s67", "exp_num": 882, "milestone": "", "phase": "block52", "status": "keep", "steps": 2021, "ts_end": "2026-08-01T10:00:00Z", "ts_end_epoch": 1785578400.0, "ts_start": "", "val_bpb": 0.931788, "vram_gb": 52.6}
{"commit": "block52-E30-control-not-mistuned", "desc": "E30 CONTROL CHECK: depth 8 MATRIX_LR=0.04, seed 68 (62-71 disjoint from every prior arm); median step 148.8 ms, duty 1.006; 20/20 clean", "exp": "E30_d8_lr0.04_s68", "exp_num": 883, "milestone": "", "phase": "block52", "status": "keep", "steps": 2028, "ts_end": "2026-08-01T10:00:00Z", "ts_end_epoch": 1785578400.0, "ts_start": "", "val_bpb": 0.930562, "vram_gb": 52.6}
{"commit": "block52-E30-control-not-mistuned", "desc": "E30 CONTROL CHECK: depth 8 MATRIX_LR=0.03, seed 68 (62-71 disjoint from every prior arm); median step 149.1 ms, duty 1.005; 20/20 clean", "exp": "E30_d8_lr0.03_s68", "exp_num": 884, "milestone": "", "phase": "block52", "status": "keep", "steps": 2023, "ts_end": "2026-08-01T10:00:00Z", "ts_end_epoch": 1785578400.0, "ts_start": "", "val_bpb": 0.931322, "vram_gb": 52.6}
{"commit": "block52-E30-control-not-mistuned", "desc": "E30 CONTROL CHECK: depth 8 MATRIX_LR=0.04, seed 69 (62-71 disjoint from every prior arm); median step 151.1 ms, duty 1.006; 20/20 clean", "exp": "E30_d8_lr0.04_s69", "exp_num": 885, "milestone": "", "phase": "block52", "status": "keep", "steps": 1997, "ts_end": "2026-08-01T10:00:00Z", "ts_end_epoch": 1785578400.0, "ts_start": "", "val_bpb": 0.933916, "vram_gb": 52.6}
{"commit": "block52-E30-control-not-mistuned", "desc": "E30 CONTROL CHECK: depth 8 MATRIX_LR=0.03, seed 69 (62-71 disjoint from every prior arm); median step 153.7 ms, duty 1.006; 20/20 clean", "exp": "E30_d8_lr0.03_s69", "exp_num": 886, "milestone": "", "phase": "block52", "status": "keep", "steps": 1964, "ts_end": "2026-08-01T10:00:00Z", "ts_end_epoch": 1785578400.0, "ts_start": "", "val_bpb": 0.935485, "vram_gb": 52.6}
{"commit": "block52-E30-control-not-mistuned", "desc": "E30 CONTROL CHECK: depth 8 MATRIX_LR=0.04, seed 70 (62-71 disjoint from every prior arm); median step 151.5 ms, duty 1.006; 20/20 clean", "exp": "E30_d8_lr0.04_s70", "exp_num": 887, "milestone": "", "phase": "block52", "status": "keep", "steps": 1992, "ts_end": "2026-08-01T10:00:00Z", "ts_end_epoch": 1785578400.0, "ts_start": "", "val_bpb": 0.933834, "vram_gb": 52.6}
{"commit": "block52-E30-control-not-mistuned", "desc": "E30 CONTROL CHECK: depth 8 MATRIX_LR=0.03, seed 70 (62-71 disjoint from every prior arm); median step 149.4 ms, duty 1.005; 20/20 clean", "exp": "E30_d8_lr0.03_s70", "exp_num": 888, "milestone": "", "phase": "block52", "status": "keep", "steps": 2019, "ts_end": "2026-08-01T10:00:00Z", "ts_end_epoch": 1785578400.0, "ts_start": "", "val_bpb": 0.933344, "vram_gb": 52.6}
{"commit": "block52-E30-control-not-mistuned", "desc": "E30 CONTROL CHECK: depth 8 MATRIX_LR=0.04, seed 71 (62-71 disjoint from every prior arm); median step 149.7 ms, duty 1.005; 20/20 clean", "exp": "E30_d8_lr0.04_s71", "exp_num": 889, "milestone": "", "phase": "block52", "status": "keep", "steps": 2015, "ts_end": "2026-08-01T10:00:00Z", "ts_end_epoch": 1785578400.0, "ts_start": "", "val_bpb": 0.932535, "vram_gb": 52.6}
{"commit": "block52-E30-control-not-mistuned", "desc": "E30 CONTROL CHECK: depth 8 MATRIX_LR=0.03, seed 71 (62-71 disjoint from every prior arm); median step 149.8 ms, duty 1.006; 20/20 clean", "exp": "E30_d8_lr0.03_s71", "exp_num": 890, "milestone": "", "phase": "block52", "status": "keep", "steps": 2014, "ts_end": "2026-08-01T10:00:00Z", "ts_end_epoch": 1785578400.0, "ts_start": "", "val_bpb": 0.932852, "vram_gb": 52.6}
