{"exp_num": 365, "exp": "exp377_t15_data8", "val_bpb": 0.969586, "vram_gb": 41.0, "steps": 2050, "status": "discard", "desc": "table2^15@8sh=0.970", "phase": "meta", "milestone": "", "ts_start": "", "ts_end": "2026-07-27T23:54:00Z", "ts_end_epoch": 1785196440.0, "commit": "b69e377"}
{"exp_num": 366, "exp": "exp378_t15_data10", "val_bpb": 0.968781, "vram_gb": 41.0, "steps": 2050, "status": "discard", "desc": "table2^15@10=0.969 (2^21 wins @10=0.949). DATA-DEPENDENT optimal memory size: 2^15 best@5sh, 2^21 best@10sh. Confirms memorization; data-sensitivity scales w/ table size (off0.004,2^15:0.008,2^21:0.118)", "phase": "meta", "milestone": "", "ts_start": "", "ts_end": "2026-07-27T23:54:00Z", "ts_end_epoch": 1785196440.0, "commit": "b69e378"}
{"exp_num": 367, "exp": "exp_b1_s50", "val_bpb": 0.950426, "vram_gb": 54.7, "steps": 1956, "status": "discard", "desc": "B1 fused-ngram (pad, BYTE-IDENTICAL) throughput NULL: 1938 vs ref 1948 steps (neutral). 194k fill-kernels NOT the hash torch.zeros (inductor already fused). Re-profile before B2.", "phase": "block2", "milestone": "", "ts_start": "", "ts_end": "2026-07-28T00:10:00Z", "ts_end_epoch": 1785197400.0, "commit": "b1null"}
{"exp_num": 368, "exp": "exp_b1_s51", "val_bpb": 0.952137, "vram_gb": 54.7, "steps": 1973, "status": "discard", "desc": "B1 s51", "phase": "block2", "milestone": "", "ts_start": "", "ts_end": "2026-07-28T00:10:00Z", "ts_end_epoch": 1785197400.0, "commit": "b1null"}
{"exp_num": 369, "exp": "exp_b1_s52", "val_bpb": 0.950566, "vram_gb": 54.7, "steps": 1885, "status": "discard", "desc": "B1 s52; B1 REJECT (byte-identical, no throughput gain)", "phase": "block2", "milestone": "", "ts_start": "", "ts_end": "2026-07-28T00:10:00Z", "ts_end_epoch": 1785197400.0, "commit": "b1null"}
{"exp_num": 370, "exp": "exp_a1_s50", "val_bpb": 0.96497, "vram_gb": 56.6, "steps": 1900, "status": "discard", "desc": "A1 Canon conv REJECT: +0.0147 vs ref s50 (mechanism harm, not slow-kernel)", "phase": "block2", "milestone": "", "ts_start": "", "ts_end": "2026-07-28T00:35:00Z", "ts_end_epoch": 1785198900.0, "commit": "a1reject"}
{"exp_num": 371, "exp": "exp_a1_s51", "val_bpb": 0.965532, "vram_gb": 56.6, "steps": 1900, "status": "discard", "desc": "A1 Canon s51: +0.0128 vs ref", "phase": "block2", "milestone": "", "ts_start": "", "ts_end": "2026-07-28T00:35:00Z", "ts_end_epoch": 1785198900.0, "commit": "a1reject"}
{"exp_num": 372, "exp": "exp_a1_s52", "val_bpb": 0.968102, "vram_gb": 56.6, "steps": 1900, "status": "discard", "desc": "A1 Canon s52: +0.0184 vs ref", "phase": "block2", "milestone": "", "ts_start": "", "ts_end": "2026-07-28T00:35:00Z", "ts_end_epoch": 1785198900.0, "commit": "a1reject"}
{"exp_num": 373, "exp": "exp_a1_s53", "val_bpb": 0.966068, "vram_gb": 56.6, "steps": 1900, "status": "discard", "desc": "A1 Canon s53: +0.0164 vs ref. REJECT 4/4 (mean +0.0156); zero-init didn't save it, mechanism actively harmful not merely unhelpful", "phase": "block2", "milestone": "", "ts_start": "", "ts_end": "2026-07-28T00:35:00Z", "ts_end_epoch": 1785198900.0, "commit": "a1reject"}
{"exp_num": 374, "exp": "exp_c3v2_k50_data10", "val_bpb": 0.949774, "vram_gb": 55.9, "steps": 1954, "status": "pilot", "desc": "C3 backoff-gate k50@10sh: ~neutral vs control (+0.0009), as predicted", "phase": "block2", "milestone": "", "ts_start": "", "ts_end": "2026-07-28T04:05:00Z", "ts_end_epoch": 1785211500.0, "commit": "2bfc9de"}
{"exp_num": 375, "exp": "exp_c3v2_k0_data10", "val_bpb": 0.9489, "vram_gb": 55.9, "steps": 1976, "status": "keep", "desc": "C3 control@10sh (byte-identical off, matches known SOTA ~0.9488)", "phase": "block2", "milestone": "", "ts_start": "", "ts_end": "2026-07-28T04:05:00Z", "ts_end_epoch": 1785211500.0, "commit": "2bfc9de"}
{"exp_num": 376, "exp": "exp_c3v2_k50_data5", "val_bpb": 1.035207, "vram_gb": 55.9, "steps": 1968, "status": "pilot", "desc": "C3 backoff-gate k50@5sh: HELPS -0.0214 vs control (14x noise floor). Premise CONFIRMED: harm concentrated in low-count keys", "phase": "block2", "milestone": "", "ts_start": "", "ts_end": "2026-07-28T04:05:00Z", "ts_end_epoch": 1785211500.0, "commit": "2bfc9de"}
{"exp_num": 377, "exp": "exp_c3v2_k0_data5", "val_bpb": 1.056567, "vram_gb": 55.9, "steps": 1889, "status": "discard", "desc": "C3 control@5sh (matches known 5sh curve ~1.067)", "phase": "block2", "milestone": "", "ts_start": "", "ts_end": "2026-07-28T04:05:00Z", "ts_end_epoch": 1785211500.0, "commit": "2bfc9de"}
{"exp_num": 378, "exp": "exp_f5_baseline", "val_bpb": 0.94918, "vram_gb": 55.7, "steps": 1956, "status": "keep", "desc": "factorial baseline (matches known SOTA)", "phase": "block2", "milestone": "", "ts_start": "", "ts_end": "2026-07-28T04:45:00Z", "ts_end_epoch": 1785213900.0, "commit": "factorial5"}
{"exp_num": 379, "exp": "exp_f5_attnres", "val_bpb": 0.971033, "vram_gb": 55.7, "steps": 1438, "status": "pilot", "desc": "AttnRes alone +0.0219 (HOLD: throughput-confounded -26% steps, needs fixed-step isolation)", "phase": "block2", "milestone": "", "ts_start": "", "ts_end": "2026-07-28T04:45:00Z", "ts_end_epoch": 1785213900.0, "commit": "factorial5"}
{"exp_num": 380, "exp": "exp_f5_c1wd", "val_bpb": 0.97639, "vram_gb": 55.7, "steps": 1969, "status": "discard", "desc": "n-gram table WD lambda=0.2 alone +0.0272 (rejected at this lambda/10sh operating point, not throughput-confounded)", "phase": "block2", "milestone": "", "ts_start": "", "ts_end": "2026-07-28T04:45:00Z", "ts_end_epoch": 1785213900.0, "commit": "factorial5"}
{"exp_num": 381, "exp": "exp_f5_combined", "val_bpb": 1.020663, "vram_gb": 55.7, "steps": 1376, "status": "discard", "desc": "AttnRes+tableWD combined +0.0715 (super-additive: +0.0224 excess over additive prediction of +0.0491 -- confirmed negative interaction, recombination finding)", "phase": "block2", "milestone": "", "ts_start": "", "ts_end": "2026-07-28T04:45:00Z", "ts_end_epoch": 1785213900.0, "commit": "factorial5"}
{"exp_num": 382, "exp": "exp_c1_ref_data5", "val_bpb": 1.057312, "vram_gb": 55.7, "steps": 1927, "status": "keep", "desc": "C1 sweep ref@5sh (matches known baseline curve)", "phase": "block2", "milestone": "", "ts_start": "", "ts_end": "2026-07-28T05:05:00Z", "ts_end_epoch": 1785215100.0, "commit": "c1sweep"}
{"exp_num": 383, "exp": "exp_c1_wd002_data5", "val_bpb": 0.961918, "vram_gb": 55.7, "steps": 1975, "status": "pilot", "desc": "table-WD lambda=0.02@5sh: HUGE help -0.0954 vs ref, confirms C1 family prediction cleanly", "phase": "block2", "milestone": "", "ts_start": "", "ts_end": "2026-07-28T05:05:00Z", "ts_end_epoch": 1785215100.0, "commit": "c1sweep"}
{"exp_num": 384, "exp": "exp_c1_wd005_data5", "val_bpb": 0.972258, "vram_gb": 55.7, "steps": 1885, "status": "pilot", "desc": "table-WD lambda=0.05@5sh: large help -0.0851 vs ref (weaker than 0.02, suggests optimum near/below 0.02)", "phase": "block2", "milestone": "", "ts_start": "", "ts_end": "2026-07-28T05:05:00Z", "ts_end_epoch": 1785215100.0, "commit": "c1sweep"}
{"exp_num": 385, "exp": "baseline_reconcile_v22_sota_levers", "val_bpb": 0.939797, "vram_gb": 89.9, "steps": 1140, "status": "keep", "desc": "BASELINE RECONCILIATION (not a treatment result): train.py hardcoded defaults corrected to match sota_swin4 SOTA levers (WINDOW_PATTERN=SSSL, TOTAL_BATCH_SIZE=2^18, DEVICE_BATCH_SIZE=128, MATRIX_LR=0.03), which had drifted back to a 2026-07-21 rsi/daniel reset config. 10-seed mean=0.939797, sigma=0.002036, replacing the pre-correction 0.933073 baseline (measured on the un-reapplied code) as the new reference point for block 14 onward.", "phase": "block14", "milestone": "Baseline reconciliation (SOTA levers reapplied)", "ts_start": "", "ts_end": "2026-07-28T09:05:00Z", "ts_end_epoch": 1785222300.0, "commit": "reconcile-v22"}
{"exp_num": 386, "exp": "exp_block14_attnres_r2", "val_bpb": 0.940624, "vram_gb": 89.9, "steps": 1113, "status": "discard", "desc": "AttnRes vs baseline (corrected SOTA config): delta -0.000839, stop_no_signal -- null, inside 2-sigma gate 0.004072", "phase": "block14", "milestone": "", "ts_start": "", "ts_end": "2026-07-28T10:00:00Z", "ts_end_epoch": 1785225600.0, "commit": "block14-r2"}
{"exp_num": 387, "exp": "exp_block14_cudagraph_r2", "val_bpb": 0.941037, "vram_gb": 89.9, "steps": 1092, "status": "discard", "desc": "CUDA-graph capture treatment: REPRODUCIBLE SEGFAULT (exit 139), confirmed across two independent batch configs -- rejected, kernel-level FA3 incompatibility, not a quality verdict", "phase": "block14", "milestone": "", "ts_start": "", "ts_end": "2026-07-28T10:00:00Z", "ts_end_epoch": 1785225600.0, "commit": "block14-r2"}
{"exp_num": 388, "exp": "exp_block14_c1_10sh_r2", "val_bpb": 0.94262, "vram_gb": 89.9, "steps": 1051, "status": "discard", "desc": "C1 table-WD lambda=0.02 @10sh (corrected SOTA config): delta -0.001281, stop_no_signal -- directionally favorable, inside 2-sigma gate", "phase": "block14", "milestone": "", "ts_start": "", "ts_end": "2026-07-28T10:00:00Z", "ts_end_epoch": 1785225600.0, "commit": "block14-r2"}
{"exp_num": 389, "exp": "exp_block14_c1c3_r2", "val_bpb": 0.941268, "vram_gb": 89.9, "steps": 1053, "status": "discard", "desc": "C1(0.02) x C3(kappa=50) combined @10sh (corrected SOTA config): delta -0.001019, stop_no_signal -- 10-shard secondary prediction not contradicted", "phase": "block14", "milestone": "", "ts_start": "", "ts_end": "2026-07-28T10:00:00Z", "ts_end_epoch": 1785225600.0, "commit": "block14-r2"}
{"exp_num": 390, "exp": "b2_baseline", "val_bpb": 0.941008, "vram_gb": 89.9, "steps": 1133, "status": "keep", "desc": "Baseline (corrected SOTA config, repaired harness), within-round control", "phase": "block15", "milestone": "", "ts_start": "", "ts_end": "2026-07-28T17:00:00Z", "ts_end_epoch": 1785250800.0, "commit": "block15"}
{"exp_num": 391, "exp": "b2_baseline_rep", "val_bpb": 0.94231, "vram_gb": 89.9, "steps": 1117, "status": "keep", "desc": "Baseline replicate -- within-round sigma ~0.0009 (2 samples)", "phase": "block15", "milestone": "", "ts_start": "", "ts_end": "2026-07-28T17:00:00Z", "ts_end_epoch": 1785250800.0, "commit": "block15"}
{"exp_num": 392, "exp": "b2_attnres_refined", "val_bpb": 0.952485, "vram_gb": 89.9, "steps": 1050, "status": "discard", "desc": "AttnRes after kernel refinement: +0.0108 vs baseline, 83 steps lost. Reproduces 0.951815 from the prior refined run. Naive->refined improved -0.0044 and recovered VRAM 115GB->89.7GB", "phase": "block15", "milestone": "", "ts_start": "", "ts_end": "2026-07-28T17:00:00Z", "ts_end_epoch": 1785250800.0, "commit": "block15"}
{"exp_num": 393, "exp": "b2_token_shift", "val_bpb": 0.960819, "vram_gb": 89.9, "steps": 1044, "status": "discard", "desc": "TOKEN_SHIFT (Recursive-reported lever, newly implemented here): +0.0198, 89 steps lost. Not free -- the Q/K cat+lerp costs ~9% step time", "phase": "block15", "milestone": "", "ts_start": "", "ts_end": "2026-07-28T17:00:00Z", "ts_end_epoch": 1785250800.0, "commit": "block15"}
{"exp_num": 394, "exp": "b2_token_shift_x_c3", "val_bpb": 0.964778, "vram_gb": 89.9, "steps": 992, "status": "discard", "desc": "TOKEN_SHIFT x C3 backoff combination: +0.0231, 141 steps lost. Combination compounds step loss", "phase": "block15", "milestone": "", "ts_start": "", "ts_end": "2026-07-28T17:00:00Z", "ts_end_epoch": 1785250800.0, "commit": "block15"}
{"exp_num": 395, "exp": "t_rowwise", "val_bpb": 0.941779, "vram_gb": 89.9, "steps": 1131, "status": "keep", "desc": "NGRAM_STATE_ROWWISE=1 is exactly FREE: dbpb +0.00004, dsteps -1 (both inside within-round sigma 0.0009), while cutting optimizer state to a rowwise second moment. Banked as zero-cost VRAM headroom for future combinations.", "phase": "block15", "milestone": "", "ts_start": "", "ts_end": "2026-07-28T18:00:00Z", "ts_end_epoch": 1785254400.0, "commit": "block15"}
{"exp_num": 396, "exp": "t_sparse_grad", "val_bpb": 0.953537, "vram_gb": 89.9, "steps": 984, "status": "discard", "desc": "NGRAM_SPARSE_GRAD=1 HARMFUL on this box: -148 steps (-13%), +0.0118. CONTRADICTS the stored torch-2.13 note (-9.3% step-time win); deciding variable is torch version (box runs 2.9.1). Memory corrected to version-gated.", "phase": "block15", "milestone": "", "ts_start": "", "ts_end": "2026-07-28T18:00:00Z", "ts_end_epoch": 1785254400.0, "commit": "block15"}
{"exp_num": 397, "exp": "n_ngpt_alpha025", "val_bpb": 0.980217, "vram_gb": 89.9, "steps": 1097, "status": "discard", "desc": "nGPT hypersphere residual (arXiv 2410.01131), alpha=0.25 (best of 1.0/0.25/0.05): +0.0387. Cheapest lever tested (only -36 steps) but quality-per-step collapsed. Non-monotonic in alpha => real mechanism, not a bug. Partial implementation (residual-stream only, no weight normalization, weight decay retained) is the likely cause; full nGPT needs global hyperparameter retuning.", "phase": "block15", "milestone": "", "ts_start": "", "ts_end": "2026-07-28T18:00:00Z", "ts_end_epoch": 1785254400.0, "commit": "block15"}
{"exp_num": 398, "exp": "d_sdpa_off", "val_bpb": 0.952979, "vram_gb": 89.9, "steps": 983, "status": "keep", "desc": "sdpa backend, no doc-mask -- the matched control for all DOC_MASK arms. Backend swap alone costs +0.0114 and -150 steps vs fa3.", "phase": "block15", "milestone": "", "ts_start": "", "ts_end": "2026-07-28T18:40:00Z", "ts_end_epoch": 1785256800.0, "commit": "block15-docmask"}
{"exp_num": 399, "exp": "d_docmask_dense_both", "val_bpb": 1.012956, "vram_gb": 89.9, "steps": 522, "status": "discard", "desc": "DOC_MASK MODE=both, DENSE impl: catastrophic -- (B,1,T,T) mask materialization halves throughput (983->522 steps). The implementation, not the mechanism, is the problem.", "phase": "block15", "milestone": "", "ts_start": "", "ts_end": "2026-07-28T18:40:00Z", "ts_end_epoch": 1785256800.0, "commit": "block15-docmask"}
{"exp_num": 400, "exp": "d_docmask_window_ctrl", "val_bpb": 1.018364, "vram_gb": 89.9, "steps": 528, "status": "keep", "desc": "MODE=window control (windowing only, no doc restriction). vs MODE=both (1.012956) isolates pure doc-restriction at matched windowing: -0.0054 FAVORABLE.", "phase": "block15", "milestone": "", "ts_start": "", "ts_end": "2026-07-28T18:40:00Z", "ts_end_epoch": 1785256800.0, "commit": "block15-docmask"}
{"exp_num": 401, "exp": "d_docmask_flex_both", "val_bpb": 0.94375, "vram_gb": 89.9, "steps": 1084, "status": "keep", "desc": "BREAKTHROUGH: DOC_MASK MODE=both with block-sparse FLEX impl. Same masking semantics as dense but -0.0692 bpb and 2.08x throughput (522->1084 steps). vs matched sdpa control (0.952979): -0.0092, i.e. 2.3x the 2-sigma gate, AND +101 steps. Validates LITERATURE_SYNTHESIS ranked bet #2 verbatim. Only +0.0019 behind the fa3 baseline.", "phase": "block15", "milestone": "Block-sparse doc-mask: mechanism wins once implementation is fixed", "ts_start": "", "ts_end": "2026-07-28T18:40:00Z", "ts_end_epoch": 1785256800.0, "commit": "block15-docmask"}
{"exp_num": 402, "exp": "f_flexboth_s43", "val_bpb": 0.941999, "vram_gb": 89.9, "steps": 1099, "status": "keep", "desc": "flex doc-mask CONFIRM seed43: vs matched sdpa control (0.954907) = -0.012908. Paired with seed42 (-0.009229): mean -0.011069, both same sign, 2.7x the 2-sigma gate. CONFIRMED WIN on sdpa.", "phase": "block15", "milestone": "", "ts_start": "", "ts_end": "2026-07-28T19:10:00Z", "ts_end_epoch": 1785258600.0, "commit": "block15-docmask-confirm"}
{"exp_num": 403, "exp": "f_flexboth_s44", "val_bpb": 0.943086, "vram_gb": 89.9, "steps": 1084, "status": "keep", "desc": "flex doc-mask seed44. 3-seed mean 0.942945, sigma 0.00088.", "phase": "block15", "milestone": "", "ts_start": "", "ts_end": "2026-07-28T19:10:00Z", "ts_end_epoch": 1785258600.0, "commit": "block15-docmask-confirm"}
{"exp_num": 404, "exp": "f_flexseg", "val_bpb": 0.942631, "vram_gb": 89.9, "steps": 1091, "status": "keep", "desc": "flex + MODE=seg (pure INTRADoc, no window): 0.942631/1091 -- comparable to MODE=both, marginally better on this seed.", "phase": "block15", "milestone": "", "ts_start": "", "ts_end": "2026-07-28T19:10:00Z", "ts_end_epoch": 1785258600.0, "commit": "block15-docmask-confirm"}
{"exp_num": 405, "exp": "f_flexboth_rw", "val_bpb": 0.945186, "vram_gb": 89.9, "steps": 1060, "status": "discard", "desc": "flex doc-mask x NGRAM_STATE_ROWWISE: 0.945186/1060. The free-elsewhere rowwise lever does NOT compose favorably here (-24 steps, +0.0022).", "phase": "block15", "milestone": "", "ts_start": "", "ts_end": "2026-07-28T19:10:00Z", "ts_end_epoch": 1785258600.0, "commit": "block15-docmask-confirm"}
{"exp_num": 406, "exp": "f_sdpaoff_s43", "val_bpb": 0.954907, "vram_gb": 89.9, "steps": 983, "status": "keep", "desc": "sdpa control seed43 -- pairs with seed42 (0.952979) for the confirmed doc-mask delta.", "phase": "block15", "milestone": "", "ts_start": "", "ts_end": "2026-07-28T19:10:00Z", "ts_end_epoch": 1785258600.0, "commit": "block15-docmask-confirm"}
{"exp_num": 407, "exp": "g_flex_blk64", "val_bpb": 0.940137, "vram_gb": 89.9, "steps": 1130, "status": "keep", "desc": "DOC_MASK flex BLOCK_SIZE=64: 0.940137/1130 steps -- BEATS the fa3 baseline (0.941146/1133) by -0.001009 while running doc-masking on the slower sdpa backend. Finer blocks skip more masked work, recovering essentially the whole step gap (1101->1130). Sub-gate on one seed; paired confirm in flight.", "phase": "block15", "milestone": "flex doc-mask blk64 reaches baseline parity", "ts_start": "", "ts_end": "2026-07-28T19:50:00Z", "ts_end_epoch": 1785261000.0, "commit": "block15-blocksize"}
{"exp_num": 408, "exp": "g_flex_blk128", "val_bpb": 0.942352, "vram_gb": 89.9, "steps": 1101, "status": "keep", "desc": "DOC_MASK flex BLOCK_SIZE=128 (FlexAttention default).", "phase": "block15", "milestone": "", "ts_start": "", "ts_end": "2026-07-28T19:50:00Z", "ts_end_epoch": 1785261000.0, "commit": "block15-blocksize"}
{"exp_num": 409, "exp": "g_flex_blk256", "val_bpb": 0.946783, "vram_gb": 89.9, "steps": 1042, "status": "discard", "desc": "DOC_MASK flex BLOCK_SIZE=256: coarser blocks force computing partially-masked blocks -> -88 steps vs blk64. Block-size sweep is monotonic: 64 < 128 < 256 in val_bpb.", "phase": "block15", "milestone": "", "ts_start": "", "ts_end": "2026-07-28T19:50:00Z", "ts_end_epoch": 1785261000.0, "commit": "block15-blocksize"}
{"exp_num": 410, "exp": "g_fa3ref", "val_bpb": 0.941146, "vram_gb": 89.9, "steps": 1133, "status": "keep", "desc": "fa3 baseline reference for the block-size sweep.", "phase": "block15", "milestone": "", "ts_start": "", "ts_end": "2026-07-28T19:50:00Z", "ts_end_epoch": 1785261000.0, "commit": "block15-blocksize"}
{"exp_num": 411, "exp": "h_b64_s43", "val_bpb": 0.939594, "vram_gb": 89.9, "steps": 1129, "status": "keep", "desc": "flex doc-mask blk64 seed43: paired vs fa3 s43 (0.942527) = -0.002933", "phase": "block15", "milestone": "", "ts_start": "", "ts_end": "2026-07-28T20:15:00Z", "ts_end_epoch": 1785262500.0, "commit": "block15-paired"}
{"exp_num": 412, "exp": "h_b64_s44", "val_bpb": 0.940464, "vram_gb": 89.9, "steps": 1123, "status": "keep", "desc": "flex doc-mask blk64 seed44: paired vs fa3 s44 (0.941425) = -0.000961. 3-seed paired mean -0.001634, 3/3 same sign, but SUB-GATE (2sigma=0.004072, paired t=2.53 df=2 p~0.13). NOT a SOTA under the campaign rule; needs more seeds.", "phase": "block15", "milestone": "", "ts_start": "", "ts_end": "2026-07-28T20:15:00Z", "ts_end_epoch": 1785262500.0, "commit": "block15-paired"}
{"exp_num": 414, "exp": "i_b64_s45", "val_bpb": 0.936987, "vram_gb": 89.9, "steps": 1128, "status": "keep", "desc": "flex doc-mask blk64 seed45 -- best single value of the campaign (0.936987) vs fa3 s45 0.938412 = -0.001425", "phase": "block15", "milestone": "", "ts_start": "", "ts_end": "2026-07-28T20:40:00Z", "ts_end_epoch": 1785264000.0, "commit": "block15-n6"}
{"exp_num": 415, "exp": "i_b64_s46", "val_bpb": 0.940549, "vram_gb": 89.9, "steps": 1111, "status": "keep", "desc": "flex doc-mask blk64 seed46 vs fa3 s46 0.940594 = -0.000045", "phase": "block15", "milestone": "", "ts_start": "", "ts_end": "2026-07-28T20:40:00Z", "ts_end_epoch": 1785264000.0, "commit": "block15-n6"}
{"exp_num": 416, "exp": "i_b64_s47", "val_bpb": 0.93791, "vram_gb": 89.9, "steps": 1107, "status": "keep", "desc": "flex doc-mask blk64 seed47 vs fa3 s47 0.940028 = -0.002118. FINAL n=6 PAIRED VERDICT: mean -0.001415, 6/6 same sign, t=-3.45 p~0.018 -- statistically real but does NOT clear the preregistered 2-sigma adoption gate (0.004072). NOT adopted as SOTA per the campaign rule that a sub-floor refinement is not a result. blk64 6-seed mean 0.939274 vs fa3 6-seed mean 0.940689.", "phase": "block15", "milestone": "", "ts_start": "", "ts_end": "2026-07-28T20:40:00Z", "ts_end_epoch": 1785264000.0, "commit": "block15-n6"}
{"exp_num": 417, "exp": "j_docmask_only", "val_bpb": 0.941327, "vram_gb": 89.9, "steps": 1120, "status": "keep", "desc": "doc-mask@64 alone (combination-round control, 6 concurrent runs). Note 0.941327 here vs 0.940137 in the less-contended round -- the ~0.0012 spread is the within-round contention/seed noise level.", "phase": "block15", "milestone": "", "ts_start": "", "ts_end": "2026-07-28T21:00:00Z", "ts_end_epoch": 1785265200.0, "commit": "block15-combo"}
{"exp_num": 418, "exp": "j_docmask_c3", "val_bpb": 0.941114, "vram_gb": 89.9, "steps": 1112, "status": "keep", "desc": "doc-mask@64 + C3 backoff: -0.000213 vs doc-mask alone. NEUTRAL, same as C3 without doc-masking.", "phase": "block15", "milestone": "", "ts_start": "", "ts_end": "2026-07-28T21:00:00Z", "ts_end_epoch": 1785265200.0, "commit": "block15-combo"}
