{"exp_num": 152, "exp": "exp155_fusedce_c8", "val_bpb": 0.958285, "vram_gb": 50.8, "steps": 1557, "status": "discard", "desc": "fused chunked-CE chunk8 (slower: 8 GEMMs > 1 fused)", "phase": "2", "milestone": "", "ts_start": "", "ts_end": "2026-07-27T14:36:00Z", "ts_end_epoch": 1785162960.0, "commit": "b23e155"}
{"exp_num": 153, "exp": "exp156_fusedce_c1", "val_bpb": 0.954721, "vram_gb": 57.9, "steps": 1676, "status": "pilot", "desc": "fused-CE control chunk1 (= reference)", "phase": "2", "milestone": "", "ts_start": "", "ts_end": "2026-07-27T14:36:00Z", "ts_end_epoch": 1785162960.0, "commit": "b23e156"}
{"exp_num": 154, "exp": "exp157_ngout_i00", "val_bpb": 0.961196, "vram_gb": 73.2, "steps": 1491, "status": "discard", "desc": "output n-gram head gate0 (redundant w/ value-side, +cost)", "phase": "2", "milestone": "", "ts_start": "", "ts_end": "2026-07-27T14:36:00Z", "ts_end_epoch": 1785162960.0, "commit": "b23e157"}
{"exp_num": 155, "exp": "exp158_ngout_i05", "val_bpb": 0.962939, "vram_gb": 73.2, "steps": 1452, "status": "discard", "desc": "output n-gram gate0.5", "phase": "2", "milestone": "", "ts_start": "", "ts_end": "2026-07-27T14:36:00Z", "ts_end_epoch": 1785162960.0, "commit": "b23e158"}
{"exp_num": 156, "exp": "exp159_ngout_i10", "val_bpb": 0.965267, "vram_gb": 73.2, "steps": 1413, "status": "discard", "desc": "output n-gram gate1.0 (worse, injects noisy bias)", "phase": "2", "milestone": "", "ts_start": "", "ts_end": "2026-07-27T14:36:00Z", "ts_end_epoch": 1785162960.0, "commit": "b23e159"}
{"exp_num": 157, "exp": "exp160_ref_s49", "val_bpb": 0.954753, "vram_gb": 57.9, "steps": 1658, "status": "keep", "desc": "reference s49", "phase": "2", "milestone": "", "ts_start": "", "ts_end": "2026-07-27T14:36:00Z", "ts_end_epoch": 1785162960.0, "commit": "b23e160"}
{"exp_num": 158, "exp": "exp161_ref_s50", "val_bpb": 0.953041, "vram_gb": 57.9, "steps": 1693, "status": "keep", "desc": "reference s50", "phase": "2", "milestone": "", "ts_start": "", "ts_end": "2026-07-27T14:36:00Z", "ts_end_epoch": 1785162960.0, "commit": "b23e161"}
{"exp_num": 159, "exp": "exp162_ref_s51", "val_bpb": 0.955048, "vram_gb": 57.9, "steps": 1666, "status": "keep", "desc": "reference s51", "phase": "2", "milestone": "", "ts_start": "", "ts_end": "2026-07-27T14:44:00Z", "ts_end_epoch": 1785163440.0, "commit": "b24e162"}
{"exp_num": 160, "exp": "exp163_ref_s52", "val_bpb": 0.952605, "vram_gb": 57.9, "steps": 1705, "status": "keep", "desc": "reference s52 (best single)", "phase": "2", "milestone": "", "ts_start": "", "ts_end": "2026-07-27T14:44:00Z", "ts_end_epoch": 1785163440.0, "commit": "b24e163"}
{"exp_num": 161, "exp": "exp164_ref_s53", "val_bpb": 0.956325, "vram_gb": 57.9, "steps": 1694, "status": "keep", "desc": "reference s53", "phase": "2", "milestone": "", "ts_start": "", "ts_end": "2026-07-27T14:44:00Z", "ts_end_epoch": 1785163440.0, "commit": "b24e164"}
{"exp_num": 162, "exp": "exp165_rope50k_s43", "val_bpb": 0.954234, "vram_gb": 57.9, "steps": 1673, "status": "pilot", "desc": "rope50k s43 (3-seed neutral)", "phase": "2", "milestone": "", "ts_start": "", "ts_end": "2026-07-27T14:44:00Z", "ts_end_epoch": 1785163440.0, "commit": "b24e165"}
{"exp_num": 163, "exp": "exp166_rope50k_s44", "val_bpb": 0.955153, "vram_gb": 57.9, "steps": 1626, "status": "pilot", "desc": "rope50k s44", "phase": "2", "milestone": "", "ts_start": "", "ts_end": "2026-07-27T14:44:00Z", "ts_end_epoch": 1785163440.0, "commit": "b24e166"}
{"exp_num": 164, "exp": "exp167_softcap20_s43", "val_bpb": 0.956629, "vram_gb": 57.9, "steps": 1670, "status": "discard", "desc": "softcap20 s43 (slightly worse)", "phase": "2", "milestone": "", "ts_start": "", "ts_end": "2026-07-27T14:44:00Z", "ts_end_epoch": 1785163440.0, "commit": "b24e167"}
{"exp_num": 165, "exp": "exp168_moe_e8t2m3_db64", "val_bpb": 1.313286, "vram_gb": 127.0, "steps": 741, "status": "discard", "desc": "MoE E8 dense-experts db64 (catastrophic 1.31, unstable + dense-compute)", "phase": "2", "milestone": "", "ts_start": "", "ts_end": "2026-07-27T14:50:00Z", "ts_end_epoch": 1785163800.0, "commit": "b25e168"}
{"exp_num": 166, "exp": "exp170_moe_e4t2m2", "val_bpb": 1.135635, "vram_gb": 87.9, "steps": 1434, "status": "discard", "desc": "MoE E4 dense (catastrophic 1.14)", "phase": "2", "milestone": "", "ts_start": "", "ts_end": "2026-07-27T14:50:00Z", "ts_end_epoch": 1785163800.0, "commit": "b25e170"}
{"exp_num": 167, "exp": "exp171_ref_s54", "val_bpb": 0.955997, "vram_gb": 57.9, "steps": 1674, "status": "keep", "desc": "reference s54", "phase": "2", "milestone": "", "ts_start": "", "ts_end": "2026-07-27T14:50:00Z", "ts_end_epoch": 1785163800.0, "commit": "b25e171"}
{"exp_num": 168, "exp": "exp172_ref_s55", "val_bpb": 0.956298, "vram_gb": 57.9, "steps": 1630, "status": "keep", "desc": "reference s55", "phase": "2", "milestone": "", "ts_start": "", "ts_end": "2026-07-27T14:50:00Z", "ts_end_epoch": 1785163800.0, "commit": "b25e172"}
{"exp_num": 169, "exp": "exp173_ref_s56", "val_bpb": 0.95639, "vram_gb": 57.9, "steps": 1669, "status": "keep", "desc": "reference s56", "phase": "2", "milestone": "", "ts_start": "", "ts_end": "2026-07-27T14:50:00Z", "ts_end_epoch": 1785163800.0, "commit": "b25e173"}
{"exp_num": 170, "exp": "exp174_ref_s57", "val_bpb": 0.955173, "vram_gb": 57.9, "steps": 1692, "status": "keep", "desc": "reference s57 (13-seed SOTA mean 0.9548)", "phase": "2", "milestone": "", "ts_start": "", "ts_end": "2026-07-27T14:50:00Z", "ts_end_epoch": 1785163800.0, "commit": "b25e174"}
{"exp_num": 171, "exp": "exp175_sg1_s42", "val_bpb": 0.990767, "vram_gb": 57.9, "steps": 987, "status": "discard", "desc": "n-gram sparse-grad SG1 (throughput regression torch2.9: 987 steps)", "phase": "2", "milestone": "", "ts_start": "", "ts_end": "2026-07-27T14:57:00Z", "ts_end_epoch": 1785164220.0, "commit": "b26e175"}
{"exp_num": 172, "exp": "exp176_sg1_s43", "val_bpb": 0.969596, "vram_gb": 57.9, "steps": 1239, "status": "discard", "desc": "sparse-grad s43", "phase": "2", "milestone": "", "ts_start": "", "ts_end": "2026-07-27T14:57:00Z", "ts_end_epoch": 1785164220.0, "commit": "b26e176"}
{"exp_num": 173, "exp": "exp177_sg1_s44", "val_bpb": 0.97208, "vram_gb": 57.9, "steps": 1235, "status": "discard", "desc": "sparse-grad s44 (3-seed reject: fewer steps)", "phase": "2", "milestone": "", "ts_start": "", "ts_end": "2026-07-27T14:57:00Z", "ts_end_epoch": 1785164220.0, "commit": "b26e177"}
{"exp_num": 174, "exp": "exp178_sg0_s42", "val_bpb": 0.955858, "vram_gb": 57.9, "steps": 1638, "status": "pilot", "desc": "dense control SG0 (no-maxauto base 0.9566)", "phase": "2", "milestone": "", "ts_start": "", "ts_end": "2026-07-27T14:57:00Z", "ts_end_epoch": 1785164220.0, "commit": "b26e178"}
{"exp_num": 175, "exp": "exp179_sg0_s43", "val_bpb": 0.957854, "vram_gb": 57.9, "steps": 1593, "status": "pilot", "desc": "dense control s43", "phase": "2", "milestone": "", "ts_start": "", "ts_end": "2026-07-27T14:57:00Z", "ts_end_epoch": 1785164220.0, "commit": "b26e179"}
{"exp_num": 176, "exp": "exp180_sg0_s44", "val_bpb": 0.956242, "vram_gb": 57.9, "steps": 1632, "status": "pilot", "desc": "dense control s44", "phase": "2", "milestone": "", "ts_start": "", "ts_end": "2026-07-27T14:57:00Z", "ts_end_epoch": 1785164220.0, "commit": "b26e180"}
{"exp_num": 177, "exp": "exp181_ema999_s42", "val_bpb": 0.955257, "vram_gb": 57.9, "steps": 1650, "status": "pilot", "desc": "EMA 0.999 (ema 1.004 > raw; EMA hurts, no basin)", "phase": "2", "milestone": "", "ts_start": "", "ts_end": "2026-07-27T15:03:00Z", "ts_end_epoch": 1785164580.0, "commit": "b27e181"}
{"exp_num": 178, "exp": "exp182_ema9995_s42", "val_bpb": 0.954602, "vram_gb": 57.9, "steps": 1675, "status": "pilot", "desc": "EMA 0.9995 (ema worse)", "phase": "2", "milestone": "", "ts_start": "", "ts_end": "2026-07-27T15:03:00Z", "ts_end_epoch": 1785164580.0, "commit": "b27e182"}
{"exp_num": 179, "exp": "exp183_ema998_s42", "val_bpb": 0.954813, "vram_gb": 57.9, "steps": 1667, "status": "pilot", "desc": "EMA 0.998 (ema 0.972 worse)", "phase": "2", "milestone": "", "ts_start": "", "ts_end": "2026-07-27T15:03:00Z", "ts_end_epoch": 1785164580.0, "commit": "b27e183"}
{"exp_num": 180, "exp": "exp184_ema99_s42", "val_bpb": 0.955932, "vram_gb": 57.9, "steps": 1638, "status": "pilot", "desc": "EMA 0.99 (ema 0.956 ~raw, still worse)", "phase": "2", "milestone": "", "ts_start": "", "ts_end": "2026-07-27T15:03:00Z", "ts_end_epoch": 1785164580.0, "commit": "b27e184"}
{"exp_num": 181, "exp": "exp185_ema999_s43", "val_bpb": 0.958652, "vram_gb": 57.9, "steps": 1591, "status": "pilot", "desc": "EMA 0.999 s43", "phase": "2", "milestone": "", "ts_start": "", "ts_end": "2026-07-27T15:03:00Z", "ts_end_epoch": 1785164580.0, "commit": "b27e185"}
{"exp_num": 182, "exp": "exp186_ema999_s44", "val_bpb": 0.95663, "vram_gb": 57.9, "steps": 1626, "status": "pilot", "desc": "EMA 0.999 s44", "phase": "2", "milestone": "", "ts_start": "", "ts_end": "2026-07-27T15:03:00Z", "ts_end_epoch": 1785164580.0, "commit": "b27e186"}
{"exp_num": 183, "exp": "exp187_ema999_sf5", "val_bpb": 0.955227, "vram_gb": 57.9, "steps": 1666, "status": "pilot", "desc": "EMA start-frac 0.5", "phase": "2", "milestone": "", "ts_start": "", "ts_end": "2026-07-27T15:03:00Z", "ts_end_epoch": 1785164580.0, "commit": "b27e187"}
{"exp_num": 184, "exp": "exp188_ref_s58", "val_bpb": 0.954525, "vram_gb": 57.9, "steps": 1670, "status": "keep", "desc": "reference s58 (SOTA-CI)", "phase": "2", "milestone": "", "ts_start": "", "ts_end": "2026-07-27T15:04:00Z", "ts_end_epoch": 1785164640.0, "commit": "b28e188"}
{"exp_num": 185, "exp": "exp189_ref_s59", "val_bpb": 0.95361, "vram_gb": 57.9, "steps": 1685, "status": "keep", "desc": "reference s59", "phase": "2", "milestone": "", "ts_start": "", "ts_end": "2026-07-27T15:04:00Z", "ts_end_epoch": 1785164640.0, "commit": "b28e189"}
{"exp_num": 186, "exp": "exp190_ref_s60", "val_bpb": 0.953591, "vram_gb": 57.9, "steps": 1688, "status": "keep", "desc": "reference s60 (n=16 seeds -> SOTA mean 0.9546)", "phase": "2", "milestone": "", "ts_start": "", "ts_end": "2026-07-27T15:04:00Z", "ts_end_epoch": 1785164640.0, "commit": "b28e190"}
{"exp_num": 187, "exp": "exp191_mh_k1", "val_bpb": 0.966261, "vram_gb": 57.9, "steps": 1366, "status": "discard", "desc": "multi-hash k=1 control (anomalous 1366 steps, contention)", "phase": "2", "milestone": "", "ts_start": "", "ts_end": "2026-07-27T15:10:00Z", "ts_end_epoch": 1785165000.0, "commit": "b29e191"}
{"exp_num": 188, "exp": "exp192_mh_k2", "val_bpb": 0.959518, "vram_gb": 57.9, "steps": 1612, "status": "discard", "desc": "multi-hash k=2 (>reference)", "phase": "2", "milestone": "", "ts_start": "", "ts_end": "2026-07-27T15:10:00Z", "ts_end_epoch": 1785165000.0, "commit": "b29e192"}
{"exp_num": 189, "exp": "exp193_mh_k3", "val_bpb": 0.956892, "vram_gb": 57.9, "steps": 1629, "status": "discard", "desc": "multi-hash k=3", "phase": "2", "milestone": "", "ts_start": "", "ts_end": "2026-07-27T15:10:00Z", "ts_end_epoch": 1785165000.0, "commit": "b29e193"}
{"exp_num": 190, "exp": "exp194_mh_k4", "val_bpb": 0.956418, "vram_gb": 57.9, "steps": 1635, "status": "discard", "desc": "multi-hash k=4 (best mh 0.9564, still > ref 0.9546; over-subscription offsets collision gain)", "phase": "2", "milestone": "", "ts_start": "", "ts_end": "2026-07-27T15:10:00Z", "ts_end_epoch": 1785165000.0, "commit": "b29e194"}
{"exp_num": 191, "exp": "exp195_fp8_s42", "val_bpb": 0.953896, "vram_gb": 57.9, "steps": 1715, "status": "keep", "desc": "fp8 MLP s42 (+steps, quality-neutral)", "phase": "2", "milestone": "", "ts_start": "", "ts_end": "2026-07-27T15:20:00Z", "ts_end_epoch": 1785165600.0, "commit": "b30e195"}
{"exp_num": 192, "exp": "exp196_fp8_s43", "val_bpb": 0.953969, "vram_gb": 57.9, "steps": 1737, "status": "keep", "desc": "fp8 MLP s43", "phase": "2", "milestone": "", "ts_start": "", "ts_end": "2026-07-27T15:20:00Z", "ts_end_epoch": 1785165600.0, "commit": "b30e196"}
{"exp_num": 193, "exp": "exp197_fp8_s44", "val_bpb": 0.953482, "vram_gb": 57.9, "steps": 1728, "status": "keep", "desc": "fp8 MLP s44 (3-seed mean 0.9538, MFU 43.9)", "phase": "2", "milestone": "", "ts_start": "", "ts_end": "2026-07-27T15:20:00Z", "ts_end_epoch": 1785165600.0, "commit": "b30e197"}
{"exp_num": 194, "exp": "exp198_bf16_s42", "val_bpb": 0.955597, "vram_gb": 57.9, "steps": 1639, "status": "pilot", "desc": "bf16 control s42 (MFU 41.6 slow)", "phase": "2", "milestone": "", "ts_start": "", "ts_end": "2026-07-27T15:20:00Z", "ts_end_epoch": 1785165600.0, "commit": "b30e198"}
{"exp_num": 195, "exp": "exp199_bf16_s43", "val_bpb": 0.956788, "vram_gb": 57.9, "steps": 1637, "status": "pilot", "desc": "bf16 control s43", "phase": "2", "milestone": "", "ts_start": "", "ts_end": "2026-07-27T15:20:00Z", "ts_end_epoch": 1785165600.0, "commit": "b30e199"}
{"exp_num": 196, "exp": "exp200_fp8_s45", "val_bpb": 0.954894, "vram_gb": 57.9, "steps": 1712, "status": "keep", "desc": "fp8 MLP s45", "phase": "2", "milestone": "", "ts_start": "", "ts_end": "2026-07-27T15:27:00Z", "ts_end_epoch": 1785166020.0, "commit": "b31e200"}
{"exp_num": 197, "exp": "exp201_fp8_s46", "val_bpb": 0.953261, "vram_gb": 57.9, "steps": 1733, "status": "keep", "desc": "fp8 MLP s46", "phase": "2", "milestone": "", "ts_start": "", "ts_end": "2026-07-27T15:27:00Z", "ts_end_epoch": 1785166020.0, "commit": "b31e201"}
{"exp_num": 198, "exp": "exp202_fp8_s47", "val_bpb": 0.952753, "vram_gb": 57.9, "steps": 1731, "status": "pilot", "desc": "fp8 MLP ADOPTED (6-seed mean 0.9537, +0.0015 vs bf16 paired, quality-neutral +MFU)", "phase": "2", "milestone": "", "ts_start": "", "ts_end": "2026-07-27T15:27:00Z", "ts_end_epoch": 1785166020.0, "commit": "b31e202", "change": "fp8 MLP (tested NEUTRAL under interleaved A/B \u2014 retracted)"}
{"exp_num": 199, "exp": "exp203_bf16_s44", "val_bpb": 0.954698, "vram_gb": 57.9, "steps": 1683, "status": "pilot", "desc": "bf16 control s44", "phase": "2", "milestone": "", "ts_start": "", "ts_end": "2026-07-27T15:27:00Z", "ts_end_epoch": 1785166020.0, "commit": "b31e203"}
{"exp_num": 200, "exp": "exp204_bf16_s45", "val_bpb": 0.954241, "vram_gb": 57.9, "steps": 1632, "status": "pilot", "desc": "bf16 control s45", "phase": "2", "milestone": "", "ts_start": "", "ts_end": "2026-07-27T15:27:00Z", "ts_end_epoch": 1785166020.0, "commit": "b31e204"}
{"exp_num": 201, "exp": "exp205_bf16_s46", "val_bpb": 0.95574, "vram_gb": 57.9, "steps": 1670, "status": "pilot", "desc": "bf16 control s46", "phase": "2", "milestone": "", "ts_start": "", "ts_end": "2026-07-27T15:27:00Z", "ts_end_epoch": 1785166020.0, "commit": "b31e205"}
{"exp_num": 202, "exp": "exp209_fp8attn_s42", "val_bpb": 0.954403, "vram_gb": 57.9, "steps": 1703, "status": "discard", "desc": "fp8 attention (no MFU gain: proj GEMMs too small for fp8)", "phase": "2", "milestone": "", "ts_start": "", "ts_end": "2026-07-27T15:36:00Z", "ts_end_epoch": 1785166560.0, "commit": "b33e209"}
{"exp_num": 203, "exp": "exp210_fp8attn_s43", "val_bpb": 0.957891, "vram_gb": 57.9, "steps": 1639, "status": "discard", "desc": "fp8 attn s43 (worse, q/k quant risk)", "phase": "2", "milestone": "", "ts_start": "", "ts_end": "2026-07-27T15:36:00Z", "ts_end_epoch": 1785166560.0, "commit": "b33e210"}
{"exp_num": 204, "exp": "exp211_fp8mlponly_s42", "val_bpb": 0.954869, "vram_gb": 57.9, "steps": 1684, "status": "pilot", "desc": "fp8-MLP-only control s42", "phase": "2", "milestone": "", "ts_start": "", "ts_end": "2026-07-27T15:36:00Z", "ts_end_epoch": 1785166560.0, "commit": "b33e211"}
{"exp_num": 205, "exp": "exp212_fp8mlponly_s43", "val_bpb": 0.955321, "vram_gb": 57.9, "steps": 1709, "status": "pilot", "desc": "fp8-MLP-only control s43", "phase": "2", "milestone": "", "ts_start": "", "ts_end": "2026-07-27T15:36:00Z", "ts_end_epoch": 1785166560.0, "commit": "b33e212"}
{"exp_num": 206, "exp": "exp26_fp8ref_s48", "val_bpb": 0.95473, "vram_gb": 57.9, "steps": 1708, "status": "keep", "desc": "fp8 reference confirm s48", "phase": "2", "milestone": "", "ts_start": "", "ts_end": "2026-07-27T15:34:00Z", "ts_end_epoch": 1785166440.0, "commit": "b32e026"}
{"exp_num": 207, "exp": "exp27_fp8ref_s49", "val_bpb": 0.953178, "vram_gb": 57.9, "steps": 1731, "status": "keep", "desc": "fp8 reference s49", "phase": "2", "milestone": "", "ts_start": "", "ts_end": "2026-07-27T15:34:00Z", "ts_end_epoch": 1785166440.0, "commit": "b32e027"}
{"exp_num": 208, "exp": "exp28_fp8ref_s50", "val_bpb": 0.952125, "vram_gb": 57.9, "steps": 1726, "status": "keep", "desc": "fp8 reference s50 (9-seed fp8 SOTA 0.9535, best single 0.9521)", "phase": "2", "milestone": "", "ts_start": "", "ts_end": "2026-07-27T15:34:00Z", "ts_end_epoch": 1785166440.0, "commit": "b32e028"}
{"exp_num": 209, "exp": "exp213_fp8lmh_s42", "val_bpb": 0.954129, "vram_gb": 57.9, "steps": 1728, "status": "pilot", "desc": "fp8 lm_head s42 (+MFU 44.1, quality-neutral, marginal)", "phase": "2", "milestone": "", "ts_start": "", "ts_end": "2026-07-27T15:44:00Z", "ts_end_epoch": 1785167040.0, "commit": "b34e213"}
{"exp_num": 210, "exp": "exp214_fp8lmh_s43", "val_bpb": 0.953925, "vram_gb": 57.9, "steps": 1746, "status": "pilot", "desc": "fp8 lm_head s43", "phase": "2", "milestone": "", "ts_start": "", "ts_end": "2026-07-27T15:44:00Z", "ts_end_epoch": 1785167040.0, "commit": "b34e214"}
{"exp_num": 211, "exp": "exp215_fp8lmh_s44", "val_bpb": 0.953937, "vram_gb": 57.9, "steps": 1741, "status": "pilot", "desc": "fp8 lm_head s44 (3-seed 0.9540 ~ fp8-ref, settling)", "phase": "2", "milestone": "", "ts_start": "", "ts_end": "2026-07-27T15:44:00Z", "ts_end_epoch": 1785167040.0, "commit": "b34e215"}
{"exp_num": 212, "exp": "exp216_fp8ref_s51", "val_bpb": 0.954793, "vram_gb": 57.9, "steps": 1697, "status": "keep", "desc": "fp8 ref s51 (control slow)", "phase": "2", "milestone": "", "ts_start": "", "ts_end": "2026-07-27T15:44:00Z", "ts_end_epoch": 1785167040.0, "commit": "b34e216"}
{"exp_num": 213, "exp": "exp217_fp8ref_s52", "val_bpb": 0.954852, "vram_gb": 57.9, "steps": 1661, "status": "keep", "desc": "fp8 ref s52", "phase": "2", "milestone": "", "ts_start": "", "ts_end": "2026-07-27T15:44:00Z", "ts_end_epoch": 1785167040.0, "commit": "b34e217"}
{"exp_num": 214, "exp": "exp218_fp8lmh_s53", "val_bpb": 0.954729, "vram_gb": 57.9, "steps": 1724, "status": "pilot", "desc": "fp8 lm_head s53", "phase": "2", "milestone": "", "ts_start": "", "ts_end": "2026-07-27T15:52:00Z", "ts_end_epoch": 1785167520.0, "commit": "b35e218"}
{"exp_num": 215, "exp": "exp219_fp8lmh_s54", "val_bpb": 0.955066, "vram_gb": 57.9, "steps": 1746, "status": "pilot", "desc": "fp8 lm_head s54", "phase": "2", "milestone": "", "ts_start": "", "ts_end": "2026-07-27T15:52:00Z", "ts_end_epoch": 1785167520.0, "commit": "b35e219"}
{"exp_num": 216, "exp": "exp220_fp8lmh_s55", "val_bpb": 0.953273, "vram_gb": 57.9, "steps": 1739, "status": "pilot", "desc": "fp8 lm_head s55 (6-seed 0.9542 ~ fp8-ref; NEUTRAL, not adopted; A/B GPU-contention confound)", "phase": "2", "milestone": "", "ts_start": "", "ts_end": "2026-07-27T15:52:00Z", "ts_end_epoch": 1785167520.0, "commit": "b35e220"}
{"exp_num": 217, "exp": "exp221_fp8ref_s53", "val_bpb": 0.953885, "vram_gb": 57.9, "steps": 1694, "status": "keep", "desc": "fp8 ref s53", "phase": "2", "milestone": "", "ts_start": "", "ts_end": "2026-07-27T15:52:00Z", "ts_end_epoch": 1785167520.0, "commit": "b35e221"}
{"exp_num": 218, "exp": "exp222_fp8ref_s54", "val_bpb": 0.958389, "vram_gb": 57.9, "steps": 1650, "status": "keep", "desc": "fp8 ref s54 (slow GPU)", "phase": "2", "milestone": "", "ts_start": "", "ts_end": "2026-07-27T15:52:00Z", "ts_end_epoch": 1785167520.0, "commit": "b35e222"}
{"exp_num": 219, "exp": "exp223_fp8ref_s55", "val_bpb": 0.954575, "vram_gb": 57.9, "steps": 1687, "status": "keep", "desc": "fp8 ref s55", "phase": "2", "milestone": "", "ts_start": "", "ts_end": "2026-07-27T15:52:00Z", "ts_end_epoch": 1785167520.0, "commit": "b35e223"}
{"exp_num": 220, "exp": "exp224_fp8_s60", "val_bpb": 0.953809, "vram_gb": 57.9, "steps": 1711, "status": "pilot", "desc": "fp8 interleaved s60", "phase": "2", "milestone": "", "ts_start": "", "ts_end": "2026-07-27T16:00:00Z", "ts_end_epoch": 1785168000.0, "commit": "b36e224"}
{"exp_num": 221, "exp": "exp225_bf16_s60", "val_bpb": 0.953162, "vram_gb": 57.9, "steps": 1718, "status": "pilot", "desc": "bf16 interleaved s60", "phase": "2", "milestone": "", "ts_start": "", "ts_end": "2026-07-27T16:00:00Z", "ts_end_epoch": 1785168000.0, "commit": "b36e225"}
{"exp_num": 222, "exp": "exp226_fp8_s61", "val_bpb": 0.952912, "vram_gb": 57.9, "steps": 1723, "status": "pilot", "desc": "fp8 interleaved s61", "phase": "2", "milestone": "", "ts_start": "", "ts_end": "2026-07-27T16:00:00Z", "ts_end_epoch": 1785168000.0, "commit": "b36e226"}
{"exp_num": 223, "exp": "exp227_bf16_s61", "val_bpb": 0.953879, "vram_gb": 57.9, "steps": 1679, "status": "pilot", "desc": "bf16 interleaved s61", "phase": "2", "milestone": "", "ts_start": "", "ts_end": "2026-07-27T16:00:00Z", "ts_end_epoch": 1785168000.0, "commit": "b36e227"}
{"exp_num": 224, "exp": "exp228_fp8_s62", "val_bpb": 0.956695, "vram_gb": 57.9, "steps": 1655, "status": "pilot", "desc": "fp8 interleaved s62", "phase": "2", "milestone": "", "ts_start": "", "ts_end": "2026-07-27T16:00:00Z", "ts_end_epoch": 1785168000.0, "commit": "b36e228"}
{"exp_num": 225, "exp": "exp229_bf16_s62", "val_bpb": 0.9558, "vram_gb": 57.9, "steps": 1667, "status": "pilot", "desc": "INTERLEAVED fp8-vs-bf16: paired \u0394 +0.0002 NEUTRAL, MFU equal -> fp8 win was GPU-contention artifact, RETRACTED", "phase": "2", "milestone": "", "ts_start": "", "ts_end": "2026-07-27T16:00:00Z", "ts_end_epoch": 1785168000.0, "commit": "b36e229"}
{"exp_num": 226, "exp": "exp230_full_s70", "val_bpb": 0.953092, "vram_gb": 57.9, "steps": 1705, "status": "keep", "desc": "ablation full SOTA s70 (gpu0)", "phase": "2", "milestone": "", "ts_start": "", "ts_end": "2026-07-27T16:12:00Z", "ts_end_epoch": 1785168720.0, "commit": "b37e230"}
