{"exp_num": 570, "exp": "E3_gpas_s51_g1", "val_bpb": 0.932818, "vram_gb": 55.0, "steps": 2001, "status": "keep", "desc": "E3 GPAS = NEGATIVE, does not transfer. h - SiLU(alpha_l)*sg(h), identity Jacobian, alpha zero-init so step-0 no-op. Source clm_gpas_gradient_preserving_scaling_contract improved ppl at EVERY scale tested including 71M (33.98->33.38) -- the NEAREST-SCALE evidence in the entire 123-claim corpus. Registry had it labelled 'blocked by tooling'; that referred to a governance harness for a diagnostic, while GPAS_ENABLE is fully implemented and env-gated -- it was one env var away. Paired n=10; screen CORRECTED mid-experiment to steps>=1950 primary + MEDIAN mfu>=18.5 after finding last-sample MFU flagged a clean run (s44 ctrl: last-sample 8.94 but median 19.29, 1964 steps). 2 pairs quarantined: s47 treat 1188 steps/13.11 median mfu; s50 CTRL 1131 steps/10.78 -- both ASYMMETRIC (contention hit one arm only), the unusable case. Clean n=8: RAW +0.001437 (sd 0.001826, 1/8 neg, t=+2.23); INTRINSIC +0.001269 (sd 0.001415, 1/8 neg, t=+2.53) after the token-law control variate. Sign is POSITIVE = GPAS is WORSE, 7/8 pairs consistent. Magnitude is 53% of the 0.002396 gate, so this does NOT clear the bar for a confident harm claim -- the defensible statement is that GPAS fails to help here and trends harmful. NOT ADOPTED. SIGNIFICANCE BEYOND GPAS: this is the corpus's nearest-scale claim (71M vs our ~94M dense) from a paper reporting gains at every scale it tested, and it does not survive transfer into the 300s/~2-epoch frame. Combined with E1 (472M conditioned init, null) and E2 (400M Peri-LN, null), all three zero-cost structural levers with adequate scope-match have now failed here, which is evidence about the FRAME rather than about any one mechanism.", "phase": "block26", "milestone": "", "ts_start": "", "ts_end": "2026-07-31T04:15:31Z", "ts_end_epoch": 1785471331.3775702, "commit": "block26-E3-gpas-negative"}
{"exp_num": 571, "exp": "E5_shuffle_s42_sh0", "val_bpb": 0.930917, "vram_gb": 55.0, "steps": 2031, "status": "keep", "desc": "E5 data-ordering arm SHUFFLE_DATA=0 seed 42; all 20 arms passed the contention screen (steps>=1950 primary, median MFU>=18.5 secondary)", "phase": "block27", "milestone": "", "ts_start": "", "ts_end": "2026-07-31T04:05:00Z", "ts_end_epoch": 1785470700.0, "commit": "block27-E5-shuffle-null"}
{"exp_num": 572, "exp": "E5_shuffle_s42_sh1", "val_bpb": 0.932822, "vram_gb": 55.0, "steps": 2025, "status": "keep", "desc": "E5 data-ordering arm SHUFFLE_DATA=1 seed 42; all 20 arms passed the contention screen (steps>=1950 primary, median MFU>=18.5 secondary)", "phase": "block27", "milestone": "", "ts_start": "", "ts_end": "2026-07-31T04:05:00Z", "ts_end_epoch": 1785470700.0, "commit": "block27-E5-shuffle-null"}
{"exp_num": 573, "exp": "E5_shuffle_s43_sh0", "val_bpb": 0.934594, "vram_gb": 55.0, "steps": 2007, "status": "keep", "desc": "E5 data-ordering arm SHUFFLE_DATA=0 seed 43; all 20 arms passed the contention screen (steps>=1950 primary, median MFU>=18.5 secondary)", "phase": "block27", "milestone": "", "ts_start": "", "ts_end": "2026-07-31T04:05:00Z", "ts_end_epoch": 1785470700.0, "commit": "block27-E5-shuffle-null"}
{"exp_num": 574, "exp": "E5_shuffle_s43_sh1", "val_bpb": 0.932925, "vram_gb": 55.0, "steps": 2002, "status": "keep", "desc": "E5 data-ordering arm SHUFFLE_DATA=1 seed 43; all 20 arms passed the contention screen (steps>=1950 primary, median MFU>=18.5 secondary)", "phase": "block27", "milestone": "", "ts_start": "", "ts_end": "2026-07-31T04:05:00Z", "ts_end_epoch": 1785470700.0, "commit": "block27-E5-shuffle-null"}
{"exp_num": 575, "exp": "E5_shuffle_s44_sh0", "val_bpb": 0.93205, "vram_gb": 55.0, "steps": 2023, "status": "keep", "desc": "E5 data-ordering arm SHUFFLE_DATA=0 seed 44; all 20 arms passed the contention screen (steps>=1950 primary, median MFU>=18.5 secondary)", "phase": "block27", "milestone": "", "ts_start": "", "ts_end": "2026-07-31T04:05:00Z", "ts_end_epoch": 1785470700.0, "commit": "block27-E5-shuffle-null"}
{"exp_num": 576, "exp": "E5_shuffle_s44_sh1", "val_bpb": 0.931925, "vram_gb": 55.0, "steps": 2029, "status": "keep", "desc": "E5 data-ordering arm SHUFFLE_DATA=1 seed 44; all 20 arms passed the contention screen (steps>=1950 primary, median MFU>=18.5 secondary)", "phase": "block27", "milestone": "", "ts_start": "", "ts_end": "2026-07-31T04:05:00Z", "ts_end_epoch": 1785470700.0, "commit": "block27-E5-shuffle-null"}
{"exp_num": 577, "exp": "E5_shuffle_s45_sh0", "val_bpb": 0.93222, "vram_gb": 55.0, "steps": 2026, "status": "keep", "desc": "E5 data-ordering arm SHUFFLE_DATA=0 seed 45; all 20 arms passed the contention screen (steps>=1950 primary, median MFU>=18.5 secondary)", "phase": "block27", "milestone": "", "ts_start": "", "ts_end": "2026-07-31T04:05:00Z", "ts_end_epoch": 1785470700.0, "commit": "block27-E5-shuffle-null"}
{"exp_num": 578, "exp": "E5_shuffle_s45_sh1", "val_bpb": 0.932892, "vram_gb": 55.0, "steps": 2011, "status": "keep", "desc": "E5 data-ordering arm SHUFFLE_DATA=1 seed 45; all 20 arms passed the contention screen (steps>=1950 primary, median MFU>=18.5 secondary)", "phase": "block27", "milestone": "", "ts_start": "", "ts_end": "2026-07-31T04:05:00Z", "ts_end_epoch": 1785470700.0, "commit": "block27-E5-shuffle-null"}
{"exp_num": 579, "exp": "E5_shuffle_s46_sh0", "val_bpb": 0.932094, "vram_gb": 55.0, "steps": 2005, "status": "keep", "desc": "E5 data-ordering arm SHUFFLE_DATA=0 seed 46; all 20 arms passed the contention screen (steps>=1950 primary, median MFU>=18.5 secondary)", "phase": "block27", "milestone": "", "ts_start": "", "ts_end": "2026-07-31T04:05:00Z", "ts_end_epoch": 1785470700.0, "commit": "block27-E5-shuffle-null"}
{"exp_num": 580, "exp": "E5_shuffle_s46_sh1", "val_bpb": 0.933613, "vram_gb": 55.0, "steps": 2020, "status": "keep", "desc": "E5 data-ordering arm SHUFFLE_DATA=1 seed 46; all 20 arms passed the contention screen (steps>=1950 primary, median MFU>=18.5 secondary)", "phase": "block27", "milestone": "", "ts_start": "", "ts_end": "2026-07-31T04:05:00Z", "ts_end_epoch": 1785470700.0, "commit": "block27-E5-shuffle-null"}
{"exp_num": 581, "exp": "E5_shuffle_s47_sh0", "val_bpb": 0.930888, "vram_gb": 55.0, "steps": 2031, "status": "keep", "desc": "E5 data-ordering arm SHUFFLE_DATA=0 seed 47; all 20 arms passed the contention screen (steps>=1950 primary, median MFU>=18.5 secondary)", "phase": "block27", "milestone": "", "ts_start": "", "ts_end": "2026-07-31T04:05:00Z", "ts_end_epoch": 1785470700.0, "commit": "block27-E5-shuffle-null"}
{"exp_num": 582, "exp": "E5_shuffle_s47_sh1", "val_bpb": 0.930211, "vram_gb": 55.0, "steps": 2026, "status": "keep", "desc": "E5 data-ordering arm SHUFFLE_DATA=1 seed 47; all 20 arms passed the contention screen (steps>=1950 primary, median MFU>=18.5 secondary)", "phase": "block27", "milestone": "", "ts_start": "", "ts_end": "2026-07-31T04:05:00Z", "ts_end_epoch": 1785470700.0, "commit": "block27-E5-shuffle-null"}
{"exp_num": 583, "exp": "E5_shuffle_s48_sh0", "val_bpb": 0.931371, "vram_gb": 55.0, "steps": 2011, "status": "keep", "desc": "E5 data-ordering arm SHUFFLE_DATA=0 seed 48; all 20 arms passed the contention screen (steps>=1950 primary, median MFU>=18.5 secondary)", "phase": "block27", "milestone": "", "ts_start": "", "ts_end": "2026-07-31T04:05:00Z", "ts_end_epoch": 1785470700.0, "commit": "block27-E5-shuffle-null"}
{"exp_num": 584, "exp": "E5_shuffle_s48_sh1", "val_bpb": 0.932975, "vram_gb": 55.0, "steps": 2005, "status": "keep", "desc": "E5 data-ordering arm SHUFFLE_DATA=1 seed 48; all 20 arms passed the contention screen (steps>=1950 primary, median MFU>=18.5 secondary)", "phase": "block27", "milestone": "", "ts_start": "", "ts_end": "2026-07-31T04:05:00Z", "ts_end_epoch": 1785470700.0, "commit": "block27-E5-shuffle-null"}
{"exp_num": 585, "exp": "E5_shuffle_s49_sh0", "val_bpb": 0.931915, "vram_gb": 55.0, "steps": 2023, "status": "keep", "desc": "E5 data-ordering arm SHUFFLE_DATA=0 seed 49; all 20 arms passed the contention screen (steps>=1950 primary, median MFU>=18.5 secondary)", "phase": "block27", "milestone": "", "ts_start": "", "ts_end": "2026-07-31T04:05:00Z", "ts_end_epoch": 1785470700.0, "commit": "block27-E5-shuffle-null"}
{"exp_num": 586, "exp": "E5_shuffle_s49_sh1", "val_bpb": 0.930684, "vram_gb": 55.0, "steps": 2030, "status": "keep", "desc": "E5 data-ordering arm SHUFFLE_DATA=1 seed 49; all 20 arms passed the contention screen (steps>=1950 primary, median MFU>=18.5 secondary)", "phase": "block27", "milestone": "", "ts_start": "", "ts_end": "2026-07-31T04:05:00Z", "ts_end_epoch": 1785470700.0, "commit": "block27-E5-shuffle-null"}
{"exp_num": 587, "exp": "E5_shuffle_s50_sh0", "val_bpb": 0.930739, "vram_gb": 55.0, "steps": 2027, "status": "keep", "desc": "E5 data-ordering arm SHUFFLE_DATA=0 seed 50; all 20 arms passed the contention screen (steps>=1950 primary, median MFU>=18.5 secondary)", "phase": "block27", "milestone": "", "ts_start": "", "ts_end": "2026-07-31T04:05:00Z", "ts_end_epoch": 1785470700.0, "commit": "block27-E5-shuffle-null"}
{"exp_num": 588, "exp": "E5_shuffle_s50_sh1", "val_bpb": 0.931701, "vram_gb": 55.0, "steps": 2011, "status": "keep", "desc": "E5 data-ordering arm SHUFFLE_DATA=1 seed 50; all 20 arms passed the contention screen (steps>=1950 primary, median MFU>=18.5 secondary)", "phase": "block27", "milestone": "", "ts_start": "", "ts_end": "2026-07-31T04:05:00Z", "ts_end_epoch": 1785470700.0, "commit": "block27-E5-shuffle-null"}
{"exp_num": 589, "exp": "E5_shuffle_s51_sh0", "val_bpb": 0.931784, "vram_gb": 55.0, "steps": 2006, "status": "keep", "desc": "E5 data-ordering arm SHUFFLE_DATA=0 seed 51; all 20 arms passed the contention screen (steps>=1950 primary, median MFU>=18.5 secondary)", "phase": "block27", "milestone": "", "ts_start": "", "ts_end": "2026-07-31T04:05:00Z", "ts_end_epoch": 1785470700.0, "commit": "block27-E5-shuffle-null"}
{"exp_num": 590, "exp": "E5_shuffle_s51_sh1", "val_bpb": 0.930318, "vram_gb": 55.0, "steps": 2024, "status": "keep", "desc": "E5 data-ordering arm SHUFFLE_DATA=1 seed 51; all 20 arms passed the contention screen (steps>=1950 primary, median MFU>=18.5 secondary)", "phase": "block27", "milestone": "", "ts_start": "", "ts_end": "2026-07-31T04:05:00Z", "ts_end_epoch": 1785470700.0, "commit": "block27-E5-shuffle-null"}
{"exp_num": 591, "exp": "E6_sparsegrad_s42_sg0", "val_bpb": 0.931131, "vram_gb": 55.0, "steps": 2029, "status": "keep", "desc": "E6 NGRAM_SPARSE_GRAD=0 seed 42 at the frame-default table multiplier; round KILLED at the preregistered trap-check after 5 pairs", "phase": "block28", "milestone": "", "ts_start": "", "ts_end": "2026-07-31T05:55:00Z", "ts_end_epoch": 1785477300.0, "commit": "block28-E6-sparsegrad-trapcheck-kill"}
{"exp_num": 592, "exp": "E6_sparsegrad_s42_sg1", "val_bpb": 0.939586, "vram_gb": 55.0, "steps": 1786, "status": "keep", "desc": "E6 NGRAM_SPARSE_GRAD=1 seed 42 at the frame-default table multiplier; round KILLED at the preregistered trap-check after 5 pairs", "phase": "block28", "milestone": "", "ts_start": "", "ts_end": "2026-07-31T05:55:00Z", "ts_end_epoch": 1785477300.0, "commit": "block28-E6-sparsegrad-trapcheck-kill"}
{"exp_num": 593, "exp": "E6_sparsegrad_s43_sg0", "val_bpb": 0.934496, "vram_gb": 55.0, "steps": 2008, "status": "keep", "desc": "E6 NGRAM_SPARSE_GRAD=0 seed 43 at the frame-default table multiplier; round KILLED at the preregistered trap-check after 5 pairs", "phase": "block28", "milestone": "", "ts_start": "", "ts_end": "2026-07-31T05:55:00Z", "ts_end_epoch": 1785477300.0, "commit": "block28-E6-sparsegrad-trapcheck-kill"}
{"exp_num": 594, "exp": "E6_sparsegrad_s43_sg1", "val_bpb": 0.943503, "vram_gb": 55.0, "steps": 1769, "status": "keep", "desc": "E6 NGRAM_SPARSE_GRAD=1 seed 43 at the frame-default table multiplier; round KILLED at the preregistered trap-check after 5 pairs", "phase": "block28", "milestone": "", "ts_start": "", "ts_end": "2026-07-31T05:55:00Z", "ts_end_epoch": 1785477300.0, "commit": "block28-E6-sparsegrad-trapcheck-kill"}
{"exp_num": 595, "exp": "E6_sparsegrad_s44_sg0", "val_bpb": 0.932508, "vram_gb": 55.0, "steps": 2020, "status": "keep", "desc": "E6 NGRAM_SPARSE_GRAD=0 seed 44 at the frame-default table multiplier; round KILLED at the preregistered trap-check after 5 pairs", "phase": "block28", "milestone": "", "ts_start": "", "ts_end": "2026-07-31T05:55:00Z", "ts_end_epoch": 1785477300.0, "commit": "block28-E6-sparsegrad-trapcheck-kill"}
{"exp_num": 596, "exp": "E6_sparsegrad_s44_sg1", "val_bpb": 0.940192, "vram_gb": 55.0, "steps": 1788, "status": "keep", "desc": "E6 NGRAM_SPARSE_GRAD=1 seed 44 at the frame-default table multiplier; round KILLED at the preregistered trap-check after 5 pairs", "phase": "block28", "milestone": "", "ts_start": "", "ts_end": "2026-07-31T05:55:00Z", "ts_end_epoch": 1785477300.0, "commit": "block28-E6-sparsegrad-trapcheck-kill"}
{"exp_num": 597, "exp": "E6_sparsegrad_s45_sg0", "val_bpb": 0.932173, "vram_gb": 55.0, "steps": 2023, "status": "keep", "desc": "E6 NGRAM_SPARSE_GRAD=0 seed 45 at the frame-default table multiplier; round KILLED at the preregistered trap-check after 5 pairs", "phase": "block28", "milestone": "", "ts_start": "", "ts_end": "2026-07-31T05:55:00Z", "ts_end_epoch": 1785477300.0, "commit": "block28-E6-sparsegrad-trapcheck-kill"}
{"exp_num": 598, "exp": "E6_sparsegrad_s45_sg1", "val_bpb": 0.941401, "vram_gb": 55.0, "steps": 1770, "status": "keep", "desc": "E6 NGRAM_SPARSE_GRAD=1 seed 45 at the frame-default table multiplier; round KILLED at the preregistered trap-check after 5 pairs", "phase": "block28", "milestone": "", "ts_start": "", "ts_end": "2026-07-31T05:55:00Z", "ts_end_epoch": 1785477300.0, "commit": "block28-E6-sparsegrad-trapcheck-kill"}
{"exp_num": 599, "exp": "E6_sparsegrad_s46_sg0", "val_bpb": 0.932356, "vram_gb": 55.0, "steps": 2002, "status": "keep", "desc": "E6 NGRAM_SPARSE_GRAD=0 seed 46 at the frame-default table multiplier; round KILLED at the preregistered trap-check after 5 pairs", "phase": "block28", "milestone": "", "ts_start": "", "ts_end": "2026-07-31T05:55:00Z", "ts_end_epoch": 1785477300.0, "commit": "block28-E6-sparsegrad-trapcheck-kill"}
{"exp_num": 600, "exp": "E6_sparsegrad_s46_sg1", "val_bpb": 0.940048, "vram_gb": 55.0, "steps": 1780, "status": "keep", "desc": "E6 NGRAM_SPARSE_GRAD=1 seed 46 at the frame-default table multiplier; round KILLED at the preregistered trap-check after 5 pairs", "phase": "block28", "milestone": "", "ts_start": "", "ts_end": "2026-07-31T05:55:00Z", "ts_end_epoch": 1785477300.0, "commit": "block28-E6-sparsegrad-trapcheck-kill"}
{"exp_num": 601, "exp": "E7_m64_sg0_s42", "val_bpb": 0.930667, "vram_gb": 55.0, "steps": 2027, "status": "keep", "desc": "E7 2x2 mechanism test: NGRAM_TABLE_MULT=64, NGRAM_SPARSE_GRAD=0, median step 148.9 ms, median MFU 19.53. Screened on median step time, not the absolute step floor, which is calibrated for mult=64 only.", "phase": "block29", "milestone": "", "ts_start": "", "ts_end": "2026-07-31T06:30:00Z", "ts_end_epoch": 1785479400.0, "commit": "block29-E7-fillflood-confirmed"}
{"exp_num": 602, "exp": "E7_m64_sg1_s42", "val_bpb": 0.939397, "vram_gb": 55.0, "steps": 1788, "status": "keep", "desc": "E7 2x2 mechanism test: NGRAM_TABLE_MULT=64, NGRAM_SPARSE_GRAD=1, median step 168.8 ms, median MFU 17.22. Screened on median step time, not the absolute step floor, which is calibrated for mult=64 only.", "phase": "block29", "milestone": "", "ts_start": "", "ts_end": "2026-07-31T06:30:00Z", "ts_end_epoch": 1785479400.0, "commit": "block29-E7-fillflood-confirmed"}
{"exp_num": 603, "exp": "E7_m256_sg0_s42", "val_bpb": 0.943676, "vram_gb": 55.0, "steps": 1615, "status": "keep", "desc": "E7 2x2 mechanism test: NGRAM_TABLE_MULT=256, NGRAM_SPARSE_GRAD=0, median step 187.0 ms, median MFU 15.55. Screened on median step time, not the absolute step floor, which is calibrated for mult=64 only.", "phase": "block29", "milestone": "", "ts_start": "", "ts_end": "2026-07-31T06:30:00Z", "ts_end_epoch": 1785479400.0, "commit": "block29-E7-fillflood-confirmed"}
{"exp_num": 604, "exp": "E7_m256_sg1_s42", "val_bpb": 0.945871, "vram_gb": 55.0, "steps": 1563, "status": "keep", "desc": "E7 2x2 mechanism test: NGRAM_TABLE_MULT=256, NGRAM_SPARSE_GRAD=1, median step 193.3 ms, median MFU 15.04. Screened on median step time, not the absolute step floor, which is calibrated for mult=64 only.", "phase": "block29", "milestone": "", "ts_start": "", "ts_end": "2026-07-31T06:30:00Z", "ts_end_epoch": 1785479400.0, "commit": "block29-E7-fillflood-confirmed"}
{"exp_num": 605, "exp": "E7_m64_sg0_s43", "val_bpb": 0.934316, "vram_gb": 55.0, "steps": 2019, "status": "keep", "desc": "E7 2x2 mechanism test: NGRAM_TABLE_MULT=64, NGRAM_SPARSE_GRAD=0, median step 149.4 ms, median MFU 19.46. Screened on median step time, not the absolute step floor, which is calibrated for mult=64 only.", "phase": "block29", "milestone": "", "ts_start": "", "ts_end": "2026-07-31T06:30:00Z", "ts_end_epoch": 1785479400.0, "commit": "block29-E7-fillflood-confirmed"}
{"exp_num": 606, "exp": "E7_m64_sg1_s43", "val_bpb": 0.942704, "vram_gb": 55.0, "steps": 1791, "status": "keep", "desc": "E7 2x2 mechanism test: NGRAM_TABLE_MULT=64, NGRAM_SPARSE_GRAD=1, median step 168.6 ms, median MFU 17.25. Screened on median step time, not the absolute step floor, which is calibrated for mult=64 only.", "phase": "block29", "milestone": "", "ts_start": "", "ts_end": "2026-07-31T06:30:00Z", "ts_end_epoch": 1785479400.0, "commit": "block29-E7-fillflood-confirmed"}
{"exp_num": 607, "exp": "E7_m256_sg0_s43", "val_bpb": 0.946078, "vram_gb": 55.0, "steps": 1626, "status": "keep", "desc": "E7 2x2 mechanism test: NGRAM_TABLE_MULT=256, NGRAM_SPARSE_GRAD=0, median step 185.8 ms, median MFU 15.64. Screened on median step time, not the absolute step floor, which is calibrated for mult=64 only.", "phase": "block29", "milestone": "", "ts_start": "", "ts_end": "2026-07-31T06:30:00Z", "ts_end_epoch": 1785479400.0, "commit": "block29-E7-fillflood-confirmed"}
{"exp_num": 608, "exp": "E7_m256_sg1_s43", "val_bpb": 0.948699, "vram_gb": 55.0, "steps": 1568, "status": "keep", "desc": "E7 2x2 mechanism test: NGRAM_TABLE_MULT=256, NGRAM_SPARSE_GRAD=1, median step 192.6 ms, median MFU 15.09. Screened on median step time, not the absolute step floor, which is calibrated for mult=64 only.", "phase": "block29", "milestone": "", "ts_start": "", "ts_end": "2026-07-31T06:30:00Z", "ts_end_epoch": 1785479400.0, "commit": "block29-E7-fillflood-confirmed"}
{"exp_num": 609, "exp": "E7_m64_sg0_s44", "val_bpb": 0.932744, "vram_gb": 55.0, "steps": 2003, "status": "keep", "desc": "E7 2x2 mechanism test: NGRAM_TABLE_MULT=64, NGRAM_SPARSE_GRAD=0, median step 150.6 ms, median MFU 19.3. Screened on median step time, not the absolute step floor, which is calibrated for mult=64 only.", "phase": "block29", "milestone": "", "ts_start": "", "ts_end": "2026-07-31T06:30:00Z", "ts_end_epoch": 1785479400.0, "commit": "block29-E7-fillflood-confirmed"}
{"exp_num": 610, "exp": "E7_m64_sg1_s44", "val_bpb": 0.940478, "vram_gb": 55.0, "steps": 1787, "status": "keep", "desc": "E7 2x2 mechanism test: NGRAM_TABLE_MULT=64, NGRAM_SPARSE_GRAD=1, median step 168.9 ms, median MFU 17.21. Screened on median step time, not the absolute step floor, which is calibrated for mult=64 only.", "phase": "block29", "milestone": "", "ts_start": "", "ts_end": "2026-07-31T06:30:00Z", "ts_end_epoch": 1785479400.0, "commit": "block29-E7-fillflood-confirmed"}
{"exp_num": 611, "exp": "E7_m256_sg0_s44", "val_bpb": 0.943551, "vram_gb": 55.0, "steps": 1627, "status": "keep", "desc": "E7 2x2 mechanism test: NGRAM_TABLE_MULT=256, NGRAM_SPARSE_GRAD=0, median step 185.7 ms, median MFU 15.66. Screened on median step time, not the absolute step floor, which is calibrated for mult=64 only.", "phase": "block29", "milestone": "", "ts_start": "", "ts_end": "2026-07-31T06:30:00Z", "ts_end_epoch": 1785479400.0, "commit": "block29-E7-fillflood-confirmed"}
{"exp_num": 612, "exp": "E7_m256_sg1_s44", "val_bpb": 0.946235, "vram_gb": 55.0, "steps": 1576, "status": "keep", "desc": "E7 2x2 mechanism test: NGRAM_TABLE_MULT=256, NGRAM_SPARSE_GRAD=1, median step 191.5 ms, median MFU 15.18. Screened on median step time, not the absolute step floor, which is calibrated for mult=64 only.", "phase": "block29", "milestone": "", "ts_start": "", "ts_end": "2026-07-31T06:30:00Z", "ts_end_epoch": 1785479400.0, "commit": "block29-E7-fillflood-confirmed"}
{"exp_num": 613, "exp": "E7_m64_sg0_s45", "val_bpb": 0.935658, "vram_gb": 55.0, "steps": 1908, "status": "keep", "desc": "E7 2x2 mechanism test: NGRAM_TABLE_MULT=64, NGRAM_SPARSE_GRAD=0, median step 150.2 ms, median MFU 19.35. Screened on median step time, not the absolute step floor, which is calibrated for mult=64 only.", "phase": "block29", "milestone": "", "ts_start": "", "ts_end": "2026-07-31T06:30:00Z", "ts_end_epoch": 1785479400.0, "commit": "block29-E7-fillflood-confirmed"}
{"exp_num": 614, "exp": "E7_m64_sg1_s45", "val_bpb": 0.941656, "vram_gb": 55.0, "steps": 1770, "status": "keep", "desc": "E7 2x2 mechanism test: NGRAM_TABLE_MULT=64, NGRAM_SPARSE_GRAD=1, median step 170.4 ms, median MFU 17.06. Screened on median step time, not the absolute step floor, which is calibrated for mult=64 only.", "phase": "block29", "milestone": "", "ts_start": "", "ts_end": "2026-07-31T06:30:00Z", "ts_end_epoch": 1785479400.0, "commit": "block29-E7-fillflood-confirmed"}
{"exp_num": 615, "exp": "E7_m256_sg0_s45", "val_bpb": 0.943614, "vram_gb": 55.0, "steps": 1622, "status": "keep", "desc": "E7 2x2 mechanism test: NGRAM_TABLE_MULT=256, NGRAM_SPARSE_GRAD=0, median step 186.2 ms, median MFU 15.61. Screened on median step time, not the absolute step floor, which is calibrated for mult=64 only.", "phase": "block29", "milestone": "", "ts_start": "", "ts_end": "2026-07-31T06:30:00Z", "ts_end_epoch": 1785479400.0, "commit": "block29-E7-fillflood-confirmed"}
