{"exp_num": 518, "exp": "G_ctrl_s55", "val_bpb": 0.92824, "vram_gb": 55.0, "steps": 1990, "status": "keep", "desc": "MECHANISM ATTEMPT (first non-knob of the session): static-shape cu_seqlens to remove the per-step torch.nonzero host sync from the ADOPTED fa3 varlen doc-masking path. Implemented behind DOC_MASK_STATIC_CU (default 0), echoed to RESOLVED_CONFIG, and verified byte-identical to the nonzero construction on the meaningful cu_seqlens prefix over 200 randomized trials before any GPU time. RESULT: REJECTED BY THE KERNEL. All 3 treatment arms died with 'CUDA driver error: an illegal memory access was encountered'; all 3 controls completed normally (0.929500/2009, 0.927866/1997, 0.928240/1990), which also confirms the edit did NOT disturb the adopted default path. FINDING: fa3 varlen does not accept a fixed-capacity cu_seqlens padded with zero-length trailing sequences. The kernel derives its sequence count from cu_seqlens.numel()-1, so declaring 8192 sequences against B*T=147456 rows of q/k/v drives per-sequence scheduling out of bounds. The 200-trial equivalence test proved the CONTENT correct and could not prove the CONTRACT -- content equivalence and kernel-contract compatibility are separate properties, and only the first is testable without the GPU. IMPLICATION: removing this host sync requires either (a) a capacity equal to the true document count, which needs the very host sync we are trying to delete, or (b) a kernel that accepts an explicit num_seqs argument separate from the cu_seqlens buffer length. Option (b) is the real proposal and points at FA4 / a custom varlen wrapper. The torch.nonzero sync therefore remains, and CUDA-graph capture remains blocked by BOTH this unbacked shape and the ~25GB graph-pool VRAM cost measured earlier.", "phase": "block23", "milestone": "", "ts_start": "", "ts_end": "2026-07-29T06:48:36Z", "ts_end_epoch": 1785307716.11646, "commit": "block23-static-cu-rejected"}
{"exp_num": 519, "exp": "E1_condinit_s44_ci0", "val_bpb": 0.932691, "vram_gb": 55.0, "steps": 2026, "status": "keep", "desc": "E1 conditioned-init arm E1_condinit_s44_ci0", "phase": "block24", "milestone": "", "ts_start": "", "ts_end": "2026-07-31T02:08:32Z", "ts_end_epoch": 1785463712.833937, "commit": "block24-E1-condinit-null"}
{"exp_num": 520, "exp": "E1_condinit_s44_ci1", "val_bpb": 0.931299, "vram_gb": 55.0, "steps": 2026, "status": "keep", "desc": "E1 conditioned-init arm E1_condinit_s44_ci1", "phase": "block24", "milestone": "", "ts_start": "", "ts_end": "2026-07-31T02:08:32Z", "ts_end_epoch": 1785463712.833937, "commit": "block24-E1-condinit-null"}
{"exp_num": 521, "exp": "E1_condinit_s45_ci0", "val_bpb": 0.932296, "vram_gb": 55.0, "steps": 2024, "status": "keep", "desc": "E1 conditioned-init arm E1_condinit_s45_ci0", "phase": "block24", "milestone": "", "ts_start": "", "ts_end": "2026-07-31T02:08:32Z", "ts_end_epoch": 1785463712.833937, "commit": "block24-E1-condinit-null"}
{"exp_num": 522, "exp": "E1_condinit_s45_ci1", "val_bpb": 0.932293, "vram_gb": 55.0, "steps": 2025, "status": "keep", "desc": "E1 conditioned-init arm E1_condinit_s45_ci1", "phase": "block24", "milestone": "", "ts_start": "", "ts_end": "2026-07-31T02:08:32Z", "ts_end_epoch": 1785463712.833937, "commit": "block24-E1-condinit-null"}
{"exp_num": 523, "exp": "E1_condinit_s48_ci0", "val_bpb": 0.930999, "vram_gb": 55.0, "steps": 2027, "status": "keep", "desc": "E1 conditioned-init arm E1_condinit_s48_ci0", "phase": "block24", "milestone": "", "ts_start": "", "ts_end": "2026-07-31T02:08:32Z", "ts_end_epoch": 1785463712.833937, "commit": "block24-E1-condinit-null"}
{"exp_num": 524, "exp": "E1_condinit_s48_ci1", "val_bpb": 0.931901, "vram_gb": 55.0, "steps": 2024, "status": "keep", "desc": "E1 conditioned-init arm E1_condinit_s48_ci1", "phase": "block24", "milestone": "", "ts_start": "", "ts_end": "2026-07-31T02:08:32Z", "ts_end_epoch": 1785463712.833937, "commit": "block24-E1-condinit-null"}
{"exp_num": 525, "exp": "E1_condinit_s49_ci0", "val_bpb": 0.932207, "vram_gb": 55.0, "steps": 2025, "status": "keep", "desc": "E1 conditioned-init arm E1_condinit_s49_ci0", "phase": "block24", "milestone": "", "ts_start": "", "ts_end": "2026-07-31T02:08:32Z", "ts_end_epoch": 1785463712.833937, "commit": "block24-E1-condinit-null"}
{"exp_num": 526, "exp": "E1_condinit_s49_ci1", "val_bpb": 0.931669, "vram_gb": 55.0, "steps": 2027, "status": "keep", "desc": "E1 conditioned-init arm E1_condinit_s49_ci1", "phase": "block24", "milestone": "", "ts_start": "", "ts_end": "2026-07-31T02:08:32Z", "ts_end_epoch": 1785463712.833937, "commit": "block24-E1-condinit-null"}
{"exp_num": 527, "exp": "E1_condinit_s50_ci0", "val_bpb": 0.93051, "vram_gb": 55.0, "steps": 2028, "status": "keep", "desc": "E1 conditioned-init arm E1_condinit_s50_ci0", "phase": "block24", "milestone": "", "ts_start": "", "ts_end": "2026-07-31T02:08:32Z", "ts_end_epoch": 1785463712.833937, "commit": "block24-E1-condinit-null"}
{"exp_num": 528, "exp": "E1_condinit_s50_ci1", "val_bpb": 0.931093, "vram_gb": 55.0, "steps": 2027, "status": "keep", "desc": "E1 conditioned-init arm E1_condinit_s50_ci1", "phase": "block24", "milestone": "", "ts_start": "", "ts_end": "2026-07-31T02:08:32Z", "ts_end_epoch": 1785463712.833937, "commit": "block24-E1-condinit-null"}
{"exp_num": 529, "exp": "E1_condinit_s51_ci0", "val_bpb": 0.931006, "vram_gb": 55.0, "steps": 2028, "status": "keep", "desc": "E1 conditioned-init arm E1_condinit_s51_ci0", "phase": "block24", "milestone": "", "ts_start": "", "ts_end": "2026-07-31T02:08:32Z", "ts_end_epoch": 1785463712.833937, "commit": "block24-E1-condinit-null"}
{"exp_num": 530, "exp": "E1_condinit_s51_ci1", "val_bpb": 0.930573, "vram_gb": 55.0, "steps": 2027, "status": "keep", "desc": "E1 CONDITIONED ATTENTION INIT = NULL. Semi-orthogonal per-head Q/K + rectangular-identity V (clm_conditioned_init_tinystories_472m, ppl 2.39->2.20 at 472M, scope adequate). MECHANISM VERIFIED AT STEP 0 before any outcome run: per-head Q/K rows orthonormal to 1.3e-6, V exact rectangular identity, QK logit-map condition number 3.4 -> 1.0. So the intervention did what the claim describes; it simply did not translate into val_bpb here. Paired n=10 launched; 4 pairs QUARANTINED on the step-count/MFU signature (s42 both arms ~9% MFU; s43 ctrl 9.2% vs treat 19.6% -- asymmetric, the worst case; s46 treat 15.9%; s47 ctrl 1817 steps). Clean n=6: RAW mean -0.000147 (sd 0.000829, 4/6 neg, t=-0.43); after the token-law control variate INTRINSIC mean -0.000157 (sd 0.000800, 3/6 neg, t=-0.48). That is 7% of the 0.002396 gate with inconsistent sign. NOT ADOPTED. Zero step-time cost, so this is a clean intrinsic null, not a throughput trade. NOTE ON SCOPE: the source claim is 472M/TinyStories; ours is ~94M dense (really ~1.7B incl. n-gram tables) at 300s/~2 epochs. The most likely reading is that conditioning matters at 472M/longer horizons and is already adequate at our scale/duration -- consistent with this campaign's repeated finding that intrinsic effects here live at ~1e-3.", "phase": "block24", "milestone": "", "ts_start": "", "ts_end": "2026-07-31T02:08:32Z", "ts_end_epoch": 1785463712.833937, "commit": "block24-E1-condinit-null"}
{"exp_num": 531, "exp": "E2_periln_s42_pl0", "val_bpb": 0.931382, "vram_gb": 55.0, "steps": 2016, "status": "keep", "desc": "E2 Peri-LN arm E2_periln_s42_pl0", "phase": "block25", "milestone": "", "ts_start": "", "ts_end": "2026-07-31T02:40:07Z", "ts_end_epoch": 1785465607.225229, "commit": "block25-E2-periln-null"}
{"exp_num": 532, "exp": "E2_periln_s42_pl1", "val_bpb": 0.930929, "vram_gb": 55.0, "steps": 2018, "status": "keep", "desc": "E2 Peri-LN arm E2_periln_s42_pl1", "phase": "block25", "milestone": "", "ts_start": "", "ts_end": "2026-07-31T02:40:07Z", "ts_end_epoch": 1785465607.225229, "commit": "block25-E2-periln-null"}
{"exp_num": 533, "exp": "E2_periln_s43_pl0", "val_bpb": 0.935034, "vram_gb": 55.0, "steps": 2001, "status": "keep", "desc": "E2 Peri-LN arm E2_periln_s43_pl0", "phase": "block25", "milestone": "", "ts_start": "", "ts_end": "2026-07-31T02:40:07Z", "ts_end_epoch": 1785465607.225229, "commit": "block25-E2-periln-null"}
{"exp_num": 534, "exp": "E2_periln_s43_pl1", "val_bpb": 0.933285, "vram_gb": 55.0, "steps": 2010, "status": "keep", "desc": "E2 Peri-LN arm E2_periln_s43_pl1", "phase": "block25", "milestone": "", "ts_start": "", "ts_end": "2026-07-31T02:40:07Z", "ts_end_epoch": 1785465607.225229, "commit": "block25-E2-periln-null"}
{"exp_num": 535, "exp": "E2_periln_s44_pl0", "val_bpb": 0.934035, "vram_gb": 55.0, "steps": 1961, "status": "keep", "desc": "E2 Peri-LN arm E2_periln_s44_pl0", "phase": "block25", "milestone": "", "ts_start": "", "ts_end": "2026-07-31T02:40:07Z", "ts_end_epoch": 1785465607.225229, "commit": "block25-E2-periln-null"}
{"exp_num": 536, "exp": "E2_periln_s44_pl1", "val_bpb": 0.932151, "vram_gb": 55.0, "steps": 1978, "status": "keep", "desc": "E2 Peri-LN arm E2_periln_s44_pl1", "phase": "block25", "milestone": "", "ts_start": "", "ts_end": "2026-07-31T02:40:07Z", "ts_end_epoch": 1785465607.225229, "commit": "block25-E2-periln-null"}
{"exp_num": 537, "exp": "E2_periln_s45_pl0", "val_bpb": 0.932871, "vram_gb": 55.0, "steps": 2021, "status": "keep", "desc": "E2 Peri-LN arm E2_periln_s45_pl0", "phase": "block25", "milestone": "", "ts_start": "", "ts_end": "2026-07-31T02:40:07Z", "ts_end_epoch": 1785465607.225229, "commit": "block25-E2-periln-null"}
{"exp_num": 538, "exp": "E2_periln_s45_pl1", "val_bpb": 0.934163, "vram_gb": 55.0, "steps": 1983, "status": "keep", "desc": "E2 Peri-LN arm E2_periln_s45_pl1", "phase": "block25", "milestone": "", "ts_start": "", "ts_end": "2026-07-31T02:40:07Z", "ts_end_epoch": 1785465607.225229, "commit": "block25-E2-periln-null"}
{"exp_num": 539, "exp": "E2_periln_s46_pl0", "val_bpb": 0.93118, "vram_gb": 55.0, "steps": 2031, "status": "keep", "desc": "E2 Peri-LN arm E2_periln_s46_pl0", "phase": "block25", "milestone": "", "ts_start": "", "ts_end": "2026-07-31T02:40:07Z", "ts_end_epoch": 1785465607.225229, "commit": "block25-E2-periln-null"}
{"exp_num": 540, "exp": "E2_periln_s46_pl1", "val_bpb": 0.933888, "vram_gb": 55.0, "steps": 2003, "status": "keep", "desc": "E2 Peri-LN arm E2_periln_s46_pl1", "phase": "block25", "milestone": "", "ts_start": "", "ts_end": "2026-07-31T02:40:07Z", "ts_end_epoch": 1785465607.225229, "commit": "block25-E2-periln-null"}
{"exp_num": 541, "exp": "E2_periln_s47_pl0", "val_bpb": 0.931048, "vram_gb": 55.0, "steps": 2025, "status": "keep", "desc": "E2 Peri-LN arm E2_periln_s47_pl0", "phase": "block25", "milestone": "", "ts_start": "", "ts_end": "2026-07-31T02:40:07Z", "ts_end_epoch": 1785465607.225229, "commit": "block25-E2-periln-null"}
{"exp_num": 542, "exp": "E2_periln_s47_pl1", "val_bpb": 0.934009, "vram_gb": 55.0, "steps": 1986, "status": "keep", "desc": "E2 Peri-LN arm E2_periln_s47_pl1", "phase": "block25", "milestone": "", "ts_start": "", "ts_end": "2026-07-31T02:40:07Z", "ts_end_epoch": 1785465607.225229, "commit": "block25-E2-periln-null"}
{"exp_num": 543, "exp": "E2_periln_s48_pl0", "val_bpb": 0.93221, "vram_gb": 55.0, "steps": 1989, "status": "quarantine", "desc": "E2 Peri-LN arm E2_periln_s48_pl0", "phase": "block25", "milestone": "", "ts_start": "", "ts_end": "2026-07-31T02:40:07Z", "ts_end_epoch": 1785465607.225229, "commit": "block25-E2-periln-null"}
{"exp_num": 544, "exp": "E2_periln_s48_pl1", "val_bpb": 0.934678, "vram_gb": 55.0, "steps": 1949, "status": "quarantine", "desc": "E2 Peri-LN arm E2_periln_s48_pl1", "phase": "block25", "milestone": "", "ts_start": "", "ts_end": "2026-07-31T02:40:07Z", "ts_end_epoch": 1785465607.225229, "commit": "block25-E2-periln-null"}
{"exp_num": 545, "exp": "E2_periln_s49_pl0", "val_bpb": 0.933376, "vram_gb": 55.0, "steps": 1992, "status": "keep", "desc": "E2 Peri-LN arm E2_periln_s49_pl0", "phase": "block25", "milestone": "", "ts_start": "", "ts_end": "2026-07-31T02:40:07Z", "ts_end_epoch": 1785465607.225229, "commit": "block25-E2-periln-null"}
{"exp_num": 546, "exp": "E2_periln_s49_pl1", "val_bpb": 0.931845, "vram_gb": 55.0, "steps": 2011, "status": "keep", "desc": "E2 Peri-LN arm E2_periln_s49_pl1", "phase": "block25", "milestone": "", "ts_start": "", "ts_end": "2026-07-31T02:40:07Z", "ts_end_epoch": 1785465607.225229, "commit": "block25-E2-periln-null"}
{"exp_num": 547, "exp": "E2_periln_s50_pl0", "val_bpb": 0.930897, "vram_gb": 55.0, "steps": 2018, "status": "keep", "desc": "E2 Peri-LN arm E2_periln_s50_pl0", "phase": "block25", "milestone": "", "ts_start": "", "ts_end": "2026-07-31T02:40:07Z", "ts_end_epoch": 1785465607.225229, "commit": "block25-E2-periln-null"}
{"exp_num": 548, "exp": "E2_periln_s50_pl1", "val_bpb": 0.93033, "vram_gb": 55.0, "steps": 2020, "status": "keep", "desc": "E2 Peri-LN arm E2_periln_s50_pl1", "phase": "block25", "milestone": "", "ts_start": "", "ts_end": "2026-07-31T02:40:07Z", "ts_end_epoch": 1785465607.225229, "commit": "block25-E2-periln-null"}
{"exp_num": 549, "exp": "E2_periln_s51_pl0", "val_bpb": 0.93154, "vram_gb": 55.0, "steps": 2008, "status": "keep", "desc": "E2 Peri-LN arm E2_periln_s51_pl0", "phase": "block25", "milestone": "", "ts_start": "", "ts_end": "2026-07-31T02:40:07Z", "ts_end_epoch": 1785465607.225229, "commit": "block25-E2-periln-null"}
{"exp_num": 550, "exp": "E2_periln_s51_pl1", "val_bpb": 0.931476, "vram_gb": 55.0, "steps": 2012, "status": "keep", "desc": "E2 PERI-LN ATTENTION POST-c_proj ARM = NULL. Adds norm() to the attention sublayer OUTPUT, the arm our own literature assessment localised as missing (our MLP path already does x + norm(mlp(norm(x))); attention did only x + attn(norm(x))). Source clm_peri_ln_loss_400m_30b: 3.43->3.34 at 400M/30B, scope adequate. COST MEASURED FIRST (not assumed): +0.302 ms = +0.20% of step, break-even 0.00012 = 5% of gate -- nearly free because inductor fuses the RMSNorm into the adjacent residual add. Paired n=10 on an UNCONTENDED box, 8 arms/wave one-per-GPU, arms interleaved across GPU indices. 1 pair quarantined (s48: treat 1949 steps, MFU 18.75, both at the screen boundary). Clean n=9: RAW +0.000079 (sd 0.001844, 6/9 neg, t=+0.13); INTRINSIC -0.000092 (sd 0.001229, 5/9 neg, t=-0.23) after the token-law control variate. 4% of the gate. NOT ADOPTED. TRAJECTORY WORTH RECORDING: n=4 gave -0.000772 (3/4 neg, t=-1.96, 32% of gate) and looked like the campaign's best signal; n=7 -0.000054; n=9 -0.000092. The early promise was SMALL-N OPTIMISM and did not survive more seeds. Refusing to call it at n=4 was the correct decision and is why this is recorded as a null rather than a retracted adoption.", "phase": "block25", "milestone": "", "ts_start": "", "ts_end": "2026-07-31T02:40:07Z", "ts_end_epoch": 1785465607.225229, "commit": "block25-E2-periln-null"}
{"exp_num": 551, "exp": "E3_gpas_s42_g0", "val_bpb": 0.930981, "vram_gb": 55.0, "steps": 2021, "status": "keep", "desc": "E3 GPAS arm E3_gpas_s42_g0", "phase": "block26", "milestone": "", "ts_start": "", "ts_end": "2026-07-31T04:15:31Z", "ts_end_epoch": 1785471331.3775702, "commit": "block26-E3-gpas-negative"}
{"exp_num": 552, "exp": "E3_gpas_s42_g1", "val_bpb": 0.931853, "vram_gb": 55.0, "steps": 2015, "status": "keep", "desc": "E3 GPAS arm E3_gpas_s42_g1", "phase": "block26", "milestone": "", "ts_start": "", "ts_end": "2026-07-31T04:15:31Z", "ts_end_epoch": 1785471331.3775702, "commit": "block26-E3-gpas-negative"}
{"exp_num": 553, "exp": "E3_gpas_s43_g0", "val_bpb": 0.934516, "vram_gb": 55.0, "steps": 2006, "status": "keep", "desc": "E3 GPAS arm E3_gpas_s43_g0", "phase": "block26", "milestone": "", "ts_start": "", "ts_end": "2026-07-31T04:15:31Z", "ts_end_epoch": 1785471331.3775702, "commit": "block26-E3-gpas-negative"}
{"exp_num": 554, "exp": "E3_gpas_s43_g1", "val_bpb": 0.934676, "vram_gb": 55.0, "steps": 2008, "status": "keep", "desc": "E3 GPAS arm E3_gpas_s43_g1", "phase": "block26", "milestone": "", "ts_start": "", "ts_end": "2026-07-31T04:15:31Z", "ts_end_epoch": 1785471331.3775702, "commit": "block26-E3-gpas-negative"}
{"exp_num": 555, "exp": "E3_gpas_s44_g0", "val_bpb": 0.934131, "vram_gb": 55.0, "steps": 1964, "status": "keep", "desc": "E3 GPAS arm E3_gpas_s44_g0", "phase": "block26", "milestone": "", "ts_start": "", "ts_end": "2026-07-31T04:15:31Z", "ts_end_epoch": 1785471331.3775702, "commit": "block26-E3-gpas-negative"}
{"exp_num": 556, "exp": "E3_gpas_s44_g1", "val_bpb": 0.934352, "vram_gb": 55.0, "steps": 2008, "status": "keep", "desc": "E3 GPAS arm E3_gpas_s44_g1", "phase": "block26", "milestone": "", "ts_start": "", "ts_end": "2026-07-31T04:15:31Z", "ts_end_epoch": 1785471331.3775702, "commit": "block26-E3-gpas-negative"}
{"exp_num": 557, "exp": "E3_gpas_s45_g0", "val_bpb": 0.932144, "vram_gb": 55.0, "steps": 2032, "status": "keep", "desc": "E3 GPAS arm E3_gpas_s45_g0", "phase": "block26", "milestone": "", "ts_start": "", "ts_end": "2026-07-31T04:15:31Z", "ts_end_epoch": 1785471331.3775702, "commit": "block26-E3-gpas-negative"}
{"exp_num": 558, "exp": "E3_gpas_s45_g1", "val_bpb": 0.933723, "vram_gb": 55.0, "steps": 2005, "status": "keep", "desc": "E3 GPAS arm E3_gpas_s45_g1", "phase": "block26", "milestone": "", "ts_start": "", "ts_end": "2026-07-31T04:15:31Z", "ts_end_epoch": 1785471331.3775702, "commit": "block26-E3-gpas-negative"}
{"exp_num": 559, "exp": "E3_gpas_s46_g0", "val_bpb": 0.93132, "vram_gb": 55.0, "steps": 2025, "status": "keep", "desc": "E3 GPAS arm E3_gpas_s46_g0", "phase": "block26", "milestone": "", "ts_start": "", "ts_end": "2026-07-31T04:15:31Z", "ts_end_epoch": 1785471331.3775702, "commit": "block26-E3-gpas-negative"}
{"exp_num": 560, "exp": "E3_gpas_s46_g1", "val_bpb": 0.936812, "vram_gb": 55.0, "steps": 1989, "status": "keep", "desc": "E3 GPAS arm E3_gpas_s46_g1", "phase": "block26", "milestone": "", "ts_start": "", "ts_end": "2026-07-31T04:15:31Z", "ts_end_epoch": 1785471331.3775702, "commit": "block26-E3-gpas-negative"}
{"exp_num": 561, "exp": "E3_gpas_s47_g0", "val_bpb": 0.930937, "vram_gb": 55.0, "steps": 2022, "status": "keep", "desc": "E3 GPAS arm E3_gpas_s47_g0", "phase": "block26", "milestone": "", "ts_start": "", "ts_end": "2026-07-31T04:15:31Z", "ts_end_epoch": 1785471331.3775702, "commit": "block26-E3-gpas-negative"}
{"exp_num": 562, "exp": "E3_gpas_s47_g1", "val_bpb": 0.970277, "vram_gb": 55.0, "steps": 1188, "status": "quarantine", "desc": "E3 GPAS arm E3_gpas_s47_g1", "phase": "block26", "milestone": "", "ts_start": "", "ts_end": "2026-07-31T04:15:31Z", "ts_end_epoch": 1785471331.3775702, "commit": "block26-E3-gpas-negative"}
{"exp_num": 563, "exp": "E3_gpas_s48_g0", "val_bpb": 0.931036, "vram_gb": 55.0, "steps": 2019, "status": "keep", "desc": "E3 GPAS arm E3_gpas_s48_g0", "phase": "block26", "milestone": "", "ts_start": "", "ts_end": "2026-07-31T04:15:31Z", "ts_end_epoch": 1785471331.3775702, "commit": "block26-E3-gpas-negative"}
{"exp_num": 564, "exp": "E3_gpas_s48_g1", "val_bpb": 0.932802, "vram_gb": 55.0, "steps": 2018, "status": "keep", "desc": "E3 GPAS arm E3_gpas_s48_g1", "phase": "block26", "milestone": "", "ts_start": "", "ts_end": "2026-07-31T04:15:31Z", "ts_end_epoch": 1785471331.3775702, "commit": "block26-E3-gpas-negative"}
{"exp_num": 565, "exp": "E3_gpas_s49_g0", "val_bpb": 0.932881, "vram_gb": 55.0, "steps": 2003, "status": "keep", "desc": "E3 GPAS arm E3_gpas_s49_g0", "phase": "block26", "milestone": "", "ts_start": "", "ts_end": "2026-07-31T04:15:31Z", "ts_end_epoch": 1785471331.3775702, "commit": "block26-E3-gpas-negative"}
{"exp_num": 566, "exp": "E3_gpas_s49_g1", "val_bpb": 0.932519, "vram_gb": 55.0, "steps": 2010, "status": "keep", "desc": "E3 GPAS arm E3_gpas_s49_g1", "phase": "block26", "milestone": "", "ts_start": "", "ts_end": "2026-07-31T04:15:31Z", "ts_end_epoch": 1785471331.3775702, "commit": "block26-E3-gpas-negative"}
{"exp_num": 567, "exp": "E3_gpas_s50_g0", "val_bpb": 0.973122, "vram_gb": 55.0, "steps": 1131, "status": "quarantine", "desc": "E3 GPAS arm E3_gpas_s50_g0", "phase": "block26", "milestone": "", "ts_start": "", "ts_end": "2026-07-31T04:15:31Z", "ts_end_epoch": 1785471331.3775702, "commit": "block26-E3-gpas-negative"}
{"exp_num": 568, "exp": "E3_gpas_s50_g1", "val_bpb": 0.933535, "vram_gb": 55.0, "steps": 2008, "status": "keep", "desc": "E3 GPAS arm E3_gpas_s50_g1", "phase": "block26", "milestone": "", "ts_start": "", "ts_end": "2026-07-31T04:15:31Z", "ts_end_epoch": 1785471331.3775702, "commit": "block26-E3-gpas-negative"}
{"exp_num": 569, "exp": "E3_gpas_s51_g0", "val_bpb": 0.931046, "vram_gb": 55.0, "steps": 2030, "status": "keep", "desc": "E3 GPAS arm E3_gpas_s51_g0", "phase": "block26", "milestone": "", "ts_start": "", "ts_end": "2026-07-31T04:15:31Z", "ts_end_epoch": 1785471331.3775702, "commit": "block26-E3-gpas-negative"}
