{"commit": "block44-E24-dilution-refuted", "desc": "E24 depth 6 NGRAM_TABLE_MULT=64 refinements=both; step 91.9 ms, duty 1.000; dense share 3.2%, dilution 30.9x; 12/12 clean", "exp": "E24_d6_mult64_both_s43", "exp_num": 784, "milestone": "", "phase": "block44", "status": "keep", "steps": 3263, "ts_end": "2026-08-01T02:00:00Z", "ts_end_epoch": 1785549600.0, "ts_start": "", "val_bpb": 0.928992, "vram_gb": 44.0}
{"commit": "block44-E24-dilution-refuted", "desc": "E24 depth 6 NGRAM_TABLE_MULT=4 refinements=base; step 82.6 ms, duty 0.996; dense share 34.9%, dilution 2.9x; 12/12 clean", "exp": "E24_d6_mult4_base_s43", "exp_num": 785, "milestone": "", "phase": "block44", "status": "keep", "steps": 3619, "ts_end": "2026-08-01T02:00:00Z", "ts_end_epoch": 1785549600.0, "ts_start": "", "val_bpb": 0.942796, "vram_gb": 36.0}
{"commit": "block44-E24-dilution-refuted", "desc": "E24 depth 6 NGRAM_TABLE_MULT=4 refinements=both; step 84.3 ms, duty 0.997; dense share 34.9%, dilution 2.9x; 12/12 clean", "exp": "E24_d6_mult4_both_s43", "exp_num": 786, "milestone": "", "phase": "block44", "status": "keep", "steps": 3549, "ts_end": "2026-08-01T02:00:00Z", "ts_end_epoch": 1785549600.0, "ts_start": "", "val_bpb": 0.943417, "vram_gb": 36.0}
{"commit": "block44-E24-dilution-refuted", "desc": "E24 depth 6 NGRAM_TABLE_MULT=64 refinements=base; step 92.6 ms, duty 1.001; dense share 3.2%, dilution 30.9x; 12/12 clean", "exp": "E24_d6_mult64_base_s44", "exp_num": 787, "milestone": "", "phase": "block44", "status": "keep", "steps": 3242, "ts_end": "2026-08-01T02:00:00Z", "ts_end_epoch": 1785549600.0, "ts_start": "", "val_bpb": 0.929303, "vram_gb": 44.0}
{"commit": "block44-E24-dilution-refuted", "desc": "E24 depth 6 NGRAM_TABLE_MULT=64 refinements=both; step 92.2 ms, duty 1.000; dense share 3.2%, dilution 30.9x; 12/12 clean", "exp": "E24_d6_mult64_both_s44", "exp_num": 788, "milestone": "", "phase": "block44", "status": "keep", "steps": 3253, "ts_end": "2026-08-01T02:00:00Z", "ts_end_epoch": 1785549600.0, "ts_start": "", "val_bpb": 0.929101, "vram_gb": 44.0}
{"commit": "block44-E24-dilution-refuted", "desc": "E24 depth 6 NGRAM_TABLE_MULT=4 refinements=base; step 82.8 ms, duty 1.000; dense share 34.9%, dilution 2.9x; 12/12 clean", "exp": "E24_d6_mult4_base_s44", "exp_num": 789, "milestone": "", "phase": "block44", "status": "keep", "steps": 3625, "ts_end": "2026-08-01T02:00:00Z", "ts_end_epoch": 1785549600.0, "ts_start": "", "val_bpb": 0.942777, "vram_gb": 36.0}
{"commit": "block44-E24-dilution-refuted", "desc": "E24 depth 6 NGRAM_TABLE_MULT=4 refinements=both; step 83.5 ms, duty 1.001; dense share 34.9%, dilution 2.9x; 12/12 clean", "exp": "E24_d6_mult4_both_s44", "exp_num": 790, "milestone": "", "phase": "block44", "status": "keep", "steps": 3598, "ts_end": "2026-08-01T02:00:00Z", "ts_end_epoch": 1785549600.0, "ts_start": "", "val_bpb": 0.942722, "vram_gb": 36.0}
{"commit": "block45-E25-window-pattern-closed", "desc": "E25 depth 6 WINDOW_PATTERN=TTTL; median step 91.3 ms, duty 1.000; 12/12 clean", "exp": "E25_d6_TTTL_s42", "exp_num": 791, "milestone": "", "phase": "block45", "status": "keep", "steps": 3287, "ts_end": "2026-08-01T03:00:00Z", "ts_end_epoch": 1785553200.0, "ts_start": "", "val_bpb": 0.929306, "vram_gb": 44.0}
{"commit": "block45-E25-window-pattern-closed", "desc": "E25 depth 6 WINDOW_PATTERN=TTTT; median step 91.1 ms, duty 0.998; 12/12 clean", "exp": "E25_d6_TTTT_s42", "exp_num": 792, "milestone": "", "phase": "block45", "status": "keep", "steps": 3288, "ts_end": "2026-08-01T03:00:00Z", "ts_end_epoch": 1785553200.0, "ts_start": "", "val_bpb": 0.931203, "vram_gb": 44.0}
{"commit": "block45-E25-window-pattern-closed", "desc": "E25 depth 6 WINDOW_PATTERN=TTLL; median step 92.8 ms, duty 1.001; 12/12 clean", "exp": "E25_d6_TTLL_s42", "exp_num": 793, "milestone": "", "phase": "block45", "status": "keep", "steps": 3235, "ts_end": "2026-08-01T03:00:00Z", "ts_end_epoch": 1785553200.0, "ts_start": "", "val_bpb": 0.930036, "vram_gb": 44.0}
{"commit": "block45-E25-window-pattern-closed", "desc": "E25 depth 6 WINDOW_PATTERN=TTTL; median step 92.5 ms, duty 1.001; 12/12 clean", "exp": "E25_d6_TTTL_s43", "exp_num": 794, "milestone": "", "phase": "block45", "status": "keep", "steps": 3247, "ts_end": "2026-08-01T03:00:00Z", "ts_end_epoch": 1785553200.0, "ts_start": "", "val_bpb": 0.929504, "vram_gb": 44.0}
{"commit": "block45-E25-window-pattern-closed", "desc": "E25 depth 6 WINDOW_PATTERN=TTTT; median step 91.2 ms, duty 0.999; 12/12 clean", "exp": "E25_d6_TTTT_s43", "exp_num": 795, "milestone": "", "phase": "block45", "status": "keep", "steps": 3285, "ts_end": "2026-08-01T03:00:00Z", "ts_end_epoch": 1785553200.0, "ts_start": "", "val_bpb": 0.930394, "vram_gb": 44.0}
{"commit": "block45-E25-window-pattern-closed", "desc": "E25 depth 6 WINDOW_PATTERN=TTLL; median step 91.8 ms, duty 1.001; 12/12 clean", "exp": "E25_d6_TTLL_s43", "exp_num": 796, "milestone": "", "phase": "block45", "status": "keep", "steps": 3271, "ts_end": "2026-08-01T03:00:00Z", "ts_end_epoch": 1785553200.0, "ts_start": "", "val_bpb": 0.928945, "vram_gb": 44.0}
{"commit": "block45-E25-window-pattern-closed", "desc": "E25 depth 6 WINDOW_PATTERN=TTTL; median step 91.4 ms, duty 0.999; 12/12 clean", "exp": "E25_d6_TTTL_s44", "exp_num": 797, "milestone": "", "phase": "block45", "status": "keep", "steps": 3280, "ts_end": "2026-08-01T03:00:00Z", "ts_end_epoch": 1785553200.0, "ts_start": "", "val_bpb": 0.92855, "vram_gb": 44.0}
{"commit": "block45-E25-window-pattern-closed", "desc": "E25 depth 6 WINDOW_PATTERN=TTTT; median step 92.1 ms, duty 1.000; 12/12 clean", "exp": "E25_d6_TTTT_s44", "exp_num": 798, "milestone": "", "phase": "block45", "status": "keep", "steps": 3258, "ts_end": "2026-08-01T03:00:00Z", "ts_end_epoch": 1785553200.0, "ts_start": "", "val_bpb": 0.930905, "vram_gb": 44.0}
{"commit": "block45-E25-window-pattern-closed", "desc": "E25 depth 6 WINDOW_PATTERN=TTLL; median step 93.1 ms, duty 1.001; 12/12 clean", "exp": "E25_d6_TTLL_s44", "exp_num": 799, "milestone": "", "phase": "block45", "status": "keep", "steps": 3227, "ts_end": "2026-08-01T03:00:00Z", "ts_end_epoch": 1785553200.0, "ts_start": "", "val_bpb": 0.929525, "vram_gb": 44.0}
{"commit": "block45-E25-window-pattern-closed", "desc": "E25 depth 6 WINDOW_PATTERN=TTTL; median step 91.7 ms, duty 1.000; 12/12 clean", "exp": "E25_d6_TTTL_s45", "exp_num": 800, "milestone": "", "phase": "block45", "status": "keep", "steps": 3271, "ts_end": "2026-08-01T03:00:00Z", "ts_end_epoch": 1785553200.0, "ts_start": "", "val_bpb": 0.929827, "vram_gb": 44.0}
{"commit": "block45-E25-window-pattern-closed", "desc": "E25 depth 6 WINDOW_PATTERN=TTTT; median step 91.5 ms, duty 1.003; 12/12 clean", "exp": "E25_d6_TTTT_s45", "exp_num": 801, "milestone": "", "phase": "block45", "status": "keep", "steps": 3287, "ts_end": "2026-08-01T03:00:00Z", "ts_end_epoch": 1785553200.0, "ts_start": "", "val_bpb": 0.931178, "vram_gb": 44.0}
{"commit": "block45-E25-window-pattern-closed", "desc": "E25 depth 6 WINDOW_PATTERN=TTLL; median step 92.0 ms, duty 1.002; 12/12 clean", "exp": "E25_d6_TTLL_s45", "exp_num": 802, "milestone": "", "phase": "block45", "status": "keep", "steps": 3267, "ts_end": "2026-08-01T03:00:00Z", "ts_end_epoch": 1785553200.0, "ts_start": "", "val_bpb": 0.930787, "vram_gb": 44.0}
{"commit": "block46-E26-muon-lr-monotone", "desc": "E26 depth 6 MATRIX_LR=0.03; median step 91.5 ms, duty 0.999; 12/12 clean", "exp": "E26_d6_lr0.03_s42", "exp_num": 803, "milestone": "", "phase": "block46", "status": "keep", "steps": 3277, "ts_end": "2026-08-01T04:00:00Z", "ts_end_epoch": 1785556800.0, "ts_start": "", "val_bpb": 0.929602, "vram_gb": 44.0}
{"commit": "block46-E26-muon-lr-monotone", "desc": "E26 depth 6 MATRIX_LR=0.04; median step 91.5 ms, duty 1.000; 12/12 clean", "exp": "E26_d6_lr0.04_s42", "exp_num": 804, "milestone": "", "phase": "block46", "status": "keep", "steps": 3279, "ts_end": "2026-08-01T04:00:00Z", "ts_end_epoch": 1785556800.0, "ts_start": "", "val_bpb": 0.929742, "vram_gb": 44.0}
{"commit": "block46-E26-muon-lr-monotone", "desc": "E26 depth 6 MATRIX_LR=0.05; median step 92.4 ms, duty 1.000; 12/12 clean", "exp": "E26_d6_lr0.05_s42", "exp_num": 805, "milestone": "", "phase": "block46", "status": "keep", "steps": 3248, "ts_end": "2026-08-01T04:00:00Z", "ts_end_epoch": 1785556800.0, "ts_start": "", "val_bpb": 0.930922, "vram_gb": 44.0}
{"commit": "block46-E26-muon-lr-monotone", "desc": "E26 depth 6 MATRIX_LR=0.06; median step 92.9 ms, duty 1.001; 12/12 clean", "exp": "E26_d6_lr0.06_s42", "exp_num": 806, "milestone": "", "phase": "block46", "status": "keep", "steps": 3234, "ts_end": "2026-08-01T04:00:00Z", "ts_end_epoch": 1785556800.0, "ts_start": "", "val_bpb": 0.932314, "vram_gb": 44.0}
{"commit": "block46-E26-muon-lr-monotone", "desc": "E26 depth 6 MATRIX_LR=0.03; median step 91.4 ms, duty 0.999; 12/12 clean", "exp": "E26_d6_lr0.03_s43", "exp_num": 807, "milestone": "", "phase": "block46", "status": "keep", "steps": 3280, "ts_end": "2026-08-01T04:00:00Z", "ts_end_epoch": 1785556800.0, "ts_start": "", "val_bpb": 0.928121, "vram_gb": 44.0}
{"commit": "block46-E26-muon-lr-monotone", "desc": "E26 depth 6 MATRIX_LR=0.04; median step 91.8 ms, duty 1.001; 12/12 clean", "exp": "E26_d6_lr0.04_s43", "exp_num": 808, "milestone": "", "phase": "block46", "status": "keep", "steps": 3270, "ts_end": "2026-08-01T04:00:00Z", "ts_end_epoch": 1785556800.0, "ts_start": "", "val_bpb": 0.929124, "vram_gb": 44.0}
{"commit": "block46-E26-muon-lr-monotone", "desc": "E26 depth 6 MATRIX_LR=0.05; median step 91.5 ms, duty 1.001; 12/12 clean", "exp": "E26_d6_lr0.05_s43", "exp_num": 809, "milestone": "", "phase": "block46", "status": "keep", "steps": 3281, "ts_end": "2026-08-01T04:00:00Z", "ts_end_epoch": 1785556800.0, "ts_start": "", "val_bpb": 0.929681, "vram_gb": 44.0}
{"commit": "block46-E26-muon-lr-monotone", "desc": "E26 depth 6 MATRIX_LR=0.06; median step 92.3 ms, duty 1.001; 12/12 clean", "exp": "E26_d6_lr0.06_s43", "exp_num": 810, "milestone": "", "phase": "block46", "status": "keep", "steps": 3253, "ts_end": "2026-08-01T04:00:00Z", "ts_end_epoch": 1785556800.0, "ts_start": "", "val_bpb": 0.93145, "vram_gb": 44.0}
{"commit": "block46-E26-muon-lr-monotone", "desc": "E26 depth 6 MATRIX_LR=0.03; median step 91.8 ms, duty 1.001; 12/12 clean", "exp": "E26_d6_lr0.03_s44", "exp_num": 811, "milestone": "", "phase": "block46", "status": "keep", "steps": 3271, "ts_end": "2026-08-01T04:00:00Z", "ts_end_epoch": 1785556800.0, "ts_start": "", "val_bpb": 0.929446, "vram_gb": 44.0}
{"commit": "block46-E26-muon-lr-monotone", "desc": "E26 depth 6 MATRIX_LR=0.04; median step 92.9 ms, duty 1.001; 12/12 clean", "exp": "E26_d6_lr0.04_s44", "exp_num": 812, "milestone": "", "phase": "block46", "status": "keep", "steps": 3234, "ts_end": "2026-08-01T04:00:00Z", "ts_end_epoch": 1785556800.0, "ts_start": "", "val_bpb": 0.929439, "vram_gb": 44.0}
{"commit": "block46-E26-muon-lr-monotone", "desc": "E26 depth 6 MATRIX_LR=0.05; median step 91.7 ms, duty 1.002; 12/12 clean", "exp": "E26_d6_lr0.05_s44", "exp_num": 813, "milestone": "", "phase": "block46", "status": "keep", "steps": 3278, "ts_end": "2026-08-01T04:00:00Z", "ts_end_epoch": 1785556800.0, "ts_start": "", "val_bpb": 0.930118, "vram_gb": 44.0}
{"commit": "block46-E26-muon-lr-monotone", "desc": "E26 depth 6 MATRIX_LR=0.06; median step 91.6 ms, duty 1.001; 12/12 clean", "exp": "E26_d6_lr0.06_s44", "exp_num": 814, "milestone": "", "phase": "block46", "status": "keep", "steps": 3277, "ts_end": "2026-08-01T04:00:00Z", "ts_end_epoch": 1785556800.0, "ts_start": "", "val_bpb": 0.93103, "vram_gb": 44.0}
{"commit": "block47-E27-lr-basin-bracketed", "desc": "E27 depth 6 MATRIX_LR=0.02; median step 93.0 ms, duty 1.002; 16/16 clean", "exp": "E27_d6_lr0.02_s42", "exp_num": 815, "milestone": "", "phase": "block47", "status": "keep", "steps": 3233, "ts_end": "2026-08-01T05:00:00Z", "ts_end_epoch": 1785560400.0, "ts_start": "", "val_bpb": 0.930418, "vram_gb": 44.0}
{"commit": "block47-E27-lr-basin-bracketed", "desc": "E27 depth 6 MATRIX_LR=0.025; median step 92.4 ms, duty 1.000; 16/16 clean", "exp": "E27_d6_lr0.025_s42", "exp_num": 816, "milestone": "", "phase": "block47", "status": "keep", "steps": 3248, "ts_end": "2026-08-01T05:00:00Z", "ts_end_epoch": 1785560400.0, "ts_start": "", "val_bpb": 0.929875, "vram_gb": 44.0}
{"commit": "block47-E27-lr-basin-bracketed", "desc": "E27 depth 6 MATRIX_LR=0.03; median step 91.4 ms, duty 0.999; 16/16 clean", "exp": "E27_d6_lr0.03_s42", "exp_num": 817, "milestone": "", "phase": "block47", "status": "keep", "steps": 3280, "ts_end": "2026-08-01T05:00:00Z", "ts_end_epoch": 1785560400.0, "ts_start": "", "val_bpb": 0.92949, "vram_gb": 44.0}
{"commit": "block47-E27-lr-basin-bracketed", "desc": "E27 depth 6 MATRIX_LR=0.04; median step 91.5 ms, duty 1.001; 16/16 clean", "exp": "E27_d6_lr0.04_s42", "exp_num": 818, "milestone": "", "phase": "block47", "status": "keep", "steps": 3281, "ts_end": "2026-08-01T05:00:00Z", "ts_end_epoch": 1785560400.0, "ts_start": "", "val_bpb": 0.929584, "vram_gb": 44.0}
{"commit": "block47-E27-lr-basin-bracketed", "desc": "E27 depth 6 MATRIX_LR=0.02; median step 92.5 ms, duty 1.000; 16/16 clean", "exp": "E27_d6_lr0.02_s43", "exp_num": 819, "milestone": "", "phase": "block47", "status": "keep", "steps": 3243, "ts_end": "2026-08-01T05:00:00Z", "ts_end_epoch": 1785560400.0, "ts_start": "", "val_bpb": 0.929598, "vram_gb": 44.0}
{"commit": "block47-E27-lr-basin-bracketed", "desc": "E27 depth 6 MATRIX_LR=0.025; median step 91.6 ms, duty 1.000; 16/16 clean", "exp": "E27_d6_lr0.025_s43", "exp_num": 820, "milestone": "", "phase": "block47", "status": "keep", "steps": 3275, "ts_end": "2026-08-01T05:00:00Z", "ts_end_epoch": 1785560400.0, "ts_start": "", "val_bpb": 0.929438, "vram_gb": 44.0}
{"commit": "block47-E27-lr-basin-bracketed", "desc": "E27 depth 6 MATRIX_LR=0.03; median step 91.5 ms, duty 1.000; 16/16 clean", "exp": "E27_d6_lr0.03_s43", "exp_num": 821, "milestone": "", "phase": "block47", "status": "keep", "steps": 3280, "ts_end": "2026-08-01T05:00:00Z", "ts_end_epoch": 1785560400.0, "ts_start": "", "val_bpb": 0.928181, "vram_gb": 44.0}
{"commit": "block47-E27-lr-basin-bracketed", "desc": "E27 depth 6 MATRIX_LR=0.04; median step 91.7 ms, duty 1.000; 16/16 clean", "exp": "E27_d6_lr0.04_s43", "exp_num": 822, "milestone": "", "phase": "block47", "status": "keep", "steps": 3271, "ts_end": "2026-08-01T05:00:00Z", "ts_end_epoch": 1785560400.0, "ts_start": "", "val_bpb": 0.929091, "vram_gb": 44.0}
{"commit": "block47-E27-lr-basin-bracketed", "desc": "E27 depth 6 MATRIX_LR=0.02; median step 91.4 ms, duty 0.999; 16/16 clean", "exp": "E27_d6_lr0.02_s44", "exp_num": 823, "milestone": "", "phase": "block47", "status": "keep", "steps": 3279, "ts_end": "2026-08-01T05:00:00Z", "ts_end_epoch": 1785560400.0, "ts_start": "", "val_bpb": 0.929764, "vram_gb": 44.0}
{"commit": "block47-E27-lr-basin-bracketed", "desc": "E27 depth 6 MATRIX_LR=0.025; median step 91.5 ms, duty 1.000; 16/16 clean", "exp": "E27_d6_lr0.025_s44", "exp_num": 824, "milestone": "", "phase": "block47", "status": "keep", "steps": 3278, "ts_end": "2026-08-01T05:00:00Z", "ts_end_epoch": 1785560400.0, "ts_start": "", "val_bpb": 0.929264, "vram_gb": 44.0}
{"commit": "block47-E27-lr-basin-bracketed", "desc": "E27 depth 6 MATRIX_LR=0.03; median step 91.8 ms, duty 1.000; 16/16 clean", "exp": "E27_d6_lr0.03_s44", "exp_num": 825, "milestone": "", "phase": "block47", "status": "keep", "steps": 3269, "ts_end": "2026-08-01T05:00:00Z", "ts_end_epoch": 1785560400.0, "ts_start": "", "val_bpb": 0.929779, "vram_gb": 44.0}
{"commit": "block47-E27-lr-basin-bracketed", "desc": "E27 depth 6 MATRIX_LR=0.04; median step 92.9 ms, duty 1.001; 16/16 clean", "exp": "E27_d6_lr0.04_s44", "exp_num": 826, "milestone": "", "phase": "block47", "status": "keep", "steps": 3234, "ts_end": "2026-08-01T05:00:00Z", "ts_end_epoch": 1785560400.0, "ts_start": "", "val_bpb": 0.929317, "vram_gb": 44.0}
{"commit": "block47-E27-lr-basin-bracketed", "desc": "E27 depth 6 MATRIX_LR=0.02; median step 91.8 ms, duty 1.002; 16/16 clean", "exp": "E27_d6_lr0.02_s45", "exp_num": 827, "milestone": "", "phase": "block47", "status": "keep", "steps": 3275, "ts_end": "2026-08-01T05:00:00Z", "ts_end_epoch": 1785560400.0, "ts_start": "", "val_bpb": 0.930182, "vram_gb": 44.0}
{"commit": "block47-E27-lr-basin-bracketed", "desc": "E27 depth 6 MATRIX_LR=0.025; median step 91.8 ms, duty 1.000; 16/16 clean", "exp": "E27_d6_lr0.025_s45", "exp_num": 828, "milestone": "", "phase": "block47", "status": "keep", "steps": 3267, "ts_end": "2026-08-01T05:00:00Z", "ts_end_epoch": 1785560400.0, "ts_start": "", "val_bpb": 0.92974, "vram_gb": 44.0}
{"commit": "block47-E27-lr-basin-bracketed", "desc": "E27 depth 6 MATRIX_LR=0.03; median step 93.0 ms, duty 1.001; 16/16 clean", "exp": "E27_d6_lr0.03_s45", "exp_num": 829, "milestone": "", "phase": "block47", "status": "keep", "steps": 3229, "ts_end": "2026-08-01T05:00:00Z", "ts_end_epoch": 1785560400.0, "ts_start": "", "val_bpb": 0.930202, "vram_gb": 44.0}
{"commit": "block47-E27-lr-basin-bracketed", "desc": "E27 depth 6 MATRIX_LR=0.04; median step 92.5 ms, duty 1.000; 16/16 clean", "exp": "E27_d6_lr0.04_s45", "exp_num": 830, "milestone": "", "phase": "block47", "status": "keep", "steps": 3244, "ts_end": "2026-08-01T05:00:00Z", "ts_end_epoch": 1785560400.0, "ts_start": "", "val_bpb": 0.930853, "vram_gb": 44.0}
{"commit": "block48-E28-first-adoption", "desc": "E28 frozen defaults (depth 8, MATRIX_LR 0.04); median step 149.0 ms, duty 1.006; screened against its OWN cell median since the two arms are different shapes; 20/20 arms clean", "exp": "E28_ctl_s42", "exp_num": 831, "milestone": "", "phase": "block48", "status": "keep", "steps": 2025, "ts_end": "2026-08-01T06:00:00Z", "ts_end_epoch": 1785564000.0, "ts_start": "", "val_bpb": 0.931294, "vram_gb": 52.6}
{"commit": "block48-E28-first-adoption", "desc": "E28 ADOPTED config: depth 6, MATRIX_LR 0.03; median step 91.5 ms, duty 1.000; screened against its OWN cell median since the two arms are different shapes; 20/20 arms clean", "exp": "E28_best_s42", "exp_num": 832, "milestone": "SOTA", "phase": "block48", "status": "keep", "steps": 3278, "ts_end": "2026-08-01T06:00:00Z", "ts_end_epoch": 1785564000.0, "ts_start": "", "val_bpb": 0.92943, "vram_gb": 44.0}
{"commit": "block48-E28-first-adoption", "desc": "E28 frozen defaults (depth 8, MATRIX_LR 0.04); median step 151.5 ms, duty 1.006; screened against its OWN cell median since the two arms are different shapes; 20/20 arms clean", "exp": "E28_ctl_s43", "exp_num": 833, "milestone": "", "phase": "block48", "status": "keep", "steps": 1992, "ts_end": "2026-08-01T06:00:00Z", "ts_end_epoch": 1785564000.0, "ts_start": "", "val_bpb": 0.935358, "vram_gb": 52.6}
{"commit": "block48-E28-first-adoption", "desc": "E28 ADOPTED config: depth 6, MATRIX_LR 0.03; median step 92.9 ms, duty 1.002; screened against its OWN cell median since the two arms are different shapes; 20/20 arms clean", "exp": "E28_best_s43", "exp_num": 834, "milestone": "SOTA", "phase": "block48", "status": "keep", "steps": 3235, "ts_end": "2026-08-01T06:00:00Z", "ts_end_epoch": 1785564000.0, "ts_start": "", "val_bpb": 0.929231, "vram_gb": 44.0}
{"commit": "block48-E28-first-adoption", "desc": "E28 frozen defaults (depth 8, MATRIX_LR 0.04); median step 149.5 ms, duty 1.006; screened against its OWN cell median since the two arms are different shapes; 20/20 arms clean", "exp": "E28_ctl_s44", "exp_num": 835, "milestone": "", "phase": "block48", "status": "keep", "steps": 2018, "ts_end": "2026-08-01T06:00:00Z", "ts_end_epoch": 1785564000.0, "ts_start": "", "val_bpb": 0.932301, "vram_gb": 52.6}
{"commit": "block48-E28-first-adoption", "desc": "E28 ADOPTED config: depth 6, MATRIX_LR 0.03; median step 91.4 ms, duty 1.000; screened against its OWN cell median since the two arms are different shapes; 20/20 arms clean", "exp": "E28_best_s44", "exp_num": 836, "milestone": "SOTA", "phase": "block48", "status": "keep", "steps": 3283, "ts_end": "2026-08-01T06:00:00Z", "ts_end_epoch": 1785564000.0, "ts_start": "", "val_bpb": 0.929283, "vram_gb": 44.0}
{"commit": "block48-E28-first-adoption", "desc": "E28 frozen defaults (depth 8, MATRIX_LR 0.04); median step 149.2 ms, duty 1.006; screened against its OWN cell median since the two arms are different shapes; 20/20 arms clean", "exp": "E28_ctl_s45", "exp_num": 837, "milestone": "", "phase": "block48", "status": "keep", "steps": 2022, "ts_end": "2026-08-01T06:00:00Z", "ts_end_epoch": 1785564000.0, "ts_start": "", "val_bpb": 0.932194, "vram_gb": 52.6}
{"commit": "block48-E28-first-adoption", "desc": "E28 ADOPTED config: depth 6, MATRIX_LR 0.03; median step 92.4 ms, duty 1.001; screened against its OWN cell median since the two arms are different shapes; 20/20 arms clean", "exp": "E28_best_s45", "exp_num": 838, "milestone": "SOTA", "phase": "block48", "status": "keep", "steps": 3251, "ts_end": "2026-08-01T06:00:00Z", "ts_end_epoch": 1785564000.0, "ts_start": "", "val_bpb": 0.929841, "vram_gb": 44.0}
{"commit": "block48-E28-first-adoption", "desc": "E28 frozen defaults (depth 8, MATRIX_LR 0.04); median step 151.8 ms, duty 1.006; screened against its OWN cell median since the two arms are different shapes; 20/20 arms clean", "exp": "E28_ctl_s46", "exp_num": 839, "milestone": "", "phase": "block48", "status": "keep", "steps": 1988, "ts_end": "2026-08-01T06:00:00Z", "ts_end_epoch": 1785564000.0, "ts_start": "", "val_bpb": 0.932533, "vram_gb": 52.6}
{"commit": "block48-E28-first-adoption", "desc": "E28 ADOPTED config: depth 6, MATRIX_LR 0.03; median step 91.7 ms, duty 1.000; screened against its OWN cell median since the two arms are different shapes; 20/20 arms clean", "exp": "E28_best_s46", "exp_num": 840, "milestone": "SOTA", "phase": "block48", "status": "keep", "steps": 3272, "ts_end": "2026-08-01T06:00:00Z", "ts_end_epoch": 1785564000.0, "ts_start": "", "val_bpb": 0.930178, "vram_gb": 44.0}
