{"commit": "block40-E20-width-formula-optimal", "desc": "E20 depth 6 MODEL_DIM=640; median step 92.2 ms, duty 0.999, 480M tokens (1.9 passes)", "exp": "E20_dim640_s43", "exp_num": 728, "milestone": "", "phase": "block40", "status": "keep", "steps": 3252, "ts_end": "2026-07-31T22:45:00Z", "ts_end_epoch": 1785538000.0, "ts_start": "", "val_bpb": 0.92995, "vram_gb": 44.0}
{"commit": "block40-E20-width-formula-optimal", "desc": "E20 depth 6 MODEL_DIM=640; median step 91.2 ms, duty 1.000, 485M tokens (1.9 passes)", "exp": "E20_dim640_s44", "exp_num": 729, "milestone": "", "phase": "block40", "status": "keep", "steps": 3288, "ts_end": "2026-07-31T22:45:00Z", "ts_end_epoch": 1785538000.0, "ts_start": "", "val_bpb": 0.928643, "vram_gb": 44.0}
{"commit": "block40-E20-width-formula-optimal", "desc": "E20 depth 6 MODEL_DIM=640; median step 91.4 ms, duty 0.998, 483M tokens (1.9 passes)", "exp": "E20_dim640_s45", "exp_num": 730, "milestone": "", "phase": "block40", "status": "keep", "steps": 3277, "ts_end": "2026-07-31T22:45:00Z", "ts_end_epoch": 1785538000.0, "ts_start": "", "val_bpb": 0.930187, "vram_gb": 44.0}
{"commit": "block40-E20-width-formula-optimal", "desc": "E20 depth 6 MODEL_DIM=512; median step 68.3 ms, duty 0.949, 615M tokens (2.5 passes) -- QUARANTINE: duty 0.949", "exp": "E20_dim512_s42", "exp_num": 731, "milestone": "", "phase": "block40", "status": "quarantine", "steps": 4170, "ts_end": "2026-07-31T22:45:00Z", "ts_end_epoch": 1785538000.0, "ts_start": "", "val_bpb": 0.972535, "vram_gb": 34.0}
{"commit": "block40-E20-width-formula-optimal", "desc": "E20 depth 6 MODEL_DIM=512; median step 68.4 ms, duty 0.949, 614M tokens (2.5 passes) -- QUARANTINE: duty 0.949", "exp": "E20_dim512_s43", "exp_num": 732, "milestone": "", "phase": "block40", "status": "quarantine", "steps": 4162, "ts_end": "2026-07-31T22:45:00Z", "ts_end_epoch": 1785538000.0, "ts_start": "", "val_bpb": 0.974223, "vram_gb": 34.0}
{"commit": "block40-E20-width-formula-optimal", "desc": "E20 depth 6 MODEL_DIM=512; median step 68.5 ms, duty 0.964, 622M tokens (2.5 passes)", "exp": "E20_dim512_s44", "exp_num": 733, "milestone": "", "phase": "block40", "status": "keep", "steps": 4221, "ts_end": "2026-07-31T22:45:00Z", "ts_end_epoch": 1785538000.0, "ts_start": "", "val_bpb": 0.973165, "vram_gb": 34.0}
{"commit": "block40-E20-width-formula-optimal", "desc": "E20 depth 6 MODEL_DIM=512; median step 68.0 ms, duty 0.988, 643M tokens (2.6 passes)", "exp": "E20_dim512_s45", "exp_num": 734, "milestone": "", "phase": "block40", "status": "keep", "steps": 4360, "ts_end": "2026-07-31T22:45:00Z", "ts_end_epoch": 1785538000.0, "ts_start": "", "val_bpb": 0.971516, "vram_gb": 34.0}
{"commit": "block40-E20-width-formula-optimal", "desc": "E20 depth 6 MODEL_DIM=768; median step 117.4 ms, duty 1.004, 378M tokens (1.5 passes)", "exp": "E20_dim768_s42", "exp_num": 735, "milestone": "", "phase": "block40", "status": "keep", "steps": 2565, "ts_end": "2026-07-31T22:45:00Z", "ts_end_epoch": 1785538000.0, "ts_start": "", "val_bpb": 0.930715, "vram_gb": 52.0}
{"commit": "block40-E20-width-formula-optimal", "desc": "E20 depth 6 MODEL_DIM=768; median step 116.3 ms, duty 1.004, 382M tokens (1.5 passes)", "exp": "E20_dim768_s43", "exp_num": 736, "milestone": "", "phase": "block40", "status": "keep", "steps": 2590, "ts_end": "2026-07-31T22:45:00Z", "ts_end_epoch": 1785538000.0, "ts_start": "", "val_bpb": 0.931171, "vram_gb": 52.0}
{"commit": "block40-E20-width-formula-optimal", "desc": "E20 depth 6 MODEL_DIM=768; median step 117.9 ms, duty 1.004, 377M tokens (1.5 passes)", "exp": "E20_dim768_s44", "exp_num": 737, "milestone": "", "phase": "block40", "status": "keep", "steps": 2555, "ts_end": "2026-07-31T22:45:00Z", "ts_end_epoch": 1785538000.0, "ts_start": "", "val_bpb": 0.9318, "vram_gb": 52.0}
{"commit": "block40-E20-width-formula-optimal", "desc": "E20 depth 6 MODEL_DIM=768; median step 116.8 ms, duty 1.004, 380M tokens (1.5 passes)", "exp": "E20_dim768_s45", "exp_num": 738, "milestone": "", "phase": "block40", "status": "keep", "steps": 2579, "ts_end": "2026-07-31T22:45:00Z", "ts_end_epoch": 1785538000.0, "ts_start": "", "val_bpb": 0.93022, "vram_gb": 52.0}
{"commit": "block41-E21-capacity-sign-flip", "desc": "E21 depth 5 NGRAM_TABLE_MULT=64; median step 66.5 ms, duty 0.964, 641M tokens (2.6 passes); 12/12 clean", "exp": "E21_d5_mult64_s42", "exp_num": 739, "milestone": "", "phase": "block41", "status": "keep", "steps": 4350, "ts_end": "2026-07-31T23:20:00Z", "ts_end_epoch": 1785540000.0, "ts_start": "", "val_bpb": 0.978864, "vram_gb": 38.0}
{"commit": "block41-E21-capacity-sign-flip", "desc": "E21 depth 5 NGRAM_TABLE_MULT=64; median step 65.9 ms, duty 0.962, 646M tokens (2.6 passes); 12/12 clean", "exp": "E21_d5_mult64_s43", "exp_num": 740, "milestone": "", "phase": "block41", "status": "keep", "steps": 4381, "ts_end": "2026-07-31T23:20:00Z", "ts_end_epoch": 1785540000.0, "ts_start": "", "val_bpb": 0.979068, "vram_gb": 38.0}
{"commit": "block41-E21-capacity-sign-flip", "desc": "E21 depth 5 NGRAM_TABLE_MULT=64; median step 68.0 ms, duty 0.963, 627M tokens (2.5 passes); 12/12 clean", "exp": "E21_d5_mult64_s44", "exp_num": 741, "milestone": "", "phase": "block41", "status": "keep", "steps": 4249, "ts_end": "2026-07-31T23:20:00Z", "ts_end_epoch": 1785540000.0, "ts_start": "", "val_bpb": 0.978953, "vram_gb": 38.0}
{"commit": "block41-E21-capacity-sign-flip", "desc": "E21 depth 5 NGRAM_TABLE_MULT=64; median step 67.3 ms, duty 0.966, 635M tokens (2.5 passes); 12/12 clean", "exp": "E21_d5_mult64_s45", "exp_num": 742, "milestone": "", "phase": "block41", "status": "keep", "steps": 4305, "ts_end": "2026-07-31T23:20:00Z", "ts_end_epoch": 1785540000.0, "ts_start": "", "val_bpb": 0.980108, "vram_gb": 38.0}
{"commit": "block41-E21-capacity-sign-flip", "desc": "E21 depth 5 NGRAM_TABLE_MULT=16; median step 67.0 ms, duty 0.967, 639M tokens (2.6 passes); 12/12 clean", "exp": "E21_d5_mult16_s42", "exp_num": 743, "milestone": "", "phase": "block41", "status": "keep", "steps": 4332, "ts_end": "2026-07-31T23:20:00Z", "ts_end_epoch": 1785540000.0, "ts_start": "", "val_bpb": 0.965439, "vram_gb": 38.0}
{"commit": "block41-E21-capacity-sign-flip", "desc": "E21 depth 5 NGRAM_TABLE_MULT=16; median step 67.6 ms, duty 0.966, 632M tokens (2.5 passes); 12/12 clean", "exp": "E21_d5_mult16_s43", "exp_num": 744, "milestone": "", "phase": "block41", "status": "keep", "steps": 4285, "ts_end": "2026-07-31T23:20:00Z", "ts_end_epoch": 1785540000.0, "ts_start": "", "val_bpb": 0.963782, "vram_gb": 38.0}
{"commit": "block41-E21-capacity-sign-flip", "desc": "E21 depth 5 NGRAM_TABLE_MULT=16; median step 66.3 ms, duty 0.971, 648M tokens (2.6 passes); 12/12 clean", "exp": "E21_d5_mult16_s44", "exp_num": 745, "milestone": "", "phase": "block41", "status": "keep", "steps": 4392, "ts_end": "2026-07-31T23:20:00Z", "ts_end_epoch": 1785540000.0, "ts_start": "", "val_bpb": 0.962772, "vram_gb": 38.0}
{"commit": "block41-E21-capacity-sign-flip", "desc": "E21 depth 5 NGRAM_TABLE_MULT=16; median step 59.2 ms, duty 0.973, 727M tokens (2.9 passes); 12/12 clean", "exp": "E21_d5_mult16_s45", "exp_num": 746, "milestone": "", "phase": "block41", "status": "keep", "steps": 4929, "ts_end": "2026-07-31T23:20:00Z", "ts_end_epoch": 1785540000.0, "ts_start": "", "val_bpb": 0.959799, "vram_gb": 38.0}
{"commit": "block41-E21-capacity-sign-flip", "desc": "E21 depth 5 NGRAM_TABLE_MULT=4; median step 67.4 ms, duty 0.969, 636M tokens (2.5 passes); 12/12 clean", "exp": "E21_d5_mult4_s42", "exp_num": 747, "milestone": "", "phase": "block41", "status": "keep", "steps": 4313, "ts_end": "2026-07-31T23:20:00Z", "ts_end_epoch": 1785540000.0, "ts_start": "", "val_bpb": 0.971316, "vram_gb": 38.0}
{"commit": "block41-E21-capacity-sign-flip", "desc": "E21 depth 5 NGRAM_TABLE_MULT=4; median step 67.5 ms, duty 0.973, 638M tokens (2.6 passes); 12/12 clean", "exp": "E21_d5_mult4_s43", "exp_num": 748, "milestone": "", "phase": "block41", "status": "keep", "steps": 4324, "ts_end": "2026-07-31T23:20:00Z", "ts_end_epoch": 1785540000.0, "ts_start": "", "val_bpb": 0.969942, "vram_gb": 38.0}
{"commit": "block41-E21-capacity-sign-flip", "desc": "E21 depth 5 NGRAM_TABLE_MULT=4; median step 67.0 ms, duty 0.972, 642M tokens (2.6 passes); 12/12 clean", "exp": "E21_d5_mult4_s44", "exp_num": 749, "milestone": "", "phase": "block41", "status": "keep", "steps": 4352, "ts_end": "2026-07-31T23:20:00Z", "ts_end_epoch": 1785540000.0, "ts_start": "", "val_bpb": 0.968665, "vram_gb": 38.0}
{"commit": "block41-E21-capacity-sign-flip", "desc": "E21 depth 5 NGRAM_TABLE_MULT=4; median step 59.6 ms, duty 0.971, 721M tokens (2.9 passes); 12/12 clean", "exp": "E21_d5_mult4_s45", "exp_num": 750, "milestone": "", "phase": "block41", "status": "keep", "steps": 4888, "ts_end": "2026-07-31T23:20:00Z", "ts_end_epoch": 1785540000.0, "ts_start": "", "val_bpb": 0.966269, "vram_gb": 38.0}
{"commit": "block42-E22-gap-tracking", "desc": "E22 depth 6 NGRAM_TABLE_MULT=64; step 91.1 ms, duty 0.999", "exp": "E22_d6_mult64_s42", "exp_num": 751, "milestone": "", "phase": "block42", "status": "keep", "steps": 3291, "ts_end": "2026-08-01T01:00:00Z", "ts_end_epoch": 1785546000.0, "ts_start": "", "val_bpb": 0.929312, "vram_gb": 44.0}
{"commit": "block42-E22-gap-tracking", "desc": "E22 depth 6 NGRAM_TABLE_MULT=64; step 92.2 ms, duty 1.000", "exp": "E22_d6_mult64_s43", "exp_num": 752, "milestone": "", "phase": "block42", "status": "keep", "steps": 3253, "ts_end": "2026-08-01T01:00:00Z", "ts_end_epoch": 1785546000.0, "ts_start": "", "val_bpb": 0.9295, "vram_gb": 44.0}
{"commit": "block42-E22-gap-tracking", "desc": "E22 depth 6 NGRAM_TABLE_MULT=64; step 91.3 ms, duty 0.914 -- QUARANTINE: duty 0.914", "exp": "E22_d6_mult64_s44", "exp_num": 753, "milestone": "", "phase": "block42", "status": "quarantine", "steps": 3004, "ts_end": "2026-08-01T01:00:00Z", "ts_end_epoch": 1785546000.0, "ts_start": "", "val_bpb": 0.933393, "vram_gb": 44.0}
{"commit": "block42-E22-gap-tracking", "desc": "E22 depth 6 NGRAM_TABLE_MULT=64; step 91.6 ms, duty 0.916 -- QUARANTINE: duty 0.916", "exp": "E22_d6_mult64_s45", "exp_num": 754, "milestone": "", "phase": "block42", "status": "quarantine", "steps": 2999, "ts_end": "2026-08-01T01:00:00Z", "ts_end_epoch": 1785546000.0, "ts_start": "", "val_bpb": 0.935144, "vram_gb": 44.0}
{"commit": "block42-E22-gap-tracking", "desc": "E22 depth 6 NGRAM_TABLE_MULT=32; step 86.7 ms, duty 0.998", "exp": "E22_d6_mult32_s42", "exp_num": 755, "milestone": "", "phase": "block42", "status": "keep", "steps": 3452, "ts_end": "2026-08-01T01:00:00Z", "ts_end_epoch": 1785546000.0, "ts_start": "", "val_bpb": 0.931031, "vram_gb": 44.0}
{"commit": "block42-E22-gap-tracking", "desc": "E22 depth 6 NGRAM_TABLE_MULT=32; step 86.9 ms, duty 0.996", "exp": "E22_d6_mult32_s43", "exp_num": 756, "milestone": "", "phase": "block42", "status": "keep", "steps": 3440, "ts_end": "2026-08-01T01:00:00Z", "ts_end_epoch": 1785546000.0, "ts_start": "", "val_bpb": 0.93079, "vram_gb": 44.0}
{"commit": "block42-E22-gap-tracking", "desc": "E22 depth 6 NGRAM_TABLE_MULT=32; step 87.4 ms, duty 0.914 -- QUARANTINE: duty 0.914", "exp": "E22_d6_mult32_s44", "exp_num": 757, "milestone": "", "phase": "block42", "status": "quarantine", "steps": 3137, "ts_end": "2026-08-01T01:00:00Z", "ts_end_epoch": 1785546000.0, "ts_start": "", "val_bpb": 0.93517, "vram_gb": 44.0}
{"commit": "block42-E22-gap-tracking", "desc": "E22 depth 6 NGRAM_TABLE_MULT=32; step 86.8 ms, duty 0.913 -- QUARANTINE: duty 0.913", "exp": "E22_d6_mult32_s45", "exp_num": 758, "milestone": "", "phase": "block42", "status": "quarantine", "steps": 3156, "ts_end": "2026-08-01T01:00:00Z", "ts_end_epoch": 1785546000.0, "ts_start": "", "val_bpb": 0.935384, "vram_gb": 44.0}
{"commit": "block42-E22-gap-tracking", "desc": "E22 depth 6 NGRAM_TABLE_MULT=16; step 86.0 ms, duty 0.998", "exp": "E22_d6_mult16_s42", "exp_num": 759, "milestone": "", "phase": "block42", "status": "keep", "steps": 3480, "ts_end": "2026-08-01T01:00:00Z", "ts_end_epoch": 1785546000.0, "ts_start": "", "val_bpb": 0.935798, "vram_gb": 44.0}
{"commit": "block42-E22-gap-tracking", "desc": "E22 depth 6 NGRAM_TABLE_MULT=16; step 85.2 ms, duty 0.916 -- QUARANTINE: duty 0.916", "exp": "E22_d6_mult16_s43", "exp_num": 760, "milestone": "", "phase": "block42", "status": "quarantine", "steps": 3224, "ts_end": "2026-08-01T01:00:00Z", "ts_end_epoch": 1785546000.0, "ts_start": "", "val_bpb": 0.937433, "vram_gb": 44.0}
{"commit": "block42-E22-gap-tracking", "desc": "E22 depth 6 NGRAM_TABLE_MULT=16; step 86.3 ms, duty 0.915 -- QUARANTINE: duty 0.915", "exp": "E22_d6_mult16_s44", "exp_num": 761, "milestone": "", "phase": "block42", "status": "quarantine", "steps": 3181, "ts_end": "2026-08-01T01:00:00Z", "ts_end_epoch": 1785546000.0, "ts_start": "", "val_bpb": 0.938894, "vram_gb": 44.0}
{"commit": "block42-E22-gap-tracking", "desc": "E22 depth 6 NGRAM_TABLE_MULT=16; step 85.3 ms, duty 0.914 -- QUARANTINE: duty 0.914", "exp": "E22_d6_mult16_s45", "exp_num": 762, "milestone": "", "phase": "block42", "status": "quarantine", "steps": 3214, "ts_end": "2026-08-01T01:00:00Z", "ts_end_epoch": 1785546000.0, "ts_start": "", "val_bpb": 0.939175, "vram_gb": 44.0}
{"commit": "block43-E23-frame-account-refuted", "desc": "E23 depth 6 arm=base (COND_INIT/PERI_LN_ATTN); step 92.0 ms, duty 1.001", "exp": "E23_d6_base_s42", "exp_num": 763, "milestone": "", "phase": "block43", "status": "keep", "steps": 3265, "ts_end": "2026-08-01T01:00:00Z", "ts_end_epoch": 1785546000.0, "ts_start": "", "val_bpb": 0.929885, "vram_gb": 44.0}
{"commit": "block43-E23-frame-account-refuted", "desc": "E23 depth 6 arm=ci (COND_INIT/PERI_LN_ATTN); step 92.2 ms, duty 1.000", "exp": "E23_d6_ci_s42", "exp_num": 764, "milestone": "", "phase": "block43", "status": "keep", "steps": 3255, "ts_end": "2026-08-01T01:00:00Z", "ts_end_epoch": 1785546000.0, "ts_start": "", "val_bpb": 0.92974, "vram_gb": 44.0}
{"commit": "block43-E23-frame-account-refuted", "desc": "E23 depth 6 arm=pl (COND_INIT/PERI_LN_ATTN); step 92.1 ms, duty 1.000", "exp": "E23_d6_pl_s42", "exp_num": 765, "milestone": "", "phase": "block43", "status": "keep", "steps": 3256, "ts_end": "2026-08-01T01:00:00Z", "ts_end_epoch": 1785546000.0, "ts_start": "", "val_bpb": 0.9299, "vram_gb": 44.0}
{"commit": "block43-E23-frame-account-refuted", "desc": "E23 depth 6 arm=both (COND_INIT/PERI_LN_ATTN); step 92.6 ms, duty 1.002", "exp": "E23_d6_both_s42", "exp_num": 766, "milestone": "", "phase": "block43", "status": "keep", "steps": 3246, "ts_end": "2026-08-01T01:00:00Z", "ts_end_epoch": 1785546000.0, "ts_start": "", "val_bpb": 0.930228, "vram_gb": 44.0}
{"commit": "block43-E23-frame-account-refuted", "desc": "E23 depth 6 arm=base (COND_INIT/PERI_LN_ATTN); step 92.4 ms, duty 1.002", "exp": "E23_d6_base_s43", "exp_num": 767, "milestone": "", "phase": "block43", "status": "keep", "steps": 3252, "ts_end": "2026-08-01T01:00:00Z", "ts_end_epoch": 1785546000.0, "ts_start": "", "val_bpb": 0.929607, "vram_gb": 44.0}
{"commit": "block43-E23-frame-account-refuted", "desc": "E23 depth 6 arm=ci (COND_INIT/PERI_LN_ATTN); step 91.4 ms, duty 1.001", "exp": "E23_d6_ci_s43", "exp_num": 768, "milestone": "", "phase": "block43", "status": "keep", "steps": 3285, "ts_end": "2026-08-01T01:00:00Z", "ts_end_epoch": 1785546000.0, "ts_start": "", "val_bpb": 0.929703, "vram_gb": 44.0}
{"commit": "block43-E23-frame-account-refuted", "desc": "E23 depth 6 arm=pl (COND_INIT/PERI_LN_ATTN); step 92.7 ms, duty 1.002", "exp": "E23_d6_pl_s43", "exp_num": 769, "milestone": "", "phase": "block43", "status": "keep", "steps": 3243, "ts_end": "2026-08-01T01:00:00Z", "ts_end_epoch": 1785546000.0, "ts_start": "", "val_bpb": 0.928953, "vram_gb": 44.0}
{"commit": "block43-E23-frame-account-refuted", "desc": "E23 depth 6 arm=both (COND_INIT/PERI_LN_ATTN); step 93.4 ms, duty 1.002", "exp": "E23_d6_both_s43", "exp_num": 770, "milestone": "", "phase": "block43", "status": "keep", "steps": 3220, "ts_end": "2026-08-01T01:00:00Z", "ts_end_epoch": 1785546000.0, "ts_start": "", "val_bpb": 0.929397, "vram_gb": 44.0}
{"commit": "block43-E23-frame-account-refuted", "desc": "E23 depth 6 arm=base (COND_INIT/PERI_LN_ATTN); step 91.6 ms, duty 1.002", "exp": "E23_d6_base_s44", "exp_num": 771, "milestone": "", "phase": "block43", "status": "keep", "steps": 3281, "ts_end": "2026-08-01T01:00:00Z", "ts_end_epoch": 1785546000.0, "ts_start": "", "val_bpb": 0.928349, "vram_gb": 44.0}
{"commit": "block43-E23-frame-account-refuted", "desc": "E23 depth 6 arm=ci (COND_INIT/PERI_LN_ATTN); step 91.9 ms, duty 1.002", "exp": "E23_d6_ci_s44", "exp_num": 772, "milestone": "", "phase": "block43", "status": "keep", "steps": 3270, "ts_end": "2026-08-01T01:00:00Z", "ts_end_epoch": 1785546000.0, "ts_start": "", "val_bpb": 0.929462, "vram_gb": 44.0}
{"commit": "block43-E23-frame-account-refuted", "desc": "E23 depth 6 arm=pl (COND_INIT/PERI_LN_ATTN); step 93.4 ms, duty 1.002", "exp": "E23_d6_pl_s44", "exp_num": 773, "milestone": "", "phase": "block43", "status": "keep", "steps": 3219, "ts_end": "2026-08-01T01:00:00Z", "ts_end_epoch": 1785546000.0, "ts_start": "", "val_bpb": 0.930945, "vram_gb": 44.0}
{"commit": "block43-E23-frame-account-refuted", "desc": "E23 depth 6 arm=both (COND_INIT/PERI_LN_ATTN); step 92.3 ms, duty 1.001", "exp": "E23_d6_both_s44", "exp_num": 774, "milestone": "", "phase": "block43", "status": "keep", "steps": 3255, "ts_end": "2026-08-01T01:00:00Z", "ts_end_epoch": 1785546000.0, "ts_start": "", "val_bpb": 0.92915, "vram_gb": 44.0}
{"commit": "block44-E23-seed45", "desc": "E23 depth 6 arm=base seed 45 (4th seed, completed after the block-43 collection); step 91.9 ms, duty 1.001 -- belongs to the E23 experiment (block43) but was collected during block44 after block43's batch was already sealed, so it is recorded under block44 rather than backdated into a closed batch", "exp": "E23_d6_base_s45", "exp_num": 775, "milestone": "", "phase": "block44", "status": "keep", "steps": 3268, "ts_end": "2026-08-01T02:00:00Z", "ts_end_epoch": 1785549600.0, "ts_start": "", "val_bpb": 0.930204, "vram_gb": 44.0}
{"commit": "block44-E23-seed45", "desc": "E23 depth 6 arm=ci seed 45 (4th seed, completed after the block-43 collection); step 92.7 ms, duty 1.002 -- belongs to the E23 experiment (block43) but was collected during block44 after block43's batch was already sealed, so it is recorded under block44 rather than backdated into a closed batch", "exp": "E23_d6_ci_s45", "exp_num": 776, "milestone": "", "phase": "block44", "status": "keep", "steps": 3244, "ts_end": "2026-08-01T02:00:00Z", "ts_end_epoch": 1785549600.0, "ts_start": "", "val_bpb": 0.93153, "vram_gb": 44.0}
{"commit": "block44-E23-seed45", "desc": "E23 depth 6 arm=pl seed 45 (4th seed, completed after the block-43 collection); step 92.3 ms, duty 1.001 -- belongs to the E23 experiment (block43) but was collected during block44 after block43's batch was already sealed, so it is recorded under block44 rather than backdated into a closed batch", "exp": "E23_d6_pl_s45", "exp_num": 777, "milestone": "", "phase": "block44", "status": "keep", "steps": 3254, "ts_end": "2026-08-01T02:00:00Z", "ts_end_epoch": 1785549600.0, "ts_start": "", "val_bpb": 0.929213, "vram_gb": 44.0}
{"commit": "block44-E23-seed45", "desc": "E23 depth 6 arm=both seed 45 (4th seed, completed after the block-43 collection); step 92.8 ms, duty 1.002 -- belongs to the E23 experiment (block43) but was collected during block44 after block43's batch was already sealed, so it is recorded under block44 rather than backdated into a closed batch", "exp": "E23_d6_both_s45", "exp_num": 778, "milestone": "", "phase": "block44", "status": "keep", "steps": 3238, "ts_end": "2026-08-01T02:00:00Z", "ts_end_epoch": 1785549600.0, "ts_start": "", "val_bpb": 0.931258, "vram_gb": 44.0}
{"commit": "block44-E24-dilution-refuted", "desc": "E24 depth 6 NGRAM_TABLE_MULT=64 refinements=base; step 91.3 ms, duty 1.000; dense share 3.2%, dilution 30.9x; 12/12 clean", "exp": "E24_d6_mult64_base_s42", "exp_num": 779, "milestone": "", "phase": "block44", "status": "keep", "steps": 3286, "ts_end": "2026-08-01T02:00:00Z", "ts_end_epoch": 1785549600.0, "ts_start": "", "val_bpb": 0.929512, "vram_gb": 44.0}
{"commit": "block44-E24-dilution-refuted", "desc": "E24 depth 6 NGRAM_TABLE_MULT=64 refinements=both; step 92.0 ms, duty 1.000; dense share 3.2%, dilution 30.9x; 12/12 clean", "exp": "E24_d6_mult64_both_s42", "exp_num": 780, "milestone": "", "phase": "block44", "status": "keep", "steps": 3261, "ts_end": "2026-08-01T02:00:00Z", "ts_end_epoch": 1785549600.0, "ts_start": "", "val_bpb": 0.92998, "vram_gb": 44.0}
{"commit": "block44-E24-dilution-refuted", "desc": "E24 depth 6 NGRAM_TABLE_MULT=4 refinements=base; step 83.7 ms, duty 0.999; dense share 34.9%, dilution 2.9x; 12/12 clean", "exp": "E24_d6_mult4_base_s42", "exp_num": 781, "milestone": "", "phase": "block44", "status": "keep", "steps": 3579, "ts_end": "2026-08-01T02:00:00Z", "ts_end_epoch": 1785549600.0, "ts_start": "", "val_bpb": 0.94439, "vram_gb": 36.0}
{"commit": "block44-E24-dilution-refuted", "desc": "E24 depth 6 NGRAM_TABLE_MULT=4 refinements=both; step 84.6 ms, duty 0.998; dense share 34.9%, dilution 2.9x; 12/12 clean", "exp": "E24_d6_mult4_both_s42", "exp_num": 782, "milestone": "", "phase": "block44", "status": "keep", "steps": 3540, "ts_end": "2026-08-01T02:00:00Z", "ts_end_epoch": 1785549600.0, "ts_start": "", "val_bpb": 0.943376, "vram_gb": 36.0}
{"commit": "block44-E24-dilution-refuted", "desc": "E24 depth 6 NGRAM_TABLE_MULT=64 refinements=base; step 91.5 ms, duty 1.000; dense share 3.2%, dilution 30.9x; 12/12 clean", "exp": "E24_d6_mult64_base_s43", "exp_num": 783, "milestone": "", "phase": "block44", "status": "keep", "steps": 3280, "ts_end": "2026-08-01T02:00:00Z", "ts_end_epoch": 1785549600.0, "ts_start": "", "val_bpb": 0.929022, "vram_gb": 44.0}
