{"exp_num": 227, "exp": "exp232_ffn4_s70", "val_bpb": 0.953633, "vram_gb": 50.8, "steps": 1971, "status": "pilot", "desc": "ablation -FFN(4x): ~full quality but +16% steps (FFN6 benefit vanished under n-gram)", "phase": "2", "milestone": "", "ts_start": "", "ts_end": "2026-07-27T16:12:00Z", "ts_end_epoch": 1785168720.0, "commit": "b37e232"}
{"exp_num": 228, "exp": "exp233_batch19_s70", "val_bpb": 0.96141, "vram_gb": 57.9, "steps": 850, "status": "discard", "desc": "ablation -batch(2^19): much worse, batch2^18 critical (-0.008)", "phase": "2", "milestone": "", "ts_start": "", "ts_end": "2026-07-27T16:12:00Z", "ts_end_epoch": 1785168720.0, "commit": "b37e233"}
{"exp_num": 229, "exp": "exp234_nomaxauto_s70", "val_bpb": 0.957153, "vram_gb": 57.9, "steps": 1590, "status": "discard", "desc": "ablation -max-autotune: worse ~0.003", "phase": "2", "milestone": "", "ts_start": "", "ts_end": "2026-07-27T16:12:00Z", "ts_end_epoch": 1785168720.0, "commit": "b37e234"}
{"exp_num": 230, "exp": "exp235_full_s70b", "val_bpb": 0.954482, "vram_gb": 57.9, "steps": 1663, "status": "keep", "desc": "ablation full SOTA s70 (gpu5): GPU-variance vs gpu0 = 0.0014 from GPU alone", "phase": "2", "milestone": "", "ts_start": "", "ts_end": "2026-07-27T16:12:00Z", "ts_end_epoch": 1785168720.0, "commit": "b37e235"}
{"exp_num": 231, "exp": "exp236_ffn4_s71", "val_bpb": 0.953059, "vram_gb": 50.8, "steps": 1953, "status": "pilot", "desc": "FFN4 s71 interleaved (+15% steps)", "phase": "2", "milestone": "", "ts_start": "", "ts_end": "2026-07-27T16:19:00Z", "ts_end_epoch": 1785169140.0, "commit": "b38e236"}
{"exp_num": 232, "exp": "exp237_ffn6_s71", "val_bpb": 0.953404, "vram_gb": 57.9, "steps": 1713, "status": "pilot", "desc": "FFN6 s71", "phase": "2", "milestone": "", "ts_start": "", "ts_end": "2026-07-27T16:19:00Z", "ts_end_epoch": 1785169140.0, "commit": "b38e237"}
{"exp_num": 233, "exp": "exp238_ffn4_s72", "val_bpb": 0.951033, "vram_gb": 50.8, "steps": 1975, "status": "pilot", "desc": "FFN4 s72 (best single 0.9510)", "phase": "2", "milestone": "", "ts_start": "", "ts_end": "2026-07-27T16:19:00Z", "ts_end_epoch": 1785169140.0, "commit": "b38e238"}
{"exp_num": 234, "exp": "exp239_ffn6_s72", "val_bpb": 0.954085, "vram_gb": 57.9, "steps": 1679, "status": "pilot", "desc": "FFN6 s72", "phase": "2", "milestone": "", "ts_start": "", "ts_end": "2026-07-27T16:19:00Z", "ts_end_epoch": 1785169140.0, "commit": "b38e239"}
{"exp_num": 235, "exp": "exp240_ffn4_s73", "val_bpb": 0.956401, "vram_gb": 50.8, "steps": 1885, "status": "pilot", "desc": "FFN4 s73", "phase": "2", "milestone": "", "ts_start": "", "ts_end": "2026-07-27T16:19:00Z", "ts_end_epoch": 1785169140.0, "commit": "b38e240"}
{"exp_num": 236, "exp": "exp241_ffn6_s73", "val_bpb": 0.955877, "vram_gb": 57.9, "steps": 1663, "status": "pilot", "desc": "FFN6 s73 (FFN4 3-seed 0.9535 < FFN6 0.9545, confirming)", "phase": "2", "milestone": "", "ts_start": "", "ts_end": "2026-07-27T16:19:00Z", "ts_end_epoch": 1785169140.0, "commit": "b38e241"}
{"exp_num": 237, "exp": "exp242_ffn6_s74", "val_bpb": 0.953777, "vram_gb": 57.9, "steps": 1691, "status": "pilot", "desc": "FFN6 s74 (swapped)", "phase": "2", "milestone": "", "ts_start": "", "ts_end": "2026-07-27T16:26:00Z", "ts_end_epoch": 1785169560.0, "commit": "b39e242"}
{"exp_num": 238, "exp": "exp243_ffn4_s74", "val_bpb": 0.953228, "vram_gb": 50.8, "steps": 1983, "status": "pilot", "desc": "FFN4 s74", "phase": "2", "milestone": "", "ts_start": "", "ts_end": "2026-07-27T16:26:00Z", "ts_end_epoch": 1785169560.0, "commit": "b39e243"}
{"exp_num": 239, "exp": "exp244_ffn6_s75", "val_bpb": 0.953855, "vram_gb": 57.9, "steps": 1704, "status": "pilot", "desc": "FFN6 s75", "phase": "2", "milestone": "", "ts_start": "", "ts_end": "2026-07-27T16:26:00Z", "ts_end_epoch": 1785169560.0, "commit": "b39e244"}
{"exp_num": 240, "exp": "exp245_ffn4_s75", "val_bpb": 0.954718, "vram_gb": 50.8, "steps": 1935, "status": "pilot", "desc": "FFN4 s75", "phase": "2", "milestone": "", "ts_start": "", "ts_end": "2026-07-27T16:26:00Z", "ts_end_epoch": 1785169560.0, "commit": "b39e245"}
{"exp_num": 241, "exp": "exp246_ffn6_s76", "val_bpb": 0.956322, "vram_gb": 57.9, "steps": 1632, "status": "pilot", "desc": "FFN6 s76", "phase": "2", "milestone": "", "ts_start": "", "ts_end": "2026-07-27T16:26:00Z", "ts_end_epoch": 1785169560.0, "commit": "b39e246"}
{"exp_num": 242, "exp": "exp247_ffn4_s76", "val_bpb": 0.954504, "vram_gb": 50.8, "steps": 1927, "status": "keep", "desc": "FFN4 ADOPTED: 6-seed 0.9538<FFN6 0.9546 (4/6), +16% steps, simplification win", "phase": "2", "milestone": "", "ts_start": "", "ts_end": "2026-07-27T16:26:00Z", "ts_end_epoch": 1785169560.0, "commit": "b39e247"}
{"exp_num": 243, "exp": "exp248_ffn3", "val_bpb": 0.95944, "vram_gb": 46.9, "steps": 2113, "status": "discard", "desc": "FFN3 (too small; FFN4 is the floor)", "phase": "2", "milestone": "", "ts_start": "", "ts_end": "2026-07-27T16:33:00Z", "ts_end_epoch": 1785169980.0, "commit": "b40e248"}
{"exp_num": 244, "exp": "exp249_ffn2", "val_bpb": 0.970188, "vram_gb": 43.0, "steps": 2334, "status": "discard", "desc": "FFN2 (too small)", "phase": "2", "milestone": "", "ts_start": "", "ts_end": "2026-07-27T16:33:00Z", "ts_end_epoch": 1785169980.0, "commit": "b40e249"}
{"exp_num": 245, "exp": "exp250_batch17", "val_bpb": 0.959936, "vram_gb": 50.8, "steps": 3720, "status": "discard", "desc": "batch2^17 on FFN4 (2^18 still optimal)", "phase": "2", "milestone": "", "ts_start": "", "ts_end": "2026-07-27T16:33:00Z", "ts_end_epoch": 1785169980.0, "commit": "b40e250"}
{"exp_num": 246, "exp": "exp251_mlr05", "val_bpb": 0.955582, "vram_gb": 50.8, "steps": 1945, "status": "discard", "desc": "matrix_lr 0.05 (worse)", "phase": "2", "milestone": "", "ts_start": "", "ts_end": "2026-07-27T16:33:00Z", "ts_end_epoch": 1785169980.0, "commit": "b40e251"}
{"exp_num": 247, "exp": "exp252_mlr03", "val_bpb": 0.952876, "vram_gb": 50.8, "steps": 1882, "status": "pilot", "desc": "matrix_lr 0.03 on FFN4 (flash 0.9529 below ref, confirming interleaved)", "phase": "2", "milestone": "", "ts_start": "", "ts_end": "2026-07-27T16:33:00Z", "ts_end_epoch": 1785169980.0, "commit": "b40e252"}
{"exp_num": 248, "exp": "exp253_warmdown6", "val_bpb": 0.953903, "vram_gb": 50.8, "steps": 1923, "status": "pilot", "desc": "warmdown 0.6 (neutral)", "phase": "2", "milestone": "", "ts_start": "", "ts_end": "2026-07-27T16:33:00Z", "ts_end_epoch": 1785169980.0, "commit": "b40e253"}
{"exp_num": 249, "exp": "exp254_mlr03_s71", "val_bpb": 0.953501, "vram_gb": 50.8, "steps": 1890, "status": "keep", "desc": "matrix_lr 0.03 s71", "phase": "2", "milestone": "", "ts_start": "", "ts_end": "2026-07-27T16:40:00Z", "ts_end_epoch": 1785170400.0, "commit": "b41e254"}
{"exp_num": 250, "exp": "exp255_mlr04_s71", "val_bpb": 0.95364, "vram_gb": 50.8, "steps": 1890, "status": "pilot", "desc": "matrix_lr 0.04 s71", "phase": "2", "milestone": "", "ts_start": "", "ts_end": "2026-07-27T16:40:00Z", "ts_end_epoch": 1785170400.0, "commit": "b41e255"}
{"exp_num": 251, "exp": "exp256_mlr03_s72", "val_bpb": 0.950409, "vram_gb": 50.8, "steps": 1890, "status": "keep", "desc": "matrix_lr 0.03 s72 (best single 0.9504)", "phase": "2", "milestone": "", "ts_start": "", "ts_end": "2026-07-27T16:40:00Z", "ts_end_epoch": 1785170400.0, "commit": "b41e256"}
{"exp_num": 252, "exp": "exp257_mlr04_s72", "val_bpb": 0.951859, "vram_gb": 50.8, "steps": 1890, "status": "pilot", "desc": "matrix_lr 0.04 s72", "phase": "2", "milestone": "", "ts_start": "", "ts_end": "2026-07-27T16:40:00Z", "ts_end_epoch": 1785170400.0, "commit": "b41e257"}
{"exp_num": 253, "exp": "exp258_mlr03_s73", "val_bpb": 0.95587, "vram_gb": 50.8, "steps": 1890, "status": "keep", "desc": "matrix_lr 0.03 s73 (mlr03 3/3 wins mean 0.9533<0.9540, ADOPTED)", "phase": "2", "milestone": "", "ts_start": "", "ts_end": "2026-07-27T16:40:00Z", "ts_end_epoch": 1785170400.0, "commit": "b41e258"}
{"exp_num": 254, "exp": "exp259_mlr04_s73", "val_bpb": 0.956389, "vram_gb": 50.8, "steps": 1890, "status": "pilot", "desc": "matrix_lr 0.04 s73", "phase": "2", "milestone": "", "ts_start": "", "ts_end": "2026-07-27T16:40:00Z", "ts_end_epoch": 1785170400.0, "commit": "b41e259"}
{"exp_num": 255, "exp": "exp260_mlr025", "val_bpb": 0.950569, "vram_gb": 50.8, "steps": 1890, "status": "pilot", "desc": "matrix_lr 0.025 flash (screen)", "phase": "2", "milestone": "", "ts_start": "", "ts_end": "2026-07-27T16:47:00Z", "ts_end_epoch": 1785170820.0, "commit": "b42e260"}
{"exp_num": 256, "exp": "exp261_emb08", "val_bpb": 0.95039, "vram_gb": 50.8, "steps": 1890, "status": "pilot", "desc": "embedding_lr 0.8 flash", "phase": "2", "milestone": "", "ts_start": "", "ts_end": "2026-07-27T16:47:00Z", "ts_end_epoch": 1785170820.0, "commit": "b42e261"}
{"exp_num": 257, "exp": "exp262_emb045", "val_bpb": 0.951491, "vram_gb": 50.8, "steps": 1890, "status": "pilot", "desc": "embedding_lr 0.45", "phase": "2", "milestone": "", "ts_start": "", "ts_end": "2026-07-27T16:47:00Z", "ts_end_epoch": 1785170820.0, "commit": "b42e262"}
{"exp_num": 258, "exp": "exp263_wd01", "val_bpb": 0.950421, "vram_gb": 50.8, "steps": 1890, "status": "pilot", "desc": "weight_decay 0.1 flash", "phase": "2", "milestone": "", "ts_start": "", "ts_end": "2026-07-27T16:47:00Z", "ts_end_epoch": 1785170820.0, "commit": "b42e263"}
{"exp_num": 259, "exp": "exp264_warmdown4", "val_bpb": 0.953571, "vram_gb": 50.8, "steps": 1890, "status": "pilot", "desc": "warmdown 0.4 neutral", "phase": "2", "milestone": "", "ts_start": "", "ts_end": "2026-07-27T16:47:00Z", "ts_end_epoch": 1785170820.0, "commit": "b42e264"}
{"exp_num": 260, "exp": "exp265_scalar03", "val_bpb": 0.952917, "vram_gb": 50.8, "steps": 1890, "status": "pilot", "desc": "scalar_lr 0.3 neutral", "phase": "2", "milestone": "", "ts_start": "", "ts_end": "2026-07-27T16:47:00Z", "ts_end_epoch": 1785170820.0, "commit": "b42e265"}
{"exp_num": 261, "exp": "exp266_emb08_s74", "val_bpb": 0.951442, "vram_gb": 50.8, "steps": 1890, "status": "discard", "desc": "embedding_lr 0.8 (screen worse than matched ref; flash was noise)", "phase": "2", "milestone": "", "ts_start": "", "ts_end": "2026-07-27T16:54:00Z", "ts_end_epoch": 1785171240.0, "commit": "b43e266"}
{"exp_num": 262, "exp": "exp267_ref_s74", "val_bpb": 0.950334, "vram_gb": 50.8, "steps": 1890, "status": "pilot", "desc": "ref s74", "phase": "2", "milestone": "", "ts_start": "", "ts_end": "2026-07-27T16:54:00Z", "ts_end_epoch": 1785171240.0, "commit": "b43e267"}
{"exp_num": 263, "exp": "exp268_wd01_s75", "val_bpb": 0.951325, "vram_gb": 50.8, "steps": 1890, "status": "pilot", "desc": "weight_decay 0.1 (screen -0.0016 vs ref, confirming)", "phase": "2", "milestone": "", "ts_start": "", "ts_end": "2026-07-27T16:54:00Z", "ts_end_epoch": 1785171240.0, "commit": "b43e268"}
{"exp_num": 264, "exp": "exp269_ref_s75", "val_bpb": 0.952913, "vram_gb": 50.8, "steps": 1890, "status": "pilot", "desc": "ref s75", "phase": "2", "milestone": "", "ts_start": "", "ts_end": "2026-07-27T16:54:00Z", "ts_end_epoch": 1785171240.0, "commit": "b43e269"}
{"exp_num": 265, "exp": "exp270_mlr025_s76", "val_bpb": 0.955254, "vram_gb": 50.8, "steps": 1890, "status": "discard", "desc": "matrix_lr 0.025 (worse; 0.03 is the LR floor)", "phase": "2", "milestone": "", "ts_start": "", "ts_end": "2026-07-27T16:54:00Z", "ts_end_epoch": 1785171240.0, "commit": "b43e270"}
{"exp_num": 266, "exp": "exp271_ref_s76", "val_bpb": 0.953318, "vram_gb": 50.8, "steps": 1890, "status": "pilot", "desc": "ref s76", "phase": "2", "milestone": "", "ts_start": "", "ts_end": "2026-07-27T16:54:00Z", "ts_end_epoch": 1785171240.0, "commit": "b43e271"}
{"exp_num": 267, "exp": "exp272_wd01_s77", "val_bpb": 0.953066, "vram_gb": 50.8, "steps": 1890, "status": "pilot", "desc": "wd0.1 s77", "phase": "2", "milestone": "", "ts_start": "", "ts_end": "2026-07-27T17:01:00Z", "ts_end_epoch": 1785171660.0, "commit": "b44e272"}
{"exp_num": 268, "exp": "exp273_ref_s77", "val_bpb": 0.952567, "vram_gb": 50.8, "steps": 1890, "status": "keep", "desc": "re-opt SOTA ref s77", "phase": "2", "milestone": "", "ts_start": "", "ts_end": "2026-07-27T17:01:00Z", "ts_end_epoch": 1785171660.0, "commit": "b44e273"}
{"exp_num": 269, "exp": "exp274_wd01_s78", "val_bpb": 0.953823, "vram_gb": 50.8, "steps": 1890, "status": "pilot", "desc": "wd0.1 s78", "phase": "2", "milestone": "", "ts_start": "", "ts_end": "2026-07-27T17:01:00Z", "ts_end_epoch": 1785171660.0, "commit": "b44e274"}
{"exp_num": 270, "exp": "exp275_ref_s78", "val_bpb": 0.954516, "vram_gb": 50.8, "steps": 1890, "status": "keep", "desc": "re-opt SOTA ref s78", "phase": "2", "milestone": "", "ts_start": "", "ts_end": "2026-07-27T17:01:00Z", "ts_end_epoch": 1785171660.0, "commit": "b44e275"}
{"exp_num": 271, "exp": "exp276_wd01_s79", "val_bpb": 0.954762, "vram_gb": 50.8, "steps": 1890, "status": "discard", "desc": "wd0.1 s79 (3-seed \u0394 -0.00008 NEUTRAL, rejected; re-opt pass done)", "phase": "2", "milestone": "", "ts_start": "", "ts_end": "2026-07-27T17:01:00Z", "ts_end_epoch": 1785171660.0, "commit": "b44e276"}
{"exp_num": 272, "exp": "exp277_ref_s79", "val_bpb": 0.954798, "vram_gb": 50.8, "steps": 1890, "status": "keep", "desc": "re-opt SOTA ref s79 (9-seed mean ~0.9532, best 0.9504)", "phase": "2", "milestone": "", "ts_start": "", "ts_end": "2026-07-27T17:01:00Z", "ts_end_epoch": 1785171660.0, "commit": "b44e277"}
{"exp_num": 273, "exp": "exp278_t21_s80", "val_bpb": 0.951965, "vram_gb": 66.4, "steps": 1886, "status": "keep", "desc": "n-gram 2^21 s80 (better on FFN4)", "phase": "2", "milestone": "", "ts_start": "", "ts_end": "2026-07-27T17:15:00Z", "ts_end_epoch": 1785172500.0, "commit": "b45e278"}
{"exp_num": 274, "exp": "exp279_ref_s80", "val_bpb": 0.953607, "vram_gb": 50.8, "steps": 1973, "status": "pilot", "desc": "ref(t20) s80", "phase": "2", "milestone": "", "ts_start": "", "ts_end": "2026-07-27T17:15:00Z", "ts_end_epoch": 1785172500.0, "commit": "b45e279"}
{"exp_num": 275, "exp": "exp280_t21_s81", "val_bpb": 0.949809, "vram_gb": 66.4, "steps": 1903, "status": "keep", "desc": "n-gram 2^21 s81 (best single 0.9498)", "phase": "2", "milestone": "", "ts_start": "", "ts_end": "2026-07-27T17:15:00Z", "ts_end_epoch": 1785172500.0, "commit": "b45e280"}
{"exp_num": 276, "exp": "exp281_ref_s81", "val_bpb": 0.952444, "vram_gb": 50.8, "steps": 1939, "status": "pilot", "desc": "ref(t20) s81", "phase": "2", "milestone": "", "ts_start": "", "ts_end": "2026-07-27T17:15:00Z", "ts_end_epoch": 1785172500.0, "commit": "b45e281"}
{"exp_num": 277, "exp": "exp282_t22_s82", "val_bpb": 0.952697, "vram_gb": 87.9, "steps": 1710, "status": "discard", "desc": "n-gram 2^22 (neutral, too big even on FFN4)", "phase": "2", "milestone": "", "ts_start": "", "ts_end": "2026-07-27T17:15:00Z", "ts_end_epoch": 1785172500.0, "commit": "b45e282"}
{"exp_num": 278, "exp": "exp283_ref_s82", "val_bpb": 0.952446, "vram_gb": 50.8, "steps": 1919, "status": "pilot", "desc": "ref(t20) s82", "phase": "2", "milestone": "", "ts_start": "", "ts_end": "2026-07-27T17:15:00Z", "ts_end_epoch": 1785172500.0, "commit": "b45e283"}
{"exp_num": 279, "exp": "exp284_ref_s83", "val_bpb": 0.95265, "vram_gb": 50.8, "steps": 1919, "status": "pilot", "desc": "ref(t20) s83", "phase": "2", "milestone": "", "ts_start": "", "ts_end": "2026-07-27T17:22:00Z", "ts_end_epoch": 1785172920.0, "commit": "b46e284"}
{"exp_num": 280, "exp": "exp285_t21_s83", "val_bpb": 0.950196, "vram_gb": 66.4, "steps": 1900, "status": "keep", "desc": "n-gram 2^21 s83", "phase": "2", "milestone": "", "ts_start": "", "ts_end": "2026-07-27T17:22:00Z", "ts_end_epoch": 1785172920.0, "commit": "b46e285"}
{"exp_num": 281, "exp": "exp286_ref_s84", "val_bpb": 0.951989, "vram_gb": 50.8, "steps": 1919, "status": "pilot", "desc": "ref(t20) s84", "phase": "2", "milestone": "", "ts_start": "", "ts_end": "2026-07-27T17:22:00Z", "ts_end_epoch": 1785172920.0, "commit": "b46e286"}
{"exp_num": 282, "exp": "exp287_t21_s84", "val_bpb": 0.950953, "vram_gb": 66.4, "steps": 1900, "status": "keep", "desc": "n-gram 2^21 s84", "phase": "2", "milestone": "", "ts_start": "", "ts_end": "2026-07-27T17:22:00Z", "ts_end_epoch": 1785172920.0, "commit": "b46e287"}
{"exp_num": 283, "exp": "exp288_ref_s85", "val_bpb": 0.953401, "vram_gb": 50.8, "steps": 1919, "status": "pilot", "desc": "ref(t20) s85", "phase": "2", "milestone": "", "ts_start": "", "ts_end": "2026-07-27T17:22:00Z", "ts_end_epoch": 1785172920.0, "commit": "b46e288"}
{"exp_num": 284, "exp": "exp289_t21_s85", "val_bpb": 0.950736, "vram_gb": 66.4, "steps": 1900, "status": "keep", "desc": "n-gram 2^21 ADOPTED (5/5 seeds \u0394-0.0021, SOTA ~0.9507 best 0.9498)", "phase": "2", "milestone": "", "ts_start": "", "ts_end": "2026-07-27T17:22:00Z", "ts_end_epoch": 1785172920.0, "commit": "b46e289"}
{"exp_num": 285, "exp": "exp290_ffn3", "val_bpb": 0.955845, "vram_gb": 46.9, "steps": 2130, "status": "discard", "desc": "FFN3 on 2^21 (worse; FFN4 stays)", "phase": "2", "milestone": "", "ts_start": "", "ts_end": "2026-07-27T17:29:00Z", "ts_end_epoch": 1785173340.0, "commit": "b47e290"}
{"exp_num": 286, "exp": "exp291_ffn5", "val_bpb": 0.949561, "vram_gb": 54.7, "steps": 1780, "status": "pilot", "desc": "FFN5 flash (screen)", "phase": "2", "milestone": "", "ts_start": "", "ts_end": "2026-07-27T17:29:00Z", "ts_end_epoch": 1785173340.0, "commit": "b47e291"}
{"exp_num": 287, "exp": "exp292_t22", "val_bpb": 0.949678, "vram_gb": 87.9, "steps": 1690, "status": "pilot", "desc": "n-gram 2^22 flash (table may want bigger)", "phase": "2", "milestone": "", "ts_start": "", "ts_end": "2026-07-27T17:29:00Z", "ts_end_epoch": 1785173340.0, "commit": "b47e292"}
{"exp_num": 288, "exp": "exp293_mlr025", "val_bpb": 0.949353, "vram_gb": 66.4, "steps": 1900, "status": "pilot", "desc": "matrix_lr 0.025 flash (LR shifting down again)", "phase": "2", "milestone": "", "ts_start": "", "ts_end": "2026-07-27T17:29:00Z", "ts_end_epoch": 1785173340.0, "commit": "b47e293"}
{"exp_num": 289, "exp": "exp294_mlr035", "val_bpb": 0.952642, "vram_gb": 66.4, "steps": 1900, "status": "discard", "desc": "matrix_lr 0.035 (worse)", "phase": "2", "milestone": "", "ts_start": "", "ts_end": "2026-07-27T17:29:00Z", "ts_end_epoch": 1785173340.0, "commit": "b47e294"}
{"exp_num": 290, "exp": "exp295_depth9", "val_bpb": 0.951812, "vram_gb": 79.1, "steps": 1200, "status": "discard", "desc": "depth 9 (neutral/worse)", "phase": "2", "milestone": "", "ts_start": "", "ts_end": "2026-07-27T17:29:00Z", "ts_end_epoch": 1785173340.0, "commit": "b47e295"}
{"exp_num": 291, "exp": "exp296_mlr025_s86", "val_bpb": 0.950427, "vram_gb": 66.4, "steps": 1900, "status": "pilot", "desc": "mlr025 screen (marginal -0.0005, below floor = noise; keep mlr03)", "phase": "2", "milestone": "", "ts_start": "", "ts_end": "2026-07-27T17:36:00Z", "ts_end_epoch": 1785173760.0, "commit": "b48e296"}
{"exp_num": 292, "exp": "exp297_ref_s86", "val_bpb": 0.950963, "vram_gb": 66.4, "steps": 1900, "status": "keep", "desc": "converged SOTA ref s86", "phase": "2", "milestone": "", "ts_start": "", "ts_end": "2026-07-27T17:36:00Z", "ts_end_epoch": 1785173760.0, "commit": "b48e297"}
{"exp_num": 293, "exp": "exp298_t22_s87", "val_bpb": 0.95019, "vram_gb": 87.9, "steps": 1690, "status": "discard", "desc": "n-gram 2^22 (neutral vs 2^21; table saturated at 2^21)", "phase": "2", "milestone": "", "ts_start": "", "ts_end": "2026-07-27T17:36:00Z", "ts_end_epoch": 1785173760.0, "commit": "b48e298"}
{"exp_num": 294, "exp": "exp299_ref_s87", "val_bpb": 0.950103, "vram_gb": 66.4, "steps": 1900, "status": "keep", "desc": "converged SOTA ref s87", "phase": "2", "milestone": "", "ts_start": "", "ts_end": "2026-07-27T17:36:00Z", "ts_end_epoch": 1785173760.0, "commit": "b48e299"}
{"exp_num": 295, "exp": "exp300_ffn5_s88", "val_bpb": 0.953985, "vram_gb": 54.7, "steps": 1780, "status": "discard", "desc": "FFN5 (worse; FFN4 stays)", "phase": "2", "milestone": "", "ts_start": "", "ts_end": "2026-07-27T17:36:00Z", "ts_end_epoch": 1785173760.0, "commit": "b48e300"}
{"exp_num": 296, "exp": "exp301_ref_s88", "val_bpb": 0.953516, "vram_gb": 66.4, "steps": 1900, "status": "keep", "desc": "re-opt CONVERGED (pass3 null): SOTA n-gram2^21+FFN4+mlr03 ~0.9507 best 0.9494", "phase": "2", "milestone": "", "ts_start": "", "ts_end": "2026-07-27T17:36:00Z", "ts_end_epoch": 1785173760.0, "commit": "b48e301"}
{"exp_num": 297, "exp": "exp302_ls002", "val_bpb": 1.034028, "vram_gb": 66.4, "steps": 1900, "status": "discard", "desc": "label smoothing 0.02 (worse; LS miscalibrates softmax vs exact-CE metric)", "phase": "2", "milestone": "", "ts_start": "", "ts_end": "2026-07-27T17:58:00Z", "ts_end_epoch": 1785175080.0, "commit": "b49e302"}
{"exp_num": 298, "exp": "exp303_ls005", "val_bpb": 1.1345, "vram_gb": 66.4, "steps": 1900, "status": "discard", "desc": "label smoothing 0.05 (worse, monotonic)", "phase": "2", "milestone": "", "ts_start": "", "ts_end": "2026-07-27T17:58:00Z", "ts_end_epoch": 1785175080.0, "commit": "b49e303"}
{"exp_num": 299, "exp": "exp304_ls010", "val_bpb": 1.293005, "vram_gb": 66.4, "steps": 1900, "status": "discard", "desc": "label smoothing 0.1 (catastrophic; metric is exact CE)", "phase": "2", "milestone": "", "ts_start": "", "ts_end": "2026-07-27T17:58:00Z", "ts_end_epoch": 1785175080.0, "commit": "b49e304"}
{"exp_num": 300, "exp": "exp305_ng234", "val_bpb": 0.953221, "vram_gb": 87.9, "steps": 1780, "status": "discard", "desc": "n-gram orders (2,3,4) worse: 4-grams too sparse at this data scale (near-init noise + cost)", "phase": "2", "milestone": "", "ts_start": "", "ts_end": "2026-07-27T18:14:00Z", "ts_end_epoch": 1785176040.0, "commit": "b50e305"}
{"exp_num": 301, "exp": "exp306_ng123", "val_bpb": 0.949481, "vram_gb": 87.9, "steps": 1900, "status": "pilot", "desc": "n-gram orders (1,2,3): neutral tie (unigram redundant with wte)", "phase": "2", "milestone": "", "ts_start": "", "ts_end": "2026-07-27T18:14:00Z", "ts_end_epoch": 1785176040.0, "commit": "b50e306"}
