{"commit": "block61-E35-final-n97", "desc": "E35 final tranche of the 24h window, seed 175; depth 6 + MATRIX_LR 0.03; median step 93.7 ms, duty 1.002; 36/36 arms clean against the clean reference", "exp": "E35_best_s175", "exp_num": 1098, "milestone": "", "phase": "block61", "status": "keep", "steps": 3207, "ts_end": "2026-08-01T19:30:00Z", "ts_end_epoch": 1785612600.0, "ts_start": "", "val_bpb": 0.929986, "vram_gb": 44.0}
{"commit": "block61-E35-final-n97", "desc": "E35 final tranche of the 24h window, seed 176; frozen defaults; median step 151.7 ms, duty 1.006; 36/36 arms clean against the clean reference", "exp": "E35_ctl_s176", "exp_num": 1099, "milestone": "", "phase": "block61", "status": "keep", "steps": 1989, "ts_end": "2026-08-01T19:30:00Z", "ts_end_epoch": 1785612600.0, "ts_start": "", "val_bpb": 0.934789, "vram_gb": 52.6}
{"commit": "block61-E35-final-n97", "desc": "E35 final tranche of the 24h window, seed 176; depth 6 + MATRIX_LR 0.03; median step 91.9 ms, duty 1.000; 36/36 arms clean against the clean reference", "exp": "E35_best_s176", "exp_num": 1100, "milestone": "", "phase": "block61", "status": "keep", "steps": 3264, "ts_end": "2026-08-01T19:30:00Z", "ts_end_epoch": 1785612600.0, "ts_start": "", "val_bpb": 0.931167, "vram_gb": 44.0}
{"commit": "block61-E35-final-n97", "desc": "E35 final tranche of the 24h window, seed 177; frozen defaults; median step 148.9 ms, duty 1.006; 36/36 arms clean against the clean reference", "exp": "E35_ctl_s177", "exp_num": 1101, "milestone": "", "phase": "block61", "status": "keep", "steps": 2026, "ts_end": "2026-08-01T19:30:00Z", "ts_end_epoch": 1785612600.0, "ts_start": "", "val_bpb": 0.93309, "vram_gb": 52.6}
{"commit": "block61-E35-final-n97", "desc": "E35 final tranche of the 24h window, seed 177; depth 6 + MATRIX_LR 0.03; median step 91.5 ms, duty 0.999; 36/36 arms clean against the clean reference", "exp": "E35_best_s177", "exp_num": 1102, "milestone": "", "phase": "block61", "status": "keep", "steps": 3277, "ts_end": "2026-08-01T19:30:00Z", "ts_end_epoch": 1785612600.0, "ts_start": "", "val_bpb": 0.929253, "vram_gb": 44.0}
{"commit": "block61-E35-final-n97", "desc": "E35 final tranche of the 24h window, seed 178; frozen defaults; median step 151.2 ms, duty 1.005; 36/36 arms clean against the clean reference", "exp": "E35_ctl_s178", "exp_num": 1103, "milestone": "", "phase": "block61", "status": "keep", "steps": 1995, "ts_end": "2026-08-01T19:30:00Z", "ts_end_epoch": 1785612600.0, "ts_start": "", "val_bpb": 0.932218, "vram_gb": 52.6}
{"commit": "block61-E35-final-n97", "desc": "E35 final tranche of the 24h window, seed 178; depth 6 + MATRIX_LR 0.03; median step 93.7 ms, duty 1.001; 36/36 arms clean against the clean reference", "exp": "E35_best_s178", "exp_num": 1104, "milestone": "", "phase": "block61", "status": "keep", "steps": 3206, "ts_end": "2026-08-01T19:30:00Z", "ts_end_epoch": 1785612600.0, "ts_start": "", "val_bpb": 0.929596, "vram_gb": 44.0}
{"commit": "block61-E35-final-n97", "desc": "E35 final tranche of the 24h window, seed 179; frozen defaults; median step 151.6 ms, duty 1.006; 36/36 arms clean against the clean reference", "exp": "E35_ctl_s179", "exp_num": 1105, "milestone": "", "phase": "block61", "status": "keep", "steps": 1990, "ts_end": "2026-08-01T19:30:00Z", "ts_end_epoch": 1785612600.0, "ts_start": "", "val_bpb": 0.933073, "vram_gb": 52.6}
{"commit": "block61-E35-final-n97", "desc": "E35 final tranche of the 24h window, seed 179; depth 6 + MATRIX_LR 0.03; median step 91.8 ms, duty 1.000; 36/36 arms clean against the clean reference", "exp": "E35_best_s179", "exp_num": 1106, "milestone": "", "phase": "block61", "status": "keep", "steps": 3267, "ts_end": "2026-08-01T19:30:00Z", "ts_end_epoch": 1785612600.0, "ts_start": "", "val_bpb": 0.930314, "vram_gb": 44.0}
