{"commit": "block53-E31-n30-precision", "desc": "E31 PRECISION pass, seed 72 (72-81, disjoint from all 62 prior seeds); frozen defaults; median step 148.9 ms, duty 1.006; 20/20 clean", "exp": "E31_ctl_s72", "exp_num": 891, "milestone": "", "phase": "block53", "status": "keep", "steps": 2026, "ts_end": "2026-08-01T11:00:00Z", "ts_end_epoch": 1785582000.0, "ts_start": "", "val_bpb": 0.931666, "vram_gb": 52.6}
{"commit": "block53-E31-n30-precision", "desc": "E31 PRECISION pass, seed 72 (72-81, disjoint from all 62 prior seeds); depth 6 + MATRIX_LR 0.03; median step 91.5 ms, duty 1.000; 20/20 clean", "exp": "E31_best_s72", "exp_num": 892, "milestone": "", "phase": "block53", "status": "keep", "steps": 3279, "ts_end": "2026-08-01T11:00:00Z", "ts_end_epoch": 1785582000.0, "ts_start": "", "val_bpb": 0.928152, "vram_gb": 44.0}
{"commit": "block53-E31-n30-precision", "desc": "E31 PRECISION pass, seed 73 (72-81, disjoint from all 62 prior seeds); frozen defaults; median step 151.2 ms, duty 1.005; 20/20 clean", "exp": "E31_ctl_s73", "exp_num": 893, "milestone": "", "phase": "block53", "status": "keep", "steps": 1995, "ts_end": "2026-08-01T11:00:00Z", "ts_end_epoch": 1785582000.0, "ts_start": "", "val_bpb": 0.932921, "vram_gb": 52.6}
{"commit": "block53-E31-n30-precision", "desc": "E31 PRECISION pass, seed 73 (72-81, disjoint from all 62 prior seeds); depth 6 + MATRIX_LR 0.03; median step 93.6 ms, duty 1.002; 20/20 clean", "exp": "E31_best_s73", "exp_num": 894, "milestone": "", "phase": "block53", "status": "keep", "steps": 3211, "ts_end": "2026-08-01T11:00:00Z", "ts_end_epoch": 1785582000.0, "ts_start": "", "val_bpb": 0.92978, "vram_gb": 44.0}
{"commit": "block53-E31-n30-precision", "desc": "E31 PRECISION pass, seed 74 (72-81, disjoint from all 62 prior seeds); frozen defaults; median step 151.6 ms, duty 1.006; 20/20 clean", "exp": "E31_ctl_s74", "exp_num": 895, "milestone": "", "phase": "block53", "status": "keep", "steps": 1990, "ts_end": "2026-08-01T11:00:00Z", "ts_end_epoch": 1785582000.0, "ts_start": "", "val_bpb": 0.932155, "vram_gb": 52.6}
{"commit": "block53-E31-n30-precision", "desc": "E31 PRECISION pass, seed 74 (72-81, disjoint from all 62 prior seeds); depth 6 + MATRIX_LR 0.03; median step 91.7 ms, duty 0.999; 20/20 clean", "exp": "E31_best_s74", "exp_num": 896, "milestone": "", "phase": "block53", "status": "keep", "steps": 3268, "ts_end": "2026-08-01T11:00:00Z", "ts_end_epoch": 1785582000.0, "ts_start": "", "val_bpb": 0.928868, "vram_gb": 44.0}
{"commit": "block53-E31-n30-precision", "desc": "E31 PRECISION pass, seed 75 (72-81, disjoint from all 62 prior seeds); frozen defaults; median step 148.8 ms, duty 1.005; 20/20 clean", "exp": "E31_ctl_s75", "exp_num": 897, "milestone": "", "phase": "block53", "status": "keep", "steps": 2027, "ts_end": "2026-08-01T11:00:00Z", "ts_end_epoch": 1785582000.0, "ts_start": "", "val_bpb": 0.932277, "vram_gb": 52.6}
{"commit": "block53-E31-n30-precision", "desc": "E31 PRECISION pass, seed 75 (72-81, disjoint from all 62 prior seeds); depth 6 + MATRIX_LR 0.03; median step 91.5 ms, duty 0.999; 20/20 clean", "exp": "E31_best_s75", "exp_num": 898, "milestone": "", "phase": "block53", "status": "keep", "steps": 3276, "ts_end": "2026-08-01T11:00:00Z", "ts_end_epoch": 1785582000.0, "ts_start": "", "val_bpb": 0.929494, "vram_gb": 44.0}
{"commit": "block53-E31-n30-precision", "desc": "E31 PRECISION pass, seed 76 (72-81, disjoint from all 62 prior seeds); frozen defaults; median step 151.2 ms, duty 1.006; 20/20 clean", "exp": "E31_ctl_s76", "exp_num": 899, "milestone": "", "phase": "block53", "status": "keep", "steps": 1996, "ts_end": "2026-08-01T11:00:00Z", "ts_end_epoch": 1785582000.0, "ts_start": "", "val_bpb": 0.93243, "vram_gb": 52.6}
{"commit": "block53-E31-n30-precision", "desc": "E31 PRECISION pass, seed 76 (72-81, disjoint from all 62 prior seeds); depth 6 + MATRIX_LR 0.03; median step 93.6 ms, duty 1.000; 20/20 clean", "exp": "E31_best_s76", "exp_num": 900, "milestone": "", "phase": "block53", "status": "keep", "steps": 3206, "ts_end": "2026-08-01T11:00:00Z", "ts_end_epoch": 1785582000.0, "ts_start": "", "val_bpb": 0.930785, "vram_gb": 44.0}
{"commit": "block53-E31-n30-precision", "desc": "E31 PRECISION pass, seed 77 (72-81, disjoint from all 62 prior seeds); frozen defaults; median step 151.7 ms, duty 1.006; 20/20 clean", "exp": "E31_ctl_s77", "exp_num": 901, "milestone": "", "phase": "block53", "status": "keep", "steps": 1989, "ts_end": "2026-08-01T11:00:00Z", "ts_end_epoch": 1785582000.0, "ts_start": "", "val_bpb": 0.935103, "vram_gb": 52.6}
{"commit": "block53-E31-n30-precision", "desc": "E31 PRECISION pass, seed 77 (72-81, disjoint from all 62 prior seeds); depth 6 + MATRIX_LR 0.03; median step 91.8 ms, duty 1.000; 20/20 clean", "exp": "E31_best_s77", "exp_num": 902, "milestone": "", "phase": "block53", "status": "keep", "steps": 3267, "ts_end": "2026-08-01T11:00:00Z", "ts_end_epoch": 1785582000.0, "ts_start": "", "val_bpb": 0.928557, "vram_gb": 44.0}
{"commit": "block53-E31-n30-precision", "desc": "E31 PRECISION pass, seed 78 (72-81, disjoint from all 62 prior seeds); frozen defaults; median step 148.8 ms, duty 1.006; 20/20 clean", "exp": "E31_ctl_s78", "exp_num": 903, "milestone": "", "phase": "block53", "status": "keep", "steps": 2028, "ts_end": "2026-08-01T11:00:00Z", "ts_end_epoch": 1785582000.0, "ts_start": "", "val_bpb": 0.931519, "vram_gb": 52.6}
{"commit": "block53-E31-n30-precision", "desc": "E31 PRECISION pass, seed 78 (72-81, disjoint from all 62 prior seeds); depth 6 + MATRIX_LR 0.03; median step 91.5 ms, duty 0.999; 20/20 clean", "exp": "E31_best_s78", "exp_num": 904, "milestone": "", "phase": "block53", "status": "keep", "steps": 3276, "ts_end": "2026-08-01T11:00:00Z", "ts_end_epoch": 1785582000.0, "ts_start": "", "val_bpb": 0.92838, "vram_gb": 44.0}
{"commit": "block53-E31-n30-precision", "desc": "E31 PRECISION pass, seed 79 (72-81, disjoint from all 62 prior seeds); frozen defaults; median step 151.1 ms, duty 1.006; 20/20 clean", "exp": "E31_ctl_s79", "exp_num": 905, "milestone": "", "phase": "block53", "status": "keep", "steps": 1997, "ts_end": "2026-08-01T11:00:00Z", "ts_end_epoch": 1785582000.0, "ts_start": "", "val_bpb": 0.933114, "vram_gb": 52.6}
{"commit": "block53-E31-n30-precision", "desc": "E31 PRECISION pass, seed 79 (72-81, disjoint from all 62 prior seeds); depth 6 + MATRIX_LR 0.03; median step 93.7 ms, duty 1.002; 20/20 clean", "exp": "E31_best_s79", "exp_num": 906, "milestone": "", "phase": "block53", "status": "keep", "steps": 3209, "ts_end": "2026-08-01T11:00:00Z", "ts_end_epoch": 1785582000.0, "ts_start": "", "val_bpb": 0.931426, "vram_gb": 44.0}
{"commit": "block53-E31-n30-precision", "desc": "E31 PRECISION pass, seed 80 (72-81, disjoint from all 62 prior seeds); frozen defaults; median step 151.6 ms, duty 1.006; 20/20 clean", "exp": "E31_ctl_s80", "exp_num": 907, "milestone": "", "phase": "block53", "status": "keep", "steps": 1991, "ts_end": "2026-08-01T11:00:00Z", "ts_end_epoch": 1785582000.0, "ts_start": "", "val_bpb": 0.930915, "vram_gb": 52.6}
{"commit": "block53-E31-n30-precision", "desc": "E31 PRECISION pass, seed 80 (72-81, disjoint from all 62 prior seeds); depth 6 + MATRIX_LR 0.03; median step 91.8 ms, duty 0.999; 20/20 clean", "exp": "E31_best_s80", "exp_num": 908, "milestone": "", "phase": "block53", "status": "keep", "steps": 3264, "ts_end": "2026-08-01T11:00:00Z", "ts_end_epoch": 1785582000.0, "ts_start": "", "val_bpb": 0.930536, "vram_gb": 44.0}
{"commit": "block53-E31-n30-precision", "desc": "E31 PRECISION pass, seed 81 (72-81, disjoint from all 62 prior seeds); frozen defaults; median step 149.6 ms, duty 1.005; 20/20 clean", "exp": "E31_ctl_s81", "exp_num": 909, "milestone": "", "phase": "block53", "status": "keep", "steps": 2016, "ts_end": "2026-08-01T11:00:00Z", "ts_end_epoch": 1785582000.0, "ts_start": "", "val_bpb": 0.93061, "vram_gb": 52.6}
{"commit": "block53-E31-n30-precision", "desc": "E31 PRECISION pass, seed 81 (72-81, disjoint from all 62 prior seeds); depth 6 + MATRIX_LR 0.03; median step 91.6 ms, duty 1.001; 20/20 clean", "exp": "E31_best_s81", "exp_num": 910, "milestone": "", "phase": "block53", "status": "keep", "steps": 3278, "ts_end": "2026-08-01T11:00:00Z", "ts_end_epoch": 1785582000.0, "ts_start": "", "val_bpb": 0.928796, "vram_gb": 44.0}
{"commit": "block55-E32-pooled-n60", "desc": "E32 POWER pass, seed 82 (82-111, disjoint from all 82 prior seeds); frozen defaults; median step 148.8 ms, duty 1.005; 60/60 arms clean", "exp": "E32_ctl_s82", "exp_num": 911, "milestone": "", "phase": "block55", "status": "keep", "steps": 2027, "ts_end": "2026-08-01T13:30:00Z", "ts_end_epoch": 1785591000.0, "ts_start": "", "val_bpb": 0.932953, "vram_gb": 52.6}
{"commit": "block55-E32-pooled-n60", "desc": "E32 POWER pass, seed 82 (82-111, disjoint from all 82 prior seeds); depth 6 + MATRIX_LR 0.03; median step 91.5 ms, duty 0.999; 60/60 arms clean", "exp": "E32_best_s82", "exp_num": 912, "milestone": "", "phase": "block55", "status": "keep", "steps": 3275, "ts_end": "2026-08-01T13:30:00Z", "ts_end_epoch": 1785591000.0, "ts_start": "", "val_bpb": 0.930197, "vram_gb": 44.0}
{"commit": "block55-E32-pooled-n60", "desc": "E32 POWER pass, seed 83 (82-111, disjoint from all 82 prior seeds); frozen defaults; median step 151.2 ms, duty 1.006; 60/60 arms clean", "exp": "E32_ctl_s83", "exp_num": 913, "milestone": "", "phase": "block55", "status": "keep", "steps": 1996, "ts_end": "2026-08-01T13:30:00Z", "ts_end_epoch": 1785591000.0, "ts_start": "", "val_bpb": 0.933801, "vram_gb": 52.6}
{"commit": "block55-E32-pooled-n60", "desc": "E32 POWER pass, seed 83 (82-111, disjoint from all 82 prior seeds); depth 6 + MATRIX_LR 0.03; median step 93.6 ms, duty 1.002; 60/60 arms clean", "exp": "E32_best_s83", "exp_num": 914, "milestone": "", "phase": "block55", "status": "keep", "steps": 3212, "ts_end": "2026-08-01T13:30:00Z", "ts_end_epoch": 1785591000.0, "ts_start": "", "val_bpb": 0.929894, "vram_gb": 44.0}
{"commit": "block55-E32-pooled-n60", "desc": "E32 POWER pass, seed 84 (82-111, disjoint from all 82 prior seeds); frozen defaults; median step 151.6 ms, duty 1.006; 60/60 arms clean", "exp": "E32_ctl_s84", "exp_num": 915, "milestone": "", "phase": "block55", "status": "keep", "steps": 1990, "ts_end": "2026-08-01T13:30:00Z", "ts_end_epoch": 1785591000.0, "ts_start": "", "val_bpb": 0.933036, "vram_gb": 52.6}
{"commit": "block55-E32-pooled-n60", "desc": "E32 POWER pass, seed 84 (82-111, disjoint from all 82 prior seeds); depth 6 + MATRIX_LR 0.03; median step 91.7 ms, duty 0.999; 60/60 arms clean", "exp": "E32_best_s84", "exp_num": 916, "milestone": "", "phase": "block55", "status": "keep", "steps": 3268, "ts_end": "2026-08-01T13:30:00Z", "ts_end_epoch": 1785591000.0, "ts_start": "", "val_bpb": 0.930006, "vram_gb": 44.0}
{"commit": "block55-E32-pooled-n60", "desc": "E32 POWER pass, seed 85 (82-111, disjoint from all 82 prior seeds); frozen defaults; median step 148.7 ms, duty 1.006; 60/60 arms clean", "exp": "E32_ctl_s85", "exp_num": 917, "milestone": "", "phase": "block55", "status": "keep", "steps": 2029, "ts_end": "2026-08-01T13:30:00Z", "ts_end_epoch": 1785591000.0, "ts_start": "", "val_bpb": 0.931019, "vram_gb": 52.6}
{"commit": "block55-E32-pooled-n60", "desc": "E32 POWER pass, seed 85 (82-111, disjoint from all 82 prior seeds); depth 6 + MATRIX_LR 0.03; median step 91.5 ms, duty 1.000; 60/60 arms clean", "exp": "E32_best_s85", "exp_num": 918, "milestone": "", "phase": "block55", "status": "keep", "steps": 3278, "ts_end": "2026-08-01T13:30:00Z", "ts_end_epoch": 1785591000.0, "ts_start": "", "val_bpb": 0.929063, "vram_gb": 44.0}
{"commit": "block55-E32-pooled-n60", "desc": "E32 POWER pass, seed 86 (82-111, disjoint from all 82 prior seeds); frozen defaults; median step 151.3 ms, duty 1.006; 60/60 arms clean", "exp": "E32_ctl_s86", "exp_num": 919, "milestone": "", "phase": "block55", "status": "keep", "steps": 1995, "ts_end": "2026-08-01T13:30:00Z", "ts_end_epoch": 1785591000.0, "ts_start": "", "val_bpb": 0.933426, "vram_gb": 52.6}
{"commit": "block55-E32-pooled-n60", "desc": "E32 POWER pass, seed 86 (82-111, disjoint from all 82 prior seeds); depth 6 + MATRIX_LR 0.03; median step 93.6 ms, duty 1.001; 60/60 arms clean", "exp": "E32_best_s86", "exp_num": 920, "milestone": "", "phase": "block55", "status": "keep", "steps": 3208, "ts_end": "2026-08-01T13:30:00Z", "ts_end_epoch": 1785591000.0, "ts_start": "", "val_bpb": 0.930173, "vram_gb": 44.0}
{"commit": "block55-E32-pooled-n60", "desc": "E32 POWER pass, seed 87 (82-111, disjoint from all 82 prior seeds); frozen defaults; median step 151.5 ms, duty 1.005; 60/60 arms clean", "exp": "E32_ctl_s87", "exp_num": 921, "milestone": "", "phase": "block55", "status": "keep", "steps": 1991, "ts_end": "2026-08-01T13:30:00Z", "ts_end_epoch": 1785591000.0, "ts_start": "", "val_bpb": 0.931653, "vram_gb": 52.6}
{"commit": "block55-E32-pooled-n60", "desc": "E32 POWER pass, seed 87 (82-111, disjoint from all 82 prior seeds); depth 6 + MATRIX_LR 0.03; median step 91.9 ms, duty 1.000; 60/60 arms clean", "exp": "E32_best_s87", "exp_num": 922, "milestone": "", "phase": "block55", "status": "keep", "steps": 3264, "ts_end": "2026-08-01T13:30:00Z", "ts_end_epoch": 1785591000.0, "ts_start": "", "val_bpb": 0.931971, "vram_gb": 44.0}
{"commit": "block55-E32-pooled-n60", "desc": "E32 POWER pass, seed 88 (82-111, disjoint from all 82 prior seeds); frozen defaults; median step 148.9 ms, duty 1.006; 60/60 arms clean", "exp": "E32_ctl_s88", "exp_num": 923, "milestone": "", "phase": "block55", "status": "keep", "steps": 2026, "ts_end": "2026-08-01T13:30:00Z", "ts_end_epoch": 1785591000.0, "ts_start": "", "val_bpb": 0.931727, "vram_gb": 52.6}
{"commit": "block55-E32-pooled-n60", "desc": "E32 POWER pass, seed 88 (82-111, disjoint from all 82 prior seeds); depth 6 + MATRIX_LR 0.03; median step 91.5 ms, duty 0.999; 60/60 arms clean", "exp": "E32_best_s88", "exp_num": 924, "milestone": "", "phase": "block55", "status": "keep", "steps": 3277, "ts_end": "2026-08-01T13:30:00Z", "ts_end_epoch": 1785591000.0, "ts_start": "", "val_bpb": 0.928777, "vram_gb": 44.0}
{"commit": "block55-E32-pooled-n60", "desc": "E32 POWER pass, seed 89 (82-111, disjoint from all 82 prior seeds); frozen defaults; median step 151.4 ms, duty 1.006; 60/60 arms clean", "exp": "E32_ctl_s89", "exp_num": 925, "milestone": "", "phase": "block55", "status": "keep", "steps": 1993, "ts_end": "2026-08-01T13:30:00Z", "ts_end_epoch": 1785591000.0, "ts_start": "", "val_bpb": 0.932842, "vram_gb": 52.6}
{"commit": "block55-E32-pooled-n60", "desc": "E32 POWER pass, seed 89 (82-111, disjoint from all 82 prior seeds); depth 6 + MATRIX_LR 0.03; median step 93.7 ms, duty 1.002; 60/60 arms clean", "exp": "E32_best_s89", "exp_num": 926, "milestone": "", "phase": "block55", "status": "keep", "steps": 3209, "ts_end": "2026-08-01T13:30:00Z", "ts_end_epoch": 1785591000.0, "ts_start": "", "val_bpb": 0.92976, "vram_gb": 44.0}
{"commit": "block55-E32-pooled-n60", "desc": "E32 POWER pass, seed 90 (82-111, disjoint from all 82 prior seeds); frozen defaults; median step 151.7 ms, duty 1.006; 60/60 arms clean", "exp": "E32_ctl_s90", "exp_num": 927, "milestone": "", "phase": "block55", "status": "keep", "steps": 1989, "ts_end": "2026-08-01T13:30:00Z", "ts_end_epoch": 1785591000.0, "ts_start": "", "val_bpb": 0.932565, "vram_gb": 52.6}
{"commit": "block55-E32-pooled-n60", "desc": "E32 POWER pass, seed 90 (82-111, disjoint from all 82 prior seeds); depth 6 + MATRIX_LR 0.03; median step 92.0 ms, duty 1.000; 60/60 arms clean", "exp": "E32_best_s90", "exp_num": 928, "milestone": "", "phase": "block55", "status": "keep", "steps": 3262, "ts_end": "2026-08-01T13:30:00Z", "ts_end_epoch": 1785591000.0, "ts_start": "", "val_bpb": 0.929191, "vram_gb": 44.0}
{"commit": "block55-E32-pooled-n60", "desc": "E32 POWER pass, seed 91 (82-111, disjoint from all 82 prior seeds); frozen defaults; median step 148.8 ms, duty 1.005; 60/60 arms clean", "exp": "E32_ctl_s91", "exp_num": 929, "milestone": "", "phase": "block55", "status": "keep", "steps": 2027, "ts_end": "2026-08-01T13:30:00Z", "ts_end_epoch": 1785591000.0, "ts_start": "", "val_bpb": 0.932222, "vram_gb": 52.6}
{"commit": "block55-E32-pooled-n60", "desc": "E32 POWER pass, seed 91 (82-111, disjoint from all 82 prior seeds); depth 6 + MATRIX_LR 0.03; median step 91.6 ms, duty 0.999; 60/60 arms clean", "exp": "E32_best_s91", "exp_num": 930, "milestone": "", "phase": "block55", "status": "keep", "steps": 3273, "ts_end": "2026-08-01T13:30:00Z", "ts_end_epoch": 1785591000.0, "ts_start": "", "val_bpb": 0.930825, "vram_gb": 44.0}
{"commit": "block55-E32-pooled-n60", "desc": "E32 POWER pass, seed 92 (82-111, disjoint from all 82 prior seeds); frozen defaults; median step 151.2 ms, duty 1.005; 60/60 arms clean", "exp": "E32_ctl_s92", "exp_num": 931, "milestone": "", "phase": "block55", "status": "keep", "steps": 1995, "ts_end": "2026-08-01T13:30:00Z", "ts_end_epoch": 1785591000.0, "ts_start": "", "val_bpb": 0.932562, "vram_gb": 52.6}
{"commit": "block55-E32-pooled-n60", "desc": "E32 POWER pass, seed 92 (82-111, disjoint from all 82 prior seeds); depth 6 + MATRIX_LR 0.03; median step 93.6 ms, duty 1.000; 60/60 arms clean", "exp": "E32_best_s92", "exp_num": 932, "milestone": "", "phase": "block55", "status": "keep", "steps": 3206, "ts_end": "2026-08-01T13:30:00Z", "ts_end_epoch": 1785591000.0, "ts_start": "", "val_bpb": 0.931231, "vram_gb": 44.0}
{"commit": "block55-E32-pooled-n60", "desc": "E32 POWER pass, seed 93 (82-111, disjoint from all 82 prior seeds); frozen defaults; median step 151.7 ms, duty 1.006; 60/60 arms clean", "exp": "E32_ctl_s93", "exp_num": 933, "milestone": "", "phase": "block55", "status": "keep", "steps": 1989, "ts_end": "2026-08-01T13:30:00Z", "ts_end_epoch": 1785591000.0, "ts_start": "", "val_bpb": 0.932695, "vram_gb": 52.6}
{"commit": "block55-E32-pooled-n60", "desc": "E32 POWER pass, seed 93 (82-111, disjoint from all 82 prior seeds); depth 6 + MATRIX_LR 0.03; median step 91.9 ms, duty 0.999; 60/60 arms clean", "exp": "E32_best_s93", "exp_num": 934, "milestone": "", "phase": "block55", "status": "keep", "steps": 3261, "ts_end": "2026-08-01T13:30:00Z", "ts_end_epoch": 1785591000.0, "ts_start": "", "val_bpb": 0.929146, "vram_gb": 44.0}
{"commit": "block55-E32-pooled-n60", "desc": "E32 POWER pass, seed 94 (82-111, disjoint from all 82 prior seeds); frozen defaults; median step 148.8 ms, duty 1.006; 60/60 arms clean", "exp": "E32_ctl_s94", "exp_num": 935, "milestone": "", "phase": "block55", "status": "keep", "steps": 2028, "ts_end": "2026-08-01T13:30:00Z", "ts_end_epoch": 1785591000.0, "ts_start": "", "val_bpb": 0.930788, "vram_gb": 52.6}
{"commit": "block55-E32-pooled-n60", "desc": "E32 POWER pass, seed 94 (82-111, disjoint from all 82 prior seeds); depth 6 + MATRIX_LR 0.03; median step 91.5 ms, duty 0.999; 60/60 arms clean", "exp": "E32_best_s94", "exp_num": 936, "milestone": "", "phase": "block55", "status": "keep", "steps": 3274, "ts_end": "2026-08-01T13:30:00Z", "ts_end_epoch": 1785591000.0, "ts_start": "", "val_bpb": 0.930833, "vram_gb": 44.0}
{"commit": "block55-E32-pooled-n60", "desc": "E32 POWER pass, seed 95 (82-111, disjoint from all 82 prior seeds); frozen defaults; median step 151.2 ms, duty 1.005; 60/60 arms clean", "exp": "E32_ctl_s95", "exp_num": 937, "milestone": "", "phase": "block55", "status": "keep", "steps": 1995, "ts_end": "2026-08-01T13:30:00Z", "ts_end_epoch": 1785591000.0, "ts_start": "", "val_bpb": 0.935414, "vram_gb": 52.6}
{"commit": "block55-E32-pooled-n60", "desc": "E32 POWER pass, seed 95 (82-111, disjoint from all 82 prior seeds); depth 6 + MATRIX_LR 0.03; median step 93.7 ms, duty 1.002; 60/60 arms clean", "exp": "E32_best_s95", "exp_num": 938, "milestone": "", "phase": "block55", "status": "keep", "steps": 3209, "ts_end": "2026-08-01T13:30:00Z", "ts_end_epoch": 1785591000.0, "ts_start": "", "val_bpb": 0.931075, "vram_gb": 44.0}
{"commit": "block55-E32-pooled-n60", "desc": "E32 POWER pass, seed 96 (82-111, disjoint from all 82 prior seeds); frozen defaults; median step 151.5 ms, duty 1.006; 60/60 arms clean", "exp": "E32_ctl_s96", "exp_num": 939, "milestone": "", "phase": "block55", "status": "keep", "steps": 1992, "ts_end": "2026-08-01T13:30:00Z", "ts_end_epoch": 1785591000.0, "ts_start": "", "val_bpb": 0.934727, "vram_gb": 52.6}
{"commit": "block55-E32-pooled-n60", "desc": "E32 POWER pass, seed 96 (82-111, disjoint from all 82 prior seeds); depth 6 + MATRIX_LR 0.03; median step 91.8 ms, duty 0.999; 60/60 arms clean", "exp": "E32_best_s96", "exp_num": 940, "milestone": "", "phase": "block55", "status": "keep", "steps": 3264, "ts_end": "2026-08-01T13:30:00Z", "ts_end_epoch": 1785591000.0, "ts_start": "", "val_bpb": 0.929657, "vram_gb": 44.0}
{"commit": "block55-E32-pooled-n60", "desc": "E32 POWER pass, seed 97 (82-111, disjoint from all 82 prior seeds); frozen defaults; median step 148.8 ms, duty 1.006; 60/60 arms clean", "exp": "E32_ctl_s97", "exp_num": 941, "milestone": "", "phase": "block55", "status": "keep", "steps": 2028, "ts_end": "2026-08-01T13:30:00Z", "ts_end_epoch": 1785591000.0, "ts_start": "", "val_bpb": 0.930033, "vram_gb": 52.6}
{"commit": "block55-E32-pooled-n60", "desc": "E32 POWER pass, seed 97 (82-111, disjoint from all 82 prior seeds); depth 6 + MATRIX_LR 0.03; median step 91.5 ms, duty 0.999; 60/60 arms clean", "exp": "E32_best_s97", "exp_num": 942, "milestone": "", "phase": "block55", "status": "keep", "steps": 3276, "ts_end": "2026-08-01T13:30:00Z", "ts_end_epoch": 1785591000.0, "ts_start": "", "val_bpb": 0.930336, "vram_gb": 44.0}
{"commit": "block55-E32-pooled-n60", "desc": "E32 POWER pass, seed 98 (82-111, disjoint from all 82 prior seeds); frozen defaults; median step 151.3 ms, duty 1.006; 60/60 arms clean", "exp": "E32_ctl_s98", "exp_num": 943, "milestone": "", "phase": "block55", "status": "keep", "steps": 1995, "ts_end": "2026-08-01T13:30:00Z", "ts_end_epoch": 1785591000.0, "ts_start": "", "val_bpb": 0.931249, "vram_gb": 52.6}
