{"exp_num": 472, "exp": "f5_oldoff_s51", "val_bpb": 0.933357, "vram_gb": 55.0, "steps": 1918, "status": "keep", "desc": "old cfg doc-mask OFF s51 (paired control)", "phase": "block17", "milestone": "", "ts_start": "", "ts_end": "2026-07-29T06:40:00Z", "ts_end_epoch": 1785307200.0, "commit": "block17-paired-n10"}
{"exp_num": 473, "exp": "f5_oldon_s47", "val_bpb": 0.928496, "vram_gb": 55.0, "steps": 2005, "status": "keep", "desc": "old cfg + doc-mask s47", "phase": "block17", "milestone": "", "ts_start": "", "ts_end": "2026-07-29T06:40:00Z", "ts_end_epoch": 1785307200.0, "commit": "block17-paired-n10"}
{"exp_num": 474, "exp": "f5_oldon_s48", "val_bpb": 0.92743, "vram_gb": 55.0, "steps": 2022, "status": "keep", "desc": "old cfg + doc-mask s48", "phase": "block17", "milestone": "", "ts_start": "", "ts_end": "2026-07-29T06:40:00Z", "ts_end_epoch": 1785307200.0, "commit": "block17-paired-n10"}
{"exp_num": 475, "exp": "f5_oldon_s49", "val_bpb": 0.929332, "vram_gb": 55.0, "steps": 2014, "status": "keep", "desc": "old cfg + doc-mask s49", "phase": "block17", "milestone": "", "ts_start": "", "ts_end": "2026-07-29T06:40:00Z", "ts_end_epoch": 1785307200.0, "commit": "block17-paired-n10"}
{"exp_num": 476, "exp": "f5_oldon_s50", "val_bpb": 0.928467, "vram_gb": 55.0, "steps": 1992, "status": "keep", "desc": "old cfg + doc-mask s50", "phase": "block17", "milestone": "", "ts_start": "", "ts_end": "2026-07-29T06:40:00Z", "ts_end_epoch": 1785307200.0, "commit": "block17-paired-n10"}
{"exp_num": 477, "exp": "f5_oldon_s51", "val_bpb": 0.930265, "vram_gb": 55.0, "steps": 1949, "status": "keep", "desc": "old cfg + doc-mask s51", "phase": "block17", "milestone": "", "ts_start": "", "ts_end": "2026-07-29T06:40:00Z", "ts_end_epoch": 1785307200.0, "commit": "block17-paired-n10"}
{"exp_num": 478, "exp": "f5_oldon_s52", "val_bpb": 0.928134, "vram_gb": 55.0, "steps": 1998, "status": "keep", "desc": "PAIRED n=10 COMPLETE: doc-mask ON vs OFF on the old config = mean -0.002203, 10/10 same sign, t=-9.04 -- extremely consistent but SUB-GATE (gate 0.004072), so NOT adoptable on its own. old+docmask mean 0.929772 (sd 0.001960, best 0.927430); old-only mean 0.931975, which reproduces the pre-session 10-seed baseline 0.933073 to within 0.0011 and validates the comparison. vs adopted SOTA: -0.005158.", "phase": "block17", "milestone": "", "ts_start": "", "ts_end": "2026-07-29T06:40:00Z", "ts_end_epoch": 1785307200.0, "commit": "block17-paired-n10"}
{"exp_num": 479, "exp": "L_b96_s42", "val_bpb": 0.939223, "vram_gb": 55.0, "steps": 1371, "status": "keep", "desc": "batch ladder B=96 (TBS=196608) -- CONTENDED: step_ms read 195 mid-run (on-model) but finished 278.5 with MFU 19.9->17.6; magnitude quarantined, direction (worse than B=72) retained", "phase": "block18", "milestone": "", "ts_start": "", "ts_end": "2026-07-29T03:56:00Z", "ts_end_epoch": 1785297360.245375, "commit": "block18-batch-ladder"}
{"exp_num": 480, "exp": "L_b72_s42", "val_bpb": 0.928257, "vram_gb": 55.0, "steps": 2004, "status": "keep", "desc": "batch ladder B=72 (TBS=147456) = INCUMBENT; best arm of the ladder, MFU peak 19.32%, most tokens (295.5M)", "phase": "block18", "milestone": "", "ts_start": "", "ts_end": "2026-07-29T03:56:00Z", "ts_end_epoch": 1785297360.245375, "commit": "block18-batch-ladder"}
{"exp_num": 481, "exp": "L_b48_s42", "val_bpb": 0.931542, "vram_gb": 55.0, "steps": 2839, "status": "keep", "desc": "batch ladder B=48 (TBS=98304): +0.003285 vs B=72 -- more steps but fewer tokens (279.1M), WORSE", "phase": "block18", "milestone": "", "ts_start": "", "ts_end": "2026-07-29T03:56:00Z", "ts_end_epoch": 1785297360.245375, "commit": "block18-batch-ladder"}
{"exp_num": 482, "exp": "L_b32_s42", "val_bpb": 0.93913, "vram_gb": 55.0, "steps": 3897, "status": "keep", "desc": "batch ladder B=32 (TBS=65536): +0.010873 vs B=72 -- most steps (3897) but fewest tokens (255.4M), clearly WORSE", "phase": "block18", "milestone": "", "ts_start": "", "ts_end": "2026-07-29T03:56:00Z", "ts_end_epoch": 1785297360.245375, "commit": "block18-batch-ladder"}
{"exp_num": 483, "exp": "L_b48_s43", "val_bpb": 0.934343, "vram_gb": 55.0, "steps": 2770, "status": "keep", "desc": "batch ladder B=48 seed 43 replicate: +0.006 vs B=72; 2/2 same sign that B=48 loses", "phase": "block18", "milestone": "", "ts_start": "", "ts_end": "2026-07-29T03:56:00Z", "ts_end_epoch": 1785297360.245375, "commit": "block18-batch-ladder"}
{"exp_num": 484, "exp": "L_b32_s43", "val_bpb": 0.937176, "vram_gb": 55.0, "steps": 3904, "status": "keep", "desc": "BATCH LADDER NULL -- PREREGISTERED PREDICTION FALSIFIED. Predicted optimum B=48-64 at val_bpb 0.921-0.925; measured curve is an inverted-U with its MINIMUM AT THE INCUMBENT B=72 (0.928257). No arm beat it, gate not approached. MECHANISM OVERTURNED: quality does NOT track optimizer steps (the hypothesis that motivated the ladder) -- it tracks TOTAL TOKENS, in perfect rank order, fitting bpb = a - 0.0755*ln(tokens) across the 3 uncontended arms. B=72 wins because it is the MFU peak (19.32%), so it pushes the most tokens in 300s; smaller batch buys steps but loses MFU and the token loss dominates. Throughput model step_ms = 15.0 + 1.875*B CONFIRMED to within 0.3-3.6% on every uncontended arm (falsifier was >15%). Also re-explains the v21 regression as a token loss, not a step loss.", "phase": "block18", "milestone": "", "ts_start": "", "ts_end": "2026-07-29T03:56:00Z", "ts_end_epoch": 1785297360.245375, "commit": "block18-batch-ladder"}
{"exp_num": 485, "exp": "block18_correction", "val_bpb": null, "vram_gb": 0.0, "steps": 0, "status": "note", "desc": "CORRECTION to exp 484: the token-law coefficient was logged as b=0.0755 from a least-squares fit to the seed-42 series alone. That is false precision. Pairwise slope estimates are 0.0575 / 0.0855 / 0.0746 (seed 42) and 0.0456 (seed 43), so the defensible statement is b in [0.046, 0.086], central ~0.06, from 4 estimates across 2 seed series. The rank-order finding (bpb tracks tokens, not steps) is unaffected; only the slope magnitude is softened. Consequently the B200 extrapolation is ~-0.022 per 1.45x token gain, not -0.024. See AI_papers/paper_017_tokens_not_steps_20260729.tex.", "phase": "block18", "milestone": "", "ts_start": "", "ts_end": "2026-07-29T04:00:12Z", "ts_end_epoch": 1785297612.7707672, "commit": "block18-correction"}
{"exp_num": 486, "exp": "N_ctrl_s42", "val_bpb": 0.928251, "vram_gb": 55.0, "steps": 2006, "status": "keep", "desc": "n-gram capacity control mult=64 (2^19) s42", "phase": "block19", "milestone": "", "ts_start": "", "ts_end": "2026-07-29T04:51:09Z", "ts_end_epoch": 1785300669.102995, "commit": "block19-ngram-capacity"}
{"exp_num": 487, "exp": "N_m128rw_s42", "val_bpb": 0.934207, "vram_gb": 55.0, "steps": 1814, "status": "keep", "desc": "mult=128 rowwise=1 s42: +0.005956 vs ctrl", "phase": "block19", "milestone": "", "ts_start": "", "ts_end": "2026-07-29T04:51:09Z", "ts_end_epoch": 1785300669.102995, "commit": "block19-ngram-capacity"}
{"exp_num": 488, "exp": "N_m256rw_s42", "val_bpb": 0.942269, "vram_gb": 55.0, "steps": 1586, "status": "keep", "desc": "mult=256 (2^21) rowwise=1 s42: +0.014018 vs ctrl", "phase": "block19", "milestone": "", "ts_start": "", "ts_end": "2026-07-29T04:51:09Z", "ts_end_epoch": 1785300669.102995, "commit": "block19-ngram-capacity"}
{"exp_num": 489, "exp": "N_m256_s42", "val_bpb": 0.940751, "vram_gb": 55.0, "steps": 1613, "status": "keep", "desc": "mult=256 rowwise=0 s42: +0.012500 vs ctrl; FASTER than rowwise=1 (188.5 vs 194.1 ms)", "phase": "block19", "milestone": "", "ts_start": "", "ts_end": "2026-07-29T04:51:09Z", "ts_end_epoch": 1785300669.102995, "commit": "block19-ngram-capacity"}
{"exp_num": 490, "exp": "N_ctrl_s43", "val_bpb": 0.93311, "vram_gb": 55.0, "steps": 1949, "status": "keep", "desc": "n-gram capacity control mult=64 s43", "phase": "block19", "milestone": "", "ts_start": "", "ts_end": "2026-07-29T04:51:09Z", "ts_end_epoch": 1785300669.102995, "commit": "block19-ngram-capacity"}
{"exp_num": 491, "exp": "N_m128rw_s43", "val_bpb": 0.935237, "vram_gb": 55.0, "steps": 1834, "status": "keep", "desc": "mult=128 rowwise=1 s43: +0.002127 vs ctrl", "phase": "block19", "milestone": "", "ts_start": "", "ts_end": "2026-07-29T04:51:09Z", "ts_end_epoch": 1785300669.102995, "commit": "block19-ngram-capacity"}
{"exp_num": 492, "exp": "N_m256rw_s43", "val_bpb": 0.944679, "vram_gb": 55.0, "steps": 1565, "status": "keep", "desc": "N-GRAM CAPACITY RESTORATION REFUTED (5/5 arms regress, monotonic in table size) AND -- more importantly -- THE TOKEN LAW IS VALIDATED OUT OF SAMPLE. The law bpb = a - 0.06*ln(tokens) was fit on a BATCH ladder; here it predicts the deltas of a completely different lever (n-gram table size) with residuals of only -0.00008, -0.00008, -0.00058, -0.00152, -0.00160. Every regression is accounted for by lost token throughput alone. The residual IS the intrinsic capacity benefit: ~-0.0007 mean, i.e. bigger tables do help slightly on a per-token basis, but the benefit is 6-20x smaller than the throughput cost it incurs, so the net is a large regression. SECOND FINDING: NGRAM_STATE_ROWWISE=1 does NOT mitigate the bandwidth cost -- at mult=256 it is SLOWER than rowwise=0 (194.06 vs 188.48 ms, MFU 15.27 vs 15.53). The rowwise mitigation premise is falsified. THIRD: this overturns the multiagent critic's item #2, which held that the v21 re-target had 'silently reverted' n-gram capacity 2^21->2^19 and that restoring it was a priority. The data say the reversion was a throughput WIN. Capacity is retired as a lever in this frame.", "phase": "block19", "milestone": "", "ts_start": "", "ts_end": "2026-07-29T04:51:09Z", "ts_end_epoch": 1785300669.102995, "commit": "block19-ngram-capacity"}
{"exp_num": 493, "exp": "P_b72_s44", "val_bpb": 0.929306, "vram_gb": 55.0, "steps": 1997, "status": "keep", "desc": "paired B96-vs-B72 confirm arm P_b72_s44", "phase": "block20", "milestone": "", "ts_start": "", "ts_end": "2026-07-29T05:45:14Z", "ts_end_epoch": 1785303914.684431, "commit": "block20-b96-null"}
{"exp_num": 494, "exp": "P_b96_s44", "val_bpb": 0.930063, "vram_gb": 55.0, "steps": 1565, "status": "keep", "desc": "paired B96-vs-B72 confirm arm P_b96_s44", "phase": "block20", "milestone": "", "ts_start": "", "ts_end": "2026-07-29T05:45:14Z", "ts_end_epoch": 1785303914.684431, "commit": "block20-b96-null"}
{"exp_num": 495, "exp": "P_b96_s45", "val_bpb": 0.929827, "vram_gb": 55.0, "steps": 1557, "status": "keep", "desc": "paired B96-vs-B72 confirm arm P_b96_s45", "phase": "block20", "milestone": "", "ts_start": "", "ts_end": "2026-07-29T05:45:14Z", "ts_end_epoch": 1785303914.684431, "commit": "block20-b96-null"}
{"exp_num": 496, "exp": "P_b72_s45", "val_bpb": 0.932614, "vram_gb": 55.0, "steps": 1905, "status": "keep", "desc": "paired B96-vs-B72 confirm arm P_b72_s45", "phase": "block20", "milestone": "", "ts_start": "", "ts_end": "2026-07-29T05:45:14Z", "ts_end_epoch": 1785303914.684431, "commit": "block20-b96-null"}
{"exp_num": 497, "exp": "P_b72_s46", "val_bpb": 0.930339, "vram_gb": 55.0, "steps": 1948, "status": "keep", "desc": "paired B96-vs-B72 confirm arm P_b72_s46", "phase": "block20", "milestone": "", "ts_start": "", "ts_end": "2026-07-29T05:45:14Z", "ts_end_epoch": 1785303914.684431, "commit": "block20-b96-null"}
{"exp_num": 498, "exp": "P_b96_s46", "val_bpb": 0.930664, "vram_gb": 55.0, "steps": 1535, "status": "keep", "desc": "paired B96-vs-B72 confirm arm P_b96_s46", "phase": "block20", "milestone": "", "ts_start": "", "ts_end": "2026-07-29T05:45:14Z", "ts_end_epoch": 1785303914.684431, "commit": "block20-b96-null"}
{"exp_num": 499, "exp": "P_b96_s42", "val_bpb": 0.931145, "vram_gb": 55.0, "steps": 1556, "status": "keep", "desc": "B=96 NULL at paired n=5, AND MY OWN CORRECTION IS FALSIFIED. Deltas (b96 minus b72): +0.002735 (s42), -0.003059 (s43), +0.000757 (s44), -0.002787 (s45), +0.000325 (s46). Mean -0.000406, sd 0.002473, 2/5 same sign, t=-0.37. Gate 0.004072. The -0.003059 at s43 that I reported as 'the session's first positive signal' was ONE DRAW from a sd=0.0025 distribution -- exactly the single-seed noise floor the campaign already documented. TWICE WRONG ON THIS LEVER IN OPPOSITE DIRECTIONS: (1) 'B=72 optimal because MFU peak' = right conclusion, wrong reason; (2) 'tok/s rises monotonically in B, so go bigger, B=288 clears the gate' = WRONG conclusion, now falsified. SCIENTIFIC CONTENT: B=96 processes MORE tokens in all 5 pairs (+3.5% to +9.0%) yet the residual vs the token-law prediction is POSITIVE IN ALL FIVE (+0.0008 to +0.0048). The extra tokens arrive; the quality does not. THE TOKEN LAW IS SCOPED: bpb = a - b*ln(tokens) holds AT FIXED BATCH, where steps are proportional to tokens -- which is exactly the regime of the n-gram sweep where it validated to 0.0016. ACROSS batch changes the step-count term re-separates and cancels the token gain. Correct picture = interior optimum near B=72: below it tokens fall and dominate, above it optimizer steps fall and dominate. Batch lever CLOSED, this time with n=5 paired evidence in both directions rather than one contaminated arm.", "phase": "block20", "milestone": "", "ts_start": "", "ts_end": "2026-07-29T05:45:14Z", "ts_end_epoch": 1785303914.684431, "commit": "block20-b96-null"}
{"exp_num": 500, "exp": "M_c_s47", "val_bpb": 0.92831, "vram_gb": 55.0, "steps": 2006, "status": "keep", "desc": "momentum-continuity confirm arm M_c_s47", "phase": "block21", "milestone": "", "ts_start": "", "ts_end": "2026-07-29T06:13:46Z", "ts_end_epoch": 1785305626.2453089, "commit": "block21-momentum-continuity"}
{"exp_num": 501, "exp": "M_t_s47", "val_bpb": 0.927183, "vram_gb": 55.0, "steps": 2022, "status": "keep", "desc": "momentum-continuity confirm arm M_t_s47", "phase": "block21", "milestone": "", "ts_start": "", "ts_end": "2026-07-29T06:13:46Z", "ts_end_epoch": 1785305626.2453089, "commit": "block21-momentum-continuity"}
{"exp_num": 502, "exp": "M_t_s48", "val_bpb": 0.92738, "vram_gb": 55.0, "steps": 2017, "status": "keep", "desc": "momentum-continuity confirm arm M_t_s48", "phase": "block21", "milestone": "", "ts_start": "", "ts_end": "2026-07-29T06:13:46Z", "ts_end_epoch": 1785305626.2453089, "commit": "block21-momentum-continuity"}
{"exp_num": 503, "exp": "M_c_s48", "val_bpb": 0.92848, "vram_gb": 55.0, "steps": 1992, "status": "keep", "desc": "momentum-continuity confirm arm M_c_s48", "phase": "block21", "milestone": "", "ts_start": "", "ts_end": "2026-07-29T06:13:46Z", "ts_end_epoch": 1785305626.2453089, "commit": "block21-momentum-continuity"}
{"exp_num": 504, "exp": "M_c_s49", "val_bpb": 0.931671, "vram_gb": 55.0, "steps": 1952, "status": "keep", "desc": "momentum-continuity confirm arm M_c_s49", "phase": "block21", "milestone": "", "ts_start": "", "ts_end": "2026-07-29T06:13:46Z", "ts_end_epoch": 1785305626.2453089, "commit": "block21-momentum-continuity"}
{"exp_num": 505, "exp": "M_t_s49", "val_bpb": 0.929782, "vram_gb": 55.0, "steps": 1983, "status": "keep", "desc": "momentum-continuity confirm arm M_t_s49", "phase": "block21", "milestone": "", "ts_start": "", "ts_end": "2026-07-29T06:13:46Z", "ts_end_epoch": 1785305626.2453089, "commit": "block21-momentum-continuity"}
{"exp_num": 506, "exp": "M_t_s50", "val_bpb": 0.927861, "vram_gb": 55.0, "steps": 1989, "status": "keep", "desc": "momentum-continuity confirm arm M_t_s50", "phase": "block21", "milestone": "", "ts_start": "", "ts_end": "2026-07-29T06:13:46Z", "ts_end_epoch": 1785305626.2453089, "commit": "block21-momentum-continuity"}
{"exp_num": 507, "exp": "M_c_s50", "val_bpb": 0.927581, "vram_gb": 55.0, "steps": 2015, "status": "keep", "desc": "MUON_MOMENTUM_CONTINUOUS=1 + WARMDOWN_RATIO=0.85, paired n=6 (4 fresh interleaved pairs s47-s50 plus s44/s45), config-verified in RESOLVED_CONFIG on every arm. RAW: mean -0.001518, sd 0.001469, 5/6 same sign, t=-2.53. SUB-GATE (~24% of 0.004072) -> NOT ADOPTED. THE IMPORTANT RESULT IS METHODOLOGICAL. This lever is host-side scalar arithmetic and CANNOT change throughput, so all step-count variation between its arms is contention noise. Netting that out with the fixed-batch token law as a CONTROL VARIATE gives INTRINSIC: mean -0.000600, sd 0.000226, 6/6 same sign, t=-6.51. The correction cut sd 6.5x (0.001469 -> 0.000226) and turned 5/6 into 6/6. WHY THIS MATTERS: the campaign's recorded single-seed noise floor is sigma=0.00061 = 72% of the gate, which is why n=1 has never resolved sub-gate levers and why both the B=96 s43 arm and the s45 pair were misread as signal this session. Contention perturbs step count -> tokens -> val_bpb along a path we have now MEASURED, so it is predictable and can be SUBTRACTED rather than averaged away. At sd=0.000226 the standard error at n=3 is 0.00013, making sub-gate effects resolvable at a third of the seeds. This implies some of the session's nine nulls may be real effects buried under contention noise; re-analysing them under the control variate is the next block.", "phase": "block21", "milestone": "", "ts_start": "", "ts_end": "2026-07-29T06:13:46Z", "ts_end_epoch": 1785305626.2453089, "commit": "block21-momentum-continuity"}
{"exp_num": 508, "exp": "F_ctrl_s51", "val_bpb": 0.928088, "vram_gb": 55.0, "steps": 2008, "status": "keep", "desc": "2x2 momentum/warmdown arm F_ctrl_s51", "phase": "block22", "milestone": "", "ts_start": "", "ts_end": "2026-07-29T06:29:32Z", "ts_end_epoch": 1785306572.1992111, "commit": "block22-momentum-warmdown-factorial"}
{"exp_num": 509, "exp": "F_mc_s51", "val_bpb": 0.927938, "vram_gb": 55.0, "steps": 2022, "status": "keep", "desc": "2x2 momentum/warmdown arm F_mc_s51", "phase": "block22", "milestone": "", "ts_start": "", "ts_end": "2026-07-29T06:29:32Z", "ts_end_epoch": 1785306572.1992111, "commit": "block22-momentum-warmdown-factorial"}
{"exp_num": 510, "exp": "F_wd_s51", "val_bpb": 0.92734, "vram_gb": 55.0, "steps": 2017, "status": "keep", "desc": "2x2 momentum/warmdown arm F_wd_s51", "phase": "block22", "milestone": "", "ts_start": "", "ts_end": "2026-07-29T06:29:32Z", "ts_end_epoch": 1785306572.1992111, "commit": "block22-momentum-warmdown-factorial"}
{"exp_num": 511, "exp": "F_both_s51", "val_bpb": 0.928124, "vram_gb": 55.0, "steps": 1996, "status": "keep", "desc": "2x2 momentum/warmdown arm F_both_s51", "phase": "block22", "milestone": "", "ts_start": "", "ts_end": "2026-07-29T06:29:32Z", "ts_end_epoch": 1785306572.1992111, "commit": "block22-momentum-warmdown-factorial"}
{"exp_num": 512, "exp": "F_both_s52", "val_bpb": 0.929194, "vram_gb": 55.0, "steps": 1949, "status": "keep", "desc": "2x2 momentum/warmdown arm F_both_s52", "phase": "block22", "milestone": "", "ts_start": "", "ts_end": "2026-07-29T06:29:32Z", "ts_end_epoch": 1785306572.1992111, "commit": "block22-momentum-warmdown-factorial"}
{"exp_num": 513, "exp": "F_wd_s52", "val_bpb": 0.978691, "vram_gb": 55.0, "steps": 1002, "status": "quarantine", "desc": "2x2 momentum/warmdown arm F_wd_s52", "phase": "block22", "milestone": "", "ts_start": "", "ts_end": "2026-07-29T06:29:32Z", "ts_end_epoch": 1785306572.1992111, "commit": "block22-momentum-warmdown-factorial"}
{"exp_num": 514, "exp": "F_mc_s52", "val_bpb": 0.929277, "vram_gb": 55.0, "steps": 1989, "status": "keep", "desc": "2x2 momentum/warmdown arm F_mc_s52", "phase": "block22", "milestone": "", "ts_start": "", "ts_end": "2026-07-29T06:29:32Z", "ts_end_epoch": 1785306572.1992111, "commit": "block22-momentum-warmdown-factorial"}
{"exp_num": 515, "exp": "F_ctrl_s52", "val_bpb": 0.927947, "vram_gb": 55.0, "steps": 2012, "status": "keep", "desc": "2x2 FACTORIAL momentum-continuity x warmdown-ratio, seeds 51/52, config-verified. wd_s52 QUARANTINED (1002 steps vs ~2000, bpb 0.978691 -- contention). Intrinsic effects after control-variate correction: MC alone +0.000454 (slightly WORSE), WD=0.85 alone -0.000480 (better), BOTH -0.000493 (= WD alone). THE EFFECT IS REASSIGNED: the -0.0006 previously attributed to MUON_MOMENTUM_CONTINUOUS actually comes from WARMDOWN_RATIO=0.85; the continuity fix contributes nothing and may hurt. BOTH ~ WD alone with MC adding nothing is the signature of a single active factor. This is exactly the confound the multiagent critic predicted when it noted that MUON_MOMENTUM_CONTINUOUS=1 also compresses momentum warmup from 300 to ~110 steps. UNDERPOWERED: n=2 with one arm lost, all effects ~0.0005 = 1/8 of the 0.004072 gate. NOT ADOPTED. THIS IS THE SESSION'S LAST KNOB EXPERIMENT. Per the new plateau rule in docs/EXPERIMENT_WORKFLOW.md, the next block is MECHANISM-ONLY: 11 knobs and 0 new mechanisms this session produced 0 adoptions, and the session's own measurement showed intrinsic effects live at ~1e-3 against a 4.07e-3 gate -- no knob could have cleared it.", "phase": "block22", "milestone": "", "ts_start": "", "ts_end": "2026-07-29T06:29:32Z", "ts_end_epoch": 1785306572.1992111, "commit": "block22-momentum-warmdown-factorial"}
{"exp_num": 516, "exp": "G_ctrl_s53", "val_bpb": 0.9295, "vram_gb": 55.0, "steps": 2009, "status": "keep", "desc": "static-cu control arm G_ctrl_s53", "phase": "block23", "milestone": "", "ts_start": "", "ts_end": "2026-07-29T06:48:36Z", "ts_end_epoch": 1785307716.11646, "commit": "block23-static-cu-rejected"}
{"exp_num": 517, "exp": "G_ctrl_s54", "val_bpb": 0.927866, "vram_gb": 55.0, "steps": 1997, "status": "keep", "desc": "static-cu control arm G_ctrl_s54", "phase": "block23", "milestone": "", "ts_start": "", "ts_end": "2026-07-29T06:48:36Z", "ts_end_epoch": 1785307716.11646, "commit": "block23-static-cu-rejected"}
