{"exp_num": 419, "exp": "j_docmask_c1", "val_bpb": 0.963567, "vram_gb": 89.9, "steps": 1124, "status": "discard", "desc": "doc-mask@64 + C1 table-WD: +0.0222 vs doc-mask alone -- ESSENTIALLY IDENTICAL to C1 harm without doc-masking (+0.0222). FALSIFIES the hypothesis that removing cross-document contamination would rescue the memorizer-regularization family: C1 harm is not about cross-document noise.", "phase": "block15", "milestone": "", "ts_start": "", "ts_end": "2026-07-28T21:00:00Z", "ts_end_epoch": 1785265200.0, "commit": "block15-combo"}
{"exp_num": 420, "exp": "j_docmask_c1c3", "val_bpb": 0.96643, "vram_gb": 89.9, "steps": 1072, "status": "discard", "desc": "doc-mask@64 + C1 + C3: +0.0251. Combination continues to be dominated by C1 harm.", "phase": "block15", "milestone": "", "ts_start": "", "ts_end": "2026-07-28T21:00:00Z", "ts_end_epoch": 1785265200.0, "commit": "block15-combo"}
{"exp_num": 421, "exp": "k_docmask_seg_blk64", "val_bpb": 0.939679, "vram_gb": 89.9, "steps": 1129, "status": "keep", "desc": "doc-mask@64 MODE=seg (pure INTRADoc, no window): 0.939679/1129 -- BEST doc-mask config. Beats MODE=both (0.941119) by -0.00144: dropping the window constraint helps once doc-masking is on, consistent with the campaign prior that full in-document context matters and sliding windows hurt.", "phase": "block15", "milestone": "", "ts_start": "", "ts_end": "2026-07-28T21:30:00Z", "ts_end_epoch": 1785267000.0, "commit": "block15-rope"}
{"exp_num": 422, "exp": "k_docmask_both_rope", "val_bpb": 0.941776, "vram_gb": 89.9, "steps": 1111, "status": "discard", "desc": "doc-mask@64 both + RESET_ROPE: +0.000657 vs no-rope. FALSIFIES the mechanistically-motivated combination that positions should restart per document when cross-document attention is blocked.", "phase": "block15", "milestone": "", "ts_start": "", "ts_end": "2026-07-28T21:30:00Z", "ts_end_epoch": 1785267000.0, "commit": "block15-rope"}
{"exp_num": 423, "exp": "k_docmask_seg_rope", "val_bpb": 0.942453, "vram_gb": 89.9, "steps": 1097, "status": "discard", "desc": "doc-mask@64 seg + RESET_ROPE: +0.002774 vs no-rope. RESET_ROPE hurts in BOTH mask modes; the doc-mask x reset-rope combination is rejected.", "phase": "block15", "milestone": "", "ts_start": "", "ts_end": "2026-07-28T21:30:00Z", "ts_end_epoch": 1785267000.0, "commit": "block15-rope"}
{"exp_num": 424, "exp": "m_seg_s44", "val_bpb": 0.941519, "vram_gb": 89.9, "steps": 1086, "status": "discard", "desc": "seg@64 seed44 vs fa3 s44 (0.941425) = +0.000094 (WORSE). CORRECTION: the seed-42 seg-beats-both advantage (-0.00144) did NOT replicate. Paired vs fa3 across seeds 42/44/45 seg gives mean -0.000547 with only 2/3 same sign, versus both@64 mean -0.001415 with 6/6 same sign. MODE=both is the more consistent config; the earlier single-seed seg claim is retracted.", "phase": "block15", "milestone": "", "ts_start": "", "ts_end": "2026-07-28T22:05:00Z", "ts_end_epoch": 1785268800.0, "commit": "block15-seg-correction"}
{"exp_num": 425, "exp": "m_seg_s45", "val_bpb": 0.938145, "vram_gb": 89.9, "steps": 1108, "status": "keep", "desc": "seg@64 seed45 vs fa3 s45 (0.938412) = -0.000267.", "phase": "block15", "milestone": "", "ts_start": "", "ts_end": "2026-07-28T22:05:00Z", "ts_end_epoch": 1785268800.0, "commit": "block15-seg-correction"}
{"exp_num": 426, "exp": "m_seg_s48", "val_bpb": 0.937261, "vram_gb": 89.9, "steps": 1129, "status": "keep", "desc": "seg@64 seed48 (no paired fa3 control this round -- my fa3 arms failed on a config error: DOC_MASK_IMPL=flex left set with ATTN_BACKEND=fa3, which the code correctly rejects).", "phase": "block15", "milestone": "", "ts_start": "", "ts_end": "2026-07-28T22:05:00Z", "ts_end_epoch": 1785268800.0, "commit": "block15-seg-correction"}
{"exp_num": 427, "exp": "m_seg_s49", "val_bpb": 0.938239, "vram_gb": 89.9, "steps": 1118, "status": "keep", "desc": "seg@64 seed49 (unpaired, same config error).", "phase": "block15", "milestone": "", "ts_start": "", "ts_end": "2026-07-28T22:05:00Z", "ts_end_epoch": 1785268800.0, "commit": "block15-seg-correction"}
{"exp_num": 428, "exp": "v_fa3base_s42", "val_bpb": 0.9413, "vram_gb": 89.9, "steps": 1135, "status": "keep", "desc": "fa3 baseline s42 (paired control for the varlen SOTA)", "phase": "block15", "milestone": "", "ts_start": "", "ts_end": "2026-07-29T01:20:00Z", "ts_end_epoch": 1785287000.0, "commit": "sota-fa3-varlen"}
{"exp_num": 429, "exp": "v_fa3base_s43", "val_bpb": 0.942041, "vram_gb": 89.9, "steps": 1139, "status": "keep", "desc": "fa3 baseline s43", "phase": "block15", "milestone": "", "ts_start": "", "ts_end": "2026-07-29T01:20:00Z", "ts_end_epoch": 1785287000.0, "commit": "sota-fa3-varlen"}
{"exp_num": 430, "exp": "v_fa3base_s44", "val_bpb": 0.942675, "vram_gb": 89.9, "steps": 1103, "status": "keep", "desc": "fa3 baseline s44", "phase": "block15", "milestone": "", "ts_start": "", "ts_end": "2026-07-29T01:20:00Z", "ts_end_epoch": 1785287000.0, "commit": "sota-fa3-varlen"}
{"exp_num": 431, "exp": "w_fa3_varlen_docmask_s42", "val_bpb": 0.937327, "vram_gb": 89.9, "steps": 1175, "status": "keep", "desc": "SOTA: fa3 varlen doc-mask s42, -0.003973 vs paired baseline, +40 steps", "phase": "block15", "milestone": "", "ts_start": "", "ts_end": "2026-07-29T01:20:00Z", "ts_end_epoch": 1785287000.0, "commit": "sota-fa3-varlen"}
{"exp_num": 432, "exp": "w_fa3_varlen_docmask_s43", "val_bpb": 0.935396, "vram_gb": 89.9, "steps": 1186, "status": "keep", "desc": "SOTA: fa3 varlen doc-mask s43, -0.006645 vs paired baseline, +47 steps. Best single value of the campaign.", "phase": "block15", "milestone": "", "ts_start": "", "ts_end": "2026-07-29T01:20:00Z", "ts_end_epoch": 1785287000.0, "commit": "sota-fa3-varlen"}
{"exp_num": 433, "exp": "w_fa3_varlen_docmask_s44", "val_bpb": 0.936189, "vram_gb": 89.9, "steps": 1181, "status": "keep", "desc": "NEW SOTA CONFIRMED: fa3 varlen doc-mask, 3 paired seeds, mean delta -0.005701, 3/3 same sign, t=-6.59, CLEARS the 2-sigma gate (0.004072). Treatment mean 0.936304 vs baseline mean 0.942005; also -0.003493 vs the reconciled 10-seed baseline 0.939797. Steps INCREASE (+40/+47/+78): the kernel skips cross-document blocks instead of computing them, so quality and throughput improve together.", "phase": "block15", "milestone": "NEW SOTA: fa3 varlen doc-masking (0.9363, -0.0057 paired, gate cleared)", "ts_start": "", "ts_end": "2026-07-29T01:20:00Z", "ts_end_epoch": 1785287000.0, "commit": "sota-fa3-varlen"}
{"exp_num": 434, "exp": "x_vl_s45", "val_bpb": 0.933834, "vram_gb": 89.9, "steps": 1176, "status": "keep", "desc": "SOTA n=6 extension s45: -0.004578 vs paired fa3 baseline 0.938412", "phase": "block15", "milestone": "", "ts_start": "", "ts_end": "2026-07-29T02:00:00Z", "ts_end_epoch": 1785289200.0, "commit": "sota-n6"}
{"exp_num": 435, "exp": "x_vl_s46", "val_bpb": 0.934646, "vram_gb": 89.9, "steps": 1188, "status": "keep", "desc": "SOTA n=6 extension s46: -0.005948 vs 0.940594", "phase": "block15", "milestone": "", "ts_start": "", "ts_end": "2026-07-29T02:00:00Z", "ts_end_epoch": 1785289200.0, "commit": "sota-n6"}
{"exp_num": 436, "exp": "x_vl_s47", "val_bpb": 0.93334, "vram_gb": 89.9, "steps": 1182, "status": "keep", "desc": "SOTA CONFIRMED at n=6: mean delta -0.005720, 6/6 same sign, t=-12.02, gate (0.004072) cleared by 1.4x. SOTA mean 0.935122, best single 0.933340, -0.004675 vs the reconciled 10-seed baseline. Steps rise throughout (1176-1188 vs 1103-1139).", "phase": "block15", "milestone": "SOTA confirmed n=6: 0.935122 mean, t=-12.02", "ts_start": "", "ts_end": "2026-07-29T02:00:00Z", "ts_end_epoch": 1785289200.0, "commit": "sota-n6"}
{"exp_num": 437, "exp": "x_vl_rowwise", "val_bpb": 0.938212, "vram_gb": 89.9, "steps": 1161, "status": "discard", "desc": "varlen SOTA + NGRAM_STATE_ROWWISE: +0.0009, -14 steps. The lever that is free on the old base does NOT compose favourably on the new one.", "phase": "block15", "milestone": "", "ts_start": "", "ts_end": "2026-07-29T02:00:00Z", "ts_end_epoch": 1785289200.0, "commit": "sota-n6"}
{"exp_num": 438, "exp": "x_vl_c3", "val_bpb": 0.939258, "vram_gb": 89.9, "steps": 1141, "status": "discard", "desc": "varlen SOTA + C3 backoff: +0.0019, -34 steps. Doc-masking does not rehabilitate the memorizer-regularization family even with cleaner context and step headroom.", "phase": "block15", "milestone": "", "ts_start": "", "ts_end": "2026-07-29T02:00:00Z", "ts_end_epoch": 1785289200.0, "commit": "sota-n6"}
{"exp_num": 439, "exp": "x_vl_attnres", "val_bpb": 0.948812, "vram_gb": 89.9, "steps": 1052, "status": "discard", "desc": "varlen SOTA + AttnRes: +0.0115, -123 steps. AttnRes still costs ~10% of steps even on the faster base, so its deficit was never only step scarcity -- a genuine per-update cost remains.", "phase": "block15", "milestone": "", "ts_start": "", "ts_end": "2026-07-29T02:00:00Z", "ts_end_epoch": 1785289200.0, "commit": "sota-n6"}
{"exp_num": 440, "exp": "y_vl_s48", "val_bpb": 0.934018, "vram_gb": 89.9, "steps": 1188, "status": "keep", "desc": "SOTA funnel s48: -0.003700 vs paired baseline 0.937718", "phase": "block15", "milestone": "", "ts_start": "", "ts_end": "2026-07-29T02:35:00Z", "ts_end_epoch": 1785291300.0, "commit": "sota-n9"}
{"exp_num": 441, "exp": "y_vl_s49", "val_bpb": 0.935478, "vram_gb": 89.9, "steps": 1169, "status": "keep", "desc": "SOTA funnel s49: -0.004294 vs paired baseline 0.939772", "phase": "block15", "milestone": "", "ts_start": "", "ts_end": "2026-07-29T02:35:00Z", "ts_end_epoch": 1785291300.0, "commit": "sota-n9"}
{"exp_num": 442, "exp": "y_vl_s50", "val_bpb": 0.934774, "vram_gb": 89.9, "steps": 1161, "status": "keep", "desc": "SOTA funnel s50: -0.007403 vs paired baseline 0.942177. n=9: mean -0.005524, 9/9 same sign, t=-11.95, gate cleared. SOTA mean 0.935000.", "phase": "block15", "milestone": "", "ts_start": "", "ts_end": "2026-07-29T02:35:00Z", "ts_end_epoch": 1785291300.0, "commit": "sota-n9"}
{"exp_num": 443, "exp": "z_vl_s51", "val_bpb": 0.934301, "vram_gb": 89.9, "steps": 1187, "status": "keep", "desc": "FINAL n=10: mean delta -0.005222, 10/10 same sign, t=-10.20, gate (0.004072) cleared. SOTA mean 0.934930 sd 0.001198, best 0.933340, -0.004867 vs the reconciled 10-seed baseline. Satisfies this scope min_seeds=10 adoption requirement; funnel 1->3->6->10 complete.", "phase": "block15", "milestone": "SOTA ADOPTED n=10: 0.934930 (funnel complete)", "ts_start": "", "ts_end": "2026-07-29T02:55:00Z", "ts_end_epoch": 1785292500.0, "commit": "sota-n10"}
{"exp_num": 444, "exp": "p_base_adopted", "val_bpb": 0.937222, "vram_gb": 89.9, "steps": 1176, "status": "keep", "desc": "Adopted-base control (DOC_MASK=1/varlen defaults). Replicate 0.937294/1160 -> within-round sigma ~0.00007, unusually tight.", "phase": "block16", "milestone": "", "ts_start": "", "ts_end": "2026-07-29T03:30:00Z", "ts_end_epoch": 1785294600.0, "commit": "post-adoption-retest"}
{"exp_num": 445, "exp": "p_ts_on_adopted", "val_bpb": 0.950947, "vram_gb": 89.9, "steps": 1081, "status": "discard", "desc": "token-shift on the ADOPTED base: +0.0137, -95 steps. Verdict unchanged from the pre-adoption base (+0.0198).", "phase": "block16", "milestone": "", "ts_start": "", "ts_end": "2026-07-29T03:30:00Z", "ts_end_epoch": 1785294600.0, "commit": "post-adoption-retest"}
{"exp_num": 446, "exp": "p_c1_on_adopted", "val_bpb": 0.960357, "vram_gb": 89.9, "steps": 1182, "status": "discard", "desc": "C1 lambda=0.02 on the ADOPTED base: +0.0231 at 1182 steps -- MORE steps than the 1176-step control, so C1 harm is purely per-update quality and never throughput. Third independent confirmation (+0.0222 pre-adoption, +0.0222 under flex doc-mask, +0.0231 here).", "phase": "block16", "milestone": "", "ts_start": "", "ts_end": "2026-07-29T03:30:00Z", "ts_end_epoch": 1785294600.0, "commit": "post-adoption-retest"}
{"exp_num": 447, "exp": "p_ngpt_on_adopted", "val_bpb": 0.984697, "vram_gb": 89.9, "steps": 1123, "status": "discard", "desc": "nGPT hypersphere on the ADOPTED base: +0.0475 (was +0.0387). Residual-only nGPT remains a half-system.", "phase": "block16", "milestone": "", "ts_start": "", "ts_end": "2026-07-29T03:30:00Z", "ts_end_epoch": 1785294600.0, "commit": "post-adoption-retest"}
{"exp_num": 448, "exp": "p_ts_rw_on_adopted", "val_bpb": 0.954798, "vram_gb": 89.9, "steps": 1034, "status": "discard", "desc": "token-shift x rowwise on the ADOPTED base: +0.0176, -142 steps. No rehabilitation from the restored step headroom.", "phase": "block16", "milestone": "", "ts_start": "", "ts_end": "2026-07-29T03:30:00Z", "ts_end_epoch": 1785294600.0, "commit": "post-adoption-retest"}
{"exp_num": 449, "exp": "q_window_sssl_ctrl", "val_bpb": 0.937194, "vram_gb": 89.9, "steps": 1176, "status": "keep", "desc": "Window-pattern retune control (SSSL, adopted default) under doc-masking. Replicate s43 0.937289/1161.", "phase": "block16", "milestone": "", "ts_start": "", "ts_end": "2026-07-29T04:00:00Z", "ts_end_epoch": 1785296400.0, "commit": "h7-window-retune"}
{"exp_num": 450, "exp": "q_window_llll", "val_bpb": 0.936641, "vram_gb": 89.9, "steps": 1183, "status": "discard", "desc": "LLLL (no window) under doc-masking: MIXED SIGN across seeds (s42 -0.000553, s43 +0.001785, mean +0.000616). The hypothesis that doc-masking makes the sliding window redundant is NOT supported.", "phase": "block16", "milestone": "", "ts_start": "", "ts_end": "2026-07-29T04:00:00Z", "ts_end_epoch": 1785296400.0, "commit": "h7-window-retune"}
{"exp_num": 451, "exp": "q_window_ssll", "val_bpb": 0.937719, "vram_gb": 89.9, "steps": 1167, "status": "discard", "desc": "SSLL under doc-masking: +0.000525 vs SSSL (single seed).", "phase": "block16", "milestone": "", "ts_start": "", "ts_end": "2026-07-29T04:00:00Z", "ts_end_epoch": 1785296400.0, "commit": "h7-window-retune"}
{"exp_num": 452, "exp": "q_window_tttl", "val_bpb": 0.936023, "vram_gb": 89.9, "steps": 1194, "status": "pilot", "desc": "TTTL under doc-masking: -0.001171 vs SSSL and the most steps of any arm (1194), but SINGLE SEED. Escalated to seeds 43/44 rather than promoted -- exactly the single-seed lead this campaign has repeatedly declined to adopt.", "phase": "block16", "milestone": "", "ts_start": "", "ts_end": "2026-07-29T04:00:00Z", "ts_end_epoch": 1785296400.0, "commit": "h7-window-retune"}
{"exp_num": 453, "exp": "r_tttl_s43", "val_bpb": 0.937138, "vram_gb": 89.9, "steps": 1187, "status": "pilot", "desc": "TTTL vs SSSL under doc-masking, s43: -0.000151", "phase": "block16", "milestone": "", "ts_start": "", "ts_end": "2026-07-29T04:20:00Z", "ts_end_epoch": 1785297600.0, "commit": "h7-tttl-resolve"}
{"exp_num": 454, "exp": "r_tttl_s44", "val_bpb": 0.934117, "vram_gb": 89.9, "steps": 1199, "status": "pilot", "desc": "TTTL vs SSSL under doc-masking, s44: -0.001871. FINAL n=3 paired: mean -0.001064, 3/3 same sign, t=-2.13 -- SUB-GATE (only ~1/4 of the 0.004072 gate). NOT adopted; SSSL remains the default. Logged as an open lead for a future block with more seeds, not a result.", "phase": "block16", "milestone": "", "ts_start": "", "ts_end": "2026-07-29T04:20:00Z", "ts_end_epoch": 1785297600.0, "commit": "h7-tttl-resolve"}
{"exp_num": 455, "exp": "r_sssl_s44", "val_bpb": 0.935988, "vram_gb": 89.9, "steps": 1183, "status": "keep", "desc": "SSSL control s44 for the TTTL pairing.", "phase": "block16", "milestone": "", "ts_start": "", "ts_end": "2026-07-29T04:20:00Z", "ts_end_epoch": 1785297600.0, "commit": "h7-tttl-resolve"}
{"exp_num": 456, "exp": "f2_oldcfg_dmoff_s42", "val_bpb": 0.930514, "vram_gb": 89.9, "steps": 1973, "status": "keep", "desc": "2x2 FACTORIAL, OLD config (TTTL/147456/72/0.04) doc-mask OFF: 0.930514 at 1973 STEPS. Beats the adopted SOTA (0.934930) outright, with doc-masking off. The old config runs ~830 MORE optimizer steps in the same 300s because its batch is 147456 vs 262144 tokens/step.", "phase": "block17", "milestone": "Batch/step-count revealed as dominant lever (old cfg 0.9305 @1973 steps)", "ts_start": "", "ts_end": "2026-07-29T05:10:00Z", "ts_end_epoch": 1785301800.0, "commit": "block17-factorial"}
{"exp_num": 457, "exp": "f2_oldcfg_dmoff_s43", "val_bpb": 0.934086, "vram_gb": 89.9, "steps": 1950, "status": "keep", "desc": "OLD config doc-mask OFF s43.", "phase": "block17", "milestone": "", "ts_start": "", "ts_end": "2026-07-29T05:10:00Z", "ts_end_epoch": 1785301800.0, "commit": "block17-factorial"}
{"exp_num": 458, "exp": "f2_oldcfg_dmon_s43", "val_bpb": 0.932944, "vram_gb": 89.9, "steps": 1951, "status": "keep", "desc": "OLD config doc-mask ON s43: -0.001142 vs off. Doc-mask still helps but LESS than at the new config (-0.003209), suggesting its benefit shrinks as step count rises -- a testable interaction.", "phase": "block17", "milestone": "", "ts_start": "", "ts_end": "2026-07-29T05:10:00Z", "ts_end_epoch": 1785301800.0, "commit": "block17-factorial"}
{"exp_num": 459, "exp": "f2_newcfg_dmoff_s42", "val_bpb": 0.941036, "vram_gb": 89.9, "steps": 1140, "status": "keep", "desc": "NEW (adopted) config doc-mask OFF s42 -- factorial control.", "phase": "block17", "milestone": "", "ts_start": "", "ts_end": "2026-07-29T05:10:00Z", "ts_end_epoch": 1785301800.0, "commit": "block17-factorial"}
{"exp_num": 460, "exp": "f2_newcfg_dmon_s42", "val_bpb": 0.937827, "vram_gb": 89.9, "steps": 1167, "status": "keep", "desc": "NEW config doc-mask ON s42. CONFIG MAIN EFFECT at matched doc-mask-off: old-new = -0.010522, roughly 2x the doc-masking effect. The v21 re-target (batch 147456->262144 among 4 constants) was a substantially larger regression than previously credited.", "phase": "block17", "milestone": "", "ts_start": "", "ts_end": "2026-07-29T05:10:00Z", "ts_end_epoch": 1785301800.0, "commit": "block17-factorial"}
{"exp_num": 461, "exp": "f2_oldcfg_dmon_s42", "val_bpb": 0.928066, "vram_gb": 89.9, "steps": 2020, "status": "keep", "desc": "OLD config + doc-mask ON, s42: 0.928066 at 2020 steps -- BEST SINGLE VALUE OF THE CAMPAIGN. Doc-masking stacks on the old config, adding both quality (-0.002448 vs old-off) and steps (+47). Old-config n=2 means: off 0.932300, on 0.930505 (-0.00180). Note doc-mask benefit SHRINKS at high step count (-0.0025/-0.0011 here vs -0.0052 on the large-batch config), so the two levers are partially redundant, not additive.", "phase": "block17", "milestone": "Best single: 0.928066 (old cfg + doc-mask, 2020 steps)", "ts_start": "", "ts_end": "2026-07-29T05:30:00Z", "ts_end_epoch": 1785303000.0, "commit": "block17-oldcfg-docmask"}
{"exp_num": 462, "exp": "f3_oldoff_s44", "val_bpb": 0.930881, "vram_gb": 89.9, "steps": 1983, "status": "keep", "desc": "old cfg, doc-mask off, s44", "phase": "block17", "milestone": "", "ts_start": "", "ts_end": "2026-07-29T05:55:00Z", "ts_end_epoch": 1785304500.0, "commit": "block17-n5"}
{"exp_num": 463, "exp": "f3_oldon_s44", "val_bpb": 0.929302, "vram_gb": 89.9, "steps": 2014, "status": "keep", "desc": "old cfg + doc-mask, s44: -0.001579 paired", "phase": "block17", "milestone": "", "ts_start": "", "ts_end": "2026-07-29T05:55:00Z", "ts_end_epoch": 1785304500.0, "commit": "block17-n5"}
{"exp_num": 464, "exp": "f3_oldoff_s45", "val_bpb": 0.932445, "vram_gb": 89.9, "steps": 1962, "status": "keep", "desc": "old cfg, doc-mask off, s45", "phase": "block17", "milestone": "", "ts_start": "", "ts_end": "2026-07-29T05:55:00Z", "ts_end_epoch": 1785304500.0, "commit": "block17-n5"}
{"exp_num": 465, "exp": "f3_oldon_s45", "val_bpb": 0.930189, "vram_gb": 89.9, "steps": 1982, "status": "keep", "desc": "old cfg + doc-mask, s45: -0.002256 paired", "phase": "block17", "milestone": "", "ts_start": "", "ts_end": "2026-07-29T05:55:00Z", "ts_end_epoch": 1785304500.0, "commit": "block17-n5"}
{"exp_num": 466, "exp": "f3_oldoff_s46", "val_bpb": 0.935423, "vram_gb": 89.9, "steps": 1808, "status": "keep", "desc": "old cfg, doc-mask off, s46", "phase": "block17", "milestone": "", "ts_start": "", "ts_end": "2026-07-29T05:55:00Z", "ts_end_epoch": 1785304500.0, "commit": "block17-n5"}
{"exp_num": 467, "exp": "f3_oldon_s46", "val_bpb": 0.933231, "vram_gb": 89.9, "steps": 1862, "status": "keep", "desc": "old cfg + doc-mask, s46: -0.002192 paired. TWO SEPARATE VERDICTS at n=5: (1) doc-mask ON vs OFF within the old config = -0.001923, 5/5 same sign, t=-7.89, but SUB-GATE (<0.004072) so not adoptable on its own; (2) old+docmask vs the ADOPTED SOTA paired on the same seeds = -0.004732, 5/5 same sign, t=-3.24, CLEARS the gate -- but that margin is largely undoing the v21 config regression, i.e. a correction rather than a discovery. Best config found: old+docmask mean 0.930746 (best 0.928066) vs pre-session baseline 0.933073 = -0.002327.", "phase": "block17", "milestone": "", "ts_start": "", "ts_end": "2026-07-29T05:55:00Z", "ts_end_epoch": 1785304500.0, "commit": "block17-n5"}
{"exp_num": 468, "exp": "f5_oldoff_s47", "val_bpb": 0.929983, "vram_gb": 55.0, "steps": 1974, "status": "keep", "desc": "old cfg doc-mask OFF s47 (paired control)", "phase": "block17", "milestone": "", "ts_start": "", "ts_end": "2026-07-29T06:40:00Z", "ts_end_epoch": 1785307200.0, "commit": "block17-paired-n10"}
{"exp_num": 469, "exp": "f5_oldoff_s48", "val_bpb": 0.928991, "vram_gb": 55.0, "steps": 1992, "status": "keep", "desc": "old cfg doc-mask OFF s48 (paired control)", "phase": "block17", "milestone": "", "ts_start": "", "ts_end": "2026-07-29T06:40:00Z", "ts_end_epoch": 1785307200.0, "commit": "block17-paired-n10"}
{"exp_num": 470, "exp": "f5_oldoff_s49", "val_bpb": 0.932071, "vram_gb": 55.0, "steps": 1984, "status": "keep", "desc": "old cfg doc-mask OFF s49 (paired control)", "phase": "block17", "milestone": "", "ts_start": "", "ts_end": "2026-07-29T06:40:00Z", "ts_end_epoch": 1785307200.0, "commit": "block17-paired-n10"}
{"exp_num": 471, "exp": "f5_oldoff_s50", "val_bpb": 0.932, "vram_gb": 55.0, "steps": 1961, "status": "keep", "desc": "old cfg doc-mask OFF s50 (paired control)", "phase": "block17", "milestone": "", "ts_start": "", "ts_end": "2026-07-29T06:40:00Z", "ts_end_epoch": 1785307200.0, "commit": "block17-paired-n10"}
