{"commit": "block59-E34-burst-19of20-lost", "desc": "E34 final settling attempt, seed 151; median step 324.4 ms, duty 1.013; screened against the CLEAN REFERENCE median (149.9 ms), not the in-tranche median -- QUARANTINE: step 2.16x clean reference", "exp": "E34_ctl_s151", "exp_num": 1049, "milestone": "", "phase": "block59", "status": "quarantine", "steps": 937, "ts_end": "2026-08-01T17:30:00Z", "ts_end_epoch": 1785605400.0, "ts_start": "", "val_bpb": 0.990017, "vram_gb": 52.6}
{"commit": "block59-E34-burst-19of20-lost", "desc": "E34 final settling attempt, seed 151; median step 206.0 ms, duty 1.009; screened against the CLEAN REFERENCE median (91.8 ms), not the in-tranche median -- QUARANTINE: step 2.24x clean reference", "exp": "E34_best_s151", "exp_num": 1050, "milestone": "", "phase": "block59", "status": "quarantine", "steps": 1470, "ts_end": "2026-08-01T17:30:00Z", "ts_end_epoch": 1785605400.0, "ts_start": "", "val_bpb": 0.977446, "vram_gb": 44.0}
{"commit": "block59-E34-burst-19of20-lost", "desc": "E34 final settling attempt, seed 152; median step 150.5 ms, duty 0.908; screened against the CLEAN REFERENCE median (149.9 ms), not the in-tranche median -- QUARANTINE: duty 0.908", "exp": "E34_ctl_s152", "exp_num": 1051, "milestone": "", "phase": "block59", "status": "quarantine", "steps": 1809, "ts_end": "2026-08-01T17:30:00Z", "ts_end_epoch": 1785605400.0, "ts_start": "", "val_bpb": 0.939283, "vram_gb": 52.6}
{"commit": "block59-E34-burst-19of20-lost", "desc": "E34 final settling attempt, seed 152; median step 212.4 ms, duty 1.011; screened against the CLEAN REFERENCE median (91.8 ms), not the in-tranche median -- QUARANTINE: step 2.31x clean reference", "exp": "E34_best_s152", "exp_num": 1052, "milestone": "", "phase": "block59", "status": "quarantine", "steps": 1428, "ts_end": "2026-08-01T17:30:00Z", "ts_end_epoch": 1785605400.0, "ts_start": "", "val_bpb": 0.981574, "vram_gb": 44.0}
{"commit": "block59-E34-burst-19of20-lost", "desc": "E34 final settling attempt, seed 153; median step 327.3 ms, duty 1.014; screened against the CLEAN REFERENCE median (149.9 ms), not the in-tranche median -- QUARANTINE: step 2.18x clean reference", "exp": "E34_ctl_s153", "exp_num": 1053, "milestone": "", "phase": "block59", "status": "quarantine", "steps": 929, "ts_end": "2026-08-01T17:30:00Z", "ts_end_epoch": 1785605400.0, "ts_start": "", "val_bpb": 0.988808, "vram_gb": 52.6}
{"commit": "block59-E34-burst-19of20-lost", "desc": "E34 final settling attempt, seed 153; median step 138.2 ms, duty 0.997; screened against the CLEAN REFERENCE median (91.8 ms), not the in-tranche median -- QUARANTINE: step 1.51x clean reference", "exp": "E34_best_s153", "exp_num": 1054, "milestone": "", "phase": "block59", "status": "quarantine", "steps": 2165, "ts_end": "2026-08-01T17:30:00Z", "ts_end_epoch": 1785605400.0, "ts_start": "", "val_bpb": 0.953347, "vram_gb": 44.0}
{"commit": "block59-E34-burst-19of20-lost", "desc": "E34 final settling attempt, seed 154; median step 322.7 ms, duty 1.013; screened against the CLEAN REFERENCE median (149.9 ms), not the in-tranche median -- QUARANTINE: step 2.15x clean reference", "exp": "E34_ctl_s154", "exp_num": 1055, "milestone": "", "phase": "block59", "status": "quarantine", "steps": 942, "ts_end": "2026-08-01T17:30:00Z", "ts_end_epoch": 1785605400.0, "ts_start": "", "val_bpb": 0.992457, "vram_gb": 52.6}
{"commit": "block59-E34-burst-19of20-lost", "desc": "E34 final settling attempt, seed 154; median step 206.9 ms, duty 1.009; screened against the CLEAN REFERENCE median (91.8 ms), not the in-tranche median -- QUARANTINE: step 2.25x clean reference", "exp": "E34_best_s154", "exp_num": 1056, "milestone": "", "phase": "block59", "status": "quarantine", "steps": 1463, "ts_end": "2026-08-01T17:30:00Z", "ts_end_epoch": 1785605400.0, "ts_start": "", "val_bpb": 0.979682, "vram_gb": 44.0}
{"commit": "block59-E34-burst-19of20-lost", "desc": "E34 final settling attempt, seed 155; median step 150.3 ms, duty 1.006; screened against the CLEAN REFERENCE median (149.9 ms), not the in-tranche median", "exp": "E34_ctl_s155", "exp_num": 1057, "milestone": "", "phase": "block59", "status": "keep", "steps": 2007, "ts_end": "2026-08-01T17:30:00Z", "ts_end_epoch": 1785605400.0, "ts_start": "", "val_bpb": 0.93206, "vram_gb": 52.6}
{"commit": "block59-E34-burst-19of20-lost", "desc": "E34 final settling attempt, seed 155; median step 212.7 ms, duty 1.012; screened against the CLEAN REFERENCE median (91.8 ms), not the in-tranche median -- QUARANTINE: step 2.32x clean reference", "exp": "E34_best_s155", "exp_num": 1058, "milestone": "", "phase": "block59", "status": "quarantine", "steps": 1427, "ts_end": "2026-08-01T17:30:00Z", "ts_end_epoch": 1785605400.0, "ts_start": "", "val_bpb": 0.98319, "vram_gb": 44.0}
{"commit": "block59-E34-burst-19of20-lost", "desc": "E34 final settling attempt, seed 156; median step 326.5 ms, duty 1.012; screened against the CLEAN REFERENCE median (149.9 ms), not the in-tranche median -- QUARANTINE: step 2.18x clean reference", "exp": "E34_ctl_s156", "exp_num": 1059, "milestone": "", "phase": "block59", "status": "quarantine", "steps": 930, "ts_end": "2026-08-01T17:30:00Z", "ts_end_epoch": 1785605400.0, "ts_start": "", "val_bpb": 0.989879, "vram_gb": 52.6}
{"commit": "block59-E34-burst-19of20-lost", "desc": "E34 final settling attempt, seed 156; median step 136.7 ms, duty 0.963; screened against the CLEAN REFERENCE median (91.8 ms), not the in-tranche median -- QUARANTINE: step 1.49x clean reference", "exp": "E34_best_s156", "exp_num": 1060, "milestone": "", "phase": "block59", "status": "quarantine", "steps": 2113, "ts_end": "2026-08-01T17:30:00Z", "ts_end_epoch": 1785605400.0, "ts_start": "", "val_bpb": 0.95464, "vram_gb": 44.0}
{"commit": "block59-E34-burst-19of20-lost", "desc": "E34 final settling attempt, seed 157; median step 325.2 ms, duty 1.012; screened against the CLEAN REFERENCE median (149.9 ms), not the in-tranche median -- QUARANTINE: step 2.17x clean reference", "exp": "E34_ctl_s157", "exp_num": 1061, "milestone": "", "phase": "block59", "status": "quarantine", "steps": 934, "ts_end": "2026-08-01T17:30:00Z", "ts_end_epoch": 1785605400.0, "ts_start": "", "val_bpb": 0.992204, "vram_gb": 52.6}
{"commit": "block59-E34-burst-19of20-lost", "desc": "E34 final settling attempt, seed 157; median step 206.7 ms, duty 1.009; screened against the CLEAN REFERENCE median (91.8 ms), not the in-tranche median -- QUARANTINE: step 2.25x clean reference", "exp": "E34_best_s157", "exp_num": 1062, "milestone": "", "phase": "block59", "status": "quarantine", "steps": 1464, "ts_end": "2026-08-01T17:30:00Z", "ts_end_epoch": 1785605400.0, "ts_start": "", "val_bpb": 0.979084, "vram_gb": 44.0}
{"commit": "block59-E34-burst-19of20-lost", "desc": "E34 final settling attempt, seed 158; median step 150.7 ms, duty 1.005; screened against the CLEAN REFERENCE median (149.9 ms), not the in-tranche median", "exp": "E34_ctl_s158", "exp_num": 1063, "milestone": "", "phase": "block59", "status": "keep", "steps": 2001, "ts_end": "2026-08-01T17:30:00Z", "ts_end_epoch": 1785605400.0, "ts_start": "", "val_bpb": 0.933298, "vram_gb": 52.6}
{"commit": "block59-E34-burst-19of20-lost", "desc": "E34 final settling attempt, seed 158; median step 213.0 ms, duty 1.011; screened against the CLEAN REFERENCE median (91.8 ms), not the in-tranche median -- QUARANTINE: step 2.32x clean reference", "exp": "E34_best_s158", "exp_num": 1064, "milestone": "", "phase": "block59", "status": "quarantine", "steps": 1424, "ts_end": "2026-08-01T17:30:00Z", "ts_end_epoch": 1785605400.0, "ts_start": "", "val_bpb": 0.981709, "vram_gb": 44.0}
{"commit": "block59-E34-burst-19of20-lost", "desc": "E34 final settling attempt, seed 159; median step 328.2 ms, duty 1.014; screened against the CLEAN REFERENCE median (149.9 ms), not the in-tranche median -- QUARANTINE: step 2.19x clean reference", "exp": "E34_ctl_s159", "exp_num": 1065, "milestone": "", "phase": "block59", "status": "quarantine", "steps": 927, "ts_end": "2026-08-01T17:30:00Z", "ts_end_epoch": 1785605400.0, "ts_start": "", "val_bpb": 0.994692, "vram_gb": 52.6}
{"commit": "block59-E34-burst-19of20-lost", "desc": "E34 final settling attempt, seed 159; median step 91.6 ms, duty 1.000; screened against the CLEAN REFERENCE median (91.8 ms), not the in-tranche median", "exp": "E34_best_s159", "exp_num": 1066, "milestone": "", "phase": "block59", "status": "keep", "steps": 3275, "ts_end": "2026-08-01T17:30:00Z", "ts_end_epoch": 1785605400.0, "ts_start": "", "val_bpb": 0.928319, "vram_gb": 44.0}
{"commit": "block59-E34-burst-19of20-lost", "desc": "E34 final settling attempt, seed 160; median step 325.3 ms, duty 1.013; screened against the CLEAN REFERENCE median (149.9 ms), not the in-tranche median -- QUARANTINE: step 2.17x clean reference", "exp": "E34_ctl_s160", "exp_num": 1067, "milestone": "", "phase": "block59", "status": "quarantine", "steps": 934, "ts_end": "2026-08-01T17:30:00Z", "ts_end_epoch": 1785605400.0, "ts_start": "", "val_bpb": 0.994377, "vram_gb": 52.6}
{"commit": "block59-E34-burst-19of20-lost", "desc": "E34 final settling attempt, seed 160; median step 206.7 ms, duty 1.009; screened against the CLEAN REFERENCE median (91.8 ms), not the in-tranche median -- QUARANTINE: step 2.25x clean reference", "exp": "E34_best_s160", "exp_num": 1068, "milestone": "", "phase": "block59", "status": "quarantine", "steps": 1465, "ts_end": "2026-08-01T17:30:00Z", "ts_end_epoch": 1785605400.0, "ts_start": "", "val_bpb": 0.977758, "vram_gb": 44.0}
{"commit": "block59-E34-burst-19of20-lost", "desc": "E34 final settling attempt, seed 161; median step 151.4 ms, duty 1.006; screened against the CLEAN REFERENCE median (149.9 ms), not the in-tranche median", "exp": "E34_ctl_s161", "exp_num": 1069, "milestone": "", "phase": "block59", "status": "keep", "steps": 1993, "ts_end": "2026-08-01T17:30:00Z", "ts_end_epoch": 1785605400.0, "ts_start": "", "val_bpb": 0.933602, "vram_gb": 52.6}
{"commit": "block59-E34-burst-19of20-lost", "desc": "E34 final settling attempt, seed 161; median step 212.2 ms, duty 1.011; screened against the CLEAN REFERENCE median (91.8 ms), not the in-tranche median -- QUARANTINE: step 2.31x clean reference", "exp": "E34_best_s161", "exp_num": 1070, "milestone": "", "phase": "block59", "status": "quarantine", "steps": 1430, "ts_end": "2026-08-01T17:30:00Z", "ts_end_epoch": 1785605400.0, "ts_start": "", "val_bpb": 0.981759, "vram_gb": 44.0}
{"commit": "block61-E35-final-n97", "desc": "E35 final tranche of the 24h window, seed 162; frozen defaults; median step 148.9 ms, duty 1.006; 36/36 arms clean against the clean reference", "exp": "E35_ctl_s162", "exp_num": 1071, "milestone": "", "phase": "block61", "status": "keep", "steps": 2026, "ts_end": "2026-08-01T19:30:00Z", "ts_end_epoch": 1785612600.0, "ts_start": "", "val_bpb": 0.931958, "vram_gb": 52.6}
{"commit": "block61-E35-final-n97", "desc": "E35 final tranche of the 24h window, seed 162; depth 6 + MATRIX_LR 0.03; median step 91.5 ms, duty 0.987; 36/36 arms clean against the clean reference", "exp": "E35_best_s162", "exp_num": 1072, "milestone": "", "phase": "block61", "status": "keep", "steps": 3237, "ts_end": "2026-08-01T19:30:00Z", "ts_end_epoch": 1785612600.0, "ts_start": "", "val_bpb": 0.931578, "vram_gb": 44.0}
{"commit": "block61-E35-final-n97", "desc": "E35 final tranche of the 24h window, seed 163; frozen defaults; median step 151.2 ms, duty 1.005; 36/36 arms clean against the clean reference", "exp": "E35_ctl_s163", "exp_num": 1073, "milestone": "", "phase": "block61", "status": "keep", "steps": 1995, "ts_end": "2026-08-01T19:30:00Z", "ts_end_epoch": 1785612600.0, "ts_start": "", "val_bpb": 0.931903, "vram_gb": 52.6}
{"commit": "block61-E35-final-n97", "desc": "E35 final tranche of the 24h window, seed 163; depth 6 + MATRIX_LR 0.03; median step 93.8 ms, duty 0.991; 36/36 arms clean against the clean reference", "exp": "E35_best_s163", "exp_num": 1074, "milestone": "", "phase": "block61", "status": "keep", "steps": 3169, "ts_end": "2026-08-01T19:30:00Z", "ts_end_epoch": 1785612600.0, "ts_start": "", "val_bpb": 0.930942, "vram_gb": 44.0}
{"commit": "block61-E35-final-n97", "desc": "E35 final tranche of the 24h window, seed 164; frozen defaults; median step 151.5 ms, duty 1.005; 36/36 arms clean against the clean reference", "exp": "E35_ctl_s164", "exp_num": 1075, "milestone": "", "phase": "block61", "status": "keep", "steps": 1991, "ts_end": "2026-08-01T19:30:00Z", "ts_end_epoch": 1785612600.0, "ts_start": "", "val_bpb": 0.933484, "vram_gb": 52.6}
{"commit": "block61-E35-final-n97", "desc": "E35 final tranche of the 24h window, seed 164; depth 6 + MATRIX_LR 0.03; median step 91.8 ms, duty 0.987; 36/36 arms clean against the clean reference", "exp": "E35_best_s164", "exp_num": 1076, "milestone": "", "phase": "block61", "status": "keep", "steps": 3226, "ts_end": "2026-08-01T19:30:00Z", "ts_end_epoch": 1785612600.0, "ts_start": "", "val_bpb": 0.930089, "vram_gb": 44.0}
{"commit": "block61-E35-final-n97", "desc": "E35 final tranche of the 24h window, seed 165; frozen defaults; median step 149.0 ms, duty 1.005; 36/36 arms clean against the clean reference", "exp": "E35_ctl_s165", "exp_num": 1077, "milestone": "", "phase": "block61", "status": "keep", "steps": 2024, "ts_end": "2026-08-01T19:30:00Z", "ts_end_epoch": 1785612600.0, "ts_start": "", "val_bpb": 0.932023, "vram_gb": 52.6}
{"commit": "block61-E35-final-n97", "desc": "E35 final tranche of the 24h window, seed 165; depth 6 + MATRIX_LR 0.03; median step 91.5 ms, duty 0.998; 36/36 arms clean against the clean reference", "exp": "E35_best_s165", "exp_num": 1078, "milestone": "", "phase": "block61", "status": "keep", "steps": 3271, "ts_end": "2026-08-01T19:30:00Z", "ts_end_epoch": 1785612600.0, "ts_start": "", "val_bpb": 0.929657, "vram_gb": 44.0}
{"commit": "block61-E35-final-n97", "desc": "E35 final tranche of the 24h window, seed 166; frozen defaults; median step 151.3 ms, duty 1.006; 36/36 arms clean against the clean reference", "exp": "E35_ctl_s166", "exp_num": 1079, "milestone": "", "phase": "block61", "status": "keep", "steps": 1994, "ts_end": "2026-08-01T19:30:00Z", "ts_end_epoch": 1785612600.0, "ts_start": "", "val_bpb": 0.931262, "vram_gb": 52.6}
{"commit": "block61-E35-final-n97", "desc": "E35 final tranche of the 24h window, seed 166; depth 6 + MATRIX_LR 0.03; median step 93.7 ms, duty 1.001; 36/36 arms clean against the clean reference", "exp": "E35_best_s166", "exp_num": 1080, "milestone": "", "phase": "block61", "status": "keep", "steps": 3205, "ts_end": "2026-08-01T19:30:00Z", "ts_end_epoch": 1785612600.0, "ts_start": "", "val_bpb": 0.929989, "vram_gb": 44.0}
{"commit": "block61-E35-final-n97", "desc": "E35 final tranche of the 24h window, seed 167; frozen defaults; median step 151.7 ms, duty 1.006; 36/36 arms clean against the clean reference", "exp": "E35_ctl_s167", "exp_num": 1081, "milestone": "", "phase": "block61", "status": "keep", "steps": 1989, "ts_end": "2026-08-01T19:30:00Z", "ts_end_epoch": 1785612600.0, "ts_start": "", "val_bpb": 0.932827, "vram_gb": 52.6}
{"commit": "block61-E35-final-n97", "desc": "E35 final tranche of the 24h window, seed 167; depth 6 + MATRIX_LR 0.03; median step 91.9 ms, duty 0.999; 36/36 arms clean against the clean reference", "exp": "E35_best_s167", "exp_num": 1082, "milestone": "", "phase": "block61", "status": "keep", "steps": 3260, "ts_end": "2026-08-01T19:30:00Z", "ts_end_epoch": 1785612600.0, "ts_start": "", "val_bpb": 0.931, "vram_gb": 44.0}
{"commit": "block61-E35-final-n97", "desc": "E35 final tranche of the 24h window, seed 168; frozen defaults; median step 148.7 ms, duty 1.005; 36/36 arms clean against the clean reference", "exp": "E35_ctl_s168", "exp_num": 1083, "milestone": "", "phase": "block61", "status": "keep", "steps": 2028, "ts_end": "2026-08-01T19:30:00Z", "ts_end_epoch": 1785612600.0, "ts_start": "", "val_bpb": 0.933528, "vram_gb": 52.6}
{"commit": "block61-E35-final-n97", "desc": "E35 final tranche of the 24h window, seed 168; depth 6 + MATRIX_LR 0.03; median step 91.5 ms, duty 0.999; 36/36 arms clean against the clean reference", "exp": "E35_best_s168", "exp_num": 1084, "milestone": "", "phase": "block61", "status": "keep", "steps": 3275, "ts_end": "2026-08-01T19:30:00Z", "ts_end_epoch": 1785612600.0, "ts_start": "", "val_bpb": 0.928331, "vram_gb": 44.0}
{"commit": "block61-E35-final-n97", "desc": "E35 final tranche of the 24h window, seed 169; frozen defaults; median step 151.2 ms, duty 1.006; 36/36 arms clean against the clean reference", "exp": "E35_ctl_s169", "exp_num": 1085, "milestone": "", "phase": "block61", "status": "keep", "steps": 1996, "ts_end": "2026-08-01T19:30:00Z", "ts_end_epoch": 1785612600.0, "ts_start": "", "val_bpb": 0.933482, "vram_gb": 52.6}
{"commit": "block61-E35-final-n97", "desc": "E35 final tranche of the 24h window, seed 169; depth 6 + MATRIX_LR 0.03; median step 93.8 ms, duty 1.003; 36/36 arms clean against the clean reference", "exp": "E35_best_s169", "exp_num": 1086, "milestone": "", "phase": "block61", "status": "keep", "steps": 3207, "ts_end": "2026-08-01T19:30:00Z", "ts_end_epoch": 1785612600.0, "ts_start": "", "val_bpb": 0.930232, "vram_gb": 44.0}
{"commit": "block61-E35-final-n97", "desc": "E35 final tranche of the 24h window, seed 170; frozen defaults; median step 151.6 ms, duty 1.006; 36/36 arms clean against the clean reference", "exp": "E35_ctl_s170", "exp_num": 1087, "milestone": "", "phase": "block61", "status": "keep", "steps": 1990, "ts_end": "2026-08-01T19:30:00Z", "ts_end_epoch": 1785612600.0, "ts_start": "", "val_bpb": 0.932933, "vram_gb": 52.6}
{"commit": "block61-E35-final-n97", "desc": "E35 final tranche of the 24h window, seed 170; depth 6 + MATRIX_LR 0.03; median step 91.8 ms, duty 1.000; 36/36 arms clean against the clean reference", "exp": "E35_best_s170", "exp_num": 1088, "milestone": "", "phase": "block61", "status": "keep", "steps": 3267, "ts_end": "2026-08-01T19:30:00Z", "ts_end_epoch": 1785612600.0, "ts_start": "", "val_bpb": 0.929964, "vram_gb": 44.0}
{"commit": "block61-E35-final-n97", "desc": "E35 final tranche of the 24h window, seed 171; frozen defaults; median step 148.9 ms, duty 1.006; 36/36 arms clean against the clean reference", "exp": "E35_ctl_s171", "exp_num": 1089, "milestone": "", "phase": "block61", "status": "keep", "steps": 2026, "ts_end": "2026-08-01T19:30:00Z", "ts_end_epoch": 1785612600.0, "ts_start": "", "val_bpb": 0.93122, "vram_gb": 52.6}
{"commit": "block61-E35-final-n97", "desc": "E35 final tranche of the 24h window, seed 171; depth 6 + MATRIX_LR 0.03; median step 91.5 ms, duty 0.999; 36/36 arms clean against the clean reference", "exp": "E35_best_s171", "exp_num": 1090, "milestone": "", "phase": "block61", "status": "keep", "steps": 3275, "ts_end": "2026-08-01T19:30:00Z", "ts_end_epoch": 1785612600.0, "ts_start": "", "val_bpb": 0.930598, "vram_gb": 44.0}
{"commit": "block61-E35-final-n97", "desc": "E35 final tranche of the 24h window, seed 172; frozen defaults; median step 151.5 ms, duty 1.006; 36/36 arms clean against the clean reference", "exp": "E35_ctl_s172", "exp_num": 1091, "milestone": "", "phase": "block61", "status": "keep", "steps": 1992, "ts_end": "2026-08-01T19:30:00Z", "ts_end_epoch": 1785612600.0, "ts_start": "", "val_bpb": 0.933995, "vram_gb": 52.6}
{"commit": "block61-E35-final-n97", "desc": "E35 final tranche of the 24h window, seed 172; depth 6 + MATRIX_LR 0.03; median step 93.7 ms, duty 1.002; 36/36 arms clean against the clean reference", "exp": "E35_best_s172", "exp_num": 1092, "milestone": "", "phase": "block61", "status": "keep", "steps": 3207, "ts_end": "2026-08-01T19:30:00Z", "ts_end_epoch": 1785612600.0, "ts_start": "", "val_bpb": 0.931064, "vram_gb": 44.0}
{"commit": "block61-E35-final-n97", "desc": "E35 final tranche of the 24h window, seed 173; frozen defaults; median step 151.8 ms, duty 1.006; 36/36 arms clean against the clean reference", "exp": "E35_ctl_s173", "exp_num": 1093, "milestone": "", "phase": "block61", "status": "keep", "steps": 1988, "ts_end": "2026-08-01T19:30:00Z", "ts_end_epoch": 1785612600.0, "ts_start": "", "val_bpb": 0.934884, "vram_gb": 52.6}
{"commit": "block61-E35-final-n97", "desc": "E35 final tranche of the 24h window, seed 173; depth 6 + MATRIX_LR 0.03; median step 91.8 ms, duty 1.000; 36/36 arms clean against the clean reference", "exp": "E35_best_s173", "exp_num": 1094, "milestone": "", "phase": "block61", "status": "keep", "steps": 3267, "ts_end": "2026-08-01T19:30:00Z", "ts_end_epoch": 1785612600.0, "ts_start": "", "val_bpb": 0.928471, "vram_gb": 44.0}
{"commit": "block61-E35-final-n97", "desc": "E35 final tranche of the 24h window, seed 174; frozen defaults; median step 148.8 ms, duty 1.005; 36/36 arms clean against the clean reference", "exp": "E35_ctl_s174", "exp_num": 1095, "milestone": "", "phase": "block61", "status": "keep", "steps": 2027, "ts_end": "2026-08-01T19:30:00Z", "ts_end_epoch": 1785612600.0, "ts_start": "", "val_bpb": 0.932408, "vram_gb": 52.6}
{"commit": "block61-E35-final-n97", "desc": "E35 final tranche of the 24h window, seed 174; depth 6 + MATRIX_LR 0.03; median step 91.5 ms, duty 0.999; 36/36 arms clean against the clean reference", "exp": "E35_best_s174", "exp_num": 1096, "milestone": "", "phase": "block61", "status": "keep", "steps": 3277, "ts_end": "2026-08-01T19:30:00Z", "ts_end_epoch": 1785612600.0, "ts_start": "", "val_bpb": 0.929471, "vram_gb": 44.0}
{"commit": "block61-E35-final-n97", "desc": "E35 final tranche of the 24h window, seed 175; frozen defaults; median step 151.3 ms, duty 1.006; 36/36 arms clean against the clean reference", "exp": "E35_ctl_s175", "exp_num": 1097, "milestone": "", "phase": "block61", "status": "keep", "steps": 1995, "ts_end": "2026-08-01T19:30:00Z", "ts_end_epoch": 1785612600.0, "ts_start": "", "val_bpb": 0.933683, "vram_gb": 52.6}
