{"exp_num": 616, "exp": "E7_m256_sg1_s45", "val_bpb": 0.945471, "vram_gb": 55.0, "steps": 1579, "status": "keep", "desc": "E7 2x2 mechanism test: NGRAM_TABLE_MULT=256, NGRAM_SPARSE_GRAD=1, median step 191.3 ms, median MFU 15.2. Screened on median step time, not the absolute step floor, which is calibrated for mult=64 only.", "phase": "block29", "milestone": "", "ts_start": "", "ts_end": "2026-07-31T06:30:00Z", "ts_end_epoch": 1785479400.0, "commit": "block29-E7-fillflood-confirmed"}
{"exp_num": 617, "exp": "E8_base_s42", "val_bpb": 0.930797, "vram_gb": 52.6, "steps": 2029, "status": "keep", "desc": "A baseline: 14 independent hash tables, 524288 rows each; median step 148.6 ms, duty cycle 1.005", "phase": "block30", "milestone": "", "ts_start": "", "ts_end": "2026-07-31T07:40:00Z", "ts_end_epoch": 1785483600.0, "commit": "block30-E8-tngram-rejected"}
{"exp_num": 618, "exp": "E8_base_s43", "val_bpb": 0.935159, "vram_gb": 52.6, "steps": 2001, "status": "keep", "desc": "A baseline: 14 independent hash tables, 524288 rows each; median step 150.8 ms, duty cycle 1.006", "phase": "block30", "milestone": "", "ts_start": "", "ts_end": "2026-07-31T07:40:00Z", "ts_end_epoch": 1785483600.0, "commit": "block30-E8-tngram-rejected"}
{"exp_num": 619, "exp": "E8_base_s44", "val_bpb": 0.932033, "vram_gb": 52.6, "steps": 2023, "status": "keep", "desc": "A baseline: 14 independent hash tables, 524288 rows each; median step 149.1 ms, duty cycle 1.005", "phase": "block30", "milestone": "", "ts_start": "", "ts_end": "2026-07-31T07:40:00Z", "ts_end_epoch": 1785483600.0, "commit": "block30-E8-tngram-rejected"}
{"exp_num": 620, "exp": "E8_base_s45", "val_bpb": 0.932485, "vram_gb": 52.6, "steps": 2021, "status": "keep", "desc": "A baseline: 14 independent hash tables, 524288 rows each; median step 149.2 ms, duty cycle 1.005", "phase": "block30", "milestone": "", "ts_start": "", "ts_end": "2026-07-31T07:40:00Z", "ts_end_epoch": 1785483600.0, "commit": "block30-E8-tngram-rejected"}
{"exp_num": 621, "exp": "E8_base_s46", "val_bpb": 0.940946, "vram_gb": 52.6, "steps": 1778, "status": "quarantine", "desc": "A baseline: 14 independent hash tables, 524288 rows each; median step 150.6 ms, duty cycle 0.893 -- QUARANTINED: lost wall-clock outside the timed steps", "phase": "block30", "milestone": "", "ts_start": "", "ts_end": "2026-07-31T07:40:00Z", "ts_end_epoch": 1785483600.0, "commit": "block30-E8-tngram-rejected"}
{"exp_num": 622, "exp": "E8_tngram_s42", "val_bpb": 0.943382, "vram_gb": 44.2, "steps": 2109, "status": "keep", "desc": "B TN-gram: ONE shared 524288-row CP factor table + learned per-site order-absorption (~14x fewer n-gram params); median step 143.0 ms, duty cycle 1.005", "phase": "block30", "milestone": "", "ts_start": "", "ts_end": "2026-07-31T07:40:00Z", "ts_end_epoch": 1785483600.0, "commit": "block30-E8-tngram-rejected"}
{"exp_num": 623, "exp": "E8_tngram_s43", "val_bpb": 0.944098, "vram_gb": 44.2, "steps": 2107, "status": "keep", "desc": "B TN-gram: ONE shared 524288-row CP factor table + learned per-site order-absorption (~14x fewer n-gram params); median step 143.1 ms, duty cycle 1.005", "phase": "block30", "milestone": "", "ts_start": "", "ts_end": "2026-07-31T07:40:00Z", "ts_end_epoch": 1785483600.0, "commit": "block30-E8-tngram-rejected"}
{"exp_num": 624, "exp": "E8_tngram_s44", "val_bpb": 0.951813, "vram_gb": 44.2, "steps": 1806, "status": "quarantine", "desc": "B TN-gram: ONE shared 524288-row CP factor table + learned per-site order-absorption (~14x fewer n-gram params); median step 144.5 ms, duty cycle 0.870 -- QUARANTINED: lost wall-clock outside the timed steps", "phase": "block30", "milestone": "", "ts_start": "", "ts_end": "2026-07-31T07:40:00Z", "ts_end_epoch": 1785483600.0, "commit": "block30-E8-tngram-rejected"}
{"exp_num": 625, "exp": "E8_tngram_s45", "val_bpb": 0.943572, "vram_gb": 44.2, "steps": 2115, "status": "keep", "desc": "B TN-gram: ONE shared 524288-row CP factor table + learned per-site order-absorption (~14x fewer n-gram params); median step 142.5 ms, duty cycle 1.005", "phase": "block30", "milestone": "", "ts_start": "", "ts_end": "2026-07-31T07:40:00Z", "ts_end_epoch": 1785483600.0, "commit": "block30-E8-tngram-rejected"}
{"exp_num": 626, "exp": "E8_tngram_s46", "val_bpb": 0.94149, "vram_gb": 44.2, "steps": 2090, "status": "keep", "desc": "B TN-gram: ONE shared 524288-row CP factor table + learned per-site order-absorption (~14x fewer n-gram params); median step 144.3 ms, duty cycle 1.005", "phase": "block30", "milestone": "", "ts_start": "", "ts_end": "2026-07-31T07:40:00Z", "ts_end_epoch": 1785483600.0, "commit": "block30-E8-tngram-rejected"}
{"exp_num": 627, "exp": "E8_cap_s42", "val_bpb": 0.939294, "vram_gb": 42.7, "steps": 2165, "status": "keep", "desc": "C capacity control: 14 independent tables at mult=5 (573440 total rows, within 9% of B) -- no sharing; median step 139.2 ms, duty cycle 1.005", "phase": "block30", "milestone": "", "ts_start": "", "ts_end": "2026-07-31T07:40:00Z", "ts_end_epoch": 1785483600.0, "commit": "block30-E8-tngram-rejected"}
{"exp_num": 628, "exp": "E8_cap_s43", "val_bpb": 0.942421, "vram_gb": 42.7, "steps": 2186, "status": "keep", "desc": "C capacity control: 14 independent tables at mult=5 (573440 total rows, within 9% of B) -- no sharing; median step 137.8 ms, duty cycle 1.004", "phase": "block30", "milestone": "", "ts_start": "", "ts_end": "2026-07-31T07:40:00Z", "ts_end_epoch": 1785483600.0, "commit": "block30-E8-tngram-rejected"}
{"exp_num": 629, "exp": "E8_cap_s44", "val_bpb": 0.941794, "vram_gb": 42.7, "steps": 2155, "status": "keep", "desc": "C capacity control: 14 independent tables at mult=5 (573440 total rows, within 9% of B) -- no sharing; median step 139.8 ms, duty cycle 1.004", "phase": "block30", "milestone": "", "ts_start": "", "ts_end": "2026-07-31T07:40:00Z", "ts_end_epoch": 1785483600.0, "commit": "block30-E8-tngram-rejected"}
{"exp_num": 630, "exp": "E8_cap_s45", "val_bpb": 0.939967, "vram_gb": 42.7, "steps": 2181, "status": "keep", "desc": "C capacity control: 14 independent tables at mult=5 (573440 total rows, within 9% of B) -- no sharing; median step 138.2 ms, duty cycle 1.005", "phase": "block30", "milestone": "", "ts_start": "", "ts_end": "2026-07-31T07:40:00Z", "ts_end_epoch": 1785483600.0, "commit": "block30-E8-tngram-rejected"}
{"exp_num": 631, "exp": "E8_cap_s46", "val_bpb": 0.939293, "vram_gb": 42.7, "steps": 2179, "status": "keep", "desc": "C capacity control: 14 independent tables at mult=5 (573440 total rows, within 9% of B) -- no sharing; median step 138.3 ms, duty cycle 1.005", "phase": "block30", "milestone": "", "ts_start": "", "ts_end": "2026-07-31T07:40:00Z", "ts_end_epoch": 1785483600.0, "commit": "block30-E8-tngram-rejected"}
{"exp_num": 632, "exp": "E9_m128_sg0_s42", "val_bpb": 0.935062, "vram_gb": 60.0, "steps": 1875, "status": "keep", "desc": "E9 mult=128 sparse=0; median step 160.9 ms, duty 1.006. Test of paper 028's published P(m) fit. Screened on duty cycle BEFORE val_bpb was inspected.", "phase": "block31", "milestone": "", "ts_start": "", "ts_end": "2026-07-31T08:20:00Z", "ts_end_epoch": 1785486000.0, "commit": "block31-E9-Pm-confirmed"}
{"exp_num": 633, "exp": "E9_m128_sg1_s42", "val_bpb": 0.941612, "vram_gb": 60.0, "steps": 1705, "status": "keep", "desc": "E9 mult=128 sparse=1; median step 176.9 ms, duty 1.005. Test of paper 028's published P(m) fit. Screened on duty cycle BEFORE val_bpb was inspected.", "phase": "block31", "milestone": "", "ts_start": "", "ts_end": "2026-07-31T08:20:00Z", "ts_end_epoch": 1785486000.0, "commit": "block31-E9-Pm-confirmed"}
{"exp_num": 634, "exp": "E9_m128_sg0_s43", "val_bpb": 0.939915, "vram_gb": 60.0, "steps": 1815, "status": "keep", "desc": "E9 mult=128 sparse=0; median step 162.5 ms, duty 0.983. Test of paper 028's published P(m) fit. Screened on duty cycle BEFORE val_bpb was inspected.", "phase": "block31", "milestone": "", "ts_start": "", "ts_end": "2026-07-31T08:20:00Z", "ts_end_epoch": 1785486000.0, "commit": "block31-E9-Pm-confirmed"}
{"exp_num": 635, "exp": "E9_m128_sg1_s43", "val_bpb": 0.945294, "vram_gb": 60.0, "steps": 1686, "status": "keep", "desc": "E9 mult=128 sparse=1; median step 178.6 ms, duty 1.004. Test of paper 028's published P(m) fit. Screened on duty cycle BEFORE val_bpb was inspected.", "phase": "block31", "milestone": "", "ts_start": "", "ts_end": "2026-07-31T08:20:00Z", "ts_end_epoch": 1785486000.0, "commit": "block31-E9-Pm-confirmed"}
{"exp_num": 636, "exp": "E9_m128_sg0_s44", "val_bpb": 0.935817, "vram_gb": 60.0, "steps": 1855, "status": "keep", "desc": "E9 mult=128 sparse=0; median step 161.9 ms, duty 1.001. Test of paper 028's published P(m) fit. Screened on duty cycle BEFORE val_bpb was inspected.", "phase": "block31", "milestone": "", "ts_start": "", "ts_end": "2026-07-31T08:20:00Z", "ts_end_epoch": 1785486000.0, "commit": "block31-E9-Pm-confirmed"}
{"exp_num": 637, "exp": "E9_m128_sg1_s44", "val_bpb": 0.941423, "vram_gb": 60.0, "steps": 1713, "status": "keep", "desc": "E9 mult=128 sparse=1; median step 176.2 ms, duty 1.006. Test of paper 028's published P(m) fit. Screened on duty cycle BEFORE val_bpb was inspected.", "phase": "block31", "milestone": "", "ts_start": "", "ts_end": "2026-07-31T08:20:00Z", "ts_end_epoch": 1785486000.0, "commit": "block31-E9-Pm-confirmed"}
{"exp_num": 638, "exp": "E9_m128_sg0_s45", "val_bpb": 0.935206, "vram_gb": 60.0, "steps": 1874, "status": "keep", "desc": "E9 mult=128 sparse=0; median step 161.1 ms, duty 1.006. Test of paper 028's published P(m) fit. Screened on duty cycle BEFORE val_bpb was inspected.", "phase": "block31", "milestone": "", "ts_start": "", "ts_end": "2026-07-31T08:20:00Z", "ts_end_epoch": 1785486000.0, "commit": "block31-E9-Pm-confirmed"}
{"exp_num": 639, "exp": "E9_m128_sg1_s45", "val_bpb": 0.941945, "vram_gb": 60.0, "steps": 1698, "status": "keep", "desc": "E9 mult=128 sparse=1; median step 177.9 ms, duty 1.007. Test of paper 028's published P(m) fit. Screened on duty cycle BEFORE val_bpb was inspected.", "phase": "block31", "milestone": "", "ts_start": "", "ts_end": "2026-07-31T08:20:00Z", "ts_end_epoch": 1785486000.0, "commit": "block31-E9-Pm-confirmed"}
{"exp_num": 640, "exp": "E10_depth8_s42", "val_bpb": 0.931274, "vram_gb": 52.6, "steps": 2029, "status": "keep", "desc": "E10 compute-optimal shape: DEPTH=8, dim=768; median step 148.6 ms, duty 1.005, 299M tokens", "phase": "block32", "milestone": "", "ts_start": "", "ts_end": "2026-07-31T09:10:00Z", "ts_end_epoch": 1785488400.0, "commit": "block32-E10-depth-sweep"}
{"exp_num": 641, "exp": "E10_depth7_s42", "val_bpb": 0.931622, "vram_gb": 50.0, "steps": 2249, "status": "keep", "desc": "E10 compute-optimal shape: DEPTH=7, dim=768; median step 134.0 ms, duty 1.005, 332M tokens", "phase": "block32", "milestone": "", "ts_start": "", "ts_end": "2026-07-31T09:10:00Z", "ts_end_epoch": 1785488400.0, "commit": "block32-E10-depth-sweep"}
{"exp_num": 642, "exp": "E10_depth6_s42", "val_bpb": 0.929685, "vram_gb": 44.0, "steps": 3266, "status": "keep", "desc": "E10 compute-optimal shape: DEPTH=6, dim=640; median step 91.8 ms, duty 0.999, 482M tokens", "phase": "block32", "milestone": "", "ts_start": "", "ts_end": "2026-07-31T09:10:00Z", "ts_end_epoch": 1785488400.0, "commit": "block32-E10-depth-sweep"}
{"exp_num": 643, "exp": "E10_depth5_s42", "val_bpb": 0.978808, "vram_gb": 38.0, "steps": 4553, "status": "keep", "desc": "E10 compute-optimal shape: DEPTH=5, dim=512; median step 63.0 ms, duty 0.956, 671M tokens", "phase": "block32", "milestone": "", "ts_start": "", "ts_end": "2026-07-31T09:10:00Z", "ts_end_epoch": 1785488400.0, "commit": "block32-E10-depth-sweep"}
{"exp_num": 644, "exp": "E10_depth8_s43", "val_bpb": 0.934144, "vram_gb": 52.6, "steps": 2023, "status": "keep", "desc": "E10 compute-optimal shape: DEPTH=8, dim=768; median step 149.2 ms, duty 1.006, 298M tokens", "phase": "block32", "milestone": "", "ts_start": "", "ts_end": "2026-07-31T09:10:00Z", "ts_end_epoch": 1785488400.0, "commit": "block32-E10-depth-sweep"}
{"exp_num": 645, "exp": "E10_depth7_s43", "val_bpb": 0.931403, "vram_gb": 50.0, "steps": 2254, "status": "keep", "desc": "E10 compute-optimal shape: DEPTH=7, dim=768; median step 133.8 ms, duty 1.005, 332M tokens", "phase": "block32", "milestone": "", "ts_start": "", "ts_end": "2026-07-31T09:10:00Z", "ts_end_epoch": 1785488400.0, "commit": "block32-E10-depth-sweep"}
{"exp_num": 646, "exp": "E10_depth6_s43", "val_bpb": 0.929339, "vram_gb": 44.0, "steps": 3288, "status": "keep", "desc": "E10 compute-optimal shape: DEPTH=6, dim=640; median step 91.0 ms, duty 0.997, 485M tokens", "phase": "block32", "milestone": "", "ts_start": "", "ts_end": "2026-07-31T09:10:00Z", "ts_end_epoch": 1785488400.0, "commit": "block32-E10-depth-sweep"}
{"exp_num": 647, "exp": "E10_depth5_s43", "val_bpb": 0.978371, "vram_gb": 38.0, "steps": 4417, "status": "keep", "desc": "E10 compute-optimal shape: DEPTH=5, dim=512; median step 65.3 ms, duty 0.961, 651M tokens", "phase": "block32", "milestone": "", "ts_start": "", "ts_end": "2026-07-31T09:10:00Z", "ts_end_epoch": 1785488400.0, "commit": "block32-E10-depth-sweep"}
{"exp_num": 648, "exp": "E10_depth8_s44", "val_bpb": 0.93239, "vram_gb": 52.6, "steps": 2003, "status": "keep", "desc": "E10 compute-optimal shape: DEPTH=8, dim=768; median step 150.6 ms, duty 1.006, 295M tokens", "phase": "block32", "milestone": "", "ts_start": "", "ts_end": "2026-07-31T09:10:00Z", "ts_end_epoch": 1785488400.0, "commit": "block32-E10-depth-sweep"}
{"exp_num": 649, "exp": "E10_depth7_s44", "val_bpb": 0.930996, "vram_gb": 50.0, "steps": 2248, "status": "keep", "desc": "E10 compute-optimal shape: DEPTH=7, dim=768; median step 134.1 ms, duty 1.005, 331M tokens", "phase": "block32", "milestone": "", "ts_start": "", "ts_end": "2026-07-31T09:10:00Z", "ts_end_epoch": 1785488400.0, "commit": "block32-E10-depth-sweep"}
{"exp_num": 650, "exp": "E10_depth6_s44", "val_bpb": 0.928555, "vram_gb": 44.0, "steps": 3287, "status": "keep", "desc": "E10 compute-optimal shape: DEPTH=6, dim=640; median step 91.0 ms, duty 0.997, 485M tokens", "phase": "block32", "milestone": "", "ts_start": "", "ts_end": "2026-07-31T09:10:00Z", "ts_end_epoch": 1785488400.0, "commit": "block32-E10-depth-sweep"}
{"exp_num": 651, "exp": "E10_depth5_s44", "val_bpb": 0.978482, "vram_gb": 38.0, "steps": 4395, "status": "keep", "desc": "E10 compute-optimal shape: DEPTH=5, dim=512; median step 66.1 ms, duty 0.968, 648M tokens", "phase": "block32", "milestone": "", "ts_start": "", "ts_end": "2026-07-31T09:10:00Z", "ts_end_epoch": 1785488400.0, "commit": "block32-E10-depth-sweep"}
{"exp_num": 652, "exp": "E10_depth8_s45", "val_bpb": 0.933003, "vram_gb": 52.6, "steps": 2011, "status": "keep", "desc": "E10 compute-optimal shape: DEPTH=8, dim=768; median step 150.0 ms, duty 1.006, 297M tokens", "phase": "block32", "milestone": "", "ts_start": "", "ts_end": "2026-07-31T09:10:00Z", "ts_end_epoch": 1785488400.0, "commit": "block32-E10-depth-sweep"}
{"exp_num": 653, "exp": "E10_depth7_s45", "val_bpb": 0.932263, "vram_gb": 50.0, "steps": 2229, "status": "keep", "desc": "E10 compute-optimal shape: DEPTH=7, dim=768; median step 135.2 ms, duty 1.005, 329M tokens", "phase": "block32", "milestone": "", "ts_start": "", "ts_end": "2026-07-31T09:10:00Z", "ts_end_epoch": 1785488400.0, "commit": "block32-E10-depth-sweep"}
{"exp_num": 654, "exp": "E10_depth6_s45", "val_bpb": 0.930226, "vram_gb": 44.0, "steps": 3276, "status": "keep", "desc": "E10 compute-optimal shape: DEPTH=6, dim=640; median step 91.4 ms, duty 0.998, 483M tokens", "phase": "block32", "milestone": "", "ts_start": "", "ts_end": "2026-07-31T09:10:00Z", "ts_end_epoch": 1785488400.0, "commit": "block32-E10-depth-sweep"}
{"exp_num": 655, "exp": "E10_depth5_s45", "val_bpb": 0.978036, "vram_gb": 38.0, "steps": 4749, "status": "keep", "desc": "E10 compute-optimal shape: DEPTH=5, dim=512; median step 60.7 ms, duty 0.961, 700M tokens", "phase": "block32", "milestone": "", "ts_start": "", "ts_end": "2026-07-31T09:10:00Z", "ts_end_epoch": 1785488400.0, "commit": "block32-E10-depth-sweep"}
{"exp_num": 656, "exp": "E11_depth8_s46", "val_bpb": 0.931311, "vram_gb": 52.6, "steps": 2031, "status": "keep", "desc": "E11 depth 8 n=10 extension; median step 148.5 ms, duty 1.005, 0.99x cell median", "phase": "block33", "milestone": "", "ts_start": "", "ts_end": "2026-07-31T10:00:00Z", "ts_end_epoch": 1785492000.0, "commit": "block33-E11-screen-v3"}
{"exp_num": 657, "exp": "E11_depth6_s46", "val_bpb": 0.930276, "vram_gb": 44.0, "steps": 3289, "status": "keep", "desc": "E11 depth 6 n=10 extension; median step 91.1 ms, duty 0.999, 0.99x cell median", "phase": "block33", "milestone": "", "ts_start": "", "ts_end": "2026-07-31T10:00:00Z", "ts_end_epoch": 1785492000.0, "commit": "block33-E11-screen-v3"}
{"exp_num": 658, "exp": "E11_depth8_s47", "val_bpb": 0.931507, "vram_gb": 52.6, "steps": 2012, "status": "keep", "desc": "E11 depth 8 n=10 extension; median step 149.9 ms, duty 1.005, 1.00x cell median", "phase": "block33", "milestone": "", "ts_start": "", "ts_end": "2026-07-31T10:00:00Z", "ts_end_epoch": 1785492000.0, "commit": "block33-E11-screen-v3"}
{"exp_num": 659, "exp": "E11_depth6_s47", "val_bpb": 0.929347, "vram_gb": 44.0, "steps": 3251, "status": "keep", "desc": "E11 depth 6 n=10 extension; median step 92.2 ms, duty 0.999, 1.00x cell median", "phase": "block33", "milestone": "", "ts_start": "", "ts_end": "2026-07-31T10:00:00Z", "ts_end_epoch": 1785492000.0, "commit": "block33-E11-screen-v3"}
{"exp_num": 660, "exp": "E11_depth8_s48", "val_bpb": 0.930998, "vram_gb": 52.6, "steps": 2023, "status": "keep", "desc": "E11 depth 8 n=10 extension; median step 149.1 ms, duty 1.005, 0.99x cell median", "phase": "block33", "milestone": "", "ts_start": "", "ts_end": "2026-07-31T10:00:00Z", "ts_end_epoch": 1785492000.0, "commit": "block33-E11-screen-v3"}
{"exp_num": 661, "exp": "E11_depth6_s48", "val_bpb": 0.953235, "vram_gb": 44.0, "steps": 2205, "status": "quarantine", "desc": "E11 depth 6 n=10 extension; median step 91.7 ms, duty 0.674, 1.00x cell median -- QUARANTINE: duty 0.674", "phase": "block33", "milestone": "", "ts_start": "", "ts_end": "2026-07-31T10:00:00Z", "ts_end_epoch": 1785492000.0, "commit": "block33-E11-screen-v3"}
{"exp_num": 662, "exp": "E11_depth8_s49", "val_bpb": 0.945324, "vram_gb": 52.6, "steps": 1668, "status": "quarantine", "desc": "E11 depth 8 n=10 extension; median step 150.2 ms, duty 0.835, 1.00x cell median -- QUARANTINE: duty 0.835", "phase": "block33", "milestone": "", "ts_start": "", "ts_end": "2026-07-31T10:00:00Z", "ts_end_epoch": 1785492000.0, "commit": "block33-E11-screen-v3"}
{"exp_num": 663, "exp": "E11_depth6_s49", "val_bpb": 0.952156, "vram_gb": 44.0, "steps": 2189, "status": "quarantine", "desc": "E11 depth 6 n=10 extension; median step 92.6 ms, duty 0.676, 1.01x cell median -- QUARANTINE: duty 0.676", "phase": "block33", "milestone": "", "ts_start": "", "ts_end": "2026-07-31T10:00:00Z", "ts_end_epoch": 1785492000.0, "commit": "block33-E11-screen-v3"}
{"exp_num": 664, "exp": "E11_depth8_s50", "val_bpb": 0.943893, "vram_gb": 52.6, "steps": 1654, "status": "quarantine", "desc": "E11 depth 8 n=10 extension; median step 151.4 ms, duty 0.835, 1.01x cell median -- QUARANTINE: duty 0.835", "phase": "block33", "milestone": "", "ts_start": "", "ts_end": "2026-07-31T10:00:00Z", "ts_end_epoch": 1785492000.0, "commit": "block33-E11-screen-v3"}
{"exp_num": 665, "exp": "E11_depth6_s50", "val_bpb": 0.952169, "vram_gb": 44.0, "steps": 2211, "status": "quarantine", "desc": "E11 depth 6 n=10 extension; median step 91.9 ms, duty 0.677, 1.00x cell median -- QUARANTINE: duty 0.677", "phase": "block33", "milestone": "", "ts_start": "", "ts_end": "2026-07-31T10:00:00Z", "ts_end_epoch": 1785492000.0, "commit": "block33-E11-screen-v3"}
{"exp_num": 666, "exp": "E11_depth8_s51", "val_bpb": 0.953284, "vram_gb": 52.6, "steps": 1478, "status": "quarantine", "desc": "E11 depth 8 n=10 extension; median step 204.3 ms, duty 1.007, 1.36x cell median -- QUARANTINE: step time 1.36x cell median", "phase": "block33", "milestone": "", "ts_start": "", "ts_end": "2026-07-31T10:00:00Z", "ts_end_epoch": 1785492000.0, "commit": "block33-E11-screen-v3"}
{"exp_num": 667, "exp": "E11_depth6_s51", "val_bpb": 0.973186, "vram_gb": 44.0, "steps": 1598, "status": "quarantine", "desc": "E11 depth 6 n=10 extension; median step 192.4 ms, duty 1.025, 2.10x cell median -- QUARANTINE: step time 2.10x cell median", "phase": "block33", "milestone": "", "ts_start": "", "ts_end": "2026-07-31T10:00:00Z", "ts_end_epoch": 1785492000.0, "commit": "block33-E11-screen-v3"}
{"exp_num": 668, "exp": "E12_depth8_s48", "val_bpb": 0.930942, "vram_gb": 52.6, "steps": 2029, "status": "keep", "desc": "E12 depth 8 (probe-gated launch); median step 148.7 ms, duty 1.006, 0.99x cell median", "phase": "block34", "milestone": "", "ts_start": "", "ts_end": "2026-07-31T18:00:00Z", "ts_end_epoch": 1785520800.0, "commit": "block34-E12-probe-gated"}
{"exp_num": 669, "exp": "E12_depth6_s48", "val_bpb": 0.931074, "vram_gb": 44.0, "steps": 3254, "status": "keep", "desc": "E12 depth 6 (probe-gated launch); median step 91.2 ms, duty 0.989, 1.00x cell median", "phase": "block34", "milestone": "", "ts_start": "", "ts_end": "2026-07-31T18:00:00Z", "ts_end_epoch": 1785520800.0, "commit": "block34-E12-probe-gated"}
{"exp_num": 670, "exp": "E12_depth8_s49", "val_bpb": 0.932864, "vram_gb": 52.6, "steps": 2008, "status": "keep", "desc": "E12 depth 8 (probe-gated launch); median step 150.2 ms, duty 1.005, 1.00x cell median", "phase": "block34", "milestone": "", "ts_start": "", "ts_end": "2026-07-31T18:00:00Z", "ts_end_epoch": 1785520800.0, "commit": "block34-E12-probe-gated"}
