{"exp_num": 0, "exp": "exp000_baseline", "val_bpb": 1.030094, "vram_gb": 44.0, "steps": 671, "status": "baseline", "desc": "naive baseline (cold first run, 671 steps)", "phase": "0", "ts_start": "2026-07-27T11:27:56Z", "ts_end": "2026-07-27T11:33:33Z", "ts_end_epoch": 1785152013.0, "commit": "baseline", "change": "naive baseline"}
{"exp_num": 1, "exp": "exp001_matrixlr05", "val_bpb": 0.986235, "vram_gb": 44.0, "steps": 1024, "status": "pilot", "desc": "refine matrix_lr 0.05 (1024 steps vs base 671 \u2014 throughput confound)", "phase": "1", "ts_start": "2026-07-27T11:35:00Z", "ts_end": "2026-07-27T11:39:17Z", "ts_end_epoch": 1785152357.0, "commit": "b1e001", "milestone": "torch.compile (warm cache)", "change": "torch.compile (warm cache)"}
{"exp_num": 2, "exp": "exp002_matrixlr06", "val_bpb": 0.986569, "vram_gb": 44.0, "steps": 1020, "status": "pilot", "desc": "refine matrix_lr 0.06", "phase": "1", "ts_start": "2026-07-27T11:35:00Z", "ts_end": "2026-07-27T11:39:17Z", "ts_end_epoch": 1785152357.0, "commit": "b1e002"}
{"exp_num": 3, "exp": "exp003_matrixlr03", "val_bpb": 0.98813, "vram_gb": 44.0, "steps": 999, "status": "pilot", "desc": "refine matrix_lr 0.03", "phase": "1", "ts_start": "2026-07-27T11:35:00Z", "ts_end": "2026-07-27T11:39:17Z", "ts_end_epoch": 1785152357.0, "commit": "b1e003"}
{"exp_num": 4, "exp": "exp004_emblr08", "val_bpb": 0.987681, "vram_gb": 44.0, "steps": 973, "status": "pilot", "desc": "refine embedding_lr 0.8", "phase": "1", "ts_start": "2026-07-27T11:35:00Z", "ts_end": "2026-07-27T11:39:17Z", "ts_end_epoch": 1785152357.0, "commit": "b1e004"}
{"exp_num": 5, "exp": "exp005_emblr045", "val_bpb": 0.987529, "vram_gb": 44.0, "steps": 999, "status": "pilot", "desc": "refine embedding_lr 0.45", "phase": "1", "ts_start": "2026-07-27T11:35:00Z", "ts_end": "2026-07-27T11:39:18Z", "ts_end_epoch": 1785152358.0, "commit": "b1e005"}
{"exp_num": 6, "exp": "exp006_warmdown04", "val_bpb": 0.987637, "vram_gb": 44.0, "steps": 1012, "status": "pilot", "desc": "refine warmdown 0.4", "phase": "1", "ts_start": "2026-07-27T11:35:00Z", "ts_end": "2026-07-27T11:39:17Z", "ts_end_epoch": 1785152357.0, "commit": "b1e006"}
{"exp_num": 7, "exp": "exp007_warmdown06", "val_bpb": 0.987362, "vram_gb": 44.0, "steps": 1012, "status": "pilot", "desc": "refine warmdown 0.6", "phase": "1", "ts_start": "2026-07-27T11:35:00Z", "ts_end": "2026-07-27T11:40:29Z", "ts_end_epoch": 1785152429.0, "commit": "b1e007"}
{"exp_num": 0, "exp": "exp008_base_s42", "val_bpb": 0.987325, "vram_gb": 44.0, "steps": 1009, "status": "pilot", "desc": "baseline warm s42", "phase": "1", "ts_start": "", "ts_end": "2026-07-27T11:49:19Z", "ts_end_epoch": 1785152959.0, "commit": "b2e008", "change": "baseline config (warm)"}
{"exp_num": 0, "exp": "exp009_base_s43", "val_bpb": 0.989363, "vram_gb": 44.0, "steps": 1022, "status": "pilot", "desc": "baseline warm s43", "phase": "1", "ts_start": "", "ts_end": "2026-07-27T11:49:19Z", "ts_end_epoch": 1785152959.0, "commit": "b2e009", "change": "baseline config (warm)"}
{"exp_num": 0, "exp": "exp010_base_s44", "val_bpb": 0.986351, "vram_gb": 44.0, "steps": 1019, "status": "pilot", "desc": "baseline warm s44", "phase": "1", "ts_start": "", "ts_end": "2026-07-27T11:49:19Z", "ts_end_epoch": 1785152959.0, "commit": "b2e010", "change": "baseline config (warm)"}
{"exp_num": 8, "exp": "exp011_mlr05_s42", "val_bpb": 0.987799, "vram_gb": 44.0, "steps": 1002, "status": "discard", "desc": "matrix_lr 0.05 s42 (rejected 3-seed)", "phase": "1", "ts_start": "", "ts_end": "2026-07-27T11:49:19Z", "ts_end_epoch": 1785152959.0, "commit": "b2e011"}
{"exp_num": 9, "exp": "exp012_mlr05_s43", "val_bpb": 0.992086, "vram_gb": 44.0, "steps": 975, "status": "discard", "desc": "matrix_lr 0.05 s43", "phase": "1", "ts_start": "", "ts_end": "2026-07-27T11:49:19Z", "ts_end_epoch": 1785152959.0, "commit": "b2e012"}
{"exp_num": 10, "exp": "exp013_mlr05_s44", "val_bpb": 0.98795, "vram_gb": 44.0, "steps": 998, "status": "discard", "desc": "matrix_lr 0.05 s44", "phase": "1", "ts_start": "", "ts_end": "2026-07-27T11:49:19Z", "ts_end_epoch": 1785152959.0, "commit": "b2e013"}
{"exp_num": 11, "exp": "exp014_mlr06_s42", "val_bpb": 0.987147, "vram_gb": 44.0, "steps": 1012, "status": "pilot", "desc": "matrix_lr 0.06 s42 (inconclusive 1-seed)", "phase": "1", "ts_start": "", "ts_end": "2026-07-27T11:49:19Z", "ts_end_epoch": 1785152959.0, "commit": "b2e014"}
{"exp_num": 12, "exp": "exp015_wd010", "val_bpb": 0.987761, "vram_gb": 44.0, "steps": 1011, "status": "pilot", "desc": "weight_decay 0.1", "phase": "1", "ts_start": "", "ts_end": "2026-07-27T11:59:59Z", "ts_end_epoch": 1785153599.0, "commit": "b3e015"}
{"exp_num": 13, "exp": "exp016_wd035", "val_bpb": 0.986998, "vram_gb": 44.0, "steps": 1024, "status": "pilot", "desc": "weight_decay 0.35", "phase": "1", "ts_start": "", "ts_end": "2026-07-27T11:59:59Z", "ts_end_epoch": 1785153599.0, "commit": "b3e016"}
{"exp_num": 14, "exp": "exp017_unemb006", "val_bpb": 0.986434, "vram_gb": 44.0, "steps": 1017, "status": "pilot", "desc": "unembedding_lr 0.006", "phase": "1", "ts_start": "", "ts_end": "2026-07-27T11:59:59Z", "ts_end_epoch": 1785153599.0, "commit": "b3e017"}
{"exp_num": 15, "exp": "exp018_scalar03", "val_bpb": 0.986702, "vram_gb": 44.0, "steps": 1002, "status": "pilot", "desc": "scalar_lr 0.3", "phase": "1", "ts_start": "", "ts_end": "2026-07-27T11:59:59Z", "ts_end_epoch": 1785153599.0, "commit": "b3e018"}
{"exp_num": 16, "exp": "exp019_beta109", "val_bpb": 0.990374, "vram_gb": 44.0, "steps": 976, "status": "discard", "desc": "Adam beta1 0.9 (worse)", "phase": "1", "ts_start": "", "ts_end": "2026-07-27T11:59:59Z", "ts_end_epoch": 1785153599.0, "commit": "b3e019"}
{"exp_num": 17, "exp": "exp020_warmup05", "val_bpb": 0.989167, "vram_gb": 44.0, "steps": 995, "status": "discard", "desc": "warmup 0.05 (worse)", "phase": "1", "ts_start": "", "ts_end": "2026-07-27T11:59:59Z", "ts_end_epoch": 1785153599.0, "commit": "b3e020"}
{"exp_num": 18, "exp": "exp021_devbatch256", "val_bpb": 0.986751, "vram_gb": 95.8, "steps": 1018, "status": "discard", "desc": "device_batch 256 no throughput gain 2x vram", "phase": "1", "ts_start": "", "ts_end": "2026-07-27T12:00:15Z", "ts_end_epoch": 1785153615.0, "commit": "b3e021"}
{"exp_num": 19, "exp": "exp022_depth10", "val_bpb": 0.990823, "vram_gb": 66.5, "steps": 609, "status": "discard", "desc": "depth 10 (fewer steps)", "phase": "1", "ts_start": "", "ts_end": "2026-07-27T12:07:42Z", "ts_end_epoch": 1785154062.0, "commit": "b4e022"}
{"exp_num": 20, "exp": "exp023_depth6", "val_bpb": 1.022171, "vram_gb": 26.6, "steps": 1401, "status": "discard", "desc": "depth 6 (too small)", "phase": "1", "ts_start": "", "ts_end": "2026-07-27T12:07:25Z", "ts_end_epoch": 1785154045.0, "commit": "b4e023"}
{"exp_num": 21, "exp": "exp024_tbs18", "val_bpb": 0.978375, "vram_gb": 43.9, "steps": 2020, "status": "keep", "desc": "TOTAL_BATCH 2^18 (-0.0093 win pending 3-seed)", "phase": "1", "ts_start": "", "ts_end": "2026-07-27T12:07:07Z", "ts_end_epoch": 1785154027.0, "commit": "b4e024", "milestone": "batch 2\u00b9\u2079\u21922\u00b9\u2078", "change": "batch size 2^19\u21922^18"}
{"exp_num": 22, "exp": "exp025_tbs20", "val_bpb": 1.013104, "vram_gb": 44.0, "steps": 506, "status": "discard", "desc": "batch 2^20 (worse)", "phase": "1", "ts_start": "", "ts_end": "2026-07-27T12:07:12Z", "ts_end_epoch": 1785154032.0, "commit": "b4e025"}
{"exp_num": 23, "exp": "exp026_windowL", "val_bpb": 0.99075, "vram_gb": 44.0, "steps": 951, "status": "discard", "desc": "window all-L", "phase": "1", "ts_start": "", "ts_end": "2026-07-27T12:07:23Z", "ts_end_epoch": 1785154043.0, "commit": "b4e026"}
{"exp_num": 24, "exp": "exp027_aspect96", "val_bpb": 1.033791, "vram_gb": 64.2, "steps": 576, "status": "discard", "desc": "aspect_ratio 96 wider", "phase": "1", "ts_start": "", "ts_end": "2026-07-27T12:07:37Z", "ts_end_epoch": 1785154057.0, "commit": "b4e027"}
{"exp_num": 25, "exp": "exp028_depth12", "val_bpb": 1.0052, "vram_gb": 94.0, "steps": 405, "status": "discard", "desc": "depth 12 deepest", "phase": "1", "ts_start": "", "ts_end": "2026-07-27T12:07:51Z", "ts_end_epoch": 1785154071.0, "commit": "b4e028"}
{"exp_num": 26, "exp": "exp029_tbs18_s42", "val_bpb": 0.97884, "vram_gb": 43.9, "steps": 2001, "status": "keep", "desc": "tbs2^18 confirm s42", "phase": "1", "ts_start": "", "ts_end": "2026-07-27T12:14:32Z", "ts_end_epoch": 1785154472.0, "commit": "b5e029"}
{"exp_num": 27, "exp": "exp030_tbs18_s43", "val_bpb": 0.981356, "vram_gb": 43.9, "steps": 2013, "status": "keep", "desc": "tbs2^18 confirm s43", "phase": "1", "ts_start": "", "ts_end": "2026-07-27T12:14:33Z", "ts_end_epoch": 1785154473.0, "commit": "b5e030"}
{"exp_num": 28, "exp": "exp031_tbs18_s44", "val_bpb": 0.978776, "vram_gb": 43.9, "steps": 2014, "status": "keep", "desc": "tbs2^18 confirm s44", "phase": "1", "ts_start": "", "ts_end": "2026-07-27T12:14:32Z", "ts_end_epoch": 1785154472.0, "commit": "b5e031"}
{"exp_num": 29, "exp": "exp032_tbs17_s42", "val_bpb": 0.985983, "vram_gb": 43.9, "steps": 3807, "status": "discard", "desc": "tbs2^17 db64 (worse than 2^18)", "phase": "1", "ts_start": "", "ts_end": "2026-07-27T12:17:13Z", "ts_end_epoch": 1785154633.0, "commit": "b5e032"}
{"exp_num": 30, "exp": "exp033_tbs17_s43", "val_bpb": 0.987357, "vram_gb": 43.9, "steps": 3707, "status": "discard", "desc": "tbs2^17 db64 s43", "phase": "1", "ts_start": "", "ts_end": "2026-07-27T12:17:13Z", "ts_end_epoch": 1785154633.0, "commit": "b5e033"}
{"exp_num": 31, "exp": "exp034_tbs17_s44", "val_bpb": 0.985692, "vram_gb": 43.9, "steps": 3765, "status": "discard", "desc": "tbs2^17 db64 s44", "phase": "1", "ts_start": "", "ts_end": "2026-07-27T12:17:12Z", "ts_end_epoch": 1785154632.0, "commit": "b5e034"}
{"exp_num": 32, "exp": "exp035_tbs16_s42", "val_bpb": 1.000708, "vram_gb": 43.9, "steps": 6881, "status": "discard", "desc": "tbs2^16 db32 too small", "phase": "1", "ts_start": "", "ts_end": "2026-07-27T12:17:13Z", "ts_end_epoch": 1785154633.0, "commit": "b5e035"}
{"exp_num": 33, "exp": "exp036_t18_mlr05", "val_bpb": 0.979834, "vram_gb": 43.9, "steps": 2005, "status": "pilot", "desc": "matrix_lr 0.05 @2^18", "phase": "1", "ts_start": "", "ts_end": "2026-07-27T12:27:19Z", "ts_end_epoch": 1785155239.0, "commit": "b6e036"}
{"exp_num": 34, "exp": "exp037_t18_mlr03", "val_bpb": 0.977569, "vram_gb": 43.9, "steps": 2024, "status": "pilot", "desc": "matrix_lr 0.03 @2^18 (promising)", "phase": "1", "ts_start": "", "ts_end": "2026-07-27T12:27:19Z", "ts_end_epoch": 1785155239.0, "commit": "b6e037"}
{"exp_num": 35, "exp": "exp038_t18_emb08", "val_bpb": 0.977905, "vram_gb": 43.9, "steps": 2014, "status": "pilot", "desc": "embedding_lr 0.8 @2^18 (promising)", "phase": "1", "ts_start": "", "ts_end": "2026-07-27T12:27:19Z", "ts_end_epoch": 1785155239.0, "commit": "b6e038"}
{"exp_num": 36, "exp": "exp039_t18_wd04", "val_bpb": 0.980173, "vram_gb": 43.9, "steps": 1988, "status": "discard", "desc": "warmdown 0.4 @2^18", "phase": "1", "ts_start": "", "ts_end": "2026-07-27T12:27:19Z", "ts_end_epoch": 1785155239.0, "commit": "b6e039"}
{"exp_num": 37, "exp": "exp040_t18_wd010", "val_bpb": 0.97898, "vram_gb": 43.9, "steps": 1937, "status": "pilot", "desc": "weight_decay 0.1 @2^18", "phase": "1", "ts_start": "", "ts_end": "2026-07-27T12:27:19Z", "ts_end_epoch": 1785155239.0, "commit": "b6e040"}
{"exp_num": 38, "exp": "exp041_t18b_196k", "val_bpb": 0.981074, "vram_gb": 43.9, "steps": 2603, "status": "discard", "desc": "batch 196k (worse than 2^18)", "phase": "1", "ts_start": "", "ts_end": "2026-07-27T12:27:34Z", "ts_end_epoch": 1785155254.0, "commit": "b6e041"}
{"exp_num": 39, "exp": "exp042_t18_s45", "val_bpb": 0.979406, "vram_gb": 43.9, "steps": 2005, "status": "pilot", "desc": "tbs2^18 base s45", "phase": "1", "ts_start": "", "ts_end": "2026-07-27T12:27:19Z", "ts_end_epoch": 1785155239.0, "commit": "b6e042"}
{"exp_num": 40, "exp": "exp043_mlr03_s43", "val_bpb": 0.982521, "vram_gb": 43.9, "steps": 2000, "status": "pilot", "desc": "matrix_lr 0.03 s43 (reject 3-seed)", "phase": "1", "ts_start": "", "ts_end": "2026-07-27T12:34:10Z", "ts_end_epoch": 1785155650.0, "commit": "b7e043"}
{"exp_num": 41, "exp": "exp044_mlr03_s44", "val_bpb": 0.978951, "vram_gb": 43.9, "steps": 2026, "status": "pilot", "desc": "matrix_lr 0.03 s44", "phase": "1", "ts_start": "", "ts_end": "2026-07-27T12:34:10Z", "ts_end_epoch": 1785155650.0, "commit": "b7e044"}
{"exp_num": 42, "exp": "exp045_emb08_s43", "val_bpb": 0.981219, "vram_gb": 43.9, "steps": 2016, "status": "pilot", "desc": "embedding_lr 0.8 s43 (reject)", "phase": "1", "ts_start": "", "ts_end": "2026-07-27T12:34:10Z", "ts_end_epoch": 1785155650.0, "commit": "b7e045"}
{"exp_num": 43, "exp": "exp046_emb08_s44", "val_bpb": 0.980303, "vram_gb": 43.9, "steps": 1987, "status": "pilot", "desc": "embedding_lr 0.8 s44", "phase": "1", "ts_start": "", "ts_end": "2026-07-27T12:34:10Z", "ts_end_epoch": 1785155650.0, "commit": "b7e046"}
{"exp_num": 44, "exp": "exp047_combo_s42", "val_bpb": 0.979311, "vram_gb": 43.9, "steps": 1935, "status": "discard", "desc": "mlr03+emb08 combo (reject)", "phase": "1", "ts_start": "", "ts_end": "2026-07-27T12:34:10Z", "ts_end_epoch": 1785155650.0, "commit": "b7e047"}
{"exp_num": 45, "exp": "exp048_combo_s43", "val_bpb": 0.981197, "vram_gb": 43.9, "steps": 1971, "status": "discard", "desc": "combo s43", "phase": "1", "ts_start": "", "ts_end": "2026-07-27T12:34:10Z", "ts_end_epoch": 1785155650.0, "commit": "b7e048"}
{"exp_num": 46, "exp": "exp049_mlr02_s42", "val_bpb": 0.977884, "vram_gb": 43.9, "steps": 2002, "status": "pilot", "desc": "matrix_lr 0.02 (1-seed, noise)", "phase": "1", "ts_start": "", "ts_end": "2026-07-27T12:34:10Z", "ts_end_epoch": 1785155650.0, "commit": "b7e049"}
{"exp_num": 47, "exp": "exp050_gelu", "val_bpb": 0.99595, "vram_gb": 43.9, "steps": 1883, "status": "discard", "desc": "gelu activation (relu^2 better)", "phase": "2", "ts_start": "", "ts_end": "2026-07-27T12:41:28Z", "ts_end_epoch": 1785156088.0, "commit": "b8e050"}
{"exp_num": 48, "exp": "exp051_winSSSS", "val_bpb": 0.97821, "vram_gb": 43.9, "steps": 2037, "status": "pilot", "desc": "window SSSS all-short (neutral)", "phase": "2", "ts_start": "", "ts_end": "2026-07-27T12:41:28Z", "ts_end_epoch": 1785156088.0, "commit": "b8e051"}
{"exp_num": 49, "exp": "exp052_hdim64", "val_bpb": 0.986455, "vram_gb": 43.9, "steps": 1950, "status": "discard", "desc": "head_dim 64 / 8 heads", "phase": "2", "ts_start": "", "ts_end": "2026-07-27T12:41:28Z", "ts_end_epoch": 1785156088.0, "commit": "b8e052"}
{"exp_num": 50, "exp": "exp053_rope100k", "val_bpb": 0.980845, "vram_gb": 43.9, "steps": 1985, "status": "discard", "desc": "rotary base 100k", "phase": "2", "ts_start": "", "ts_end": "2026-07-27T12:41:28Z", "ts_end_epoch": 1785156088.0, "commit": "b8e053"}
{"exp_num": 51, "exp": "exp054_softcap30", "val_bpb": 0.984371, "vram_gb": 43.9, "steps": 1944, "status": "discard", "desc": "logit softcap 30", "phase": "2", "ts_start": "", "ts_end": "2026-07-27T12:41:28Z", "ts_end_epoch": 1785156088.0, "commit": "b8e054"}
{"exp_num": 52, "exp": "exp055_mlp3x", "val_bpb": 0.984486, "vram_gb": 43.9, "steps": 2133, "status": "discard", "desc": "FFN ratio 3x (too small)", "phase": "2", "ts_start": "", "ts_end": "2026-07-27T12:41:28Z", "ts_end_epoch": 1785156088.0, "commit": "b8e055"}
{"exp_num": 53, "exp": "exp056_mlp6x", "val_bpb": 0.97501, "vram_gb": 50.8, "steps": 1721, "status": "keep", "desc": "FFN ratio 6x (new best, confirming)", "phase": "2", "ts_start": "", "ts_end": "2026-07-27T12:41:28Z", "ts_end_epoch": 1785156088.0, "commit": "b8e056", "milestone": "FFN 4\u00d7\u21926\u00d7", "change": "FFN ratio 4\u00d7\u21926\u00d7"}
{"exp_num": 54, "exp": "exp057_mlp6x_s43", "val_bpb": 0.978757, "vram_gb": 50.8, "steps": 1718, "status": "keep", "desc": "FFN 6x confirm s43", "phase": "2", "ts_start": "", "ts_end": "2026-07-27T12:48:10Z", "ts_end_epoch": 1785156490.0, "commit": "b9e057"}
{"exp_num": 55, "exp": "exp058_mlp6x_s44", "val_bpb": 0.977104, "vram_gb": 50.8, "steps": 1741, "status": "keep", "desc": "FFN 6x confirm s44", "phase": "2", "ts_start": "", "ts_end": "2026-07-27T12:48:10Z", "ts_end_epoch": 1785156490.0, "commit": "b9e058"}
{"exp_num": 56, "exp": "exp059_mlp8x_s42", "val_bpb": 0.974736, "vram_gb": 56.6, "steps": 1543, "status": "pilot", "desc": "FFN 8x (best single, high var)", "phase": "2", "ts_start": "", "ts_end": "2026-07-27T12:48:10Z", "ts_end_epoch": 1785156490.0, "commit": "b9e059"}
{"exp_num": 57, "exp": "exp060_mlp8x_s43", "val_bpb": 0.98065, "vram_gb": 56.6, "steps": 1515, "status": "pilot", "desc": "FFN 8x s43 (variance)", "phase": "2", "ts_start": "", "ts_end": "2026-07-27T12:48:10Z", "ts_end_epoch": 1785156490.0, "commit": "b9e060"}
{"exp_num": 58, "exp": "exp061_mlp5x_s42", "val_bpb": 0.977754, "vram_gb": 48.8, "steps": 1792, "status": "pilot", "desc": "FFN 5x", "phase": "2", "ts_start": "", "ts_end": "2026-07-27T12:48:10Z", "ts_end_epoch": 1785156490.0, "commit": "b9e061"}
{"exp_num": 59, "exp": "exp062_mlp6x_ssss_s42", "val_bpb": 0.976579, "vram_gb": 50.8, "steps": 1701, "status": "discard", "desc": "FFN6x+SSSS (SSSS adds nothing)", "phase": "2", "ts_start": "", "ts_end": "2026-07-27T12:48:10Z", "ts_end_epoch": 1785156490.0, "commit": "b9e062"}
{"exp_num": 60, "exp": "exp063_mlp6x_ssss_s43", "val_bpb": 0.979096, "vram_gb": 50.8, "steps": 1727, "status": "discard", "desc": "FFN6x+SSSS s43", "phase": "2", "ts_start": "", "ts_end": "2026-07-27T12:48:10Z", "ts_end_epoch": 1785156490.0, "commit": "b9e063"}
{"exp_num": 61, "exp": "exp064_mlp8x_s44", "val_bpb": 0.977517, "vram_gb": 56.6, "steps": 1529, "status": "pilot", "desc": "FFN 8x s44 (not better than 6x)", "phase": "2", "ts_start": "", "ts_end": "2026-07-27T12:55:30Z", "ts_end_epoch": 1785156930.0, "commit": "b10e064"}
{"exp_num": 62, "exp": "exp065_mlp7x_s42", "val_bpb": 0.974911, "vram_gb": 53.7, "steps": 1617, "status": "pilot", "desc": "FFN 7x (single seed, settling)", "phase": "2", "ts_start": "", "ts_end": "2026-07-27T12:55:30Z", "ts_end_epoch": 1785156930.0, "commit": "b10e065"}
{"exp_num": 63, "exp": "exp066_ffn6_t17_s42", "val_bpb": 0.980407, "vram_gb": 43.9, "steps": 3372, "status": "discard", "desc": "FFN6x + batch2^17 (worse, 2^18 stays optimal)", "phase": "2", "ts_start": "", "ts_end": "2026-07-27T12:55:30Z", "ts_end_epoch": 1785156930.0, "commit": "b10e066"}
{"exp_num": 64, "exp": "exp067_ffn6_t17_s43", "val_bpb": 0.983063, "vram_gb": 43.9, "steps": 3323, "status": "discard", "desc": "FFN6x + batch2^17 s43", "phase": "2", "ts_start": "", "ts_end": "2026-07-27T12:55:30Z", "ts_end_epoch": 1785156930.0, "commit": "b10e067"}
{"exp_num": 65, "exp": "exp068_ffn6_gqa_s42", "val_bpb": 0.983354, "vram_gb": 48.8, "steps": 1729, "status": "discard", "desc": "FFN6x + GQA kv//2 (hurts quality)", "phase": "2", "ts_start": "", "ts_end": "2026-07-27T12:55:30Z", "ts_end_epoch": 1785156930.0, "commit": "b10e068"}
{"exp_num": 66, "exp": "exp069_ffn6_gqa_s43", "val_bpb": 0.983825, "vram_gb": 48.8, "steps": 1766, "status": "discard", "desc": "FFN6x + GQA s43", "phase": "2", "ts_start": "", "ts_end": "2026-07-27T12:55:30Z", "ts_end_epoch": 1785156930.0, "commit": "b10e069"}
{"exp_num": 67, "exp": "exp070_mlp10x_s42", "val_bpb": 0.979846, "vram_gb": 62.5, "steps": 1367, "status": "discard", "desc": "FFN 10x (too big, too few steps)", "phase": "2", "ts_start": "", "ts_end": "2026-07-27T12:55:30Z", "ts_end_epoch": 1785156930.0, "commit": "b10e070"}
{"exp_num": 68, "exp": "exp071_mlp7x_s43", "val_bpb": 0.978655, "vram_gb": 53.7, "steps": 1594, "status": "pilot", "desc": "FFN 7x s43 (approx 6x)", "phase": "2", "ts_start": "", "ts_end": "2026-07-27T13:04:00Z", "ts_end_epoch": 1785157440.0, "commit": "b11e071"}
{"exp_num": 69, "exp": "exp072_mlp7x_s44", "val_bpb": 0.977216, "vram_gb": 53.7, "steps": 1617, "status": "pilot", "desc": "FFN 7x s44", "phase": "2", "ts_start": "", "ts_end": "2026-07-27T13:04:00Z", "ts_end_epoch": 1785157440.0, "commit": "b11e072"}
{"exp_num": 70, "exp": "exp073_veall_s42", "val_bpb": 0.973933, "vram_gb": 50.8, "steps": 1702, "status": "pilot", "desc": "VE on all layers s42 (best single, noisy)", "phase": "2", "ts_start": "", "ts_end": "2026-07-27T13:04:00Z", "ts_end_epoch": 1785157440.0, "commit": "b11e073"}
{"exp_num": 71, "exp": "exp074_veall_s43", "val_bpb": 0.978266, "vram_gb": 50.8, "steps": 1677, "status": "pilot", "desc": "VE on all layers s43", "phase": "2", "ts_start": "", "ts_end": "2026-07-27T13:04:00Z", "ts_end_epoch": 1785157440.0, "commit": "b11e074"}
{"exp_num": 72, "exp": "exp075_x0lam02", "val_bpb": 0.977611, "vram_gb": 50.8, "steps": 1663, "status": "pilot", "desc": "x0_lambda init 0.2", "phase": "2", "ts_start": "", "ts_end": "2026-07-27T13:04:00Z", "ts_end_epoch": 1785157440.0, "commit": "b11e075"}
{"exp_num": 73, "exp": "exp076_softcap100", "val_bpb": 0.981629, "vram_gb": 50.8, "steps": 1695, "status": "discard", "desc": "softcap 100 off (worse)", "phase": "2", "ts_start": "", "ts_end": "2026-07-27T13:04:00Z", "ts_end_epoch": 1785157440.0, "commit": "b11e076"}
{"exp_num": 74, "exp": "exp077_rope2500", "val_bpb": 0.977302, "vram_gb": 50.8, "steps": 1720, "status": "pilot", "desc": "rotary base 2500", "phase": "2", "ts_start": "", "ts_end": "2026-07-27T13:04:00Z", "ts_end_epoch": 1785157440.0, "commit": "b11e077"}
{"exp_num": 75, "exp": "exp078_ngram23_s42", "val_bpb": 0.969687, "vram_gb": 52.3, "steps": 1699, "status": "keep", "desc": "bigram+trigram hash value-embeds (Engram) \u2014 big win", "phase": "2", "milestone": "n-gram value-embeds", "ts_start": "", "ts_end": "2026-07-27T13:09:00Z", "ts_end_epoch": 1785157740.0, "commit": "b12e078"}
{"exp_num": 76, "exp": "exp079_veall_s44", "val_bpb": 0.97702, "vram_gb": 53.0, "steps": 1713, "status": "discard", "desc": "VE all layers s44 (reject 3-seed, mean 0.9764)", "phase": "2", "milestone": "", "ts_start": "", "ts_end": "2026-07-27T13:09:00Z", "ts_end_epoch": 1785157740.0, "commit": "b12e079"}
