{"exp_num": 302, "exp": "exp307_ng2345", "val_bpb": 0.956164, "vram_gb": 107.4, "steps": 1690, "status": "discard", "desc": "n-gram orders (2,3,4,5) worse (sparse long-grams + optimizer cost)", "phase": "2", "milestone": "", "ts_start": "", "ts_end": "2026-07-27T18:14:00Z", "ts_end_epoch": 1785176040.0, "commit": "b50e307"}
{"exp_num": 303, "exp": "exp308_veall", "val_bpb": 0.949981, "vram_gb": 58.6, "steps": 1900, "status": "pilot", "desc": "VE on ALL layers (flash near-best; broadens n-gram injection)", "phase": "2", "milestone": "", "ts_start": "", "ts_end": "2026-07-27T18:22:00Z", "ts_end_epoch": 1785176520.0, "commit": "b51e308"}
{"exp_num": 304, "exp": "exp309_swin4", "val_bpb": 0.948781, "vram_gb": 54.7, "steps": 1980, "status": "pilot", "desc": "short attn window //4 (NEW BEST flash; cheaper local layers + ngram covers local recall)", "phase": "2", "milestone": "", "ts_start": "", "ts_end": "2026-07-27T18:22:00Z", "ts_end_epoch": 1785176520.0, "commit": "b51e309"}
{"exp_num": 305, "exp": "exp310_alllong", "val_bpb": 0.950772, "vram_gb": 62.5, "steps": 1820, "status": "discard", "desc": "all-long attention (neutral; sliding window not hurting)", "phase": "2", "milestone": "", "ts_start": "", "ts_end": "2026-07-27T18:22:00Z", "ts_end_epoch": 1785176520.0, "commit": "b51e310"}
{"exp_num": 306, "exp": "exp311_swin4_s90", "val_bpb": 0.950161, "vram_gb": 54.7, "steps": 1980, "status": "keep", "desc": "swin4 confirm s90 (win -0.00113)", "phase": "2", "milestone": "", "ts_start": "", "ts_end": "2026-07-27T18:33:00Z", "ts_end_epoch": 1785177180.0, "commit": "b52e311"}
{"exp_num": 307, "exp": "exp313_swin4_s91", "val_bpb": 0.949514, "vram_gb": 54.7, "steps": 1980, "status": "keep", "desc": "swin4 confirm s91 (win -0.00291)", "phase": "2", "milestone": "", "ts_start": "", "ts_end": "2026-07-27T18:33:00Z", "ts_end_epoch": 1785177180.0, "commit": "b52e313"}
{"exp_num": 308, "exp": "exp315_swin4_s92", "val_bpb": 0.951737, "vram_gb": 54.7, "steps": 1980, "status": "keep", "desc": "swin4 confirm s92 (win -0.00051); ADOPTED short window //4, 3/3 paired dMean=-0.00152", "phase": "2", "milestone": "short attn window //4 (SSSL)", "ts_start": "", "ts_end": "2026-07-27T18:33:00Z", "ts_end_epoch": 1785177180.0, "commit": "b52e315"}
{"exp_num": 309, "exp": "exp317_swin8", "val_bpb": 0.950052, "vram_gb": 52.7, "steps": 2010, "status": "discard", "desc": "window //8 worse than //4 (too local, loses context)", "phase": "2", "milestone": "", "ts_start": "", "ts_end": "2026-07-27T18:44:00Z", "ts_end_epoch": 1785177840.0, "commit": "b53e317"}
{"exp_num": 310, "exp": "exp318_swin16", "val_bpb": 0.952835, "vram_gb": 50.8, "steps": 2050, "status": "discard", "desc": "window //16 much worse; //4 is the window optimum", "phase": "2", "milestone": "", "ts_start": "", "ts_end": "2026-07-27T18:44:00Z", "ts_end_epoch": 1785177840.0, "commit": "b53e318"}
{"exp_num": 311, "exp": "exp319_veall", "val_bpb": 0.949511, "vram_gb": 58.6, "steps": 1900, "status": "discard", "desc": "VE-all on swin4 stack worse than swin4 ref (injection saturated)", "phase": "2", "milestone": "", "ts_start": "", "ts_end": "2026-07-27T18:44:00Z", "ts_end_epoch": 1785177840.0, "commit": "b53e319"}
{"exp_num": 312, "exp": "exp320_t22", "val_bpb": 0.950568, "vram_gb": 87.9, "steps": 1780, "status": "discard", "desc": "table 2^22 still saturated even w/ swin4 freed compute", "phase": "2", "milestone": "", "ts_start": "", "ts_end": "2026-07-27T18:44:00Z", "ts_end_epoch": 1785177840.0, "commit": "b53e320"}
{"exp_num": 313, "exp": "exp321_ffn6", "val_bpb": 0.953063, "vram_gb": 62.5, "steps": 1750, "status": "discard", "desc": "FFN6 still stale (not un-staled by swin4); FFN4 floor holds", "phase": "2", "milestone": "", "ts_start": "", "ts_end": "2026-07-27T18:44:00Z", "ts_end_epoch": 1785177840.0, "commit": "b53e321"}
{"exp_num": 314, "exp": "exp322_ffn5", "val_bpb": 0.950856, "vram_gb": 56.6, "steps": 1830, "status": "discard", "desc": "FFN5 worse; 4th re-opt pass ZERO-FLIP, swin4 stack re-converged best 0.948781", "phase": "2", "milestone": "", "ts_start": "", "ts_end": "2026-07-27T18:44:00Z", "ts_end_epoch": 1785177840.0, "commit": "b53e322"}
{"exp_num": 315, "exp": "exp323_pat7S", "val_bpb": 0.949749, "vram_gb": 52.7, "steps": 2010, "status": "discard", "desc": "window pattern SSSSSSSS (7S+1L) worse; need some long-range", "phase": "2", "milestone": "", "ts_start": "", "ts_end": "2026-07-27T18:56:00Z", "ts_end_epoch": 1785178560.0, "commit": "b54e323"}
{"exp_num": 316, "exp": "exp324_patSSSSL", "val_bpb": 0.948671, "vram_gb": 53.7, "steps": 1990, "status": "pilot", "desc": "window pattern SSSSL (noise-tie -0.0001; pattern converged at SSSL)", "phase": "2", "milestone": "", "ts_start": "", "ts_end": "2026-07-27T18:56:00Z", "ts_end_epoch": 1785178560.0, "commit": "b54e324"}
{"exp_num": 317, "exp": "exp325_patSSLL", "val_bpb": 0.949396, "vram_gb": 56.6, "steps": 1920, "status": "discard", "desc": "window pattern SSLL (4S+4L) worse; fewer short loses cheap-local; SSSL optimal, span was the win", "phase": "2", "milestone": "", "ts_start": "", "ts_end": "2026-07-27T18:56:00Z", "ts_end_epoch": 1785178560.0, "commit": "b54e325"}
{"exp_num": 318, "exp": "exp326_gqa3", "val_bpb": 0.949232, "vram_gb": 50.8, "steps": 2030, "status": "discard", "desc": "GQA n_kv_head=3 worse; VE dim (kv_dim) is load-bearing, shrinking it costs>throughput", "phase": "2", "milestone": "", "ts_start": "", "ts_end": "2026-07-27T19:05:00Z", "ts_end_epoch": 1785179100.0, "commit": "b55e326"}
{"exp_num": 319, "exp": "exp327_gqa2", "val_bpb": 0.949221, "vram_gb": 48.8, "steps": 2050, "status": "discard", "desc": "GQA n_kv_head=2 worse (same reason); attention cheapening via KV doesnt pay unlike span", "phase": "2", "milestone": "", "ts_start": "", "ts_end": "2026-07-27T19:05:00Z", "ts_end_epoch": 1785179100.0, "commit": "b55e327"}
{"exp_num": 320, "exp": "exp328_heads12", "val_bpb": 0.949241, "vram_gb": 54.7, "steps": 1900, "status": "discard", "desc": "n_head=12 (smaller head_dim) worse; 6/6 MHA optimal. Attn-structure axis mapped: span=win, pattern/heads converged", "phase": "2", "milestone": "", "ts_start": "", "ts_end": "2026-07-27T19:05:00Z", "ts_end_epoch": 1785179100.0, "commit": "b55e328"}
{"exp_num": 321, "exp": "exp329_skip22", "val_bpb": 0.950616, "vram_gb": 87.9, "steps": 1885, "status": "discard", "desc": "skip-bigram (t,t-2) worse; gappy context skips adjacent t-1 (strongest predictor)+3rd table costs U", "phase": "2", "milestone": "", "ts_start": "", "ts_end": "2026-07-27T19:46:00Z", "ts_end_epoch": 1785181560.0, "commit": "b56e329"}
{"exp_num": 322, "exp": "exp331_skip2223", "val_bpb": 0.952626, "vram_gb": 107.4, "steps": 1834, "status": "discard", "desc": "two skip-bigrams worse (+0.0039); context-hash memory saturated at consecutive (2,3)", "phase": "2", "milestone": "", "ts_start": "", "ts_end": "2026-07-27T19:46:00Z", "ts_end_epoch": 1785181560.0, "commit": "b56e331"}
{"exp_num": 323, "exp": "exp332_rope5k", "val_bpb": 0.94966, "vram_gb": 54.7, "steps": 1980, "status": "discard", "desc": "RoPE base 5000 worse; 10000 optimal (swin4 short windows didnt shift positional optimum)", "phase": "2", "milestone": "", "ts_start": "", "ts_end": "2026-07-27T19:52:00Z", "ts_end_epoch": 1785181920.0, "commit": "b57e332"}
{"exp_num": 324, "exp": "exp333_rope20k", "val_bpb": 0.94952, "vram_gb": 54.7, "steps": 1980, "status": "discard", "desc": "RoPE base 20000 worse; 10000 optimal", "phase": "2", "milestone": "", "ts_start": "", "ts_end": "2026-07-27T19:52:00Z", "ts_end_epoch": 1785181920.0, "commit": "b57e333"}
{"exp_num": 325, "exp": "exp334_x0_005", "val_bpb": 0.979945, "vram_gb": 54.7, "steps": 1980, "status": "discard", "desc": "x0_lambda 0.05 catastrophic (+0.031); value-residual mixing 0.1 critical", "phase": "2", "milestone": "", "ts_start": "", "ts_end": "2026-07-27T19:52:00Z", "ts_end_epoch": 1785181920.0, "commit": "b57e334"}
{"exp_num": 326, "exp": "exp335_wtestd05", "val_bpb": 0.94915, "vram_gb": 54.7, "steps": 1980, "status": "discard", "desc": "wte init std 0.5 marginally worse; 1.0 optimal", "phase": "2", "milestone": "", "ts_start": "", "ts_end": "2026-07-27T19:52:00Z", "ts_end_epoch": 1785181920.0, "commit": "b57e335"}
{"exp_num": 327, "exp": "exp336_muonmom90", "val_bpb": 0.951351, "vram_gb": 54.7, "steps": 1980, "status": "discard", "desc": "Muon momentum 0.90 worse; 0.95 optimal", "phase": "2", "milestone": "", "ts_start": "", "ts_end": "2026-07-27T19:52:00Z", "ts_end_epoch": 1785181920.0, "commit": "b57e336"}
{"exp_num": 328, "exp": "exp337_emblr25", "val_bpb": 0.950583, "vram_gb": 54.7, "steps": 1980, "status": "discard", "desc": "embedding_lr 0.25 worse; 0.2 optimal. Scattershot all-null (15 nulls since swin4)", "phase": "2", "milestone": "", "ts_start": "", "ts_end": "2026-07-27T19:52:00Z", "ts_end_epoch": 1785181920.0, "commit": "b57e337"}
{"exp_num": 329, "exp": "exp338_ngout_s42", "val_bpb": 1.009663, "vram_gb": 66.4, "steps": 1850, "status": "discard", "desc": "n-gram OUTPUT head catastrophic (+0.061): direct n-gram->logit bias uncalibratable; n-gram must inject as contextualizable VALUES not logit prior", "phase": "2", "milestone": "", "ts_start": "", "ts_end": "2026-07-27T20:03:00Z", "ts_end_epoch": 1785182580.0, "commit": "b58e338"}
{"exp_num": 330, "exp": "exp339_ngout_s43", "val_bpb": 1.010981, "vram_gb": 66.4, "steps": 1850, "status": "discard", "desc": "ngram output head s43 (catastrophic, replicated); learned-from-scratch mappings lose in 5min budget vs O(1) hash", "phase": "2", "milestone": "", "ts_start": "", "ts_end": "2026-07-27T20:03:00Z", "ts_end_epoch": 1785182580.0, "commit": "b58e339"}
{"exp_num": 331, "exp": "exp340_ref_s43", "val_bpb": 0.951369, "vram_gb": 54.7, "steps": 1980, "status": "keep", "desc": "swin4 SOTA ref seed43 (matched)", "phase": "2", "milestone": "", "ts_start": "", "ts_end": "2026-07-27T20:03:00Z", "ts_end_epoch": 1785182580.0, "commit": "b58e340"}
{"exp_num": 332, "exp": "exp341_bag4", "val_bpb": 0.952782, "vram_gb": 87.9, "steps": 1885, "status": "discard", "desc": "bag-of-4 memory worse; order-invariance discards predictive order info (falsifies paper009 Dir3: density wasnt the fix)", "phase": "2", "milestone": "", "ts_start": "", "ts_end": "2026-07-27T20:16:00Z", "ts_end_epoch": 1785183360.0, "commit": "b59e341"}
{"exp_num": 333, "exp": "exp342_bag6", "val_bpb": 0.953167, "vram_gb": 87.9, "steps": 1908, "status": "discard", "desc": "bag-of-6 worse (monotonic w/ window); larger bag blurs more order", "phase": "2", "milestone": "", "ts_start": "", "ts_end": "2026-07-27T20:16:00Z", "ts_end_epoch": 1785183360.0, "commit": "b59e342"}
{"exp_num": 334, "exp": "exp343_bag8", "val_bpb": 0.953981, "vram_gb": 87.9, "steps": 1896, "status": "discard", "desc": "bag-of-8 worst; order-density tradeoff: informative longer-range context is irreducibly sparse, ordered (2,3) optimal", "phase": "2", "milestone": "", "ts_start": "", "ts_end": "2026-07-27T20:16:00Z", "ts_end_epoch": 1785183360.0, "commit": "b59e343"}
{"exp_num": 335, "exp": "exp344_ns4", "val_bpb": 0.949604, "vram_gb": 54.7, "steps": 1956, "status": "discard", "desc": "Muon ns_steps=4 worse; NS not a throughput bottleneck so cheapening loses q without buying U", "phase": "2", "milestone": "", "ts_start": "", "ts_end": "2026-07-27T20:24:00Z", "ts_end_epoch": 1785183840.0, "commit": "b60e344"}
{"exp_num": 336, "exp": "exp345_ns3", "val_bpb": 0.952201, "vram_gb": 54.7, "steps": 1975, "status": "discard", "desc": "ns_steps=3 worse (poor orthogonalization)", "phase": "2", "milestone": "", "ts_start": "", "ts_end": "2026-07-27T20:24:00Z", "ts_end_epoch": 1785183840.0, "commit": "b60e345"}
{"exp_num": 337, "exp": "exp346_ns6", "val_bpb": 0.949257, "vram_gb": 54.7, "steps": 1968, "status": "discard", "desc": "ns_steps=6 worse; 5 optimal. cheaper-compute wins ONLY at real bottlenecks (span yes, NS no)", "phase": "2", "milestone": "", "ts_start": "", "ts_end": "2026-07-27T20:24:00Z", "ts_end_epoch": 1785183840.0, "commit": "b60e346"}
{"exp_num": 338, "exp": "exp347_sota2x", "val_bpb": 0.987045, "vram_gb": 54.7, "steps": 3918, "status": "discard", "desc": "OFF-FRAME 2x budget(600s): reaches epoch 3 -> overfits (val 0.987>0.9488). Frame is near ~2-epoch boundary", "phase": "meta", "milestone": "", "ts_start": "", "ts_end": "2026-07-27T20:40:00Z", "ts_end_epoch": 1785184800.0, "commit": "b61e347"}
{"exp_num": 339, "exp": "exp348_ffn6_2x", "val_bpb": 0.969733, "vram_gb": 62.5, "steps": 3428, "status": "discard", "desc": "OFF-FRAME 2x FFN6: epoch 2 (slower=fewer epochs=less overfit) beats sota2x epoch3. FFN6 flip is overfitting-confound NOT capacity re-admission; H9 budget-test needs more data", "phase": "meta", "milestone": "", "ts_start": "", "ts_end": "2026-07-27T20:40:00Z", "ts_end_epoch": 1785184800.0, "commit": "b61e348"}
{"exp_num": 340, "exp": "exp349_t22_2x", "val_bpb": 1.00912, "vram_gb": 87.9, "steps": 3677, "status": "discard", "desc": "OFF-FRAME 2x table2^22: worse (table saturation is collision-bound not budget-bound; consistent)", "phase": "meta", "milestone": "", "ts_start": "", "ts_end": "2026-07-27T20:40:00Z", "ts_end_epoch": 1785184800.0, "commit": "b61e349"}
{"exp_num": 341, "exp": "exp350_drop005", "val_bpb": 0.957635, "vram_gb": 54.7, "steps": 1975, "status": "discard", "desc": "dropout 0.05 worse; model NOT overfitting-limited in-frame (frame stops just before epoch-3 onset)", "phase": "2", "milestone": "", "ts_start": "", "ts_end": "2026-07-27T21:00:00Z", "ts_end_epoch": 1785186000.0, "commit": "b62e350"}
{"exp_num": 342, "exp": "exp351_drop010", "val_bpb": 0.962367, "vram_gb": 54.7, "steps": 1975, "status": "discard", "desc": "dropout 0.1 worse (monotonic)", "phase": "2", "milestone": "", "ts_start": "", "ts_end": "2026-07-27T21:00:00Z", "ts_end_epoch": 1785186000.0, "commit": "b62e351"}
{"exp_num": 343, "exp": "exp352_drop020", "val_bpb": 0.973672, "vram_gb": 54.7, "steps": 1975, "status": "discard", "desc": "dropout 0.2 worst; frame optimally placed at ~2-epoch sweet spot (no in-frame regularization helps). Every in-frame direction exhausted.", "phase": "2", "milestone": "", "ts_start": "", "ts_end": "2026-07-27T21:00:00Z", "ts_end_epoch": 1785186000.0, "commit": "b62e352"}
{"exp_num": 344, "exp": "exp353_sota_s50", "val_bpb": 0.950531, "vram_gb": 54.7, "steps": 1980, "status": "keep", "desc": "SOTA CI seed 50 (n=10 final: mean 0.95058 std 0.00147 best 0.948335)", "phase": "2", "milestone": "", "ts_start": "", "ts_end": "2026-07-27T21:10:00Z", "ts_end_epoch": 1785186600.0, "commit": "b63e50"}
{"exp_num": 345, "exp": "exp354_sota_s51", "val_bpb": 0.952321, "vram_gb": 54.7, "steps": 1980, "status": "keep", "desc": "SOTA CI seed 51 (n=10 final: mean 0.95058 std 0.00147 best 0.948335)", "phase": "2", "milestone": "", "ts_start": "", "ts_end": "2026-07-27T21:10:00Z", "ts_end_epoch": 1785186600.0, "commit": "b63e51"}
{"exp_num": 346, "exp": "exp355_sota_s52", "val_bpb": 0.948335, "vram_gb": 54.7, "steps": 1980, "status": "keep", "desc": "SOTA CI seed 52 (n=10 final: mean 0.95058 std 0.00147 best 0.948335)", "phase": "2", "milestone": "", "ts_start": "", "ts_end": "2026-07-27T21:10:00Z", "ts_end_epoch": 1785186600.0, "commit": "b63e52"}
{"exp_num": 347, "exp": "exp356_sota_s53", "val_bpb": 0.950145, "vram_gb": 54.7, "steps": 1980, "status": "keep", "desc": "SOTA CI seed 53 (n=10 final: mean 0.95058 std 0.00147 best 0.948335)", "phase": "2", "milestone": "", "ts_start": "", "ts_end": "2026-07-27T21:10:00Z", "ts_end_epoch": 1785186600.0, "commit": "b63e53"}
{"exp_num": 348, "exp": "exp357_sota_s54", "val_bpb": 0.951626, "vram_gb": 54.7, "steps": 1980, "status": "keep", "desc": "SOTA CI seed 54 (n=10 final: mean 0.95058 std 0.00147 best 0.948335)", "phase": "2", "milestone": "", "ts_start": "", "ts_end": "2026-07-27T21:10:00Z", "ts_end_epoch": 1785186600.0, "commit": "b63e54"}
{"exp_num": 349, "exp": "exp358_sota_s55", "val_bpb": 0.952614, "vram_gb": 54.7, "steps": 1980, "status": "keep", "desc": "SOTA CI seed 55 (n=10 final: mean 0.95058 std 0.00147 best 0.948335)", "phase": "2", "milestone": "", "ts_start": "", "ts_end": "2026-07-27T21:10:00Z", "ts_end_epoch": 1785186600.0, "commit": "b63e55"}
{"exp_num": 350, "exp": "exp360_depth6", "val_bpb": 1.004985, "vram_gb": 50.8, "steps": 2802, "status": "discard", "desc": "depth 6 much worse; depth is load-bearing (compositional, NOT n-gram-substitutable) unlike FFN width/attn span", "phase": "2", "milestone": "", "ts_start": "", "ts_end": "2026-07-27T21:48:00Z", "ts_end_epoch": 1785188880.0, "commit": "b64e360"}
{"exp_num": 351, "exp": "exp361_depth7", "val_bpb": 0.960146, "vram_gb": 52.7, "steps": 2160, "status": "discard", "desc": "depth 7 worse; subtraction motif does NOT extend to depth", "phase": "2", "milestone": "", "ts_start": "", "ts_end": "2026-07-27T21:48:00Z", "ts_end_epoch": 1785188880.0, "commit": "b64e361"}
{"exp_num": 352, "exp": "exp362_depth9", "val_bpb": 0.950542, "vram_gb": 58.6, "steps": 1314, "status": "discard", "desc": "depth 9 worse (fewer U); depth 8 optimal. Refines subtraction principle: only n-gram-substitutable (local) capacity is cuttable, not compositional depth", "phase": "2", "milestone": "", "ts_start": "", "ts_end": "2026-07-27T21:48:00Z", "ts_end_epoch": 1785188880.0, "commit": "b64e362"}
{"exp_num": 353, "exp": "exp365_data5", "val_bpb": 1.066632, "vram_gb": 54.7, "steps": 1958, "status": "discard", "desc": "DATA-SCALING 5 shards (~4 epochs): 1.067, heavy overfit. Floor is DATA-LIMITED", "phase": "meta", "milestone": "", "ts_start": "", "ts_end": "2026-07-27T22:30:00Z", "ts_end_epoch": 1785191400.0, "commit": "b65e365"}
{"exp_num": 354, "exp": "exp366_data8", "val_bpb": 0.979345, "vram_gb": 54.7, "steps": 1980, "status": "discard", "desc": "DATA-SCALING 8 shards: 0.979. Monotonic w/ data (5->8->10: 1.067->0.979->0.949, -0.118 total)", "phase": "meta", "milestone": "", "ts_start": "", "ts_end": "2026-07-27T22:30:00Z", "ts_end_epoch": 1785191400.0, "commit": "b65e366"}
{"exp_num": 355, "exp": "exp367_data11", "val_bpb": 0.952281, "vram_gb": 54.7, "steps": 1969, "status": "discard", "desc": "DATA-SCALING 11 shards (added shard0): 0.952 (shard0 anomalous/noise); 5->8->10 trend proves floor is DATA-limited not architecture-limited", "phase": "meta", "milestone": "", "ts_start": "", "ts_end": "2026-07-27T22:30:00Z", "ts_end_epoch": 1785191400.0, "commit": "b65e367"}
{"exp_num": 356, "exp": "exp368_ffn6_data5", "val_bpb": 1.04521, "vram_gb": 62.5, "steps": 1750, "status": "discard", "desc": "FFN6@5shards: BEATS FFN4@5(1.0667) by -0.021. Verdict INVERTS: FFN6 wins when data-starved (slower=fewer epochs=less overfit)", "phase": "meta", "milestone": "", "ts_start": "", "ts_end": "2026-07-27T22:42:00Z", "ts_end_epoch": 1785192120.0, "commit": "b66e368"}
{"exp_num": 357, "exp": "exp369_ffn6_data8", "val_bpb": 0.960612, "vram_gb": 62.5, "steps": 1750, "status": "discard", "desc": "FFN6@8shards beats FFN4@8(0.9793) by -0.019. FFN6 adv: +0.021(5sh)->+0.019(8sh)->-0.004(10sh). Subtraction-wins is knife-edge at ~2-epoch operating point (H10 inversion confirmed)", "phase": "meta", "milestone": "", "ts_start": "", "ts_end": "2026-07-27T22:42:00Z", "ts_end_epoch": 1785192120.0, "commit": "b66e369"}
{"exp_num": 358, "exp": "exp370_span10_data5", "val_bpb": 1.055999, "vram_gb": 54.7, "steps": 1900, "status": "discard", "desc": "span2^10@5sh BEATS swin4/span2^9@5(1.0667) by -0.011. swin4 ALSO inverts with data", "phase": "meta", "milestone": "", "ts_start": "", "ts_end": "2026-07-27T22:56:00Z", "ts_end_epoch": 1785192960.0, "commit": "b67e370"}
{"exp_num": 359, "exp": "exp371_span10_data8", "val_bpb": 0.974673, "vram_gb": 54.7, "steps": 1900, "status": "discard", "desc": "span2^10@8sh beats swin4@8(0.9793) by -0.005; swin4 adv -0.011->-0.005->+0.0015(10sh). BOTH subtraction levers (FFN4,swin4) operating-point-specific", "phase": "meta", "milestone": "", "ts_start": "", "ts_end": "2026-07-27T22:56:00Z", "ts_end_epoch": 1785192960.0, "commit": "b67e371"}
{"exp_num": 360, "exp": "exp372_span10_data10", "val_bpb": 0.948854, "vram_gb": 54.7, "steps": 1900, "status": "discard", "desc": "span2^10@10sh=0.94885 ~= swin4@10=0.94880 (single-seed tie; swin4 confirmed +0.0015 at 3 seeds). swin4 wins only at operating point", "phase": "meta", "milestone": "", "ts_start": "", "ts_end": "2026-07-27T22:56:00Z", "ts_end_epoch": 1785192960.0, "commit": "b67e372"}
{"exp_num": 361, "exp": "exp373_ngoff_data5", "val_bpb": 0.980938, "vram_gb": 39.1, "steps": 2100, "status": "discard", "desc": "n-gram OFF@5sh=0.981 BEATS n-gram ON@5(1.0667) by 0.086! n-gram memory HURTS when data-starved (memorization overfits)", "phase": "meta", "milestone": "", "ts_start": "", "ts_end": "2026-07-27T23:42:00Z", "ts_end_epoch": 1785195720.0, "commit": "b68e373"}
{"exp_num": 362, "exp": "exp374_ngoff_data8", "val_bpb": 0.977626, "vram_gb": 39.1, "steps": 2100, "status": "discard", "desc": "n-gram OFF@8sh=0.978 ~= ON@8(0.9793); n-gram neutral at 8sh. ngoff nearly FLAT across data", "phase": "meta", "milestone": "", "ts_start": "", "ts_end": "2026-07-27T23:42:00Z", "ts_end_epoch": 1785195720.0, "commit": "b68e374"}
{"exp_num": 363, "exp": "exp375_ngoff_data10", "val_bpb": 0.977427, "vram_gb": 39.1, "steps": 2100, "status": "discard", "desc": "n-gram OFF@10=0.977; ON@10=0.9488 (n-gram helps -0.029). CAPSTONE: n-gram memory IS the data-limitation source; ngoff flat(0.981-0.977), ngon swings(1.067-0.949). Memorization lever needs data to generalize", "phase": "meta", "milestone": "", "ts_start": "", "ts_end": "2026-07-27T23:42:00Z", "ts_end_epoch": 1785195720.0, "commit": "b68e375"}
{"exp_num": 364, "exp": "exp376_t15_data5", "val_bpb": 0.977023, "vram_gb": 41.0, "steps": 2050, "status": "discard", "desc": "table2^15@5sh=0.977 BEATS 2^21@5(1.067) AND off(0.981). Small table optimal when data-starved (limited memorization)", "phase": "meta", "milestone": "", "ts_start": "", "ts_end": "2026-07-27T23:54:00Z", "ts_end_epoch": 1785196440.0, "commit": "b69e376"}
