{"commit": "block57-E33-burst-cost-the-margin", "desc": "E33 settling pass, seed 126 (112-141); frozen defaults; median step 151.5 ms, duty 1.006", "exp": "E33_ctl_s126", "exp_num": 999, "milestone": "", "phase": "block57", "status": "keep", "steps": 1992, "ts_end": "2026-08-01T15:30:00Z", "ts_end_epoch": 1785598200.0, "ts_start": "", "val_bpb": 0.931147, "vram_gb": 52.6}
{"commit": "block57-E33-burst-cost-the-margin", "desc": "E33 settling pass, seed 126 (112-141); depth 6 + MATRIX_LR 0.03; median step 91.7 ms, duty 0.999", "exp": "E33_best_s126", "exp_num": 1000, "milestone": "", "phase": "block57", "status": "keep", "steps": 3269, "ts_end": "2026-08-01T15:30:00Z", "ts_end_epoch": 1785598200.0, "ts_start": "", "val_bpb": 0.928782, "vram_gb": 44.0}
{"commit": "block57-E33-burst-cost-the-margin", "desc": "E33 settling pass, seed 127 (112-141); frozen defaults; median step 148.7 ms, duty 1.005", "exp": "E33_ctl_s127", "exp_num": 1001, "milestone": "", "phase": "block57", "status": "keep", "steps": 2028, "ts_end": "2026-08-01T15:30:00Z", "ts_end_epoch": 1785598200.0, "ts_start": "", "val_bpb": 0.93128, "vram_gb": 52.6}
{"commit": "block57-E33-burst-cost-the-margin", "desc": "E33 settling pass, seed 127 (112-141); depth 6 + MATRIX_LR 0.03; median step 91.4 ms, duty 0.999", "exp": "E33_best_s127", "exp_num": 1002, "milestone": "", "phase": "block57", "status": "keep", "steps": 3279, "ts_end": "2026-08-01T15:30:00Z", "ts_end_epoch": 1785598200.0, "ts_start": "", "val_bpb": 0.929103, "vram_gb": 44.0}
{"commit": "block57-E33-burst-cost-the-margin", "desc": "E33 settling pass, seed 128 (112-141); frozen defaults; median step 151.1 ms, duty 1.005", "exp": "E33_ctl_s128", "exp_num": 1003, "milestone": "", "phase": "block57", "status": "keep", "steps": 1996, "ts_end": "2026-08-01T15:30:00Z", "ts_end_epoch": 1785598200.0, "ts_start": "", "val_bpb": 0.932417, "vram_gb": 52.6}
{"commit": "block57-E33-burst-cost-the-margin", "desc": "E33 settling pass, seed 128 (112-141); depth 6 + MATRIX_LR 0.03; median step 93.6 ms, duty 1.002", "exp": "E33_best_s128", "exp_num": 1004, "milestone": "", "phase": "block57", "status": "keep", "steps": 3210, "ts_end": "2026-08-01T15:30:00Z", "ts_end_epoch": 1785598200.0, "ts_start": "", "val_bpb": 0.930485, "vram_gb": 44.0}
{"commit": "block57-E33-burst-cost-the-margin", "desc": "E33 settling pass, seed 129 (112-141); frozen defaults; median step 151.6 ms, duty 1.006", "exp": "E33_ctl_s129", "exp_num": 1005, "milestone": "", "phase": "block57", "status": "keep", "steps": 1990, "ts_end": "2026-08-01T15:30:00Z", "ts_end_epoch": 1785598200.0, "ts_start": "", "val_bpb": 0.934788, "vram_gb": 52.6}
{"commit": "block57-E33-burst-cost-the-margin", "desc": "E33 settling pass, seed 129 (112-141); depth 6 + MATRIX_LR 0.03; median step 91.8 ms, duty 0.998", "exp": "E33_best_s129", "exp_num": 1006, "milestone": "", "phase": "block57", "status": "keep", "steps": 3262, "ts_end": "2026-08-01T15:30:00Z", "ts_end_epoch": 1785598200.0, "ts_start": "", "val_bpb": 0.930967, "vram_gb": 44.0}
{"commit": "block57-E33-burst-cost-the-margin", "desc": "E33 settling pass, seed 130 (112-141); frozen defaults; median step 161.8 ms, duty 0.921 -- QUARANTINE: duty 0.921", "exp": "E33_ctl_s130", "exp_num": 1007, "milestone": "", "phase": "block57", "status": "quarantine", "steps": 1707, "ts_end": "2026-08-01T15:30:00Z", "ts_end_epoch": 1785598200.0, "ts_start": "", "val_bpb": 0.942243, "vram_gb": 52.6}
{"commit": "block57-E33-burst-cost-the-margin", "desc": "E33 settling pass, seed 130 (112-141); depth 6 + MATRIX_LR 0.03; median step 151.6 ms, duty 1.007 -- QUARANTINE: step 1.62x cell median", "exp": "E33_best_s130", "exp_num": 1008, "milestone": "", "phase": "block57", "status": "quarantine", "steps": 1993, "ts_end": "2026-08-01T15:30:00Z", "ts_end_epoch": 1785598200.0, "ts_start": "", "val_bpb": 0.957384, "vram_gb": 44.0}
{"commit": "block57-E33-burst-cost-the-margin", "desc": "E33 settling pass, seed 131 (112-141); frozen defaults; median step 166.6 ms, duty 0.935 -- QUARANTINE: duty 0.935", "exp": "E33_ctl_s131", "exp_num": 1009, "milestone": "", "phase": "block57", "status": "quarantine", "steps": 1683, "ts_end": "2026-08-01T15:30:00Z", "ts_end_epoch": 1785598200.0, "ts_start": "", "val_bpb": 0.945054, "vram_gb": 52.6}
{"commit": "block57-E33-burst-cost-the-margin", "desc": "E33 settling pass, seed 131 (112-141); depth 6 + MATRIX_LR 0.03; median step 145.4 ms, duty 0.992 -- QUARANTINE: step 1.55x cell median", "exp": "E33_best_s131", "exp_num": 1010, "milestone": "", "phase": "block57", "status": "quarantine", "steps": 2047, "ts_end": "2026-08-01T15:30:00Z", "ts_end_epoch": 1785598200.0, "ts_start": "", "val_bpb": 0.956479, "vram_gb": 44.0}
{"commit": "block57-E33-burst-cost-the-margin", "desc": "E33 settling pass, seed 132 (112-141); frozen defaults; median step 167.2 ms, duty 0.939 -- QUARANTINE: duty 0.939", "exp": "E33_ctl_s132", "exp_num": 1011, "milestone": "", "phase": "block57", "status": "quarantine", "steps": 1684, "ts_end": "2026-08-01T15:30:00Z", "ts_end_epoch": 1785598200.0, "ts_start": "", "val_bpb": 0.944945, "vram_gb": 52.6}
{"commit": "block57-E33-burst-cost-the-margin", "desc": "E33 settling pass, seed 132 (112-141); depth 6 + MATRIX_LR 0.03; median step 143.2 ms, duty 0.981 -- QUARANTINE: step 1.53x cell median", "exp": "E33_best_s132", "exp_num": 1012, "milestone": "", "phase": "block57", "status": "quarantine", "steps": 2056, "ts_end": "2026-08-01T15:30:00Z", "ts_end_epoch": 1785598200.0, "ts_start": "", "val_bpb": 0.954159, "vram_gb": 44.0}
{"commit": "block57-E33-burst-cost-the-margin", "desc": "E33 settling pass, seed 133 (112-141); frozen defaults; median step 181.1 ms, duty 0.994 -- QUARANTINE: step 1.19x cell median", "exp": "E33_ctl_s133", "exp_num": 1013, "milestone": "", "phase": "block57", "status": "quarantine", "steps": 1646, "ts_end": "2026-08-01T15:30:00Z", "ts_end_epoch": 1785598200.0, "ts_start": "", "val_bpb": 0.946653, "vram_gb": 52.6}
{"commit": "block57-E33-burst-cost-the-margin", "desc": "E33 settling pass, seed 133 (112-141); depth 6 + MATRIX_LR 0.03; median step 182.3 ms, duty 1.005 -- QUARANTINE: step 1.95x cell median", "exp": "E33_best_s133", "exp_num": 1014, "milestone": "", "phase": "block57", "status": "quarantine", "steps": 1654, "ts_end": "2026-08-01T15:30:00Z", "ts_end_epoch": 1785598200.0, "ts_start": "", "val_bpb": 0.973759, "vram_gb": 44.0}
{"commit": "block57-E33-burst-cost-the-margin", "desc": "E33 settling pass, seed 134 (112-141); frozen defaults; median step 188.8 ms, duty 0.998 -- QUARANTINE: step 1.25x cell median", "exp": "E33_ctl_s134", "exp_num": 1015, "milestone": "", "phase": "block57", "status": "quarantine", "steps": 1586, "ts_end": "2026-08-01T15:30:00Z", "ts_end_epoch": 1785598200.0, "ts_start": "", "val_bpb": 0.94787, "vram_gb": 52.6}
{"commit": "block57-E33-burst-cost-the-margin", "desc": "E33 settling pass, seed 134 (112-141); depth 6 + MATRIX_LR 0.03; median step 183.7 ms, duty 1.005 -- QUARANTINE: step 1.96x cell median", "exp": "E33_best_s134", "exp_num": 1016, "milestone": "", "phase": "block57", "status": "quarantine", "steps": 1641, "ts_end": "2026-08-01T15:30:00Z", "ts_end_epoch": 1785598200.0, "ts_start": "", "val_bpb": 0.972846, "vram_gb": 44.0}
{"commit": "block57-E33-burst-cost-the-margin", "desc": "E33 settling pass, seed 135 (112-141); frozen defaults; median step 182.3 ms, duty 0.991 -- QUARANTINE: step 1.20x cell median", "exp": "E33_ctl_s135", "exp_num": 1017, "milestone": "", "phase": "block57", "status": "quarantine", "steps": 1631, "ts_end": "2026-08-01T15:30:00Z", "ts_end_epoch": 1785598200.0, "ts_start": "", "val_bpb": 0.945829, "vram_gb": 52.6}
{"commit": "block57-E33-burst-cost-the-margin", "desc": "E33 settling pass, seed 135 (112-141); depth 6 + MATRIX_LR 0.03; median step 181.2 ms, duty 1.003 -- QUARANTINE: step 1.94x cell median", "exp": "E33_best_s135", "exp_num": 1018, "milestone": "", "phase": "block57", "status": "quarantine", "steps": 1661, "ts_end": "2026-08-01T15:30:00Z", "ts_end_epoch": 1785598200.0, "ts_start": "", "val_bpb": 0.970676, "vram_gb": 44.0}
{"commit": "block57-E33-burst-cost-the-margin", "desc": "E33 settling pass, seed 136 (112-141); frozen defaults; median step 227.7 ms, duty 1.015 -- QUARANTINE: step 1.50x cell median", "exp": "E33_ctl_s136", "exp_num": 1019, "milestone": "", "phase": "block57", "status": "quarantine", "steps": 1337, "ts_end": "2026-08-01T15:30:00Z", "ts_end_epoch": 1785598200.0, "ts_start": "", "val_bpb": 0.961249, "vram_gb": 52.6}
{"commit": "block57-E33-burst-cost-the-margin", "desc": "E33 settling pass, seed 136 (112-141); depth 6 + MATRIX_LR 0.03; median step 226.1 ms, duty 0.993 -- QUARANTINE: step 2.42x cell median", "exp": "E33_best_s136", "exp_num": 1020, "milestone": "", "phase": "block57", "status": "quarantine", "steps": 1318, "ts_end": "2026-08-01T15:30:00Z", "ts_end_epoch": 1785598200.0, "ts_start": "", "val_bpb": 0.987911, "vram_gb": 44.0}
{"commit": "block57-E33-burst-cost-the-margin", "desc": "E33 settling pass, seed 137 (112-141); frozen defaults; median step 221.1 ms, duty 1.007 -- QUARANTINE: step 1.46x cell median", "exp": "E33_ctl_s137", "exp_num": 1021, "milestone": "", "phase": "block57", "status": "quarantine", "steps": 1367, "ts_end": "2026-08-01T15:30:00Z", "ts_end_epoch": 1785598200.0, "ts_start": "", "val_bpb": 0.960171, "vram_gb": 52.6}
{"commit": "block57-E33-burst-cost-the-margin", "desc": "E33 settling pass, seed 137 (112-141); depth 6 + MATRIX_LR 0.03; median step 223.1 ms, duty 0.984 -- QUARANTINE: step 2.38x cell median", "exp": "E33_best_s137", "exp_num": 1022, "milestone": "", "phase": "block57", "status": "quarantine", "steps": 1323, "ts_end": "2026-08-01T15:30:00Z", "ts_end_epoch": 1785598200.0, "ts_start": "", "val_bpb": 0.988359, "vram_gb": 44.0}
{"commit": "block57-E33-burst-cost-the-margin", "desc": "E33 settling pass, seed 138 (112-141); frozen defaults; median step 305.7 ms, duty 1.021 -- QUARANTINE: step 2.02x cell median", "exp": "E33_ctl_s138", "exp_num": 1023, "milestone": "", "phase": "block57", "status": "quarantine", "steps": 1002, "ts_end": "2026-08-01T15:30:00Z", "ts_end_epoch": 1785598200.0, "ts_start": "", "val_bpb": 0.988676, "vram_gb": 52.6}
{"commit": "block57-E33-burst-cost-the-margin", "desc": "E33 settling pass, seed 138 (112-141); depth 6 + MATRIX_LR 0.03; median step 224.6 ms, duty 0.986 -- QUARANTINE: step 2.40x cell median", "exp": "E33_best_s138", "exp_num": 1024, "milestone": "", "phase": "block57", "status": "quarantine", "steps": 1317, "ts_end": "2026-08-01T15:30:00Z", "ts_end_epoch": 1785598200.0, "ts_start": "", "val_bpb": 0.988084, "vram_gb": 44.0}
{"commit": "block57-E33-burst-cost-the-margin", "desc": "E33 settling pass, seed 139 (112-141); frozen defaults; median step 343.3 ms, duty 0.993 -- QUARANTINE: step 2.27x cell median", "exp": "E33_ctl_s139", "exp_num": 1025, "milestone": "", "phase": "block57", "status": "quarantine", "steps": 868, "ts_end": "2026-08-01T15:30:00Z", "ts_end_epoch": 1785598200.0, "ts_start": "", "val_bpb": 1.006553, "vram_gb": 52.6}
{"commit": "block57-E33-burst-cost-the-margin", "desc": "E33 settling pass, seed 139 (112-141); depth 6 + MATRIX_LR 0.03; median step 341.0 ms, duty 1.005 -- QUARANTINE: step 3.64x cell median", "exp": "E33_best_s139", "exp_num": 1026, "milestone": "", "phase": "block57", "status": "quarantine", "steps": 884, "ts_end": "2026-08-01T15:30:00Z", "ts_end_epoch": 1785598200.0, "ts_start": "", "val_bpb": 1.027023, "vram_gb": 44.0}
{"commit": "block57-E33-burst-cost-the-margin", "desc": "E33 settling pass, seed 140 (112-141); frozen defaults; median step 354.3 ms, duty 1.012 -- QUARANTINE: step 2.34x cell median", "exp": "E33_ctl_s140", "exp_num": 1027, "milestone": "", "phase": "block57", "status": "quarantine", "steps": 857, "ts_end": "2026-08-01T15:30:00Z", "ts_end_epoch": 1785598200.0, "ts_start": "", "val_bpb": 1.007339, "vram_gb": 52.6}
{"commit": "block57-E33-burst-cost-the-margin", "desc": "E33 settling pass, seed 140 (112-141); depth 6 + MATRIX_LR 0.03; median step 334.0 ms, duty 1.029 -- QUARANTINE: step 3.57x cell median", "exp": "E33_best_s140", "exp_num": 1028, "milestone": "", "phase": "block57", "status": "quarantine", "steps": 924, "ts_end": "2026-08-01T15:30:00Z", "ts_end_epoch": 1785598200.0, "ts_start": "", "val_bpb": 1.015058, "vram_gb": 44.0}
{"commit": "block57-E33-burst-cost-the-margin", "desc": "E33 settling pass, seed 141 (112-141); frozen defaults; median step 344.8 ms, duty 0.995 -- QUARANTINE: step 2.28x cell median", "exp": "E33_ctl_s141", "exp_num": 1029, "milestone": "", "phase": "block57", "status": "quarantine", "steps": 866, "ts_end": "2026-08-01T15:30:00Z", "ts_end_epoch": 1785598200.0, "ts_start": "", "val_bpb": 1.002415, "vram_gb": 52.6}
{"commit": "block57-E33-burst-cost-the-margin", "desc": "E33 settling pass, seed 141 (112-141); depth 6 + MATRIX_LR 0.03; median step 344.1 ms, duty 1.009 -- QUARANTINE: step 3.68x cell median", "exp": "E33_best_s141", "exp_num": 1030, "milestone": "", "phase": "block57", "status": "quarantine", "steps": 880, "ts_end": "2026-08-01T15:30:00Z", "ts_end_epoch": 1785598200.0, "ts_start": "", "val_bpb": 1.02597, "vram_gb": 44.0}
{"commit": "block59-E34-burst-19of20-lost", "desc": "E34 final settling attempt, seed 142; median step 148.9 ms, duty 1.006; screened against the CLEAN REFERENCE median (149.9 ms), not the in-tranche median", "exp": "E34_ctl_s142", "exp_num": 1031, "milestone": "", "phase": "block59", "status": "keep", "steps": 2027, "ts_end": "2026-08-01T17:30:00Z", "ts_end_epoch": 1785605400.0, "ts_start": "", "val_bpb": 0.929512, "vram_gb": 52.6}
{"commit": "block59-E34-burst-19of20-lost", "desc": "E34 final settling attempt, seed 142; median step 207.1 ms, duty 1.011; screened against the CLEAN REFERENCE median (91.8 ms), not the in-tranche median -- QUARANTINE: step 2.26x clean reference", "exp": "E34_best_s142", "exp_num": 1032, "milestone": "", "phase": "block59", "status": "quarantine", "steps": 1465, "ts_end": "2026-08-01T17:30:00Z", "ts_end_epoch": 1785605400.0, "ts_start": "", "val_bpb": 0.979474, "vram_gb": 44.0}
{"commit": "block59-E34-burst-19of20-lost", "desc": "E34 final settling attempt, seed 143; median step 329.8 ms, duty 1.055; screened against the CLEAN REFERENCE median (149.9 ms), not the in-tranche median -- QUARANTINE: step 2.20x clean reference", "exp": "E34_ctl_s143", "exp_num": 1033, "milestone": "", "phase": "block59", "status": "quarantine", "steps": 960, "ts_end": "2026-08-01T17:30:00Z", "ts_end_epoch": 1785605400.0, "ts_start": "", "val_bpb": 0.985545, "vram_gb": 52.6}
{"commit": "block59-E34-burst-19of20-lost", "desc": "E34 final settling attempt, seed 143; median step 212.7 ms, duty 1.014; screened against the CLEAN REFERENCE median (91.8 ms), not the in-tranche median -- QUARANTINE: step 2.32x clean reference", "exp": "E34_best_s143", "exp_num": 1034, "milestone": "", "phase": "block59", "status": "quarantine", "steps": 1430, "ts_end": "2026-08-01T17:30:00Z", "ts_end_epoch": 1785605400.0, "ts_start": "", "val_bpb": 0.98111, "vram_gb": 44.0}
{"commit": "block59-E34-burst-19of20-lost", "desc": "E34 final settling attempt, seed 144; median step 151.0 ms, duty 1.006; screened against the CLEAN REFERENCE median (149.9 ms), not the in-tranche median", "exp": "E34_ctl_s144", "exp_num": 1035, "milestone": "", "phase": "block59", "status": "keep", "steps": 1999, "ts_end": "2026-08-01T17:30:00Z", "ts_end_epoch": 1785605400.0, "ts_start": "", "val_bpb": 0.933244, "vram_gb": 52.6}
{"commit": "block59-E34-burst-19of20-lost", "desc": "E34 final settling attempt, seed 144; median step 91.7 ms, duty 1.000; screened against the CLEAN REFERENCE median (91.8 ms), not the in-tranche median", "exp": "E34_best_s144", "exp_num": 1036, "milestone": "", "phase": "block59", "status": "keep", "steps": 3271, "ts_end": "2026-08-01T17:30:00Z", "ts_end_epoch": 1785605400.0, "ts_start": "", "val_bpb": 0.928779, "vram_gb": 44.0}
{"commit": "block59-E34-burst-19of20-lost", "desc": "E34 final settling attempt, seed 145; median step 323.4 ms, duty 1.013; screened against the CLEAN REFERENCE median (149.9 ms), not the in-tranche median -- QUARANTINE: step 2.16x clean reference", "exp": "E34_ctl_s145", "exp_num": 1037, "milestone": "", "phase": "block59", "status": "quarantine", "steps": 940, "ts_end": "2026-08-01T17:30:00Z", "ts_end_epoch": 1785605400.0, "ts_start": "", "val_bpb": 0.989811, "vram_gb": 52.6}
{"commit": "block59-E34-burst-19of20-lost", "desc": "E34 final settling attempt, seed 145; median step 206.9 ms, duty 1.008; screened against the CLEAN REFERENCE median (91.8 ms), not the in-tranche median -- QUARANTINE: step 2.25x clean reference", "exp": "E34_best_s145", "exp_num": 1038, "milestone": "", "phase": "block59", "status": "quarantine", "steps": 1462, "ts_end": "2026-08-01T17:30:00Z", "ts_end_epoch": 1785605400.0, "ts_start": "", "val_bpb": 0.979808, "vram_gb": 44.0}
{"commit": "block59-E34-burst-19of20-lost", "desc": "E34 final settling attempt, seed 146; median step 330.2 ms, duty 1.038; screened against the CLEAN REFERENCE median (149.9 ms), not the in-tranche median -- QUARANTINE: step 2.20x clean reference", "exp": "E34_ctl_s146", "exp_num": 1039, "milestone": "", "phase": "block59", "status": "quarantine", "steps": 943, "ts_end": "2026-08-01T17:30:00Z", "ts_end_epoch": 1785605400.0, "ts_start": "", "val_bpb": 0.987209, "vram_gb": 52.6}
{"commit": "block59-E34-burst-19of20-lost", "desc": "E34 final settling attempt, seed 146; median step 212.2 ms, duty 1.011; screened against the CLEAN REFERENCE median (91.8 ms), not the in-tranche median -- QUARANTINE: step 2.31x clean reference", "exp": "E34_best_s146", "exp_num": 1040, "milestone": "", "phase": "block59", "status": "quarantine", "steps": 1429, "ts_end": "2026-08-01T17:30:00Z", "ts_end_epoch": 1785605400.0, "ts_start": "", "val_bpb": 0.980322, "vram_gb": 44.0}
{"commit": "block59-E34-burst-19of20-lost", "desc": "E34 final settling attempt, seed 147; median step 328.9 ms, duty 1.014; screened against the CLEAN REFERENCE median (149.9 ms), not the in-tranche median -- QUARANTINE: step 2.19x clean reference", "exp": "E34_ctl_s147", "exp_num": 1041, "milestone": "", "phase": "block59", "status": "quarantine", "steps": 925, "ts_end": "2026-08-01T17:30:00Z", "ts_end_epoch": 1785605400.0, "ts_start": "", "val_bpb": 0.989573, "vram_gb": 52.6}
{"commit": "block59-E34-burst-19of20-lost", "desc": "E34 final settling attempt, seed 147; median step 91.9 ms, duty 0.912; screened against the CLEAN REFERENCE median (91.8 ms), not the in-tranche median -- QUARANTINE: duty 0.912", "exp": "E34_best_s147", "exp_num": 1042, "milestone": "", "phase": "block59", "status": "quarantine", "steps": 2976, "ts_end": "2026-08-01T17:30:00Z", "ts_end_epoch": 1785605400.0, "ts_start": "", "val_bpb": 0.933794, "vram_gb": 44.0}
{"commit": "block59-E34-burst-19of20-lost", "desc": "E34 final settling attempt, seed 148; median step 323.2 ms, duty 1.013; screened against the CLEAN REFERENCE median (149.9 ms), not the in-tranche median -- QUARANTINE: step 2.16x clean reference", "exp": "E34_ctl_s148", "exp_num": 1043, "milestone": "", "phase": "block59", "status": "quarantine", "steps": 940, "ts_end": "2026-08-01T17:30:00Z", "ts_end_epoch": 1785605400.0, "ts_start": "", "val_bpb": 0.992212, "vram_gb": 52.6}
{"commit": "block59-E34-burst-19of20-lost", "desc": "E34 final settling attempt, seed 148; median step 206.8 ms, duty 1.008; screened against the CLEAN REFERENCE median (91.8 ms), not the in-tranche median -- QUARANTINE: step 2.25x clean reference", "exp": "E34_best_s148", "exp_num": 1044, "milestone": "", "phase": "block59", "status": "quarantine", "steps": 1463, "ts_end": "2026-08-01T17:30:00Z", "ts_end_epoch": 1785605400.0, "ts_start": "", "val_bpb": 0.979213, "vram_gb": 44.0}
{"commit": "block59-E34-burst-19of20-lost", "desc": "E34 final settling attempt, seed 149; median step 150.2 ms, duty 0.989; screened against the CLEAN REFERENCE median (149.9 ms), not the in-tranche median", "exp": "E34_ctl_s149", "exp_num": 1045, "milestone": "", "phase": "block59", "status": "keep", "steps": 1976, "ts_end": "2026-08-01T17:30:00Z", "ts_end_epoch": 1785605400.0, "ts_start": "", "val_bpb": 0.933177, "vram_gb": 52.6}
{"commit": "block59-E34-burst-19of20-lost", "desc": "E34 final settling attempt, seed 149; median step 212.1 ms, duty 1.027; screened against the CLEAN REFERENCE median (91.8 ms), not the in-tranche median -- QUARANTINE: step 2.31x clean reference", "exp": "E34_best_s149", "exp_num": 1046, "milestone": "", "phase": "block59", "status": "quarantine", "steps": 1453, "ts_end": "2026-08-01T17:30:00Z", "ts_end_epoch": 1785605400.0, "ts_start": "", "val_bpb": 0.980524, "vram_gb": 44.0}
{"commit": "block59-E34-burst-19of20-lost", "desc": "E34 final settling attempt, seed 150; median step 328.6 ms, duty 1.014; screened against the CLEAN REFERENCE median (149.9 ms), not the in-tranche median -- QUARANTINE: step 2.19x clean reference", "exp": "E34_ctl_s150", "exp_num": 1047, "milestone": "", "phase": "block59", "status": "quarantine", "steps": 926, "ts_end": "2026-08-01T17:30:00Z", "ts_end_epoch": 1785605400.0, "ts_start": "", "val_bpb": 0.994132, "vram_gb": 52.6}
{"commit": "block59-E34-burst-19of20-lost", "desc": "E34 final settling attempt, seed 150; median step 139.2 ms, duty 1.010; screened against the CLEAN REFERENCE median (91.8 ms), not the in-tranche median -- QUARANTINE: step 1.52x clean reference", "exp": "E34_best_s150", "exp_num": 1048, "milestone": "", "phase": "block59", "status": "quarantine", "steps": 2176, "ts_end": "2026-08-01T17:30:00Z", "ts_end_epoch": 1785605400.0, "ts_start": "", "val_bpb": 0.953737, "vram_gb": 44.0}
