{"exp_num": 671, "exp": "E12_depth6_s49", "val_bpb": 0.929753, "vram_gb": 44.0, "steps": 3231, "status": "keep", "desc": "E12 depth 6 (probe-gated launch); median step 92.3 ms, duty 0.994, 1.01x cell median", "phase": "block34", "milestone": "", "ts_start": "", "ts_end": "2026-07-31T18:00:00Z", "ts_end_epoch": 1785520800.0, "commit": "block34-E12-probe-gated"}
{"exp_num": 672, "exp": "E12_depth8_s50", "val_bpb": 0.931053, "vram_gb": 52.6, "steps": 2022, "status": "keep", "desc": "E12 depth 8 (probe-gated launch); median step 149.2 ms, duty 1.006, 1.00x cell median", "phase": "block34", "milestone": "", "ts_start": "", "ts_end": "2026-07-31T18:00:00Z", "ts_end_epoch": 1785520800.0, "commit": "block34-E12-probe-gated"}
{"exp_num": 673, "exp": "E12_depth6_s50", "val_bpb": 0.954602, "vram_gb": 44.0, "steps": 2142, "status": "quarantine", "desc": "E12 depth 6 (probe-gated launch); median step 136.0 ms, duty 0.971, 1.48x cell median -- QUARANTINE: step time 1.48x cell median", "phase": "block34", "milestone": "", "ts_start": "", "ts_end": "2026-07-31T18:00:00Z", "ts_end_epoch": 1785520800.0, "commit": "block34-E12-probe-gated"}
{"exp_num": 674, "exp": "E12_depth8_s51", "val_bpb": 0.946406, "vram_gb": 52.6, "steps": 1641, "status": "quarantine", "desc": "E12 depth 8 (probe-gated launch); median step 178.6 ms, duty 0.977, 1.19x cell median -- QUARANTINE: step time 1.19x cell median", "phase": "block34", "milestone": "", "ts_start": "", "ts_end": "2026-07-31T18:00:00Z", "ts_end_epoch": 1785520800.0, "commit": "block34-E12-probe-gated"}
{"exp_num": 675, "exp": "E12_depth6_s51", "val_bpb": 0.952473, "vram_gb": 44.0, "steps": 2242, "status": "quarantine", "desc": "E12 depth 6 (probe-gated launch); median step 114.4 ms, duty 0.855, 1.25x cell median -- QUARANTINE: duty 0.855, step time 1.25x cell median", "phase": "block34", "milestone": "", "ts_start": "", "ts_end": "2026-07-31T18:00:00Z", "ts_end_epoch": 1785520800.0, "commit": "block34-E12-probe-gated"}
{"commit": "block35-E13-depth-n12-NULL", "desc": "E13 depth 8 (probe-gated); median step 149.1 ms, duty 0.988, 1.00x cell median", "exp": "E13_depth8_s50", "exp_num": 676, "milestone": "", "phase": "block35", "status": "keep", "steps": 1987, "ts_end": "2026-07-31T19:00:00Z", "ts_end_epoch": 1785524400.0, "ts_start": "", "val_bpb": 0.932062, "vram_gb": 52.6}
{"commit": "block35-E13-depth-n12-NULL", "desc": "E13 depth 6 (probe-gated); median step 91.9 ms, duty 0.964, 1.00x cell median", "exp": "E13_depth6_s50", "exp_num": 677, "milestone": "", "phase": "block35", "status": "keep", "steps": 3146, "ts_end": "2026-07-31T19:00:00Z", "ts_end_epoch": 1785524400.0, "ts_start": "", "val_bpb": 0.931484, "vram_gb": 44.0}
{"commit": "block35-E13-depth-n12-NULL", "desc": "E13 depth 8 (probe-gated); median step 150.7 ms, duty 0.990, 1.01x cell median", "exp": "E13_depth8_s51", "exp_num": 678, "milestone": "", "phase": "block35", "status": "keep", "steps": 1970, "ts_end": "2026-07-31T19:00:00Z", "ts_end_epoch": 1785524400.0, "ts_start": "", "val_bpb": 0.932867, "vram_gb": 52.6}
{"commit": "block35-E13-depth-n12-NULL", "desc": "E13 depth 6 (probe-gated); median step 91.6 ms, duty 0.964, 1.00x cell median", "exp": "E13_depth6_s51", "exp_num": 679, "milestone": "", "phase": "block35", "status": "keep", "steps": 3156, "ts_end": "2026-07-31T19:00:00Z", "ts_end_epoch": 1785524400.0, "ts_start": "", "val_bpb": 0.931522, "vram_gb": 44.0}
{"commit": "block35-E13-depth-n12-NULL", "desc": "E13 depth 8 (probe-gated); median step 149.0 ms, duty 1.006, 1.00x cell median", "exp": "E13_depth8_s52", "exp_num": 680, "milestone": "", "phase": "block35", "status": "keep", "steps": 2025, "ts_end": "2026-07-31T19:00:00Z", "ts_end_epoch": 1785524400.0, "ts_start": "", "val_bpb": 0.930597, "vram_gb": 52.6}
{"commit": "block35-E13-depth-n12-NULL", "desc": "E13 depth 6 (probe-gated); median step 92.1 ms, duty 1.001, 1.01x cell median", "exp": "E13_depth6_s52", "exp_num": 681, "milestone": "", "phase": "block35", "status": "keep", "steps": 3261, "ts_end": "2026-07-31T19:00:00Z", "ts_end_epoch": 1785524400.0, "ts_start": "", "val_bpb": 0.930728, "vram_gb": 44.0}
{"commit": "block35-E13-depth-n12-NULL", "desc": "E13 depth 8 (probe-gated); median step 151.3 ms, duty 1.006, 1.01x cell median", "exp": "E13_depth8_s53", "exp_num": 682, "milestone": "", "phase": "block35", "status": "keep", "steps": 1994, "ts_end": "2026-07-31T19:00:00Z", "ts_end_epoch": 1785524400.0, "ts_start": "", "val_bpb": 0.933178, "vram_gb": 52.6}
{"commit": "block35-E13-depth-n12-NULL", "desc": "E13 depth 6 (probe-gated); median step 91.6 ms, duty 1.001, 1.00x cell median", "exp": "E13_depth6_s53", "exp_num": 683, "milestone": "", "phase": "block35", "status": "keep", "steps": 3278, "ts_end": "2026-07-31T19:00:00Z", "ts_end_epoch": 1785524400.0, "ts_start": "", "val_bpb": 0.930123, "vram_gb": 44.0}
{"commit": "block36-E14-global-wd-refuted", "desc": "E14 depth 5 global WEIGHT_DECAY=0.6; median step 69.5 ms, duty 0.962, 1.01x cell median", "exp": "E14_s43_wd0.6", "exp_num": 684, "milestone": "", "phase": "block36", "status": "keep", "steps": 4153, "ts_end": "2026-07-31T20:30:00Z", "ts_end_epoch": 1785530000.0, "ts_start": "", "val_bpb": 1.004147, "vram_gb": 38.0}
{"commit": "block36-E14-global-wd-refuted", "desc": "E14 depth 5 global WEIGHT_DECAY=0.1; median step 70.0 ms, duty 0.969, 1.02x cell median", "exp": "E14_s44_wd0.1", "exp_num": 685, "milestone": "", "phase": "block36", "status": "keep", "steps": 4151, "ts_end": "2026-07-31T20:30:00Z", "ts_end_epoch": 1785530000.0, "ts_start": "", "val_bpb": 0.978707, "vram_gb": 38.0}
{"commit": "block36-E14-global-wd-refuted", "desc": "E14 depth 5 global WEIGHT_DECAY=0.3; median step 69.1 ms, duty 0.963, 1.01x cell median", "exp": "E14_s44_wd0.3", "exp_num": 686, "milestone": "", "phase": "block36", "status": "keep", "steps": 4179, "ts_end": "2026-07-31T20:30:00Z", "ts_end_epoch": 1785530000.0, "ts_start": "", "val_bpb": 0.990472, "vram_gb": 38.0}
{"commit": "block36-E14-global-wd-refuted", "desc": "E14 depth 5 global WEIGHT_DECAY=0.6; median step 69.6 ms, duty 0.963, 1.01x cell median", "exp": "E14_s44_wd0.6", "exp_num": 687, "milestone": "", "phase": "block36", "status": "keep", "steps": 4153, "ts_end": "2026-07-31T20:30:00Z", "ts_end_epoch": 1785530000.0, "ts_start": "", "val_bpb": 1.00197, "vram_gb": 38.0}
{"commit": "block36-E14-global-wd-refuted", "desc": "E14 depth 5 global WEIGHT_DECAY=0.1; median step 69.6 ms, duty 0.963, 1.01x cell median", "exp": "E14_s45_wd0.1", "exp_num": 688, "milestone": "", "phase": "block36", "status": "keep", "steps": 4149, "ts_end": "2026-07-31T20:30:00Z", "ts_end_epoch": 1785530000.0, "ts_start": "", "val_bpb": 0.979587, "vram_gb": 38.0}
{"commit": "block36-E14-global-wd-refuted", "desc": "E14 depth 5 global WEIGHT_DECAY=0.3; median step 69.0 ms, duty 1.087, 1.01x cell median", "exp": "E14_s45_wd0.3", "exp_num": 689, "milestone": "", "phase": "block36", "status": "keep", "steps": 4725, "ts_end": "2026-07-31T20:30:00Z", "ts_end_epoch": 1785530000.0, "ts_start": "", "val_bpb": 0.987805, "vram_gb": 38.0}
{"commit": "block36-E14-global-wd-refuted", "desc": "E14 depth 5 global WEIGHT_DECAY=0.6; median step 69.2 ms, duty 1.086, 1.01x cell median", "exp": "E14_s45_wd0.6", "exp_num": 690, "milestone": "", "phase": "block36", "status": "keep", "steps": 4707, "ts_end": "2026-07-31T20:30:00Z", "ts_end_epoch": 1785530000.0, "ts_start": "", "val_bpb": 1.001024, "vram_gb": 38.0}
{"commit": "block36-E14-global-wd-refuted", "desc": "E14 depth 5 global WEIGHT_DECAY=0.1; median step 155.7 ms, duty 1.031, 2.27x cell median -- QUARANTINE: step time 2.27x", "exp": "E14_s42_wd0.1", "exp_num": 691, "milestone": "", "phase": "block36", "status": "quarantine", "steps": 1986, "ts_end": "2026-07-31T20:30:00Z", "ts_end_epoch": 1785530000.0, "ts_start": "", "val_bpb": 0.985063, "vram_gb": 38.0}
{"commit": "block36-E14-global-wd-refuted", "desc": "E14 depth 5 global WEIGHT_DECAY=0.3; median step 160.7 ms, duty 1.035, 2.34x cell median -- QUARANTINE: step time 2.34x", "exp": "E14_s42_wd0.3", "exp_num": 692, "milestone": "", "phase": "block36", "status": "quarantine", "steps": 1932, "ts_end": "2026-07-31T20:30:00Z", "ts_end_epoch": 1785530000.0, "ts_start": "", "val_bpb": 0.990679, "vram_gb": 38.0}
{"commit": "block36-E14-global-wd-refuted", "desc": "E14 depth 5 global WEIGHT_DECAY=0.6; median step 148.0 ms, duty 0.997, 2.16x cell median -- QUARANTINE: step time 2.16x", "exp": "E14_s42_wd0.6", "exp_num": 693, "milestone": "", "phase": "block36", "status": "quarantine", "steps": 2020, "ts_end": "2026-07-31T20:30:00Z", "ts_end_epoch": 1785530000.0, "ts_start": "", "val_bpb": 0.997809, "vram_gb": 38.0}
{"commit": "block36-E14-global-wd-refuted", "desc": "E14 depth 5 global WEIGHT_DECAY=0.1; median step 157.7 ms, duty 1.026, 2.30x cell median -- QUARANTINE: step time 2.30x", "exp": "E14_s43_wd0.1", "exp_num": 694, "milestone": "", "phase": "block36", "status": "quarantine", "steps": 1951, "ts_end": "2026-07-31T20:30:00Z", "ts_end_epoch": 1785530000.0, "ts_start": "", "val_bpb": 0.984831, "vram_gb": 38.0}
{"commit": "block36-E14-global-wd-refuted", "desc": "E14 depth 5 global WEIGHT_DECAY=0.3; median step 154.3 ms, duty 1.024, 2.25x cell median -- QUARANTINE: step time 2.25x", "exp": "E14_s43_wd0.3", "exp_num": 695, "milestone": "", "phase": "block36", "status": "quarantine", "steps": 1991, "ts_end": "2026-07-31T20:30:00Z", "ts_end_epoch": 1785530000.0, "ts_start": "", "val_bpb": 0.9885, "vram_gb": 38.0}
{"commit": "block37-E15-ngram-wd-interaction", "desc": "E15 depth 5 NGRAM_WD_LAMBDA=0; median step 68.6 ms, duty 0.912, 1.00x cell median -- QUARANTINE: duty 0.912", "exp": "E15_s42_d5_lam0", "exp_num": 696, "milestone": "", "phase": "block37", "status": "quarantine", "steps": 3989, "ts_end": "2026-07-31T20:30:00Z", "ts_end_epoch": 1785530000.0, "ts_start": "", "val_bpb": 0.979968, "vram_gb": 38.0}
{"commit": "block37-E15-ngram-wd-interaction", "desc": "E15 depth 5 NGRAM_WD_LAMBDA=0.05; median step 68.4 ms, duty 0.916, 1.00x cell median -- QUARANTINE: duty 0.916", "exp": "E15_s42_d5_lam0.05", "exp_num": 697, "milestone": "", "phase": "block37", "status": "quarantine", "steps": 4016, "ts_end": "2026-07-31T20:30:00Z", "ts_end_epoch": 1785530000.0, "ts_start": "", "val_bpb": 0.996473, "vram_gb": 38.0}
{"commit": "block37-E15-ngram-wd-interaction", "desc": "E15 depth 5 NGRAM_WD_LAMBDA=0.2; median step 67.2 ms, duty 0.911, 0.98x cell median -- QUARANTINE: duty 0.911", "exp": "E15_s42_d5_lam0.2", "exp_num": 698, "milestone": "", "phase": "block37", "status": "quarantine", "steps": 4068, "ts_end": "2026-07-31T20:30:00Z", "ts_end_epoch": 1785530000.0, "ts_start": "", "val_bpb": 0.997703, "vram_gb": 38.0}
{"commit": "block37-E15-ngram-wd-interaction", "desc": "E15 depth 5 NGRAM_WD_LAMBDA=0; median step 66.8 ms, duty 0.965, 0.97x cell median", "exp": "E15_s43_d5_lam0", "exp_num": 699, "milestone": "", "phase": "block37", "status": "keep", "steps": 4332, "ts_end": "2026-07-31T20:30:00Z", "ts_end_epoch": 1785530000.0, "ts_start": "", "val_bpb": 0.979494, "vram_gb": 38.0}
{"commit": "block37-E15-ngram-wd-interaction", "desc": "E15 depth 5 NGRAM_WD_LAMBDA=0.05; median step 66.6 ms, duty 0.966, 0.97x cell median", "exp": "E15_s43_d5_lam0.05", "exp_num": 700, "milestone": "", "phase": "block37", "status": "keep", "steps": 4351, "ts_end": "2026-07-31T20:30:00Z", "ts_end_epoch": 1785530000.0, "ts_start": "", "val_bpb": 0.989879, "vram_gb": 38.0}
{"commit": "block37-E15-ngram-wd-interaction", "desc": "E15 depth 5 NGRAM_WD_LAMBDA=0.2; median step 66.4 ms, duty 0.965, 0.97x cell median", "exp": "E15_s43_d5_lam0.2", "exp_num": 701, "milestone": "", "phase": "block37", "status": "keep", "steps": 4362, "ts_end": "2026-07-31T20:30:00Z", "ts_end_epoch": 1785530000.0, "ts_start": "", "val_bpb": 0.992215, "vram_gb": 38.0}
{"commit": "block37-E15-ngram-wd-interaction", "desc": "E15 depth 5 NGRAM_WD_LAMBDA=0; median step 66.6 ms, duty 0.969, 0.97x cell median", "exp": "E15_s44_d5_lam0", "exp_num": 702, "milestone": "", "phase": "block37", "status": "keep", "steps": 4365, "ts_end": "2026-07-31T20:30:00Z", "ts_end_epoch": 1785530000.0, "ts_start": "", "val_bpb": 0.978366, "vram_gb": 38.0}
{"commit": "block37-E15-ngram-wd-interaction", "desc": "E15 depth 5 NGRAM_WD_LAMBDA=0.05; median step 66.3 ms, duty 0.970, 0.97x cell median", "exp": "E15_s44_d5_lam0.05", "exp_num": 703, "milestone": "", "phase": "block37", "status": "keep", "steps": 4389, "ts_end": "2026-07-31T20:30:00Z", "ts_end_epoch": 1785530000.0, "ts_start": "", "val_bpb": 0.989853, "vram_gb": 38.0}
{"commit": "block37-E15-ngram-wd-interaction", "desc": "E15 depth 5 NGRAM_WD_LAMBDA=0.2; median step 66.3 ms, duty 0.969, 0.97x cell median", "exp": "E15_s44_d5_lam0.2", "exp_num": 704, "milestone": "", "phase": "block37", "status": "keep", "steps": 4383, "ts_end": "2026-07-31T20:30:00Z", "ts_end_epoch": 1785530000.0, "ts_start": "", "val_bpb": 0.992125, "vram_gb": 38.0}
{"commit": "block37-E15-ngram-wd-interaction", "desc": "E15 depth 6 NGRAM_WD_LAMBDA=0; median step 92.4 ms, duty 0.961, 1.01x cell median", "exp": "E15_s42_d6_lam0", "exp_num": 705, "milestone": "", "phase": "block37", "status": "keep", "steps": 3119, "ts_end": "2026-07-31T20:30:00Z", "ts_end_epoch": 1785530000.0, "ts_start": "", "val_bpb": 0.93225, "vram_gb": 38.0}
{"commit": "block37-E15-ngram-wd-interaction", "desc": "E15 depth 6 NGRAM_WD_LAMBDA=0.05; median step 91.6 ms, duty 0.960, 1.00x cell median", "exp": "E15_s42_d6_lam0.05", "exp_num": 706, "milestone": "", "phase": "block37", "status": "keep", "steps": 3143, "ts_end": "2026-07-31T20:30:00Z", "ts_end_epoch": 1785530000.0, "ts_start": "", "val_bpb": 0.96622, "vram_gb": 38.0}
{"commit": "block37-E15-ngram-wd-interaction", "desc": "E15 depth 6 NGRAM_WD_LAMBDA=0.2; median step 91.1 ms, duty 0.997, 1.00x cell median", "exp": "E15_s42_d6_lam0.2", "exp_num": 707, "milestone": "", "phase": "block37", "status": "keep", "steps": 3282, "ts_end": "2026-07-31T20:30:00Z", "ts_end_epoch": 1785530000.0, "ts_start": "", "val_bpb": 0.966966, "vram_gb": 38.0}
{"commit": "block37-E15-ngram-wd-interaction", "desc": "E15 depth 6 NGRAM_WD_LAMBDA=0; median step 91.3 ms, duty 0.997, 1.00x cell median", "exp": "E15_s43_d6_lam0", "exp_num": 708, "milestone": "", "phase": "block37", "status": "keep", "steps": 3276, "ts_end": "2026-07-31T20:30:00Z", "ts_end_epoch": 1785530000.0, "ts_start": "", "val_bpb": 0.929456, "vram_gb": 38.0}
{"commit": "block37-E15-ngram-wd-interaction", "desc": "E15 depth 6 NGRAM_WD_LAMBDA=0.05; median step 91.0 ms, duty 0.998, 1.00x cell median", "exp": "E15_s43_d6_lam0.05", "exp_num": 709, "milestone": "", "phase": "block37", "status": "keep", "steps": 3290, "ts_end": "2026-07-31T20:30:00Z", "ts_end_epoch": 1785530000.0, "ts_start": "", "val_bpb": 0.965239, "vram_gb": 38.0}
{"commit": "block37-E15-ngram-wd-interaction", "desc": "E15 depth 6 NGRAM_WD_LAMBDA=0.2; median step 91.1 ms, duty 0.998, 1.00x cell median", "exp": "E15_s43_d6_lam0.2", "exp_num": 710, "milestone": "", "phase": "block37", "status": "keep", "steps": 3287, "ts_end": "2026-07-31T20:30:00Z", "ts_end_epoch": 1785530000.0, "ts_start": "", "val_bpb": 0.968548, "vram_gb": 38.0}
{"commit": "block39-E19-offset-aug-instantiation-refuted", "desc": "E19 depth 5 OFFSET_AUG=0; median step 66.3 ms; 8/8 pairs clean on screen v3 + pair-matching", "exp": "E19_d5_aug0_s42", "exp_num": 711, "milestone": "", "phase": "block39", "status": "keep", "steps": 4377, "ts_end": "2026-07-31T22:00:00Z", "ts_end_epoch": 1785535200.0, "ts_start": "", "val_bpb": 0.979232, "vram_gb": 38.0}
{"commit": "block39-E19-offset-aug-instantiation-refuted", "desc": "E19 depth 5 OFFSET_AUG=1; median step 66.5 ms; 8/8 pairs clean on screen v3 + pair-matching", "exp": "E19_d5_aug1_s42", "exp_num": 712, "milestone": "", "phase": "block39", "status": "keep", "steps": 4365, "ts_end": "2026-07-31T22:00:00Z", "ts_end_epoch": 1785535200.0, "ts_start": "", "val_bpb": 1.121087, "vram_gb": 38.0}
{"commit": "block39-E19-offset-aug-instantiation-refuted", "desc": "E19 depth 6 OFFSET_AUG=0; median step 91.8 ms; 8/8 pairs clean on screen v3 + pair-matching", "exp": "E19_d6_aug0_s42", "exp_num": 713, "milestone": "", "phase": "block39", "status": "keep", "steps": 3258, "ts_end": "2026-07-31T22:00:00Z", "ts_end_epoch": 1785535200.0, "ts_start": "", "val_bpb": 0.929731, "vram_gb": 44.0}
{"commit": "block39-E19-offset-aug-instantiation-refuted", "desc": "E19 depth 6 OFFSET_AUG=1; median step 92.3 ms; 8/8 pairs clean on screen v3 + pair-matching", "exp": "E19_d6_aug1_s42", "exp_num": 714, "milestone": "", "phase": "block39", "status": "keep", "steps": 3245, "ts_end": "2026-07-31T22:00:00Z", "ts_end_epoch": 1785535200.0, "ts_start": "", "val_bpb": 1.090148, "vram_gb": 44.0}
{"commit": "block39-E19-offset-aug-instantiation-refuted", "desc": "E19 depth 5 OFFSET_AUG=0; median step 66.6 ms; 8/8 pairs clean on screen v3 + pair-matching", "exp": "E19_d5_aug0_s43", "exp_num": 715, "milestone": "", "phase": "block39", "status": "keep", "steps": 4363, "ts_end": "2026-07-31T22:00:00Z", "ts_end_epoch": 1785535200.0, "ts_start": "", "val_bpb": 0.978852, "vram_gb": 38.0}
{"commit": "block39-E19-offset-aug-instantiation-refuted", "desc": "E19 depth 5 OFFSET_AUG=1; median step 67.0 ms; 8/8 pairs clean on screen v3 + pair-matching", "exp": "E19_d5_aug1_s43", "exp_num": 716, "milestone": "", "phase": "block39", "status": "keep", "steps": 4332, "ts_end": "2026-07-31T22:00:00Z", "ts_end_epoch": 1785535200.0, "ts_start": "", "val_bpb": 1.118795, "vram_gb": 38.0}
{"commit": "block39-E19-offset-aug-instantiation-refuted", "desc": "E19 depth 6 OFFSET_AUG=0; median step 91.1 ms; 8/8 pairs clean on screen v3 + pair-matching", "exp": "E19_d6_aug0_s43", "exp_num": 717, "milestone": "", "phase": "block39", "status": "keep", "steps": 3283, "ts_end": "2026-07-31T22:00:00Z", "ts_end_epoch": 1785535200.0, "ts_start": "", "val_bpb": 0.929189, "vram_gb": 44.0}
{"commit": "block39-E19-offset-aug-instantiation-refuted", "desc": "E19 depth 6 OFFSET_AUG=1; median step 91.7 ms; 8/8 pairs clean on screen v3 + pair-matching", "exp": "E19_d6_aug1_s43", "exp_num": 718, "milestone": "", "phase": "block39", "status": "keep", "steps": 3266, "ts_end": "2026-07-31T22:00:00Z", "ts_end_epoch": 1785535200.0, "ts_start": "", "val_bpb": 1.090676, "vram_gb": 44.0}
{"commit": "block39-E19-offset-aug-instantiation-refuted", "desc": "E19 depth 5 OFFSET_AUG=0; median step 66.7 ms; 8/8 pairs clean on screen v3 + pair-matching", "exp": "E19_d5_aug0_s44", "exp_num": 719, "milestone": "", "phase": "block39", "status": "keep", "steps": 4342, "ts_end": "2026-07-31T22:00:00Z", "ts_end_epoch": 1785535200.0, "ts_start": "", "val_bpb": 0.979388, "vram_gb": 38.0}
{"commit": "block39-E19-offset-aug-instantiation-refuted", "desc": "E19 depth 5 OFFSET_AUG=1; median step 67.1 ms; 8/8 pairs clean on screen v3 + pair-matching", "exp": "E19_d5_aug1_s44", "exp_num": 720, "milestone": "", "phase": "block39", "status": "keep", "steps": 4330, "ts_end": "2026-07-31T22:00:00Z", "ts_end_epoch": 1785535200.0, "ts_start": "", "val_bpb": 1.118301, "vram_gb": 38.0}
{"commit": "block39-E19-offset-aug-instantiation-refuted", "desc": "E19 depth 6 OFFSET_AUG=0; median step 91.1 ms; 8/8 pairs clean on screen v3 + pair-matching", "exp": "E19_d6_aug0_s44", "exp_num": 721, "milestone": "", "phase": "block39", "status": "keep", "steps": 3285, "ts_end": "2026-07-31T22:00:00Z", "ts_end_epoch": 1785535200.0, "ts_start": "", "val_bpb": 0.928571, "vram_gb": 44.0}
{"commit": "block39-E19-offset-aug-instantiation-refuted", "desc": "E19 depth 6 OFFSET_AUG=1; median step 91.0 ms; 8/8 pairs clean on screen v3 + pair-matching", "exp": "E19_d6_aug1_s44", "exp_num": 722, "milestone": "", "phase": "block39", "status": "keep", "steps": 3291, "ts_end": "2026-07-31T22:00:00Z", "ts_end_epoch": 1785535200.0, "ts_start": "", "val_bpb": 1.091565, "vram_gb": 44.0}
{"commit": "block39-E19-offset-aug-instantiation-refuted", "desc": "E19 depth 5 OFFSET_AUG=0; median step 66.1 ms; 8/8 pairs clean on screen v3 + pair-matching", "exp": "E19_d5_aug0_s45", "exp_num": 723, "milestone": "", "phase": "block39", "status": "keep", "steps": 4389, "ts_end": "2026-07-31T22:00:00Z", "ts_end_epoch": 1785535200.0, "ts_start": "", "val_bpb": 0.97838, "vram_gb": 38.0}
{"commit": "block39-E19-offset-aug-instantiation-refuted", "desc": "E19 depth 5 OFFSET_AUG=1; median step 65.9 ms; 8/8 pairs clean on screen v3 + pair-matching", "exp": "E19_d5_aug1_s45", "exp_num": 724, "milestone": "", "phase": "block39", "status": "keep", "steps": 4403, "ts_end": "2026-07-31T22:00:00Z", "ts_end_epoch": 1785535200.0, "ts_start": "", "val_bpb": 1.118958, "vram_gb": 38.0}
{"commit": "block39-E19-offset-aug-instantiation-refuted", "desc": "E19 depth 6 OFFSET_AUG=0; median step 91.4 ms; 8/8 pairs clean on screen v3 + pair-matching", "exp": "E19_d6_aug0_s45", "exp_num": 725, "milestone": "", "phase": "block39", "status": "keep", "steps": 3279, "ts_end": "2026-07-31T22:00:00Z", "ts_end_epoch": 1785535200.0, "ts_start": "", "val_bpb": 0.930035, "vram_gb": 44.0}
{"commit": "block39-E19-offset-aug-instantiation-refuted", "desc": "E19 depth 6 OFFSET_AUG=1; median step 91.0 ms; 8/8 pairs clean on screen v3 + pair-matching", "exp": "E19_d6_aug1_s45", "exp_num": 726, "milestone": "", "phase": "block39", "status": "keep", "steps": 3303, "ts_end": "2026-07-31T22:00:00Z", "ts_end_epoch": 1785535200.0, "ts_start": "", "val_bpb": 1.089387, "vram_gb": 44.0}
{"commit": "block40-E20-width-formula-optimal", "desc": "E20 depth 6 MODEL_DIM=640; median step 91.2 ms, duty 0.999, 484M tokens (1.9 passes)", "exp": "E20_dim640_s42", "exp_num": 727, "milestone": "", "phase": "block40", "status": "keep", "steps": 3285, "ts_end": "2026-07-31T22:45:00Z", "ts_end_epoch": 1785538000.0, "ts_start": "", "val_bpb": 0.929501, "vram_gb": 44.0}
